"""ID"",""Title"",""Content"",""Description"",""URL"",""Publication Date"" ,""Image URL"",""Author"",""Category"",""Source"""
"4683950","Lợi ích khi tập kick boxing","Kick boxing dựa trên nền tảng của các môn võ thuật cổ truyền như karate, Muay Thai và boxing, thu hút nhiều lứa tuổi tham gia. Đây là bài tập toàn thân sử dụng năng lượng giúp tăng cường tính linh hoạt và nâng cao sức chịu đựng. Dưới đây là những lợi ích khi tập kickboxing thường xuyên.
Đốt cháy calo
Trung bình một buổi tập kick boxing có thể đốt cháy 700-900 calo. Theo Mayo Clinic, người tập kick boxing đốt cháy nhiều calo hơn trong một khoảng thời gian ngắn so với các hoạt động vừa phải khác.
Cải thiện tư thế
Kick boxing tác động đến cơ bụng và cơ lưng dưới, giúp ổn định cột sống, từ đó cải thiện và tăng khả năng kiểm soát tư thế khi hoạt động thể chất. Bài tập này cũng hỗ trợ giữ thăng bằng, tăng tính phối hợp và cử động nhanh nhẹn.
Theo nghiên cứu năm 2014 của Trường Đại học Qatar và Đại học Sao Paulo (Brazil), trên 30 người, cho thấy người dành ba giờ tập kick boxing mỗi tuần đã cải thiện tính linh hoạt, tốc độ và nhanh nhẹn chỉ sau 5 tuần.
Nâng cao sức bền
Theo các chuyên gia thể thao, người tập bộ môn này thường học cách thở đúng trong quá trình tập luyện để tránh hụt hơi. Điều này giúp họ đảm bảo lượng oxy trong máu, duy trì sức bền, phòng chấn thương.
Tăng sức mạnh cho cơ bắp
Nghiên cứu năm 2017 của Đại học Liên bang Pelotas và Đại học Sao Paulo (Brazil) cho thấy các vận động viên kick boxing ưu tú và nghiệp dư có khối lượng cơ bắp nhiều và tỷ lệ mỡ trong cơ thể thấp. Các nhà nghiên cứu lý giải kick boxing là sự kết hợp của các động tác nhảy, chạy, đá và đấm... giúp cải thiện thể lực. Nhờ đó người tập rèn luyện sức khỏe tim mạch, tăng sức mạnh tổng thể của cơ bắp.
Hỗ trợ xương
Kick boxing củng cố xương bằng cách hoạt động liên tục các cơ, gân và dây chằng xung quanh xương, từ đó củng cố các khớp và giữ chúng ổn định để hỗ trợ khung xương.
Nghiên cứu năm 2006 của Đại học Athens (Hy Lạp) cho thấy tái tạo xương là cách cơ thể sửa chữa tổn thương bằng cách ngăn chặn sự tích tụ của xương cũ và thay thế nó bằng xương mới. Do đó, các đòn đánh lặp lại bằng cẳng tay và ống chân của kick boxing hỗ trợ tái cấu trúc bộ xương giúp cơ thể phản ứng lại với lực của những hành động đó.
Kick boxing là bộ môn tăng cường sức khỏe và thể lực nhưng tập luyện cường độ cao có thể tăng nguy cơ chấn thương vai, lưng, hông, đầu gối. Mỗi người nên khởi động kỹ trước khi tập và giãn cơ sau khi kết thúc. Tránh mặc quần áo quá rộng và mang giày không phù hợp vì dễ hạn chế chuyển động.
Các chuyên gia khuyến nghị cường độ an toàn là ít nhất ba ngày mỗi tuần và mỗi buổi tập kéo dài trong một giờ.","Tập kickboxing hỗ trợ tăng cường sức mạnh cơ bắp, cải thiện độ nhanh nhẹn và giữ thăng bằng tốt. - VnExpress","https://vnexpress.net/loi-ich-khi-tap-kick-boxing-4683950.html","Chủ nhật, 3/12/2023, 12:00 (GMT+7)","https://i1-suckhoe.vnecdn.net/2023/12/02/404742078-1098416431151259-892-6910-2527-1701505711.jpg?w=1200&h=0&q=100&dpr=1&fit=crop&s=sRxu221A4vDTNc1m-N57Cg","","Y học thể thao","https://vnexpress.net/tin-tuc-24h"
"4683689","Món ăn giúp trẻ thông minh","Trong 36 tháng đầu đời, bộ não của trẻ phát triển dần, rèn luyện phản xạ trong quá trình bé khám phá, tiếp thu mọi thứ xung quanh. Ngoài hoạt động như chơi trò chơi, nghe nhạc, xếp hình khối..., thực phẩm cũng góp phần kích thích trí não, giúp trẻ thông minh, lanh lợi hơn.
Thực phẩm chứa chất chống oxy hóa, choline, axit béo omega-3 và carbohydrate phức hợp đều giúp tăng cường sức khỏe não bộ. Chất chống oxy hóa bảo vệ não, choline cần thiết cho não phát triển, trí nhớ, điều chỉnh tâm trạng. Axit béo omega-3 gồm ALA, DHA và EPA hỗ trợ chức năng não, trong khi carbohydrate phức hợp cung cấp nhiên liệu cho cơ quan này hoạt động.
Phụ huynh có thể đưa thực phẩm giàu chất dinh dưỡng dưới đây vào chế độ ăn hàng ngày của trẻ theo từng độ tuổi.
Trẻ 6 tháng tuổi
Bé 6 tháng tuổi có thể ăn dặm với quả mọng, ngũ cốc nguyên hạt, bánh làm từ lúa mì nguyên hạt.
Quả mọng: Cung cấp chất chống oxy hóa dồi dào. Cho một ít quả mọng vào máy xay cùng với sữa mẹ hoặc sữa công thức để tạo thành hỗn hợp mịn và cho trẻ uống.
Ngũ cốc nguyên hạt dành cho trẻ: Giàu chất xơ lành mạnh, hỗ trợ tiêu hóa. Để nạp thêm lượng chất chống oxy hóa tăng cường trí não, phụ huynh có thể trộn ngũ cốc với nước ép quả mọng.
Bánh làm từ lúa mì nguyên hạt: Món ăn này giàu carb phức hợp, lành mạnh cho trẻ đang cai sữa. Kết hợp cùng hỗn hợp quả mọng nghiền nhỏ để tăng thêm chất chống oxy hóa.
Trẻ mới biết đi
Bơ đậu phộng và bánh mì nguyên hạt: Bánh mì phết bơ đậu phộng vừa dễ ăn vừa cung cấp dưỡng chất omega-3, carb phức hợp để trẻ phát triển trí não. Cha mẹ có thể cho con ăn thêm việt quất, mâm xôi hoặc dâu tây giàu chất chống oxy hóa.
Sữa chua và quả mọng: Ăn quả mọng tươi cùng sữa chua nguyên chất giúp tăng thêm vị ngọt. Quả việt quất chứa nhiều chất chống oxy hóa trong khi dâu tây, mâm xôi có màu sắc bắt mắt thu hút các bé.
Cá hồi: Phi lê cá hồi nướng, salad cá hồi đều là món ăn phù hợp cho bé trong các bữa chính.
Trứng: Giàu choline và protein có lợi cho sức khỏe. Thêm một ít rau bina, bông cải xanh nhỏ, phô mai vào món trứng bác để cung cấp thêm chất xơ, có lợi cho tiêu hóa.
Trẻ lớn hơn
Các loại hạt: Hạt óc chó, ngũ cốc nguyên hạt và một số loại trái cây sấy khô như quả việt quất, nam việt quất phù hợp làm món ăn nhẹ. Ngoài omega-3 dồi dào, các loại hạt còn có vitamin E, chất chống oxy hóa hỗ trợ bảo vệ màng tế bào não khỏi hư hại.
Sinh tố: Một ít sữa chua nguyên chất, quả mọng, sữa cho vào máy xay nhuyễn, tạo nên thức uống bổ dưỡng cho bữa sáng của con.
Món xào: Để có bữa ăn giàu choline, phụ huynh có thể thử làm món xào từ đậu phụ, thịt bò nạc, bông cải xanh và súp lơ trắng.","Phụ huynh cho trẻ ăn nhiều quả mọng, cá hồi, trứng, bông cải xanh để nhận được chất chống oxy hóa, axit béo omega-3, choline, hỗ trợ tăng cường chức năng não. - VnExpress","https://vnexpress.net/mon-an-giup-tre-thong-minh-4683689.html","Chủ nhật, 3/12/2023, 12:00 (GMT+7)","https://i1-suckhoe.vnecdn.net/2023/12/02/tre-an-gi-1701506321-2565-1701506794.jpg?w=1200&h=0&q=100&dpr=1&fit=crop&s=eaJh2CBCsE7SVD3y9KWf-g","","Dinh dưỡng & vận động","https://vnexpress.net/tin-tuc-24h"
"4684063","3 vũ khí để Man City đối phó 'cỗ máy pressing' của Tottenham","""Man City đã quen với việc đối mặt với những hàng thủ lùi sâu hàng tuần. Vì vậy, sẽ rất thú vị khi xem họ thi đấu thế nào trước đội hình dâng cao của Tottenham trên sân Etihad"", trang chủ Ngoại hạng Anh bình luận về trận cầu tâm điểm vòng 14 Ngoại hạng Anh hôm nay. 
Rất ít CLB đủ khả năng cũng như dũng cảm để đẩy hàng thủ lên cao nhằm thu hẹp khoảng trống, còn tuyến trên cố gắng gây sức ép và tranh chấp bên phần sân của Man City. Nhưng Tottenham nhiều khả năng vẫn lựa chọn lối chơi mạo hiểm này, ngay cả khi phải thi đấu tại Etihad. Tân HLV Ange Postecoglou khẳng định sẽ không thay đổi cách tiếp cận chiến thuật ngay cả khi không có bộ đôi trung vệ hàng đầu là Micky van de Ven và Christian Romero, cùng nhạc trưởng James Maddison.
Vậy Pep Guardiola sẽ đối phó thử thách chiến thuật rất khác biệt này như thế nào?
Khả năng chạy chỗ của Haaland và Foden. Phương pháp rõ ràng nhất để làm tổn thương đối thủ sẵn sàng mạo hiểm với hàng phòng ngự cao là những đường bóng dài ra phía sau để các cầu thủ tấn công khai thác thoảng trống.
Về lý thuyết, Erling Haaland - một trong những tiền đạo nhanh và mạnh mẽ nhất của bóng đá thế giới - sẽ thích gặp những đối thủ có lối chơi như vậy. Trung phong Na Uy đã thực hiện 363 pha chạy chỗ không bóng qua 13 vòng đầu Ngoại hạng Anh - thông số cao thứ bảy trong tại giải. Trong đó, các đồng đội chuyền cho Haaland với 32,5% số lần di chuyển đó. Phil Foden thì đứng thứ chín với 351 pha chạy chỗ tương tự.
Vì vậy, hàng thủ của Tottenham sẽ gặp thử thách rất lớn trước sự khả năng di chuyển và hoán đổi vị trí của hàng công nhà đương kim vô địch, với Foden và Julian Alvarez được đá tự do. Nếu đội khách đá thiếu chặt chẽ, bộ đôi này đủ khả năng phối hợp rồi bơm bóng cho Haaland dứt điểm.
Những ví dụ về các bàn thắng của Haaland vào lưới Fulham tại Ngoại hạng Anh và RB Leipzig ở Champions League bên dưới cho thấy rõ ràng về cách Man City triển khai bóng với tiền đạo Na Uy thường là điểm kết thúc.
Kéo giãn hàng thủ Tottenham. Sau khi nhậm chức hè 2023, Postecoglou đã biến Tottenham thành cỗ máy pressing. Họ hiện đứng đầu Ngoại hạng Anh về số cú sút từ những lần tranh cướp bóng và ghi năm bàn từ những tình huống như vậy - thông số cũng đứng đầu giải.
Nhưng Man City là bài toán rất khác cho Postecoglou. Khi quyết định dồn ép mạnh mẽ trong cả ba lần gặp Man City mùa trước và toàn thua, Arsenal đã gặp phải nhiều vấn đề. Một trong số đó là các cầu thủ chạy cánh của Man City bám sát đường biên để kéo giãn hàng thủ Arsenal và mở ra những khoảng trống.
Nếu Tottenham vẫn lựa chọn cách tiếp cận dâng cao pressing, Man City sẽ có thể thực hiện những đường chuyền dài theo chiều dọc hướng tới vị trí của Haaland - tiền đạo cao 1,94 m với khả năng làm tường - như hình dưới đây trong trận gặp Arsenal mùa trước.
Tottenham bắt buộc phải tập trung chặn các đường chuyền này. Từ đó, những khoảng trống sẽ được giải phóng ở hai biên để các tiền đạo cánh Man City khai thác, đặc biệt là ngôi sao đang thăng hoa Jeremy Doku.
Khác biệt từ Ederson. Man City cũng có thể hóa giải tuyến pressing đầu tiên của Tottenham với những đường chuyền dài từ vòng cấm. HLV Pep Guardiola khuyến khích Ederson thực hiện những cú phất như vậy cho Haaland trong các trận gặp Arsenal, và đây là lối chơi đơn giản mà Man City đôi khi sử dụng như vũ khí.
Qua 13 vòng, Ederson có 85 đường chuyền dài chính xác, đạt tỷ lệ 52,8% - cao nhất giải. Xếp sau lần lượt là Mark Flekken của Brentford với 41,1%, Jordan Pickford của Everton với 38,7%, Wes Foderingham của Sheffield United với 35,7% và Thomas Kaminski của Luton Town với 33,5%.
Nếu hàng hậu vệ của Tottenham dâng quá cao, Ederson có thể giúp Man City chuyển trạng thái từ phòng ngự sang tấn công chỉ với một đường chuyền dài và đặt Haaland vào tư thế dứt điểm ở phần sân đối diện. 
""Nếu Man City đá đúng phong độ, Haaland chắc chắn có đủ kỹ năng để khiến Tottenham phải trả giá nếu vẫn sử dụng chiến thuật pressing tầm cao"", trang chủ Ngoại hạng Anh kết luận.","Anh- Tốc độ của Haaland, khả năng kéo giãn hàng thủ đối phương và những cú phất dài từ thủ môn Ederson có thể giúp Man City hóa giải hệ thống pressing tầm cao của Tottenham. - VnExpress","https://vnexpress.net/3-vu-khi-de-man-city-doi-pho-co-may-pressing-cua-tottenham-4684063.html","Chủ nhật, 3/12/2023, 11:50 (GMT+7)","https://i1-thethao.vnecdn.net/2023/12/03/4613-jpeg-1701578771-6497-1701578902.jpg?w=1200&h=0&q=100&dpr=1&fit=crop&s=8IK4rbSCKQt6gUX0tWgMCA","","Phân tích","https://vnexpress.net/tin-tuc-24h"
"4684102","Tuyết rơi dày đặc khiến bang Đức tê liệt","Ôtô chạy giữa những hàng cây phủ đầy tuyết trên tuyến đường ở bang Bavaria, miền nam nước Đức ngày 2/12.
Phần lớn nước Đức đã phải hứng chịu tuyết và nhiệt độ đóng băng trong nhiều ngày. Tại bang Bavaria, tuyết rơi dày đặc trong đêm 1/12 và ngày 2/12, gây tình trạng hỗn loạn.
Ôtô chạy giữa những hàng cây phủ đầy tuyết trên tuyến đường ở bang Bavaria, miền nam nước Đức ngày 2/12.
Phần lớn nước Đức đã phải hứng chịu tuyết và nhiệt độ đóng băng trong nhiều ngày. Tại bang Bavaria, tuyết rơi dày đặc trong đêm 1/12 và ngày 2/12, gây tình trạng hỗn loạn.
Máy xúc tuyết làm việc trước máy bay ở sân bay Munich, thủ phủ Bavaria ngày 2/12.
Khoảng 760 chuyến bay đến và rời sân bay Munich bị hủy hôm 2/12. Sau lần đầu tiên tạm dừng hoạt động đến trưa 2/12, sân bay tiếp tục thông báo đóng cửa đến 6h ngày 3/12.
""Mọi thứ đều đóng cửa. Bạn phải kiên nhẫn, chẳng thể làm gì được"", Magda Shokosa, một hành khách bị mắc kẹt tại sân bay Munich, cho biết.
""Chúng tôi phải dùng xẻng dọn đường vào bãi đậu xe rồi bắt taxi vì xe buýt không chạy"", Brigitte Schloessel, một hành khách khác, nói.
Máy xúc tuyết làm việc trước máy bay ở sân bay Munich, thủ phủ Bavaria ngày 2/12.
Khoảng 760 chuyến bay đến và rời sân bay Munich bị hủy hôm 2/12. Sau lần đầu tiên tạm dừng hoạt động đến trưa 2/12, sân bay tiếp tục thông báo đóng cửa đến 6h ngày 3/12.
""Mọi thứ đều đóng cửa. Bạn phải kiên nhẫn, chẳng thể làm gì được"", Magda Shokosa, một hành khách bị mắc kẹt tại sân bay Munich, cho biết.
""Chúng tôi phải dùng xẻng dọn đường vào bãi đậu xe rồi bắt taxi vì xe buýt không chạy"", Brigitte Schloessel, một hành khách khác, nói.
Người phụ nữ xúc tuyết trên vỉa hè trước một cửa hàng ở Bavaria.
Truyền thông địa phương đưa tin xảy ra nhiều vụ tai nạn và ùn tắc giao thông.
Người phụ nữ xúc tuyết trên vỉa hè trước một cửa hàng ở Bavaria.
Truyền thông địa phương đưa tin xảy ra nhiều vụ tai nạn và ùn tắc giao thông.
Tuyết bám trên các chuyến tàu tại nhà ga chính thành phố Munich. Dịch vụ tàu đến và đi đường dài từ nhà ga đã bị đình chỉ.
Lượng lớn khách mắc kẹt tại nhà ga này. ""Chúng tôi chỉ muốn biết liệu còn cơ hội ra khỏi đây hay không"", một người nói.
Tuyết bám trên các chuyến tàu tại nhà ga chính thành phố Munich. Dịch vụ tàu đến và đi đường dài từ nhà ga đã bị đình chỉ.
Lượng lớn khách mắc kẹt tại nhà ga này. ""Chúng tôi chỉ muốn biết liệu còn cơ hội ra khỏi đây hay không"", một người nói.
Người đàn ông dọn tuyết trên vỉa hè ở Munich, bên cạnh là những chiếc xe đạp bị tuyết phủ đầy.
Lượng tuyết dày 44 cm hôm 2/12 ở Munich là lượng tuyết rơi nhiều nhất từng được ghi nhận trong tháng 12, kể từ khi số liệu bắt đầu được ghi lại vào năm 1933.
Người đàn ông dọn tuyết trên vỉa hè ở Munich, bên cạnh là những chiếc xe đạp bị tuyết phủ đầy.
Lượng tuyết dày 44 cm hôm 2/12 ở Munich là lượng tuyết rơi nhiều nhất từng được ghi nhận trong tháng 12, kể từ khi số liệu bắt đầu được ghi lại vào năm 1933.
Tuyết rơi trắng xóa và phủ đầy các đường ray ở nhà ga chính của thành phố Munich.
Các chuyến tàu không thể đến ga trung tâm của Munich. Tình trạng trì hoãn có thể kéo dài đến 4/12. Ngoài tàu, dịch vụ xe buýt, xe điện cũng bị dừng.
Tuyết rơi trắng xóa và phủ đầy các đường ray ở nhà ga chính của thành phố Munich.
Các chuyến tàu không thể đến ga trung tâm của Munich. Tình trạng trì hoãn có thể kéo dài đến 4/12. Ngoài tàu, dịch vụ xe buýt, xe điện cũng bị dừng.
Tuyết bao phủ sân vận động Allianz Arena của câu lạc bộ Bayern Munich ngày 2/12. Trận đấu giữa Bayern Munich và Union Berlin trong khuôn khổ giải vô địch quốc gia Đức Bundesliga đã phải hủy bỏ.
Tuyết bao phủ sân vận động Allianz Arena của câu lạc bộ Bayern Munich ngày 2/12. Trận đấu giữa Bayern Munich và Union Berlin trong khuôn khổ giải vô địch quốc gia Đức Bundesliga đã phải hủy bỏ.
Tuyết phủ dày đặc trên những chiếc xe và tuyến phố tại Munich.
Người phát ngôn cảnh sát Munich hôm 2/12 cho biết cảnh sát đã yêu cầu người dân ở Munich không sử dụng ôtô trừ khi thực sự cần thiết. Người dân ở một số vùng phía nam Bavaria được yêu cầu không rời khỏi nhà.
Tuyết phủ dày đặc trên những chiếc xe và tuyến phố tại Munich.
Người phát ngôn cảnh sát Munich hôm 2/12 cho biết cảnh sát đã yêu cầu người dân ở Munich không sử dụng ôtô trừ khi thực sự cần thiết. Người dân ở một số vùng phía nam Bavaria được yêu cầu không rời khỏi nhà.
Người trượt tuyết trên sườn núi, khi mùa trượt tuyết bắt đầu ở Zugspitze, đỉnh núi cao nhất nước Đức.
Người trượt tuyết trên sườn núi, khi mùa trượt tuyết bắt đầu ở Zugspitze, đỉnh núi cao nhất nước Đức.
Băng tuyết bám trên trạm thời tiết của Cơ quan Thời tiết Đức ở đỉnh Zugspitze.
Băng tuyết bám trên trạm thời tiết của Cơ quan Thời tiết Đức ở đỉnh Zugspitze.
Người lớn và trẻ em cùng những chiếc xe trượt tuyết trên ngọn đồi phía sau nghị viện bang Bavaria.
Dù nhiều hoạt động bị đình trệ, một số cư dân Munich tỏ ra vui vẻ với bầu không khí mùa đông. Một số phụ huynh đưa con đi chơi xe trượt tuyết.
""Cuối cùng thì tuyết cũng rơi. Tôi nghĩ thật tuyệt vì khung cảnh yên tĩnh hơn một chút. Nhìn chung bầu không khí dễ chịu hơn"", Friedrich Zeller nói.
Người lớn và trẻ em cùng những chiếc xe trượt tuyết trên ngọn đồi phía sau nghị viện bang Bavaria.
Dù nhiều hoạt động bị đình trệ, một số cư dân Munich tỏ ra vui vẻ với bầu không khí mùa đông. Một số phụ huynh đưa con đi chơi xe trượt tuyết.
""Cuối cùng thì tuyết cũng rơi. Tôi nghĩ thật tuyệt vì khung cảnh yên tĩnh hơn một chút. Nhìn chung bầu không khí dễ chịu hơn"", Friedrich Zeller nói.
Đồ trang trí Giáng sinh đang được bán tại chợ Giáng sinh Christkindlesmarkt. Christkindlesmarkt, ở thành phố Nuremberg của bang Bavaria, là một trong những chợ lớn nhất và nổi tiếng nhất thế giới, có từ thế kỷ 17.","Tuyết rơi dày ở bang Bavaria khiến nhiều chuyến bay và chuyến tàu đường dài ở Munich bị hủy, chợ Giáng sinh đóng cửa và một trận bóng đá bị hủy. - VnExpress","https://vnexpress.net/tuyet-roi-day-dac-khien-bang-duc-te-liet-4684102.html","Chủ nhật, 3/12/2023, 11:43 (GMT+7)","https://i2-vnexpress.vnecdn.net/2023/12/03/afp-1701573686-1701578314.jpg?w=1200&h=0&q=100&dpr=1&fit=crop&s=HapDteATyYHgZzPIv1DSsA","","Thế giới","https://vnexpress.net/tin-tuc-24h"
"4684017","Canh cua để qua đêm được không?","Trả lời:
Cua giàu dinh dưỡng như lipid, vitamin, canxi, muối khoáng. Trong Đông y, cua đồng vị mặn, mùi tanh, tính lạnh, có tác dụng tán huyết, bổ gân cốt, khớp xương.
Tuy nhiên, bạn không nên ăn cua buổi sáng, đặc biệt là cua để qua đêm. Cua có tính lạnh, ăn buổi sáng dễ gây lạnh bụng, thậm chí bị đau bụng, rối loạn tiêu hóa (kể cả canh cua mới nấu). Thời điểm thích hợp nhất để ăn canh cua là buổi trưa hoặc buổi tối. Người bị tiêu chảy tuyệt đối không nên ăn cua đồng tránh bị ngộ độc, tiêu hóa. Cua đồng có tính lạnh khiến người đang bị bệnh, bị tiêu chảy càng bị nặng thêm. Ngoài ra, thức ăn để qua đêm tạo điều kiện vi khuẩn phát triển, gây độc.
Người bị dị ứng với cua thì không nên ăn, do nguy cơ ngứa, nổi mề đay, tiêu chảy, thậm chí khó thở, co thắt phế quản, nguy hiểm tính mạng.
Để an toàn, bạn không nên ăn đồ ăn để qua đêm. Mọi người nên mua cua sống về chế biến, không nên mua sản phẩm đã xay sẵn vì có thể sẽ bị lẫn cua chết.","Nhiều người nói ăn canh cua nhiều dinh dưỡng nhưng không nên để qua đêm tránh ngộ độc, thậm chí nhiễm độc có đúng không? (Hoài, 47 tuổi, Bắc Ninh) - VnExpress","https://vnexpress.net/canh-cua-de-qua-dem-duoc-khong-4684017.html","Chủ nhật, 3/12/2023, 11:42 (GMT+7)","https://i1-suckhoe.vnecdn.net/2023/12/02/Anhmanhinh20231202luc210631-17-1986-3167-1701526074.png?w=1200&h=0&q=100&dpr=1&fit=crop&s=ztCWWqWGBDjL5oSXIu5F-Q","","Tư vấn","https://vnexpress.net/tin-tuc-24h"
