"""ID"", ""Title"", ""Content"", ""Description"", ""URL"", ""Publication Date"", ""Image URL"", ""Author"", ""Category"", ""Source"""
"4681584","Có lẽ nào tôi báo công an khi chồng chơi cờ bạc?","Tôi làm dâu 10 năm, có hai con đủ nếp đủ tẻ. Chồng tôi 34 tuổi, làm qua rất nhiều nghề nhưng đều thất bại, giờ quay về làm gần nhà với mức lương 10 triệu đồng. Anh đang gánh trên vai số nợ chứng khoán 300 triệu đồng, tiền nợ làm nhà còn 300 triệu đồng nữa. Hàng ngày anh đi làm từ 6h sáng đến 17h30. Từ 18h đến 18h40 là thời gian vàng của chồng tôi, dù trời có sập cũng không ai tách được anh ra khỏi chiếc điện thoại yêu quý. Sau khoảng đó là anh đi tắm, ăn cơm rồi nằm kềnh ra giường đến 22h, tiếp đó ôm điện thoại ghi ghi chép chép. Một tháng 30 ngày anh như thế.
Cứ dịp lễ tết xuân về, giỗ chạp là chồng tôi lại bơ phờ tóc tai, râu mọc dài ra, người mệt mỏi vì thức đêm để cháy với đam mê. Nhà có cỗ bàn, chú cháu, anh em ăn uống nhanh rồi vào phòng kín khóa cửa, nói là mừng tuổi cho nhau, không cần quan tâm bất cứ việc gì trên trời dưới đất. Lương anh chỉ để trả lãi, còn số tiền từ chơi đỏ đen kia cũng để phục vụ đam mê; được thì cả làng biết, mất không ai hay.
Bố chồng cũng đam mê món đó, đến tuổi này ông giảm đi đáng kể, đôi lần góp ý các con chơi có điểm dừng. Nói chung, bố mẹ chồng giờ không buồn nói nữa vì nói không được. Tôi đi làm gần nhà, đủ nuôi hai con ăn học và chi tiêu tiết kiệm cho sinh hoạt gia đình, trồng rau nuôi gà, cải thiện bữa ăn. Cứ mỗi lần chồng trúng đề là ngay lập tức anh em kéo nhau ra phố, mẹ con tôi ở nhà tự túc. Cũng có lần anh kéo anh em về nhà tôi, báo hai, ba mâm nhậu. Khi thua, anh cau có, khó chịu, bực dọc đủ thứ. Tất nhiên, ba mẹ con tôi chẳng có đồng trợ cấp nào từ lương chính hay ""lộc trời ban kia"". Tôi nói mãi không được, nói ra có khi vợ chồng còn cãi nhau, chán ngấy, thôi thì im cho yên nhà cửa, để thời gian đi làm chăm con.
Khi vỡ nợ, chồng tôi nhờ người vay tín dụng đen, mẹ con tôi là người biết sau cùng. Chắc tôi chờ người ta đến ""bê"" nốt cái nhà mới xây đi. Tôi rất mệt mỏi khi chồng cứ sống với đam mê bất tận đó mà bỏ bê vợ con. Khi vui thì bạn bè anh ở đâu mà nhiều thế. Đến khi thất bát, quay về với vợ con, chẳng thấy ai hỏi thăm ngó ngàng. Nhiều người vợ, trong đó có tôi, vẫn kiên trì bám trụ đến giờ này. Cứ cho là vì con, vì bố mẹ, vì sĩ diện bản thân, nên mọi thứ vẫn diễn ra trong im lặng, không ai biết trong đó bão giông như thế nào.
Tôi và những người vợ của các ông chồng thích đỏ đen cũng cần được nghỉ ngơi, giải trí, cần được chia sẻ, quan tâm. Sự kiên trì, chịu đựng của chúng tôi có giới hạn; các anh đừng để một ngày về nhà sau giờ làm thấy nhà vắng tanh, tủ đồ trống rỗng, lúc đó mới thấy thấm. Chồng tôi không bao giờ đọc báo nên sẽ chẳng đọc được những lời tâm sự này. Có lúc ngồi nhìn những con người ăn uống no say rồi vào phòng đóng cửa khoanh chân ấy, tôi đã thầm nghĩ: ""Liệu có khi nào mình là người báo công an không""?
Mỹ Duyên","Tôi, một người vợ lấy phải ông chồng và gia đình chồng có truyền thống thích chơi cờ bạc. - VnExpress","https://vnexpress.net/co-le-nao-toi-bao-cong-an-khi-chong-choi-co-bac-4681584.html","Thứ hai, 27/11/2023, 11:00 (GMT+7)","https://i2-vnexpress.vnecdn.net/2023/11/27/istockphoto1316343288612x612-1-5846-9287-1701056843.jpg?w=1200&h=0&q=100&dpr=1&fit=crop&s=tENfV-RJ3T495kylrkValw","","Tâm sự","https://vnexpress.net/tin-tuc-24h"
"4681471","Vinhomes và KGS hợp tác phát triển hệ thống giáo dục liên cấp quốc tế","Theo thỏa thuận hợp tác, Hệ thống Trường liên cấp quốc tế Hàn Quốc (Korean Global School – KGS) sẽ phát triển hai cơ sở giáo dục liên cấp quốc tế. Đó là Vinhomes Ocean Park 1 (Hà Nội) dự kiến khai giảng vào tháng 8/2024 và Vinhomes Grand Park (TP HCM) dự kiến khai giảng vào tháng 8/2025.
Trong đó, trường liên cấp quốc tế KGS Vinhomes Ocean Park 1 xây dựng trên khu đất có diện tích hơn một ha, nằm trên đường Đại Dương. Đây được ví như trục đường giáo dục quốc tế khi gần trường Brighton College, Đại học VinUni đã đi vào hoạt động và Dewey School đang được thi công.
Tại Vinhomes Grand Park, trường được xây dựng trên diện tích hơn 1,7 hecta. Trường nằm gần hệ thống trường liên cấp Vinschool đã đi vào vận hành, Brighton College đang được triển khai và hàng chục trường đại học, công lập, quốc tế khác trong nội khu và khu vực kế cận.
Bà Nguyễn Thu Hằng - Tổng giám đốc Công ty cổ phần Vinhomes cho biết đơn vị kỳ vọng sự hợp tác với đối tác Hàn Quốc KGS sẽ mang đến cho cư dân Vinhomes Ocean Park 1 và Vinhomes Grand Park thêm lựa chọn giáo dục chất lượng cao. Đồng thời, điều này góp phần tạo nên môi trường giáo dục đẳng cấp quốc tế cho các đại đô thị Vinhomes.
""Sự hợp tác này cũng giúp thu hút các cư dân, chuyên gia, cư dân toàn cầu lựa chọn hai nơi này làm nơi sống lý tưởng, trong đó có nhóm chuyên gia Hàn Quốc và gia đình"", bà nói.
Việc tạo dựng các hệ thống giáo dục quốc tế tầm cỡ trong nội khu thể hiện tầm nhìn và chiến lược của Vinhomes trong phát triển các đại đô thị phức hợp đầy đủ tiện ích, đặc biệt là giáo dục. Những thế hệ trẻ Việt Nam và quốc tế sinh sống tại đây cũng có thêm cơ hội giao lưu văn hóa, kiến thức, để từ đó trở thành công dân toàn cầu trong tương lai.
Bà Kim Ji Eun JI, đại diện KGS, chia sẻ các đại đô thị Vinhomes với tiện ích đầy đủ, hiện đại cùng môi trường xanh thu hút đông đảo cộng đồng quốc tế, trong đó có công dân Hàn Quốc sinh sống tại Việt Nam. Đây cũng là khu vực tiềm năng mà KGS muốn hướng tới. Nền tảng hạ tầng, tiện ích, môi trường xanh, cuộc sống văn minh sẵn có tại các đại đô thị này là một trong những tiêu chí nhà trường chọn đặt các cơ sở giáo dục.
KGS là trường liên cấp quốc tế Hàn Quốc đào tạo từ mầm non tới trung học phổ thông, thành lập vào tháng 8/2020 và được Bộ Giáo dục và Đào tạo Việt Nam cấp phép hoạt động - cần cung cấp đẩy đủ giấy tờ được BGD cấp. Hệ thống trường KGS hiện có 3 cơ sở tại Việt Nam gồm một trường tại Hà Nội và hai trường tại TP HCM, giảng dạy bằng 3 ngôn ngữ: tiếng Anh, tiếng Hàn và tiếng Việt.
Hiện trường triển khai song song chương trình đào tạo quốc tế Cambridge và chương trình quốc tế Hàn Quốc. Với triết lý lấy học sinh làm trung tâm, chương trình đào tạo tạo ra môi trường giáo dục để khơi gợi niềm đam mê khám phá của học sinh thông qua trải nghiệm thực tế, giúp học sinh phát huy tiềm năng nhằm tạo ra một thế hệ thành công và hạnh phúc, biết quan tâm, chia sẻ.","Hai đơn vị vừa ký biên bản ghi nhớ hợp tác toàn diện, phát triển hệ thống giáo dục liên cấp quốc tế tại các đại đô thị Vinhomes. - VnExpress","https://vnexpress.net/vinhomes-va-kgs-hop-tac-phat-trien-he-thong-giao-duc-lien-cap-quoc-te-4681471.html","Thứ hai, 27/11/2023, 11:00 (GMT+7)","https://i2-vnexpress.vnecdn.net/2023/11/27/anh23-1701057178-2607-1701057234.jpg?w=1200&h=0&q=100&dpr=1&fit=crop&s=7R8hhPhSwl8siDdZLfD1pA","","Tin tức","https://vnexpress.net/tin-tuc-24h"
"4681705","Nửa thế kỷ quan hệ Việt Nam - Nhật Bản","","Nửa thế kỷ quan hệ Việt Nam - Nhật Bản - VnExpress","https://vnexpress.net/nua-the-ky-quan-he-viet-nam-nhat-ban-4681705.html","Thứ hai, 27/11/2023, 10:58 (GMT+7)","https://i1-kinhdoanh.vnecdn.net/2023/11/27/anh-top.jpg?w=1200&h=0&q=100&dpr=1&fit=crop&s=SgcTZpePoA1L4NuVgN7CNA","","Vĩ mô","https://vnexpress.net/tin-tuc-24h"
"4681587","Người Israel vỡ òa khi đón con tin trở về từ Gaza","""Thật tuyệt vời, tôi đã không tin cho đến khi nhìn thấy hình ảnh con bé"", Carmel Idan, ông nội của Avigail Idan, bé gái 4 tuổi người Mỹ gốc Israel, nói bên ngoài nhà riêng tối 26/11, khi truyền hình phát trực tiếp cảnh các con tin được Hamas trao trả từ Dải Gaza.
Bé Avigail bị Hamas bắt làm con tin trong đợt đột kích khu dân cư Kfar Aza của Israel ngày 7/10. Mẹ Avigail bị giết trước mặt bé, người cha cũng không qua khỏi sau khi dùng thân mình chắn đạn cho con gái. Avigail đã phải trải qua sinh nhật 4 tuổi lúc bị giam.
Hamas ngày 26/11 thả 17 con tin gồm 14 người Israel và ba công dân Thái Lan, trong đợt trao đổi người thứ ba sau thỏa thuận ngừng bắn với Tel Aviv, nâng số người được lực lượng này phóng thích lên 39 kể từ 24/11.
Bầu không khí vui mừng bao trùm Israel. Hàng trăm người đã tụ tập hai bên đường, vẫy cờ, bắn pháo giấy chào đón đoàn xe chở con tin đi từ Dải Gaza đến căn cứ không quân Hatzerim gần Beersheba.
Khi đoàn xe đi qua Ofakim, đoàn người vẫy cờ, cất tiếng hát chào đón, một số người trong xe vẫy tay đáp lại. Sau khi đến căn cứ, các con tin được chuyển đến bệnh viện để kiểm sức khỏe và đoàn tụ cùng gia đình.
10 trên 14 con tin Israel được phóng thích trong đợt thứ ba là cư dân sống ở làng Kfar Aza.
Hàng trăm người làng Kfar Aza đã tổ chức ăn mừng vào tối 26/11 tại nơi sơ tán ở Shefayim, miền trung Israel. Họ cùng nhau xem danh tính các con tin được thả thông qua màn hình lớn, phát trực tiếp cảnh Hội Chữ thập đỏ tiếp nhận người từ tay Hamas.
Mỗi khi xác định được người quen trong làng, đám đông lại vỡ òa trong tiếng reo hò. Vài người ôm mặt, không dám nhìn vào màn hình, mô tả những ngày qua giống ""chuyến tàu lượn siêu tốc đầy cảm xúc"".
Ông Carmel ban đầu tin rằng cháu gái sẽ được thả trong đợt trao đổi con tin đầu tiên ngày 24/11. ""Nhưng chúng tôi đã tìm và không thấy con bé, đợt phóng thích thứ hai cũng không. Giống như chơi trò ú òa vậy"", ông nói.
""Chúng tôi không ngủ cả đêm vì hồi hộp, vì lo có những điều có thể xảy ra vào phút cuối"", Meitar Yacobi, 30 tuổi, người làng Kfar Aza hiện sơ tán đến Tel Aviv, nói. Cô đến Shefayim để hòa chung cảm xúc với các láng giềng.
Hamas đồng ý trao đổi 50 con tin để đổi lấy 150 tù nhân Palestine đang bị Israel giam trong thời gian ngừng bắn từ 24 đến 27/11. Israel tuyên bố chấp nhận gia hạn ngừng bắn thêm một ngày cho mỗi lần Hamas thả thêm 10 con tin.
""Thực sự rất vui, nhưng đây là niềm hạnh phúc đi đôi với nỗi đau, bởi nhiều người bạn của tôi chưa được giải thoát theo thỏa thuận. Điều này làm trái tim tôi tan vỡ"", Yacobi nói thêm.
Tại làng Nahal Oz, phóng viên Amir Tibon ôm đầu xúc động khi thấy những hình ảnh đầu tiên của hai chị em gái Ela, 8 tuổi, và Dafna, 15 tuổi, được phóng thích.
""Chúng tôi đã chờ đợi điều này suốt 51 ngày"", Tibon, người sống ở Nahal Oz, nói. Maayan Zin, mẹ của hai chị em, đã đăng bức ảnh đoàn tụ với các con gái lên mạng sau đó.
Rotem Katz, nhân viên y tế tại Nahal Oz, cho hay sự trở về của các con tin tạo ra rất nhiều cảm xúc lẫn lộn.
""Điều này khiến tôi hạnh phúc, nhưng cũng khiến tôi run rẩy tận tâm can. Có thể do đây là những người mà tôi phải chịu trách nhiệm chăm sóc, vậy mà họ phải chịu những điều tồi tệ nhất"", Katz nói.
Ông Carmel ở Kfar Aza cũng mô tả cảm xúc lẫn lộn, khi hạnh phúc vì cháu gái an toàn, nhưng còn đó nỗi đau mất con trai và con dâu trong đợt đột kích ngày 7/10. ""Đó là vết thương không bao giờ khép miệng"", ông nói.
183 con tin khác vẫn bị Hamas và các phe khác ở Gaza giam, theo thống kê của Israel. ""Nhiều người chưa thể trở về. Tôi rất mong họ sớm được giải thoát và quân đội Israel sẽ hoàn thành những gì đã hứa, gồm giải cứu tất cả con tin và tiêu diệt Hamas"", Carmel bày tỏ.","Khi thấy hình ảnh bé Avigail Idan trên truyền hình, ông Avigail ban đầu không thể tin rằng cháu gái mình đang trên đường trở về từ Gaza. - VnExpress","https://vnexpress.net/nguoi-israel-vo-oa-khi-don-con-tin-tro-ve-tu-gaza-4681587.html","Thứ hai, 27/11/2023, 10:54 (GMT+7)","https://i2-vnexpress.vnecdn.net/2023/11/27/whatsapp-image-2023-11-26-at-2-4171-5452-1701053201.jpg?w=1200&h=0&q=100&dpr=1&fit=crop&s=eLHlD3e9qNxNPeP5ODobYw","","Thế giới","https://vnexpress.net/tin-tuc-24h"
"4681574","Thanh niên bị bắn vì gây gổ với tài xế khác","Chiếc van màu đỏ hiệu Nissan chuyển làn vượt lên rồi ngoặt sang trái tạt đầu xe Ford màu đen. Xe Ford lập tức tăng tốc chặn đầu đối phương và cả hai dừng lại.
Hai người trên chiếc Ford bước xuống, và một người xông đến thò tay qua cửa sổ đấm tài xế xe Nissan. Ngay sau đó là ít nhất 3 tiếng súng vang lên. Người vừa vung nắm đấm bật ngửa ra sau, đập vào một ôtô đang lăn bánh ngang qua trước khi lảo đảo chạy về hướng ngược lại chiều xe chạy.
Cảnh sát Fort Wayne, bang Indiana, cho biết nhận được báo cáo về vụ va chạm giao thông và có người bị bắn vào trưa 19/11. Theo cảnh sát, có hai người bị bắn trong sự việc, với một bị bắn vào tay, và một ôtô khác vô tình bị bắn trúng. May mắn cả hai nạn nhân bị bắn đều không nguy hiểm đến tính mạng.
Tài xế xe Nissan bị bắt với cáo buộc thiếu thận trọng với một vũ khí chết người, trong khi tài xế xe Ford đối mặt với cáo buộc tấn công người khác.
Indiana là một trong số các bang của Mỹ có luật ""tử thủ"" (stand your ground), cho phép một người bị tấn công không có nghĩa vụ phải thoái lui mà có thể sử dụng vũ lực (kể cả vũ lực gây chết người) đáp trả kẻ tấn công nếu cần thiết để ngăn chặn đối phương giết người, gây thương tích nghiêm trọng. Luật này đóng vai trò rất quan trọng khi các công tố viên xem xét vụ án.","Mỹ- Một trong số hai người nhảy xuống từ chiếc Ford lao tới đấm tài xế xe Nissan rồi bị bắn. - VnExpress","https://vnexpress.net/thanh-nien-bi-ban-vi-gay-go-voi-tai-xe-khac-4681574.html","Thứ hai, 27/11/2023, 10:50 (GMT+7)","https://i2-vnexpress.vnecdn.net/2023/11/27/ezgif419319f41d9-1701045933-4321-1701050454.gif?w=1200&h=0&q=100&dpr=1&fit=crop&s=dkoZGtSYVbg-8dg0XDWiQA&t=image","","Tình huống","https://vnexpress.net/tin-tuc-24h"
"4681670","Cứu nam thanh niên trôi dạt hơn 10 km trên sông","Chiều qua, anh Thư khi đang chuyển muối từ trên tàu vào kho gần khu vực cảng Long An, huyện Cần Giuộc, đã sơ ý rơi xuống nước. Cố gắng bơi vào nhưng nước chảy xiết, anh đành xuôi theo dòng với hy vọng được cứu. Ở trên bờ một số đồng nghiệp phát hiện, song lúc này nạn nhân trôi xa đành báo cơ quan chức năng.
Sau hơn một giờ, Trạm biên phòng cửa khẩu cảng Hiệp Phước, huyện Nhà Bè (TP HCM) nhận tin báo của thuyền trưởng tàu ở sông Soài Rạp có người trôi dạt trên sông ở gần khu vực cảng. Thời điểm này anh Thư biểu hiện đuối sức sau khi trôi dạt quãng đường dài. Cán bộ biên phòng đã lái canô ra giữa dòng, quăng phao để nạn nhân bám vào, kéo lên.
Bộ đội biên phòng TP HCM đã đưa nạn nhân về nhà ở huyện Cần Giờ. Nhiều qua năm, lực lượng biên phòng thành phố đã cứu hàng chục người ở khúc sông nói trên khi tàu gặp nạn, đâm va.
Sông Soài Rạp dài hơn 40 km, là ranh giới tự nhiên giữa huyện Cần Giờ và Nhà Bè (TP HCM), giữa Cần Giờ với Cần Giuộc (Long An), Gò Công Đông (Tiền Giang). Sông rộng và sâu nên đang được thực hiện dự án nạo vét để đón tàu trọng tải 70.000 tấn vào cảng Hiệp Phước.","Anh Nguyễn Minh Thư khi vận chuyển muối lên bờ đã rơi xuống sông Soài Rạp ở Long An, trôi dạt hơn 10 km, được bộ đội biên phòng tại TP HCM cứu. - VnExpress","https://vnexpress.net/cuu-nam-thanh-nien-troi-dat-hon-10-km-tren-song-4681670.html","Thứ hai, 27/11/2023, 10:47 (GMT+7)","https://i2-vnexpress.vnecdn.net/2023/11/27/z4919007147643-63e4787028ae673-5833-6218-1701056800.jpg?w=1200&h=0&q=100&dpr=1&fit=crop&s=SapkULH8CSeMXZdF9hFRUg","","Thời sự","https://vnexpress.net/tin-tuc-24h"
"4681443","'Bắt buộc xe máy lắp camera hành trình không khả thi'","""Nếu tính bài toán kinh tế thì đây là bài toán quá lãng phí cho người dân. Nếu tính giá bình quân 2,5 triệu đồng một camera hành trình x 73 triệu xe máy là gần 200.000 tỷ đồng. Số tiền này để trang bị camera giao thông từng con ngõ từng con phố và từng tuyến đường, như vậy sẽ hiệu quả hơn rất nhiều"".
Độc giả Nguyễn tiến dũng làm phép toán đơn giản để cho thấy số tiền người dân bỏ ra khi bắt buộc xe máy lắp camera hành trình, đồng thời đồng quan điểm với một đại biểu Quốc hội, khi vị này cho rằng Đại biểu Điểu Huỳnh Sang cho rằng yêu cầu hơn 6 triệu ôtô và 73 triệu xe máy trên cả nước phải lắp thiết bị giám sát hành trình là không khả thi và lãng phí.
Theo đó, Điều 33 dự thảo luật, xe cơ giới, xe máy chuyên dùng tham gia giao thông phải có thiết bị giám sát hành trình; thiết bị thu thập dữ liệu, hình ảnh người lái xe, dữ liệu, hình ảnh bảo đảm an toàn hành trình theo quy định.
Độc giả nicknamew Vn Bac ninh: ""Nếu gắn camera hành trình cho xe máy còn phải lưu ý phải chống nước, tiền cước sim 4G, chưa tính phí sửa chữa"".
Nói về đường truyền và lưu trữ dữ liệu, độc giả wintertrees.vn thắc mắc: ""Đường truyền mạng trong nước đủ để gần 80 triệu phương tiện tải lên trung tâm dữ liệu không? Nếu tất cả cùng tải lên được và dữ liệu 72h này được lưu lên thì phải mở rộng kho lưu trữ để chứa"".
Độc giả Đinh Văn Hùng lo ngại về vấn đề trộm cắp: ""Không lẽ mỗi lần dừng xe vào quán nước, quán ăn, ta phải tháo cam ra bỏ túi, đi tiếp thì lắp vào?"".
Độc giả Đỗ Tuyên cho rằng: ""Láp camera hành trình cho xe máy không khó. Tuy nhiên mục đích lắp là gì? Nếu chỉ là vì để xử lý vi phạm thì thay vì đó hãy lắp camera công cộng thì tốt hơn. Nên khuyến khích thay vì bắt buộc"".
Đồng quan điểm trên, bạn đọc có nickname longcdtk42 nói: ""Thay đề xuất yêu cầu lắp camera cho từng ôtô, xe máy sao không đề xuất tăng cường lắp đặt camera giám sát trên các tuyến đường giao thông? Đồng thời nâng cấp chất lượng quản lý, giám sát và xử phạt qua camera công cộng như vậy có phải sẽ hiệu quả hơn không. Từ đó vừa giảm số lượng camera cần thiết, giảm quân số của lực lượng chấp pháp mà người tham gia giao thông sẽ phải chấp hành đúng luật"".
Hữu Nghị tổng hợp","Người dân sẽ phải tốn kém tài chính và đối mặt với tình trạng &#039;vặt trộm camera&#039;. - VnExpress","https://vnexpress.net/bat-buoc-xe-may-lap-camera-hanh-trinh-khong-kha-thi-4681443.html","Thứ hai, 27/11/2023, 10:36 (GMT+7)","https://i2-vnexpress.vnecdn.net/2023/11/26/motorcycleactioncam615ad67ea77-1254-7814-1700974444.jpg?w=1200&h=0&q=100&dpr=1&fit=crop&s=YLt39UmV8AfYKe_M55I4Pw","","Thời sự","https://vnexpress.net/tin-tuc-24h"
