"""ID"", ""Title"", ""Content"", ""Description"", ""URL"", ""Publication Date"", ""Image URL"", ""Author"", ""Category"", ""Source"""
"4681430","Arteta: 'Arsenal mua Havertz vì khả năng dứt điểm'","Khi được hỏi liệu khả năng dứt điểm có một một trong những lý do khiến Arsenal tuyển mộ Havertz với tổng phí 82 triệu USD vào hè 2023, Arteta đáp: ""Hoàn toàn đúng. Trước hàng phòng ngự lùi sâu và bảo vệ vòng cấm như thế này, bạn cần mẫu cầu thủ như Havertz. Cậu ấy cũng có sự linh hoạt và những phẩm chất đặc biệt để thi đấu ở nhiều vị trí. Hôm nay, Havertz đã mang về ba điểm cho chúng tôi"".
Trên sân Gtech Community ngày 25/11, Arsenal gặp nhiều khó khăn với hai lần thoát thua trên vạch vôi. ""Pháo thủ"" còn bị khước từ bàn thắng của Leandro Trossard ở cuối hiệp một vì lỗi việt vị.
Khác biệt chỉ đến ở phút 89, khi Bukayo Saka tạt về cột xa để Havertz băng vào đánh đầu đưa bóng qua khe chân thủ môn Mark Flekken vào lưới. Chiến thắng 1-0 đưa Arsenal lên đỉnh bảng Ngoại hạng Anh với 30 điểm, hơn Man City và Liverpool lần lượt một và hai điểm.
Sau trận, Arteta đã kéo Havertz tới chỗ người hâm mộ đội khách để cùng ăn mừng. Về hành động này, HLV Tây Ban Nha nói: ""Havertz xứng đáng với điều đó. Cậu ấy đối mặt và không trốn tránh ở những thời điểm khó khăn. Vì vậy, bây giờ hãy tận hưởng khoảnh khắc đẹp đẽ vì Havertz xứng đáng. Tôi biết Havertz sẽ không làm vậy nên phải đẩy cậu ấy"".
Màn trình diễn của Aaron Ramsdale trước Brentford cũng được chú ý. Trong lần đầu bắt chính tại Ngoại hạng Anh kể từ trận thắng Man Utd 3-1 ngày 3/9, thủ thành người Anh mắc nhiều sai lầm khó hiểu. Đáng kể nhất là tình huống ở phút 13, khi Ramsdale xử lý chậm và để Yoane Wissa cướp bóng ngay trong vòng cấm. Wissa nhả bóng để Bryan Mbeumo sút về góc xa, nhưng Declan Rice kịp lùi về phá ngay trên vạch vôi.
Arteta ca ngợi Ramsdale thể hiện sự dũng cảm và hài lòng khi học trò giữ sạch lưới. HLV 41 tuổi cũng đánh giá cao việc toàn đội cùng chạy tới chúc mừng Ramsdale sau tiếng còi mãn cuộc. ""Khi tôi thấy tập thể đoàn kết như vậy, các thành viên thì vui vẻ, tôi rất hạnh phúc và không thể tự hào hơn. Tôi rất biết ơn những người làm việc cùng tôi để giúp công việc của tôi trở nên thú vị"", ông bày tỏ.
Điều khiến Arteta chưa hài lòng là việc Arsenal vẫn chưa thể cân bằng giữa phòng thủ và tấn công. HLV Tây Ban Nha nhấn mạnh muốn Arsenal tận dụng và ghi ba bàn ngay từ hiệp một, thay vì phải chật vật và chờ đến những phút cuối để giải quyết trận đấu.
Ngày 29/11, Arsenal sẽ trở về sân nhà tiếp Lens ở lượt năm bảng B Champions League. Thầy trò Arteta sẽ chắc chắc đi tiếp với ngôi đầu nếu giành ba điểm.","HLV Mikel Arteta ca ngợi Kai Havertz sau khi cầu thủ Đức ghi bàn duy nhất giúp Arsenal thắng Brentford để lên đỉnh bảng Ngoại hạng Anh. - VnExpress","https://vnexpress.net/arteta-arsenal-mua-havertz-vi-kha-nang-dut-diem-4681430.html","Chủ nhật, 26/11/2023, 11:12 (GMT+7)","https://i1-thethao.vnecdn.net/2023/11/26/sm2-7501-yhbt5gc6-jpeg-1700971-4445-1580-1700971902.jpg?w=1200&h=0&q=100&dpr=1&fit=crop&s=IcBsiHU1pmFJwhGJMBHSuA","Hồng Duy","Tin tức","https://vnexpress.net/tin-tuc-24h"
"4681408","Klopp can ngăn vì 'yêu mến cả Guardiola và Nunez'","""Tôi yêu mến cả hai nên đã cố gắng làm dịu tình hình"", Klopp cho biết trong cuộc họp báo sau trận hoà 1-1 trên sân Etihad. ""Tôi hoàn toàn không liên quan. Tôi không chắc mình có phải là người phù hợp để giải thích việc này không. Tôi không hiểu một từ nào và không biết thực sự chuyện gì đã xảy ra"".
HLV của Liverpool cho rằng, vấn đề có thể đơn thuần chỉ là cảm xúc. Guardiola muốn thắng và đội bóng của ông cũng muốn thắng. Khi hai bên đều không đạt mục tiêu, những vụ xung đột như giữa Guardiola và Nunez hoàn toàn có thể xảy ra. Klopp cũng cho rằng vụ việc không liên quan đến lịch sử cạnh tranh giữa hai CLB. ""Tôi không nghĩ Nunez biết gì về điều đó"", HLV của Liverpool nói thêm.
Vụ va chạm diễn ra ngay sau tiếng còi mãn cuộc. Ban đầu, Guardiola và Nunez vui vẻ bắt tay nhau. Nhưng sau một vài lời nói, hai bên bất ngờ đổi thái độ. Sau khi bị HLV Klopp kéo ra, Nunez vẫn chỉ tay về phía Guardiola với vẻ tức tối. Trong họp báo, Guardiola không làm rõ những gì đã nói với Nunez, và chỉ đùa rằng Klopp hẳn phải mạnh mẽ hơn ông mới có thể lôi tiền đạo người Uruguay rời đi.
Trận này, Man City mở tỷ số phút 27. Sau khi nhận đường chuyền của Nathan Ake, Erling Haaland sút bật tay thủ môn Alisson thành bàn. Tuy thế trận không tốt, Liverpool vẫn kịp giành lại một điểm. Phút 80, sau đường chuyền của Mohamed Salah, Trent Alexander-Arnold sút chéo góc gỡ hòa 1-1.
Kết quả này khiến Man City phải nhường lại đỉnh bảng cho Arsenal - đội giành chiến thắng 1-0 trên sân của Brentford. Dù vậy, HLV Guardiola khẳng định ông không hề thất vọng mà vô cùng hài lòng với màn trình diễn của Man City vì sau bảy năm đối đầu, ông và học trò đều biết Liverpool mạnh mẽ, cứng rắn như thế nào. Guardiola nói thêm: ""Khi họ thi đấu, trận đấu diễn ra như một bài heavy metal. Khi Salah chạm bóng, cậu ấy không bao giờ để mất"".
Trận này, Haaland đạt mốc 50 bàn ở Ngoại hạng Anh, thậm chí trở thành cầu thủ lập mốc này này nhanh nhất lịch sử khi chỉ cần 48 trận. Haaland chỉ mới chơi cho Man City từ năm 2022. Tiền đạo 23 tuổi đã ghi 36 bàn Ngoại hạng Anh mùa trước, kỷ lục trong một mùa, và 14 bàn mùa này.
""Chỉ 50 bàn thôi à"", Guardiola nói đùa. ""Thật không thể tin được. Trận này, cậu ấy suýt có bàn thứ hai, với một pha sút đập người đổi hướng và một pha bị cản phá. Sau đó, Liverpool gỡ hòa. Những khoảng cách như vậy chính là vấn đề trong bóng đá"".
Sau trận Liverpool, Man City mất vị trí dẫn đầu Ngoại hạng Anh vào tay Arsenal. Đội bóng thành London đang có 30 điểm, hơn Man City một điểm và Liverpool hai điểm.","Anh- HLV Jurgen Klopp lý giải về việc can ngăn xung đột giữa Pep Guardiola và Darwin Nunez sau trận Man City - Liverpool ở vòng 13 Ngoại hạng Anh. - VnExpress","https://vnexpress.net/klopp-can-ngan-vi-yeu-men-ca-guardiola-va-nunez-4681408.html","Chủ nhật, 26/11/2023, 11:03 (GMT+7)","https://i1-thethao.vnecdn.net/2023/11/26/nunez-1700968116-1700968127-4394-1700968241.jpg?w=1200&h=0&q=100&dpr=1&fit=crop&s=Q-FgSiHzb64pk2zQx0nQZg","Thanh Quý","Tin tức","https://vnexpress.net/tin-tuc-24h"
"4681387","17 ngày nghỉ lễ Tết năm 2024","","17 ngày nghỉ lễ Tết năm 2024 - VnExpress","https://vnexpress.net/17-ngay-nghi-le-tet-nam-2024-4681387.html","Chủ nhật, 26/11/2023, 10:54 (GMT+7)","https://i2-vnexpress.vnecdn.net/2023/11/26/lich-nghi-le-02.jpg?w=1200&h=0&q=100&dpr=1&fit=crop&s=V-McMh-Rrvhec3Nm1T0PnA","","Thời sự","https://vnexpress.net/tin-tuc-24h"
"4680391","Giấy làm từ thân sen","Chị Nguyễn Thị Thúy Phượng, 42 tuổi, trưởng nhóm nghiên cứu kể, bản thân có 8 năm làm việc ở Tây Bắc, được trải nghiệm cách đồng bào Mông, Dao làm giấy từ thực vật.
Khi đến Đồng Tháp, thấy nguồn phụ phẩm từ thân sen rất lớn nhưng nông dân chặt bỏ hoặc vùi xuống đất, chị nảy ra ý tưởng làm giấy. Giữa năm nay, nhóm bắt tay nghiên cứu, nhiều lần thử nghiệm và tìm ra quy trình sản xuất giấy từ thân sen.
Dựa theo phương pháp làm giấy truyền thống, thân sen được nấu trong nước vôi 6-8 giờ. Người thợ sau đó sẽ tách sợi (cellulose) từ thân sen, làm sạch, ngâm với vi sinh khoảng một tuần, giúp sợi trắng tự nhiên, loại bỏ phần bã còn lại.
Sợi được giã nhuyễn bằng cối đá, hoà cùng với nước, tạo hỗn hợp bột sợi. Hỗn hợp đưa lên khung, dùng đầu vòi thuỷ lực tán đều. So với tán thủ công, vòi phun giúp giấy có độ phẳng, đồng đều hơn. Giấy được phơi khô khoảng hai giờ là có thể dùng được.
Theo nhóm nghiên cứu, thân sen chứa khoảng 30% cellulose chỉ thấp hơn gương sen, song loại sợi thực vật từ thân có thể tự liên kết với nhau. Giấy sen có ưu điểm dẻo, vo lại không rách, thấm hút tốt, mùi tự nhiên... Túi xách, bao bì từ thân sen có thể dùng chất kết dính nguồn gốc thực vật để tăng độ chịu lực.
Trung bình 10 kg thân sen, thu được 0,6 kg hỗn hợp bột sợi, làm được một mét giấy. Thân sen giá khá rẻ song các công đoạn mất khá nhiều sức lao động khiến giá thành giấy sen khoảng 110.000 đồng một mét vuông. Theo nhóm nghiên cứu, hầu hết các công đoạn đều có thể dùng máy móc thay thế giúp tăng năng suất và giảm giá thành. Hiện nhóm đặt hàng máy giã sợi.
Sắp tới, các bạn trẻ triển khai mô hình thí điểm trước khi chuyển giao quy trình sản xuất cho những hộ trồng sen, làm ra thành phẩm hoặc bột sợi bán cho các doanh nghiệp sản xuất giấy. Một doanh nghiệp kinh doanh quà lưu niệm từ sen đã đưa túi giấy sen vào kinh doanh từ tháng 11.
Theo chị Phượng, trong lúc chưa sản xuất quy mô công nghiệp, người dân có thể tận dụng thời gian nông nhàn để kiếm thêm thu nhập. Ngoài ra, thông qua các cơ hội xúc tiến thương mại, nhóm giới thiệu giấy sen đến các doanh nghiệp chuyên gia công bao bì, đơn vị mỹ thuật, quà tặng, tìm đầu ra lâu dài...
Nhóm đang ấp ủ, triển khai trải nghiệm làm giấy sen cho du khách đến với Đồng Tháp, vừa phát triển du lịch vừa tạo đầu ra cho sản phẩm làm từ sen. Những bạn trẻ hy vọng giấy sen sẽ góp phần hoàn thiện hệ giá trị ngành hàng sen của tỉnh Đồng Tháp trong chuyển đổi xanh và kinh tế tuần hoàn.
Ngoài giấy sen, hiện nhiều thanh niên khởi nghiệp ở Đồng Tháp đã thương mại thành công các loại sản phẩm từ sen như trà sen (từ lá, tim sen), nước giải khát đóng chai, các loại thực phẩm chế biến hạt sen, củ sen, các loại túi lá sen, quà lưu niệm, nước hoa, tinh dầu...
Ông Lê Quốc Điền, Phó giám đốc Sở Nông nghiệp và Phát triển nông thôn tỉnh Đồng Tháp, cho biết giấy sen là sản phẩm mang tính tuần hoàn trong chuỗi giá trị sen. Hiện nay các bộ phận từ sen đều không bỏ đi từ lá, thân, hạt, củ sen.
""Nông dân có thêm thu nhập, giúp họ thêm gắn bó với nông sản này"", ông nói. Đồng Tháp có hơn 1.200 ha sen, năng suất 900 kg hạt sen một ha, có 49 sản phẩm chế biến từ sen đạt chứng nhận OCOP (mỗi xã một sản phẩm theo tiêu chuẩn Bộ Công Thương).","Đồng Tháp- Nhóm bạn trẻ đã sản xuất thành công giấy từ thân sen, dùng trong mỹ thuật, túi quà, tem nhãn trang trí, giúp bảo vệ môi trường. - VnExpress","https://vnexpress.net/giay-lam-tu-than-sen-4680391.html","Chủ nhật, 26/11/2023, 10:40 (GMT+7)","https://i2-vnexpress.vnecdn.net/2023/11/26/z4906806655747-00acda030bf1cb5-5207-2633-1700970142.jpg?w=1200&h=0&q=100&dpr=1&fit=crop&s=vrxQxk7Y4LGKZ1ku1GyALA","Ngọc Tài","Khám phá","https://vnexpress.net/tin-tuc-24h"
"4681411","Hai bài tập đơn giản giúp loại bỏ mỡ lưng","Thời gian ban ngày đã ngắn lại và các siêu thị tràn ngập các món ăn mùa lễ hội. Vì vậy, mùa thu và mùa đông là thời điểm đầy thử thách để bắt đầu giảm cân.
Petra Genco, chuyên gia thể hình, giới thiệu hai bài tập đơn giản có thể giảm mỡ lưng. Các động tác trong hai bài tập này có thể được thực hiện thoải mái tại nhà hay ở bất cứ nơi nào. Bạn không cần phải rời khỏi nhà trong thời tiết u ám hoặc khi bên ngoài trời tối đen như mực.
Tất cả những gì bạn cần là một dây kháng lực.
Kéo tay
Bạn đứng thẳng, dang hai chân, hai tay cầm dây kháng lực. Giơ cả hai tay ra trước mặt và mở rộng ra, kéo dây kháng cự.
Sau đó, đưa cánh tay về phía trước và thực hiện 3 lần, mỗi lần kéo 15 nhịp.
Đẩy ngực
Đặt dây kháng lực dưới hai chân bạn, đồng thời giữ chặt dây bằng cả hai tay.
Nghiêng phần thân trên xuống đất và kéo dây kháng lực lên trên bằng cả hai tay, đồng thời giữ hai cánh tay sát với cơ thể.
Sau đó, bạn đưa cánh tay về vị trí ban đầu và cũng thực hiện 3 lần, mỗi lần 15 nhịp.
Trong khi Genco ca ngợi những bài tập giảm mỡ lưng này, Tina - chuyên gia thể hình với hơn 350.000 người theo dõi trên Tiktok - cho rằng không có bài tập nào giúp giảm mỡ tại một vùng bất kỳ trên cơ thể. Thay vào đó, bạn cần tạo ra thâm hụt calo. Đó là khi cơ thể bạn đốt cháy nhiều calo hơn mức tiêu thụ. Điều này có thể đạt được bằng cách di chuyển nhiều hơn, ăn ít hơn hoặc kết hợp cả hai.","Bài tập kéo tay và đẩy ngực có thể được thực hiện thoải mái tại nhà trong thời tiết mùa đông u ám giúp giảm mỡ lưng. - VnExpress","https://vnexpress.net/hai-bai-tap-don-gian-giup-loai-bo-mo-lung-4681411.html","Chủ nhật, 26/11/2023, 10:35 (GMT+7)","https://i1-suckhoe.vnecdn.net/2023/11/26/rearviewshothealthyyoungwomans-4754-4766-1700967312.jpg?w=1200&h=0&q=100&dpr=1&fit=crop&s=Vt-GDp3rioubqhbUrNRD1A","Kéo tay","Khỏe đẹp","https://vnexpress.net/tin-tuc-24h"
"4681390","Haaland phá kỷ lục của cựu tiền đạo Man Utd","Tối 25/11, với bàn mở tỷ số trong trận Man City hoà Liverpool 1-1 ở vòng 13, Haaland cán mốc 50 bàn Ngoại hạng Anh. Tiền đạo 23 tuổi người Na Uy chỉ cần 48 trận để đạt con số này, trong khi kỷ lục trước đó thuộc về Andy Cole với 65 trận. Điểm nổi bật duy nhất của Cole là không cần bất cứ quả phạt đền nào khi xác lập cột mốc kể trên.
Các cầu thủ xếp tiếp theo trong danh sách này gồm: Alan Shearer (66 trận), Ruud Van Nistelrooy (68 trận), Fernando Torres và Mohammed Salah (72 trận).
Với Man Utd, Cole từng giành năm Ngoại hạng Anh và một Champions League. Trên mọi đấu trường, huyền thoại 52 tuổi từng ghi 121 bàn trong 257 trận cho Man Utd, 68 bàn trong 84 trận cho Newcastle, 37 bàn trong 100 trận cho Blackburn Rovers, 13 bàn trong 39 trận cho Fulham và 10 bàn trong 23 trận cho Man City.
Mục tiêu tiếp theo của Haaland có thể là cầu thủ ghi 100 bàn Ngoại hạng Anh nhanh nhất. Shearer đang giữ kỷ lục này qua 124 trận.
Mùa trước, với 36 bàn, Haaland đã phá kỷ lục cầu thủ ghi nhiều bàn nhất trong một mùa Ngoại hạng Anh. Kỷ lục trước đó là 32 bàn do Salah lập vào mùa 2017-2018.
Trên sân Etihad hôm qua, Haaland mở tỷ số phút 27. Sau khi nhận đường chuyền của Nathan Ake, tiền đạo 23 tuổi chạm hai nhịp để đưa bóng vào vòng cấm và ổn định vị trí rồi sút bật tay thủ môn Alisson. Tuy nhiên, Man City không bảo toàn được ba điểm. Phút 80, sau đường chuyền của Salah, Trent Alexander-Arnold sút chéo góc gỡ hòa cho Liverpool.
Sau trận này, Man City mất vị trí dẫn đầu khi chỉ có 29 điểm sau 13 trận. Trong khi đó, sau trận thắng 1-0 trên sân của Brentford, Arsenal lên dẫn đầu với 30 điểm. Liverpool xếp thứ ba với 28 điểm.","Anh- Tiền đạo Man City Erling Haaland phá kỷ lục cầu thủ cần ít trận nhất để ghi 50 bàn Ngoại hạng Anh của Andy Cole. - VnExpress","https://vnexpress.net/haaland-pha-ky-luc-cua-cuu-tien-dao-man-utd-4681390.html","Chủ nhật, 26/11/2023, 10:00 (GMT+7)","https://i1-thethao.vnecdn.net/2023/11/26/haaland4-1700963311-1700963321-3193-1700963384.jpg?w=1200&h=0&q=100&dpr=1&fit=crop&s=LtTKZ-x-vkhNEH55QRUFHg","Thanh Quý","Tin tức","https://vnexpress.net/tin-tuc-24h"
"4681235","Phát hiện núi ngầm dưới biển cao gấp đôi tòa Burj Khalifa","Ngọn núi ngầm cao 1.600 m so với đáy biển và nằm ở độ sâu khoảng 4.000 m dưới mực nước biển. Các chuyên gia phát hiện nó trong chuyến thám hiểm do Viện Đại dương Schmidt (SOI) tiến hành ở vùng biển quốc tế, cách vùng đặc quyền kinh tế của Guatemala 135 km.
Núi ngầm là những ngọn núi dưới nước với các sườn dốc nhô lên từ đáy đại dương, theo Cơ quan Khí quyển và Đại dương Quốc gia Mỹ (NOAA). Đa số núi ngầm là tàn tích của các núi lửa đã tắt và thường có hình nón. Núi ngầm hiện diện ở mọi bồn trũng đại dương trên thế giới, nhưng giới chuyên gia không rõ chính xác số lượng. Số núi ngầm cao ít nhất 1.000 m được cho là nhiều hơn 100.000. Nhưng đến nay, các nhà khoa học mới chỉ phát hiện một phần nhỏ trong số đó.
Núi ngầm mới được đoàn thám hiểm SOI quan sát bằng cách sử dụng Máy đo hồi âm đa tia EM124 trên tàu nghiên cứu Falkor (too). Thiết bị này có khả năng lập bản đồ đáy biển với độ phân giải cao.
Sau khi máy đo hồi âm phát hiện núi ngầm, một chuyên gia trên tàu đã xác nhận cấu trúc này chưa có trong bất cứ cơ sở dữ liệu đáy biển nào. Dữ liệu cho thấy ngọn núi có diện tích hơn 13 km2. ""Việc một núi ngầm cao hơn 1,5 km giấu mình dưới những con sóng đến tận bây giờ cho thấy, vẫn còn rất nhiều điều mà chúng ta chưa khám phá"", Jyotika Virmani, giám đốc điều hành tại SOI, cho biết.
Núi ngầm là những ""điểm nóng"" về đa dạng sinh học, cung cấp bề mặt cho các sinh vật như san hô biển sâu, bọt biển và nhiều loài động vật không xương sống định cư và phát triển. Những sinh vật này lại tiếp tục cung cấp thức ăn cho động vật khác. Hệ sinh thái núi ngầm thường là nơi cư trú của những loài độc nhất vô nhị, chỉ được tìm thấy ở một địa điểm duy nhất. Lập bản đồ và khám phá những khu vực chưa biết dưới đáy biển là yếu tố then chốt giúp giới khoa học hiểu rõ Trái Đất hơn.
SOI là một đối tác trong chương trình Seabed 2030 với mục tiêu lập bản đồ toàn bộ đáy biển vào năm 2030. Hiện tại, tình trạng thiếu bản đồ chi tiết của phần lớn đáy biển gây khó khăn cho việc điều hướng tàu thuyền an toàn, quản lý tài nguyên biển một cách bền vững và bảo vệ các cộng đồng ven biển.","Các nhà khoa học tìm thấy ngọn núi khổng lồ dưới Thái Bình Dương với chiều cao khoảng 1.600 m, gấp đôi Burj Khalifa, tòa nhà cao nhất thế giới. ","https://vnexpress.net/phat-hien-nui-ngam-duoi-bien-cao-gap-doi-toa-burj-khalifa-4681235.html","Chủ nhật, 26/11/2023, 10:00 (GMT+7)","https://i2-vnexpress.vnecdn.net/2023/11/25/Nuingamset-1700892861-4125-1700893089.jpg?w=1200&h=0&q=100&dpr=1&fit=crop&s=bF5AGcKpbtzzbl8Y29bX6Q","Thu Thảo","Tin tức","https://vnexpress.net/tin-tuc-24h"
"4681404","Thủ tướng Ấn Độ lái tiêm kích nội địa","Thủ tướng Ấn Độ Narendra Modi ngày 25/11 đăng thông điệp ủng hộ nền công nghiệp quốc phòng nội địa kèm hình ảnh ông ngồi trên tiêm kích hạng nhẹ Tejas. Ông chia sẻ chuyến bay trên máy bay quân sự nội địa đã ""khơi dậy lòng tự hào và lạc quan về tiềm năng quốc gia"".
Ông Modi bay trải nghiệm trên chiếc Tejas hai chỗ ngồi khi thăm cơ sở thuộc Công ty Khoa học hàng không Hindustan (HAL) ở thành phố Bengaluru, bang Karnataka, miền nam Ấn Độ. Trong hình ảnh đăng trên mạng xã hội X, Thủ tướng Modi mặc đồng phục phi công và mũ bảo hộ, ngồi ở ghế phi công phụ.
Thủ tướng Modi đăng thông tin giữa lúc 5 bang Madhya Pradesh, Chhattisgarh, Rajasthan, Mizoram và Telangana tổ chức bầu cử nghị viện địa phương. Loạt bầu cử này được xem là phép thử về mức ủng hộ của người dân dành cho ông Modi, trước thềm cuộc tổng tuyển cử năm 2024.
Dự án tiêm kích hạng nhẹ Tejas mất khoảng 33 năm phát triển, hoàn tất kiểm định sơ bộ năm 2011 và nghiệm thu toàn diện vào năm 2019. Không quân Ấn Độ đã biên chế 50 chiếc, dự kiến mua tổng cộng 324 máy bay Tejas ở ba phiên bản Mark 1, Mark 1A và huấn luyện Mark 2.
Tejas là tiêm kích hạng nhẹ đa năng một động cơ, ứng dụng thiết kế cánh tam giác liền thân, dài hơn 13 m và có sải cánh hơn 8 m. Máy bay có thể thực hiện các nhiệm vụ đánh chặn trên không, tập kích mặt đất và chống hạm.
Tejas được trang bị tên lửa đối không tầm xa I-Derby ER tầm bắn 100 km và tên lửa Astra có thể đánh trúng mục tiêu ở khoảng cách 80-350 km, cùng tên lửa đối không tầm gần như R-73, Python-5 và ASRAAM. Mỗi chiếc Tejas còn được lắp một pháo tự động nòng kép GSh-23 cỡ nòng 23 mm.
HAL và tập đoàn General Electric của Mỹ hồi tháng 6 đạt thỏa thuận hợp tác sản xuất động cơ cho tiêm kích Tejas. Bộ Quốc phòng Ấn Độ đặt mục tiêu sản xuất quốc phòng năm 2025 đạt tổng giá trị 26 tỷ USD, trong đó hơn 5 tỷ USD dành cho xuất khẩu.","Thủ tướng Modi có chuyến bay trên tiêm kích hạng nhẹ Tejas do Ấn Độ tự sản xuất và ca ngợi nền công nghiệp quốc phòng nội địa. - VnExpress","https://vnexpress.net/thu-tuong-an-do-lai-tiem-kich-noi-dia-4681404.html","Chủ nhật, 26/11/2023, 09:58 (GMT+7)","https://i2-vnexpress.vnecdn.net/2023/11/26/phi-co-ng-modi-1700966624-4030-1700966764.jpg?w=1200&h=0&q=100&dpr=1&fit=crop&s=qRzA9FxdPThTWTOp3NPfXw","Thanh Danh","Quân sự","https://vnexpress.net/tin-tuc-24h"
