"""ID"", ""Title"", ""Content"", ""Description"", ""URL"", ""Publication Date"", ""Image URL"", ""Author"", ""Category"", ""Source"""
"4686374","Thủ tướng Israel dọa biến thủ đô Lebanon thành Gaza","""Nếu Hezbollah quyết định bắt đầu một cuộc chiến, chính tay họ sẽ biến Beirut và miền nam Lebanon, cách nơi này không xa, thành Gaza và Khan Younis"", Thủ tướng Benjamin Netanyahu phát biểu với các binh sĩ khi đến thăm Bộ tư lệnh miền Bắc của Lực lượng Phòng vệ Israel (IDF) ngày 7/12.
Gaza là dải đất nhỏ ven Địa Trung Hải, giáp biên giới Israel và Ai Cập. Đây là một trong hai vùng lãnh thổ của người Palestine, do lực lượng Hamas kiểm soát. IDF mở chiến dịch ở miền bắc Gaza từ ngày 7/10 để đáp trả Hamas tập kích nước này khiến hơn 1.100 người chết.
Sau 7 ngày ngừng bắn, IDF ngày 3/12 mở rộng phạm vi xuống miền nam Gaza và bao vây thành phố Khan Younis lớn nhất tại đây. Giao tranh giữa hai bên khiến nhiều khu vực ở Gaza bị tàn phá, hơn 18.000 người thiệt mạng, hơn 54.000 người bị thương tính đến ngày 7/12.
Sau khi xung đột Israel - Hamas bùng phát, Hezbollah và một số nhóm vũ trang ở miền nam Lebanon tập kích Israel bằng tên lửa, rocket hoặc UAV gần như mỗi ngày, nhằm thể hiện sự ủng hộ với Hamas. Tuy nhiên, Hezbollah chưa phát động chiến dịch quy mô lớn vào lãnh thổ Israel.
Quân đội Israel ngày 7/12 cho biết Hezbollah đã phóng tên lửa chống tăng khiến một nông dân nước này thiệt mạng. Đây là một trong số 11 vụ tập kích Hezbollah thực hiện nhằm vào doanh trại IDF ở làng Matat, giáp biên giới với Lebanon.
Hezbollah tuyên bố loạt vụ tập kích nhằm thể hiện sự ủng hộ người dân Palestine ở Gaza. IDF thông báo các chiến đấu cơ Israel đã tập kích một trung tâm chỉ huy và kiểm soát của Hezbollah để đáp trả.
Trong các tuyên bố trước đó, giới lãnh đạo Hezbollah đều từ chối đưa ra một ""lằn ranh đỏ"" cụ thể về thời điểm leo thang hoạt động quân sự chống Tel Aviv, chỉ nói sẽ phản ứng tùy thuộc vào hành động của Israel tại Dải Gaza và khu vực biên giới với Lebanon.
Được hình thành đầu thập niên 1980, Hezbollah là một phần của ""trục kháng chiến"" do Iran dẫn dắt để đối phó Israel ở Trung Đông, trong đó Hamas là một thành viên. Hezbollah hiện kiểm soát một phần thủ đô Beirut và miền nam Lebanon. Tổ chức này có đại diện chính trị, giữ ghế trong nghị viện Lebanon và vài năm qua còn cùng đồng minh kiểm soát một số bộ, ngành chính phủ nước này.","Thủ tướng Netanyahu cảnh báo thủ đô Beirut có thể biến thành Gaza nếu lực lượng Hezbollah mở mặt trận nhằm vào Israel. - VnExpress","https://vnexpress.net/thu-tuong-israel-doa-bien-thu-do-lebanon-thanh-gaza-4686374.html","Thứ sáu, 8/12/2023, 12:02 (GMT+7)","https://i2-vnexpress.vnecdn.net/2023/12/08/benjamin-1702009886-4634-1702010393.png?w=1200&h=0&q=100&dpr=1&fit=crop&s=BGwYerAHag9eI_Mc3UP8nw","","Thế giới","https://vnexpress.net/tin-tuc-24h"
"4686216","iPhone 16 sẽ nâng cấp micro để tăng trải nghiệm AI","Theo nhà phân tích Ming-Chi Kuo của hãng nghiên cứu TF Securities, trợ lý ảo Siri sẽ được ""đại tu"" trên iOS 18, còn các phiên bản iPhone 16 cũng được nâng cấp mạnh về micro.
Trong đó, micro sẽ có khả năng chống nước và tỷ lệ tín hiệu trên tạp âm (SNR) tốt hơn thế hệ trước, từ đó mang lại trải nghiệm trợ lý giọng nói trực quan hơn. Ông Kuo cũng cho biết giá thành sản xuất micro trên iPhone 16 sẽ cao hơn từ 2 đến 2,5 lần so với iPhone 15, dự kiến giúp doanh thu của hai nhà cung cấp micro cho iPhone là AAC và Goertek tăng mạnh.
Apple cũng tái cơ cấu nhóm phát triển trợ lý giọng nói Siri trong quý III/2023 với mục tiêu tích hợp AIGC (nội dung do trí tuệ nhân tạo tạo ra) và LLM (mô hình ngôn ngữ lớn) vào Siri.
Theo Kuo, đầu vào bằng giọng nói là cách tương tác chính cho AI tạo sinh trên smartphone. Do đó, để thúc đẩy AIGC, Apple sẽ tăng cường tinh chỉnh cả phần cứng và phần mềm của Siri.
Trước đó, chuyên gia công nghệ Mark Gurman của Bloomberg cho biết bộ bốn iPhone 16 sẽ không thay đổi đột phá về thiết kế, do đó Apple phải đẩy mạnh tính năng AI để làm điểm nhấn cho sản phẩm. Chức năng AI trên điện thoại mới chưa được tiết lộ, nhưng một số nguồn tin cho biết cách tiếp cận của hãng có thể giống với Google và Samsung.","Micro trên iPhone 16 dự kiến được giảm tạp âm và chống nước tốt hơn nhằm cải thiện trải nghiệm Siri thế hệ mới với công nghệ AI tạo sinh. - VnExpress","https://vnexpress.net/iphone-16-se-nang-cap-micro-de-tang-trai-nghiem-ai-4686216.html","Thứ sáu, 8/12/2023, 12:00 (GMT+7)","https://i1-sohoa.vnecdn.net/2023/12/07/57601-117359-000-lead-siri-and-1971-6146-1701964347.jpg?w=1200&h=0&q=100&dpr=1&fit=crop&s=UCEGv9sHLfeSBzu8ddiNUw","Huy Đức","Thiết bị","https://vnexpress.net/tin-tuc-24h"
"4686238","Chính phủ Mỹ kêu gọi thợ săn tiêu diệt 500.000 con cú","Cú lông sọc là loài xâm hại ở tây bắc Thái Bình Dương, có nguồn gốc từ bờ đông nước Mỹ và đặt ra mối đe dọa lớn đối với những loài bản xứ được bảo vệ, bao gồm cú lông đốm phương bắc. Trong bản dự thảo kế hoạch quản lý, Cục Cá và Động vật hoang dã Mỹ (FWS) muốn tiêu diệt loài cú xâm hại này, và hy vọng có thể kêu gọi thợ săn bắn khoảng nửa triệu con trong vòng 30 năm tới, Newsweek hôm 7/12 đưa tin.
Cú lông sọc xuất hiện ở tây bắc Thái Bình Dương từ năm 1950. Hiện nay, số lượng của chúng vượt xa cú lông đốm phương bắc ở Washington, Oregon và California. Chúng trở thành mối đe dọa đối với cú lông đốm phương bắc do hung dữ hơn và có chế độ ăn đa dạng, sẵn sàng ăn bất cứ thứ gì từ côn trùng và động vật lưỡng cư tới cá và nhiều loài chim khác. Cú lông sọc cũng lớn và bảo vệ lãnh thổ tích cực hơn cú bản xứ, có nghĩa chúng đang chiếm chỗ cú lông đốm, quấy rối hoạt động làm tổ, cạnh tranh nguồn thức ăn, thậm chí tấn công khi đối phương tới quá gần.
Ở những khu vực cú lông sọc tồn tại với số lượng cao, quần thể cú lông đốm phương bắc đang sụt giảm nhanh chóng. Hiện nay, chúng nằm trong danh mục bị đe dọa theo Đạo luật loài nguy cấp, với quần thể giảm 35 - 80% trong 20 năm qua. Trong khi đó, có hơn 100.000 con cú lông sọc ở lãnh thổ của cú lông đốm tại Washington, Oregon và Bắc California. Loài cú này cũng đang di chuyển về phía nam, tràn vào lãnh thổ của cú lông đốm tại California.
Để cứu cú lông đốm phương bắc khỏi cuộc xâm chiếm của cú lông sọc, ban đầu FWS lên kế hoạch tiêu diệt khoảng 20.000 con cú trong năm đầu tiên, tiếp theo là 13.397 con/năm trong thập kỷ thứ nhất, 16.303 con trong thập kỷ thứ hai và 17.390 con/năm trong thập kỷ thứ ba. Theo dự kiến, kế hoạch sẽ bắt đầu sớm nhất vào năm 2025. Chủ đất hoặc nhà quản lý đất có thể nộp đơn xin giấy phép giết cú.
Giới chuyên gia tin tưởng chương trình trên sẽ bảo vệ thành công cú lông đốm do kết quả nghiên cứu chỉ ra giết cú lông sọc sẽ giúp ổn định quần thể cú bị đe dọa. Kế hoạch quản lý hướng tới xóa sổ khoảng 30% tổng số lượng cú lông sọc. ""Chúng tôi không thể tiêu diệt chúng hoàn toàn, nhưng chúng tôi có thể tạo ra những khu vực với mật độ cú lông sọc thấp hơn hẳn để cú lông đốm sống sót và phát triển"", Kessina Lee, quản lý văn phòng FWS ở Oregon, chia sẻ.","Cục Cá và Động vật hoang dã Mỹ muốn thợ săn bắn hơn 500.000 con cú lông sọc để góp phần bảo vệ các loài bản xứ khác.","https://vnexpress.net/chinh-phu-my-keu-goi-tho-san-tieu-diet-500-000-con-cu-4686238.html","Thứ sáu, 8/12/2023, 11:52 (GMT+7)","https://i2-vnexpress.vnecdn.net/2023/12/08/VNEOwl-1702010532-3101-1702010581.jpg?w=1200&h=0&q=100&dpr=1&fit=crop&s=NyCqXNzKFg_yAED3fr697Q","","Thế giới tự nhiên","https://vnexpress.net/tin-tuc-24h"
"4685627","Chi Pu luyện võ đóng phim về ma cà rồng","Hôm 8/12, êkíp tung video cảnh tập luyện của dàn diễn viên Chi Pu, Thuận Nguyễn, Ngọc Vàng. Chi Pu - đóng vai Triệu, ""trùm"" phản diện - cho biết gặp áp lực khi lần đầu đảm nhận cảnh hành động, do đạo diễn yêu cầu không sử dụng cascadeur (diễn viên đóng thế). Hàng ngày, cô và Thuận Nguyễn (vai Marco, người yêu của Triệu) học các thế võ đối kháng với huấn luyện viên, tập sử dụng thành thạo các loại vũ khí.
""Cảnh quay chỉ vài phút nhưng tôi mất một tháng để tập dượt vì muốn các động tác khi lên phải chuẩn xác nhất, phối hợp với bạn diễn ăn ý. Bù lại, quá trình huấn luyện với tôi khá suôn sẻ do đã có kinh nghiệm vũ đạo"", cô nói.
Phim đánh dấu lần tái xuất điện ảnh của Chi Pu sau thành công với show truyền hình Đạp gió 2023 ở Trung Quốc. Đạo diễn Timothy Linh Bùi cho biết mời Chi Pu đóng vì ngoại hình lẫn lối diễn của cô phù hợp nhân vật - một ma nữ quyến rũ, nhiều quyền lực. Trước đó, cả hai từng hợp tác trong Chị chị em em (2019) - phim do Timothy Linh Bùi sản xuất.
Cô tên thật Nguyễn Thùy Chi, sinh năm 1993. Từ năm 2017, cô lấn sang ca hát sau khi thử sức đóng phim. Nhiều người từng bàn tán về khả năng ca hát của Chi Pu trên mạng xã hội. Dù thế, cô vẫn kiên trì theo đuổi công việc làm ca sĩ, ra sản phẩm thường xuyên, từng phát hành MV Từ hôm nay, Em sai rồi anh xin lỗi em đi, Mời anh vào tim em, Cung đàn vỡ đôi, Mơ anh. Cô từng đóng các phim điện ảnh Chị chị em em(2019), Mười: Lời nguyền trở lại (2022).
Người mặt trời xoay quanh hai anh em ma cà rồng Marco (Thuận Nguyễn) và Nhật (Trần Ngọc Vàng). Sau bốn thế kỷ sống ẩn dật, họ bị lộ danh tính vì Hạ - một nữ sinh cấp ba (Trịnh Thảo). Người anh muốn tiêu diệt Hạ để bảo vệ giống loài, còn người em quyết định chống lại anh để bảo vệ cô. Để trừng phạt Nhật, Triệu (Chi Pu) và đồng bọn truy sát, dẫn đến cuộc chiến một mất một còn.
Ấp ủ ý tưởng từ năm 2016, đạo diễn Việt kiều Timothy Linh Bùi Anh chọn tên Người mặt trời để hướng đến chủ đề khát vọng sống. Theo truyền thuyết phương Tây, ma cà rồng không thể bước ra khỏi ánh sáng, song nhiều nhân vật vẫn mong mỏi cảm giác được đứng dưới mặt trời như dấu hiệu của sự sống.","Chi Pu tập võ đối kháng, đóng cảnh hành động khi hóa thân thành ma cà rồng trong phim 18 + &quot;Người mặt trời&quot;. - VnExpress","https://vnexpress.net/chi-pu-luyen-vo-dong-phim-ve-ma-ca-rong-4685627.html","Thứ sáu, 8/12/2023, 11:48 (GMT+7)","https://i1-giaitri.vnecdn.net/2023/12/07/chi-pu-2-1701945305-1781-1701945421.jpg?w=1200&h=0&q=100&dpr=1&fit=crop&s=ZwesYEuJfCbbfoWJtE6QTw","","Chuyện màn ảnh","https://vnexpress.net/tin-tuc-24h"
"4686423","Thêm giám đốc trung tâm đăng kiểm ở Sài Gòn bị bắt","Sáng 8/2, ông Hải và cấp phó Chu Đình Hiệp bị Công an TP Thủ Đức bắt tạm giam để điều tra sai phạm tại Trung tâm 50-04V có trụ sở trong Khu công nghiệp Cát lái – Cụm 2, phường Thạnh Mỹ Lợi.
Trong sáng nay, khi trung tâm đang làm việc thì cảnh sát đến phong tỏa, khám xét nhiều phòng làm việc, thu giữ nhiều tài liệu liên quan vụ án. Hiện, hành vi sai phạm của các bị can chưa được công bố.
Động thái này được Công an TP Thủ Đức đưa ra trong quá trình điều tra vụ án Nhận hối lộ, Đưa hối lộ và Sản xuất, mua bán, trao đổi, tặng cho phần mềm sử dụng vào mục đích trái pháp luật xảy ra tại TP HCM và các quận huyện.
Liên quan đến các sai phạm xảy ra tại Cục Đăng kiểm Việt Nam và các trung tâm đăng kiểm xe cơ giới trên địa bàn thành phố, Công an TP HCM và các quận, huyện đã khởi tố 209 bị can.
Ngoài ra, công an hơn 30 tỉnh thành khác đã khởi tố hơn 60 vụ án với tổng cộng hàng trăm bị can. Trong suốt 28 năm hoạt động, đây là lần đầu ngành đăng kiểm có số lượng người bị khởi tố kỷ lục.
Theo trung tướng Tô Ân Xô, người phát ngôn của Bộ Công an, đại án đăng kiểm là vụ tham nhũng được tổ chức xuyên suốt từ lãnh đạo Cục Đăng kiểm, Phòng kiểm định xe cơ giới đến giám đốc nhiều trung tâm đăng kiểm. Công an phát hiện có sự móc nối chặt chẽ giữa nhân viên kiểm định của Cục Đăng kiểm và các trung tâm để cấp giấy chứng nhận cho xe dưới chuẩn thông qua các công ty sân sau.","Ông Ngô Xuân Hải, Giám đốc Trung tâm đăng kiểm xe cơ giới 50-04V, thuộc Cục đăng kiểm Việt Nam, bị cáo buộc sai phạm trong quá trình hoạt động của đơn vị. - VnExpress","https://vnexpress.net/them-giam-doc-trung-tam-dang-kiem-o-sai-gon-bi-bat-4686423.html","Thứ sáu, 8/12/2023, 11:41 (GMT+7)","https://i2-vnexpress.vnecdn.net/2023/12/08/dang-kiem-1702014000-3887-1702014013.jpg?w=1200&h=0&q=100&dpr=1&fit=crop&s=_uNQJ1p2Yx394b5uvl8wjg","","Pháp luật","https://vnexpress.net/tin-tuc-24h"
"4686317","Selena Gomez công khai hẹn hò sau 5 năm","Ngày 8/12, ca sĩ xác nhận tin đồn hẹn hò trên bài viết Instagram của PopFaction: ""Anh ấy là tất cả trong tim tôi, là điều tuyệt nhất từng xảy đến. Anh ấy tốt hơn bất kỳ ai tôi từng ở bên"". Cùng ngày trên Instagram Story, cô đăng ảnh tựa vào bạn trai.
Cô cũng lên tiếng bảo vệ Benny Blanco khi vài người phản đối mối quan hệ và chỉ trích nhà sản xuất: ""Nếu bạn thật sự quan tâm đến tôi thì đây là hạnh phúc của tôi. Tôi không cho phép những lời của bạn ảnh hưởng đến cuộc sống của mình"", ""Tôi biết điều gì tốt nhất cho bản thân, sẽ đấu tranh để nhận được thứ xứng đáng. Tôi tôn trọng ý kiến của bạn nhưng tôi đang phát triển. Đừng can thiệp, cứ biết tôi không bao giờ hẹn hò với trai tồi nữa"".
Cả hai quen nhau vài năm và từng làm việc chung. Gầy đây, họ hợp tác để phát hành Single Soon - ca khúc thể hiện ca sĩ vẫn ổn và vui khi ở một mình hay kết thúc một mối quan hệ. Hồi tháng 7, Benny cũng có mặt trong tiệc sinh nhật tuổi 31 của ca sĩ.
Khoảng 5 năm qua, Gomez nhiều lần vướng tin đồn hẹn hò nhưng không xác nhận. Cô thường xuyên khẳng định độc thân dù luôn muốn tìm kiếm bạn trai. Người gần nhất cô công khai là The Weeknd, hẹn hò từ tháng 1 đến 10/2017 và chia tay yên bình. Selena cũng từng có mối tình ồn ào với Justin Bieber.
Selena Gomez bắt đầu được biết đến với loạt vai diễn trong phim của Disney trước khi chuyển hướng làm ca sĩ. Cô tham gia các bộ phim truyền hình như Wizards of Waverly Place, Barney &amp; Friends. Các album của cô thường xuyên đứng vị trí cao trong bảng xếp hạng Billboard. Một số bản hit của Selena gồm Lose You to Love Me, Hands to Myself, Good for You.
Benny Blanco, 35 tuổi, là nhà sản xuất âm nhạc, từng hợp tác với nhiều sao như Halsey, Khalid, The Weeknd, Justin Bieber. Anh từng thắng giải Nhạc sĩ BMI của năm, thành lập hai hãng thu âm Mad Love Records và Friends Keep Secrets.","Selena Gomez yêu nhà sản xuất âm nhạc Benny Blanco sau 5 năm độc thân, bảo vệ bạn trai khi anh bị fan chỉ trích. - VnExpress","https://vnexpress.net/selena-gomez-cong-khai-hen-ho-sau-5-nam-4686317.html","Thứ sáu, 8/12/2023, 11:38 (GMT+7)","https://i1-giaitri.vnecdn.net/2023/12/08/selena1-1702007599-6194-1702007733.jpg?w=1200&h=0&q=100&dpr=1&fit=crop&s=yiF-whQTbMWENpV2r2epZA","","Quốc tế","https://vnexpress.net/tin-tuc-24h"
"4686357","7 món ăn nhẹ giúp kiểm soát đường huyết","Quả bơ rất ít đường, nhiều chất xơ và chứa chất béo không bão hòa đơn có lợi cho người bệnh tiểu đường. 
Theo Hiệp hội Tiểu đường Mỹ, chất béo lành mạnh trong bơ có thể cải thiện mức cholesterol tốt (HDL), ổn định đường huyết. Chất xơ làm tăng cảm giác no, giảm thèm ăn hỗ trợ giảm cân. Bơ rất giàu lutein - một loại vitamin tốt cho mắt. Khẩu phần 1/4 quả bơ cỡ vừa phù hợp cho ăn bữa nhẹ hoặc làm sinh tố. 
Quả bơ rất ít đường, nhiều chất xơ và chứa chất béo không bão hòa đơn có lợi cho người bệnh tiểu đường. 
Theo Hiệp hội Tiểu đường Mỹ, chất béo lành mạnh trong bơ có thể cải thiện mức cholesterol tốt (HDL), ổn định đường huyết. Chất xơ làm tăng cảm giác no, giảm thèm ăn hỗ trợ giảm cân. Bơ rất giàu lutein - một loại vitamin tốt cho mắt. Khẩu phần 1/4 quả bơ cỡ vừa phù hợp cho ăn bữa nhẹ hoặc làm sinh tố. 
Hạt chia rất giàu axit alpha-linolenic (một loại axit béo omega-3), chứa chất chống oxy hóa, cung cấp canxi, kali và và magiê. 
Người bệnh tiểu đường thường bị huyết áp cao. Theo Trường Y Harvard (Mỹ), chế độ ăn giàu kali và magie có thể điều hòa huyết áp. Hạt chia có thể thêm vào thức uống, sinh tố cho bữa nhẹ ngon miệng. 
Hạt chia rất giàu axit alpha-linolenic (một loại axit béo omega-3), chứa chất chống oxy hóa, cung cấp canxi, kali và và magiê. 
Người bệnh tiểu đường thường bị huyết áp cao. Theo Trường Y Harvard (Mỹ), chế độ ăn giàu kali và magie có thể điều hòa huyết áp. Hạt chia có thể thêm vào thức uống, sinh tố cho bữa nhẹ ngon miệng. 
Hạt lanh chứa nhiều chất dinh dưỡng, calo và chất béo tốt. Hầu hết lượng calo trong hạt lanh đến từ chất béo không bão hòa đa, nhất là axit béo omega-3, giúp kiểm soát đường huyết ở người bệnh tiểu đường type 2.
Vì cơ thể không thể phân hủy toàn bộ hạt lanh nên không tiếp cận được tất cả dầu và omega-3. Chất béo lành mạnh có thể được giải phóng khi nghiền nát hạt lanh. Dùng bột hạt lanh thay vì hạt lanh nguyên hạt để nhận được nhiều lợi ích cho sức khỏe. 
Hạt lanh chứa nhiều chất dinh dưỡng, calo và chất béo tốt. Hầu hết lượng calo trong hạt lanh đến từ chất béo không bão hòa đa, nhất là axit béo omega-3, giúp kiểm soát đường huyết ở người bệnh tiểu đường type 2.
Vì cơ thể không thể phân hủy toàn bộ hạt lanh nên không tiếp cận được tất cả dầu và omega-3. Chất béo lành mạnh có thể được giải phóng khi nghiền nát hạt lanh. Dùng bột hạt lanh thay vì hạt lanh nguyên hạt để nhận được nhiều lợi ích cho sức khỏe. 
Hạt gai dầu có hàm lượng carbohydrate thấp tự nhiên (dưới 1 g mỗi muỗng canh) không làm tăng đường huyết sau ăn. Hạt này cũng chứa nhiều chất xơ, protein, chất béo lành mạnh (omega-3 và omega-6), cùng nhiều khoáng chất cần thiết cho cơ thể như sắt, magiê, phốt pho, mangan và vitamin B. 
Nghiên cứu công bố năm 2016 của Trung tâm Di truyền, Dinh dưỡng và Sức khỏe Mỹ, cho thấy cân bằng axit béo omega-3 và omega-6 có tác dụng ngăn ngừa béo phì. Thừa cân hoặc béo phì là yếu tố nguy cơ của bệnh tiểu đường. 
Hạt gai dầu có hàm lượng carbohydrate thấp tự nhiên (dưới 1 g mỗi muỗng canh) không làm tăng đường huyết sau ăn. Hạt này cũng chứa nhiều chất xơ, protein, chất béo lành mạnh (omega-3 và omega-6), cùng nhiều khoáng chất cần thiết cho cơ thể như sắt, magiê, phốt pho, mangan và vitamin B. 
Nghiên cứu công bố năm 2016 của Trung tâm Di truyền, Dinh dưỡng và Sức khỏe Mỹ, cho thấy cân bằng axit béo omega-3 và omega-6 có tác dụng ngăn ngừa béo phì. Thừa cân hoặc béo phì là yếu tố nguy cơ của bệnh tiểu đường. 
Bơ hạnh nhân cung cấp chất béo không bão hòa đơn, protein và chất xơ tốt cho tim, làm giảm cholesterol xấu (LDL) và tăng cholesterol tốt (HDL). 
Hạnh nhân còn có hàm lượng cao vitamin E và magie. Đánh giá năm 2015 của Trường Đại học Palermo (Italy), dựa trên 69 nghiên cứu, cho thấy lượng magie hấp thụ cao hơn giảm nguy cơ phát triển bệnh tiểu đường và hỗ trợ điều chỉnh đường huyết. 
Dùng bơ hạnh nhân làm sinh tố, ăn cùng bánh mì, trái cây hoặc rau củ luộc cho bữa nhẹ. Giữ ở mức 1-2 muỗng canh mỗi khẩu phần để tránh tăng calo nạp vào.
Bơ hạnh nhân cung cấp chất béo không bão hòa đơn, protein và chất xơ tốt cho tim, làm giảm cholesterol xấu (LDL) và tăng cholesterol tốt (HDL). 
Hạnh nhân còn có hàm lượng cao vitamin E và magie. Đánh giá năm 2015 của Trường Đại học Palermo (Italy), dựa trên 69 nghiên cứu, cho thấy lượng magie hấp thụ cao hơn giảm nguy cơ phát triển bệnh tiểu đường và hỗ trợ điều chỉnh đường huyết. 
Dùng bơ hạnh nhân làm sinh tố, ăn cùng bánh mì, trái cây hoặc rau củ luộc cho bữa nhẹ. Giữ ở mức 1-2 muỗng canh mỗi khẩu phần để tránh tăng calo nạp vào.
Đậu phụ rất giàu protein thực vật, ít calo. Protein làm chậm quá trình tiêu hóa và no lâu hơn, hỗ trợ kiểm soát đường huyết. 
Thực phẩm này có kết cấu dày, dạng mềm nên dễ xay nhuyễn, có thể thay thế sữa trong món sinh tố cho bữa nhẹ. Đậu phụ cũng giàu canxi có thể thúc đẩy sức khỏe xương.
Đậu phụ rất giàu protein thực vật, ít calo. Protein làm chậm quá trình tiêu hóa và no lâu hơn, hỗ trợ kiểm soát đường huyết. 
Thực phẩm này có kết cấu dày, dạng mềm nên dễ xay nhuyễn, có thể thay thế sữa trong món sinh tố cho bữa nhẹ. Đậu phụ cũng giàu canxi có thể thúc đẩy sức khỏe xương.
Sữa chua nguyên chất không béo cung cấp vi khuẩn có lợi tự nhiên (men vi sinh), chứa ít calo và carbohydrate, nhiều protein. Người bệnh tiểu đường type 2 có liên quan đến sự gián đoạn sức khỏe đường ruột. Dùng men vi sinh có thể khôi phục cân bằng trong ruột và cải thiện kiểm soát lượng đường trong máu.
Tránh thêm đường mà nên thêm trái cây cắt nhỏ, bột quế, hạnh nhân cắt lát để tăng hương vị cho món ăn. 
Sữa chua nguyên chất không béo cung cấp vi khuẩn có lợi tự nhiên (men vi sinh), chứa ít calo và carbohydrate, nhiều protein. Người bệnh tiểu đường type 2 có liên quan đến sự gián đoạn sức khỏe đường ruột. Dùng men vi sinh có thể khôi phục cân bằng trong ruột và cải thiện kiểm soát lượng đường trong máu.
Tránh thêm đường mà nên thêm trái cây cắt nhỏ, bột quế, hạnh nhân cắt lát để tăng hương vị cho món ăn. ","Quả bơ, hạt lanh, đậu phụ giàu protein, chất béo lành mạnh hỗ trợ ổn định đường huyết, thích hợp làm bữa ăn nhẹ cho người tiểu đường. - VnExpress","https://vnexpress.net/7-mon-an-nhe-giup-kiem-soat-duong-huyet-4686357.html","Thứ sáu, 8/12/2023, 11:30 (GMT+7)","https://i1-suckhoe.vnecdn.net/2023/12/08/403415729-630399942430329-2543409309297931466-n-1702005527.png?w=1200&h=0&q=100&dpr=1&fit=crop&s=NSVSuPhYs3HBo9hvBzut6w","","Dinh dưỡng","https://vnexpress.net/tin-tuc-24h"
