"""ID"", ""Title"", ""Content"", ""Description"", ""URL"", ""Publication Date"", ""Image URL"", ""Author"", ""Category"", ""Source"""
"4681302","6 thực phẩm giúp trẻ tăng cân","Sữa nguyên chất có chất đạm, chất béo, bột đường, nhiều vitamin, khoáng chất cần thiết cho sự phát triển thể chất và trí não của trẻ. Sữa tươi nguyên chất cân bằng dưỡng chất tự nhiên, hài hòa về hàm lượng. 
Sữa nguyên chất có chất đạm, chất béo, bột đường, nhiều vitamin, khoáng chất cần thiết cho sự phát triển thể chất và trí não của trẻ. Sữa tươi nguyên chất cân bằng dưỡng chất tự nhiên, hài hòa về hàm lượng. 
Chuối có nhiều chất béo hơn dưa hấu, táo, dâu tây; giàu carbohydrate, kali và chất xơ. Carbohydrate giúp duy trì năng lượng, chất xơ hỗ trợ đường tiêu hóa khỏe mạnh. Trẻ ăn chuối vào buổi sáng góp phần tăng sức đề kháng. Cha mẹ nên thái lát mỏng, nghiền nhỏ chuối để phòng tránh trẻ nghẹn.
Chuối có nhiều chất béo hơn dưa hấu, táo, dâu tây; giàu carbohydrate, kali và chất xơ. Carbohydrate giúp duy trì năng lượng, chất xơ hỗ trợ đường tiêu hóa khỏe mạnh. Trẻ ăn chuối vào buổi sáng góp phần tăng sức đề kháng. Cha mẹ nên thái lát mỏng, nghiền nhỏ chuối để phòng tránh trẻ nghẹn.
Sữa chua có đầy đủ chất béo, canxi, lợi khuẩn kích thích tiêu hóa, thúc đẩy tăng cân. Trẻ có thể ăn sữa chua ăn cùng trái cây tươi để tăng hương vị. Ăn sữa chua thường xuyên còn giúp tăng cường miễn dịch, phòng tránh nhiều bệnh.
Sữa chua có đầy đủ chất béo, canxi, lợi khuẩn kích thích tiêu hóa, thúc đẩy tăng cân. Trẻ có thể ăn sữa chua ăn cùng trái cây tươi để tăng hương vị. Ăn sữa chua thường xuyên còn giúp tăng cường miễn dịch, phòng tránh nhiều bệnh.
100 g quả bơ có 101 kcal, 1,9 g protein, 9,4 g lipid, 2,3 g glucid. Vitamin và khoáng chất có trong loại quả này gồm canxi, sắt, vitamin C, vitamin nhóm B. Nếu bé tập ăn dặm, mẹ có thể trộn hoặc xay nhuyễn bơ với sữa mẹ hoặc sữa công thức. 
100 g quả bơ có 101 kcal, 1,9 g protein, 9,4 g lipid, 2,3 g glucid. Vitamin và khoáng chất có trong loại quả này gồm canxi, sắt, vitamin C, vitamin nhóm B. Nếu bé tập ăn dặm, mẹ có thể trộn hoặc xay nhuyễn bơ với sữa mẹ hoặc sữa công thức. 
Bột yến mạch giàu chất xơ, duy trì nguồn năng lượng mỗi ngày. Phụ huynh có thể cho bé ăn thêm bánh quy yến mạch, thanh bột yến mạch vì đều có lợi cho tiêu hóa và sức khỏe tổng thể.
Bột yến mạch giàu chất xơ, duy trì nguồn năng lượng mỗi ngày. Phụ huynh có thể cho bé ăn thêm bánh quy yến mạch, thanh bột yến mạch vì đều có lợi cho tiêu hóa và sức khỏe tổng thể.
Dầu ô liu giàu chất chống ôxy hóa hơn loại dầu khác. Chất béo omega-3 và omega-6 tương tự chất béo có trong sữa mẹ, giúp bé duy trì năng lượng, phát triển não bộ, thần kinh, hoàn thiện chức năng dạ dày.
Dầu ô liu giàu chất chống ôxy hóa hơn loại dầu khác. Chất béo omega-3 và omega-6 tương tự chất béo có trong sữa mẹ, giúp bé duy trì năng lượng, phát triển não bộ, thần kinh, hoàn thiện chức năng dạ dày.","Sữa chua có lợi khuẩn kích thích tiêu hóa, chuối chứa carbohydrate để duy trì năng lượng, thúc đẩy trẻ tăng cân. - VnExpress","https://vnexpress.net/6-thuc-pham-giup-tre-tang-can-4681302.html","Chủ nhật, 26/11/2023, 08:07 (GMT+7)","https://i1-suckhoe.vnecdn.net/2023/11/25/A-nh-chu-p-Ma-n-hi-nh-2023-11-09-lu-c-10-1700906425.png?w=1200&h=0&q=100&dpr=1&fit=crop&s=-UIgJpAtpDLblopmGkVfLQ","Lê Nguyễn (","Bệnh trẻ em","https://vnexpress.net/tin-tuc-24h"
"4681084","Trung tâm dữ liệu dưới biển đầu tiên trên thế giới","Sau khi hoàn thành, trung tâm dữ liệu dưới nước sẽ tiết kiệm điện hơn 40 - 60% so với trung tâm trên đất liền, theo Pu Ding, quản lý dự án. Các kỹ sư mất gần 3 giờ để đặt đơn vị lưu trữ nặng 1.300 tấn ở độ sâu 35 m dưới nước. Toàn bộ dự án bao gồm 100 đơn vị như vậy, CGTN hôm 24/11 đưa tin.
Việc đặt trung tâm dữ liệu dưới biển có thể đem lại lợi ích về nhiều mặt. Trung tâm có thể tận dụng nước để làm mát các bộ phận điện, giảm chi phí điện từ điều hòa nhiệt độ. ""Toàn bộ trung tâm dữ liệu có thể làm mát tự nhiên"", Xie Qian, kỹ sư ở phòng thí nghiệm CTTL Terminals, Viện hàn lâm công nghệ thông tin và truyền thông Trung Quốc (CAICT), cho biết. ""Công nghệ làm mát bằng nước biển cũng giúp tăng mật độ máy chủ, tăng cường năng lực tính toán"".
Ngoài ra, trung tâm dữ liệu dưới nước có thể sử dụng diện tích rộng lớn ở đáy biển để giảm chi phí đất đai. Chúng cũng nằm cách xa môi trường sống của con người và ít bị nhiễu hơn. Môi trường dưới nước cũng không có bụi và oxy, do đó thiết bị điện tử có tuổi thọ lâu dài và ít hỏng hóc hơn. Theo Xie, một số trung tâm dữ liệu dưới biển sẽ nằm gần thành phố duyên hải. Vì vậy, chúng ở gần nút lõi của mạng, khiến mạng phản ứng nhanh hơn.
Dù những công ty như Microsoft đã thử nghiệm trung tâm dữ liệu dưới nước và kết luận kế hoạch khả thi, song phiên bản của Trung Quốc đưa vào hoạt động thương mại và phục vụ khách hàng thực tế đầu tiên.","Trung Quốc nhấn chìm đơn vị lưu trữ dữ liệu đầu tiên của trung tâm dữ liệu thương mại dưới biển gần đảo Hải Nam hôm 24/11.","https://vnexpress.net/trung-tam-du-lieu-duoi-bien-dau-tien-tren-the-gioi-4681084.html","Chủ nhật, 26/11/2023, 08:00 (GMT+7)","https://i2-vnexpress.vnecdn.net/2023/11/25/VNEData-1700910028-5300-1700910105.jpg?w=1200&h=0&q=100&dpr=1&fit=crop&s=y7qY8ji7XgS6Wv8V3tMRew","An Khang","Tin tức","https://vnexpress.net/tin-tuc-24h"
"4680921","Đánh giá robot hút bụi lau nhà Ecovacs giá 25 triệu đồng","Ưu điểm:  - Giặt giẻ nước nóng, sấy khô giẻ bằng khí nóng tích hợp - Lau hiệu quả bằng giẻ xoay, có thể nâng giẻ 1,5 cm - Lực hút mạnh, chổi hút chống rối - Thiết kế cao cấp, khác biệt so với đối thủ - Camera nhận diện và tránh vật thể tốt, có thể xem trực tiếp như camera an ninh - Dock thiết kế gọn, có đèn LED báo trạng thái khi hết nước
Nhược điểm:  - Phần mềm, trợ lý ảo chưa hỗ trợ tiếng Việt - Không có hộc chứa nước tẩy rửa chuyên biệt riêng (phải mua thêm phụ kiện) - Một nút bấm cảm ứng chưa thực sự thân thiện khi sử dụng","Ecovacs Deebot X2 Omni nổi bật với thiết kế không &quot;khối u&quot; nhờ cảm biến lidar thế hệ mới, hệ thống lau nhà nước nóng nhưng phần mềm chưa hỗ trợ tiếng Việt. - VnExpress","https://vnexpress.net/danh-gia-robot-hut-bui-lau-nha-ecovacs-gia-25-trieu-dong-4680921.html","Chủ nhật, 26/11/2023, 08:00 (GMT+7)","https://i1-sohoa.vnecdn.net/2023/11/24/a1-1700813845-1340-1700813901.jpg?w=1200&h=0&q=100&dpr=1&fit=crop&s=2nIRkeIFoyBcYfyrzsYDoQ","Ưu điểm:","Đánh giá","https://vnexpress.net/tin-tuc-24h"
"4681231","Cách xử trí khi tụt huyết áp","Huyết áp là lực của máu tác động lên thành mạch máu, mức khỏe mạnh khoảng 120/80 mmHg, thấp hơn 90/60 mmHg là huyết áp thấp.
Để mọi bộ phận trong cơ thể, nhất là não, tim, phổi nhận được nhiều oxy máu, huyết áp thay đổi tự nhiên suốt cả ngày theo nhu cầu của các cơ quan. Cơ thể cũng liên tục điều chỉnh và cân bằng huyết áp. Chỉ số này có thể hạ nếu đứng dậy đột ngột, thường giảm khi ngủ hoặc nghỉ ngơi.
ThS.BS.CKII Huỳnh Thanh Kiều, Trưởng khoa Nội Tim mạch 1, Trung tâm Tim mạch Bệnh viện Đa khoa Tâm Anh TP HCM, cho biết người bị tụt huyết áp đột ngột có các triệu chứng như mờ mắt, chóng mặt, khó giữ thăng bằng, đổ mồ hôi, thở nhanh và nông. Trường hợp nặng có thể buồn nôn, nôn, lú lẫn, mất ý thức hoặc ngất xỉu... Bác sĩ gợi ý cách xử trí khi gặp tình trạng này.
Khi hạ huyết áp mức độ nhẹ, bệnh nhân nằm xuống bề mặt phẳng hoặc ngồi dựa vào ghế, dùng gối kê đầu và chân sao cho chân cao hơn đầu. Nên uống một ly nước hoặc sữa, ăn thêm chocolate, kẹo ngọt hoặc trà gừng, nước sâm... giúp huyết áp sớm trở lại bình thường. Khi tỉnh táo hơn, người bệnh nên được đỡ ngồi dậy từ từ, tập cử động chân tay để tránh choáng váng.
Người bệnh có triệu chứng nguy hiểm như hôn mê, lú lẫn, mất thăng bằng, mất ý thức cần được đưa đến cơ sở y tế càng sớm càng tốt.
Để phòng ngừa tụt huyết áp đột ngột, bác sĩ Kiều tư vấn một số cách sau:
Uống đủ nước: Mất nước đôi khi có thể dẫn đến huyết áp thấp. Một số người hạ huyết áp ngay cả khi mất nước nhẹ như nôn mửa, tiêu chảy nặng, sốt, tập thể dục đổ mồ hôi quá nhiều... Một số thuốc lợi tiểu cũng có thể gây mất nước.
Ăn uống cân bằng: Thiếu chất dinh dưỡng cũng là nguyên nhân khiến huyết áp tụt. Người thiếu vitamin B12, axit folic và sắt có thể thiếu máu, dần dẫn đến huyết áp thấp. Nên ăn đa dạng các loại vitamin, khoáng chất từ các loại rau xanh, hoa quả hay ngũ cốc để cơ thể có đủ các chất dinh dưỡng cần thiết.
Ăn nhiều bữa nhỏ: Tụt huyết áp sau một bữa ăn thịnh soạn phổ biến hơn ở người lớn tuổi. Sau khi ăn no, máu tập trung nhiều ở hệ tiêu hóa để hỗ trợ quá trình hấp thụ chất dinh dưỡng, khiến cho nhiều cơ quan thiếu máu, trong đó có cả vùng não bộ, gây tụt huyết áp. Trường hợp này có thể khắc phục bằng cách ăn nhiều bữa nhỏ.
Hạn chế hoặc tránh uống rượu: Thức uống có cồn có khả năng dẫn đến mất nước, tương tác với thuốc và gây hạ huyết áp.
Mang vớ áp lực: Tất hoặc vớ áp lực tĩnh mạch có thể giúp ngăn máu tụ lại ở chân, nhờ đó giảm nguy cơ hạ huyết áp tư thế. Đây là huyết áp giảm khi đứng hoặc do nằm, ngồi quá nhiều, phổ biến ở người lớn tuổi.
Uống thuốc: Người bệnh nên uống thuốc kiểm soát huyết áp đều đặn theo chỉ định của bác sĩ nếu có.
Bác sĩ Kiều khuyến nghị người bệnh nên chủ động theo dõi chỉ số huyết áp bằng dụng cụ đo huyết áp tại nhà. Nếu thường xuyên gặp tình trạng này, người bệnh cần khám chuyên khoa tim mạch để tìm nguyên nhân và điều trị sớm.","Người tụt huyết áp nên nằm nghỉ ngơi, kê chân cao hơn đầu, ăn kẹo chocolate hoặc uống một chút trà gừng để chỉ số về mức bình thường. - VnExpress","https://vnexpress.net/cach-xu-tri-khi-tut-huyet-ap-4681231.html","Chủ nhật, 26/11/2023, 08:00 (GMT+7)","https://i1-suckhoe.vnecdn.net/2023/11/25/do-huyet-ap-1700902814-5347-1700903236.jpg?w=1200&h=0&q=100&dpr=1&fit=crop&s=DSR8jKrxcMiURYqrMUt0wg","Bảo Bảo","Bệnh người lớn","https://vnexpress.net/tin-tuc-24h"
"4681075","6 món ăn giàu chất xơ tốt cho tiêu hóa","Thực phẩm giàu chất xơ có nguồn gốc thực vật khi vào hệ tiêu hóa làm tăng lượng lợi khuẩn trong đường ruột. Chúng giúp mềm phân, phân dễ dàng đi qua đường tiêu hóa, bớt táo bón.
Bông cải xanh hỗ trợ hệ vi sinh vật trong đường ruột phong phú. Các chất polysulfide trong bông cải xanh góp phần giảm nguy cơ ung thư đại trực tràng. Quá trình lên men đường ruột của chất xơ hình thành các axit béo chuỗi ngắn, giảm viêm.
Thực phẩm giàu chất xơ có nguồn gốc thực vật khi vào hệ tiêu hóa làm tăng lượng lợi khuẩn trong đường ruột. Chúng giúp mềm phân, phân dễ dàng đi qua đường tiêu hóa, bớt táo bón.
Bông cải xanh hỗ trợ hệ vi sinh vật trong đường ruột phong phú. Các chất polysulfide trong bông cải xanh góp phần giảm nguy cơ ung thư đại trực tràng. Quá trình lên men đường ruột của chất xơ hình thành các axit béo chuỗi ngắn, giảm viêm.
Đậu đen có hàm lượng chất xơ hòa tan dồi dào. Cơ thể tiêu hóa đậu đen thường lâu hơn các thực phẩm khác nên chất dinh dưỡng được hấp thu tối ưu, tạo cảm giác no lâu. Đậu đen hầu như không có chất béo, nhiều đạm và sắt có lợi cho đường ruột.
Đậu đen có hàm lượng chất xơ hòa tan dồi dào. Cơ thể tiêu hóa đậu đen thường lâu hơn các thực phẩm khác nên chất dinh dưỡng được hấp thu tối ưu, tạo cảm giác no lâu. Đậu đen hầu như không có chất béo, nhiều đạm và sắt có lợi cho đường ruột.
Chuối chín có vị ngọt dễ chịu, giàu chất xơ và tinh bột kháng (loại carbohydrate không bị phân hủy thành đường, không được tiêu hóa trong ruột non). Nhờ đó ăn chuối chín có thể nuôi lợi khuẩn, cải thiện hệ vi sinh vật đường ruột.
Chuối chín có vị ngọt dễ chịu, giàu chất xơ và tinh bột kháng (loại carbohydrate không bị phân hủy thành đường, không được tiêu hóa trong ruột non). Nhờ đó ăn chuối chín có thể nuôi lợi khuẩn, cải thiện hệ vi sinh vật đường ruột.
Cà rốt rất giàu beta carotene, kali, chất chống oxy hóa và chất xơ. Loại củ này có thể ăn sống, chế biến thành các món tráng miệng như nước ép, sinh tố, bánh cà rốt hoặc kết hợp trong bữa ăn chính như nấu canh, luộc, xào…
Cà rốt rất giàu beta carotene, kali, chất chống oxy hóa và chất xơ. Loại củ này có thể ăn sống, chế biến thành các món tráng miệng như nước ép, sinh tố, bánh cà rốt hoặc kết hợp trong bữa ăn chính như nấu canh, luộc, xào…
Dứa có nhiều enzym tiêu hóa bromelain với chức năng phân hủy protein trong thực phẩm, tăng cường hoạt động tiêu hóa. Bromelain còn có thể ngăn chặn các mầm bệnh đường ruột, giảm tiêu chảy, đầy hơi.
Dứa có nhiều enzym tiêu hóa bromelain với chức năng phân hủy protein trong thực phẩm, tăng cường hoạt động tiêu hóa. Bromelain còn có thể ngăn chặn các mầm bệnh đường ruột, giảm tiêu chảy, đầy hơi.
Khoai lang có gần 4 g chất xơ hòa tan trong 100 g nấu chín, giúp no lâu, hỗ trợ nhu động ruột để tiêu hóa trơn tru. Nó còn giàu các vitamin A, B, kali giúp tăng cường lợi khuẩn cho hệ tiêu hóa. Ăn khoai luộc, hấp để tiêu hóa thuận lợi hơn thay vì ăn loại chiên nhiều dầu mỡ.
Khoai lang có gần 4 g chất xơ hòa tan trong 100 g nấu chín, giúp no lâu, hỗ trợ nhu động ruột để tiêu hóa trơn tru. Nó còn giàu các vitamin A, B, kali giúp tăng cường lợi khuẩn cho hệ tiêu hóa. Ăn khoai luộc, hấp để tiêu hóa thuận lợi hơn thay vì ăn loại chiên nhiều dầu mỡ.","Cà rốt, khoai lang, bông cải xanh, dứa giàu chất xơ giúp tăng vi khuẩn có lợi cho đường ruột, giảm viêm và tiêu hóa dễ dàng. - VnExpress","https://vnexpress.net/6-mon-an-giau-chat-xo-tot-cho-tieu-hoa-4681075.html","Chủ nhật, 26/11/2023, 08:00 (GMT+7)","https://i1-suckhoe.vnecdn.net/2023/11/25/black-bean-small-wooden-spoon-place-sack-bag-full-black-bean-1150-35417-1700865255.jpg?w=1200&h=0&q=100&dpr=1&fit=crop&s=gX_uF2en9LOk5Yl4KnNs2A","Anh Chi","Bệnh đường tiêu hóa","https://vnexpress.net/tin-tuc-24h"
"4678736","Có 7 bất động sản, nên bán bớt loại nào để trả nợ?","Vợ chồng tôi hiện có khối tài sản trên dưới 11 tỷ đồng, gồm một căn nhà lầu đang ở giá khoảng 1,8 tỷ đồng, một mảnh đất mặt đường chính khu dân cư giá 4 tỷ đồng, một căn nhà xã hội khoảng 600 triệu đồng, một lô đất ở quê ông bà ngoại cho giá khoảng 2 tỷ đồng và hai sào đất vườn giá khoảng 800 triệu. Gần đây, tôi thấy có miếng đất bán rẻ, khoảng 1,8 tỷ đồng nên tôi đã vay 600 triệu đồng trong 10 năm để mua.
Thu nhập trước đây của hai vợ chồng tôi gồm 45 triệu đồng từ lương hàng tháng, 6 triệu tiền cho thuê mặt bằng. Tuy nhiên, sau khi mua thêm mảnh đất mới, tôi bị mất việc và mặt bằng cũng bị trả lại, chưa có người thuê. Thu nhập cả nhà hiện còn khoảng 33 triệu đồng, từ lương của vợ và trợ cấp thất nghiệp của tôi.
Hiện tôi khá áp lực với việc phải trả lãi và gốc hàng tháng khoảng 30 triệu đồng. Tổng các khoản nợ ngân hàng đến thời điểm này khoảng 1,6 tỷ đồng. Trong đó, khoản vay 540 triệu đồng mua đất năm 2019 còn 324 triệu, khoản vay 300 triệu năm 2022 còn 260 triệu và khoản vay mua ôtô năm 2022 còn 490 triệu đồng, thêm một khoản vay mua mảnh đất 1,8 tỷ đồng ở trên.
Tôi dự tính bán bớt căn nhà xã hội khoảng 600 triệu đồng để trả bớt nợ tuy nhiên thời điểm này rất khó bán được giá. Mong chuyên gia cho tôi xin lời tư vấn tôi nên bán tài sản nào để giảm bớt áp lực tài chính.
Độc giả Pham Nam
Chuyên gia tư vấn:
Với thông tin bạn cung cấp, sau khi trả nợ ngân hàng, số tiền còn lại của bạn là 3 triệu đồng, không đủ chi tiêu cho nhu cầu sinh hoạt hàng ngày. Do đó việc nhanh chóng tất toán một phần hoặc toàn bộ một trong các khoản nợ nhằm giảm áp lực tài chính bắt buộc phải làm ngay bây giờ.
Về nguyên tắc, bạn nên ưu tiên trả các khoản nợ có lãi suất cao nhất, tiếp theo là các khoản nợ nhỏ, có thể trả dứt điểm trước. Trước khi tính đến việc bán tài sản, bạn có thể rà soát xem có thể nhờ đến sự trợ giúp của người thân, bạn bè cho những khoản vay nhỏ hay không. Việc tạm vay mượn từ người thân giúp bạn nhanh chóng tất toán các khoản nợ lãi suất cao hoặc các khoản nợ nhỏ, tránh trường hợp xấu nhất là mất khả năng chi trả và bị xếp vào nhóm nợ xấu.
Tiếp theo, tùy vào khoản nợ cũng như quy định của mỗi ngân hàng, bạn có thể thương lượng với nhà băng để xin được giãn nợ, cơ cấu nợ nếu tình huống cho phép. Đồng thời, bạn nên rao bán tài sản là các bất động sản, một phương án bắt buộc nếu hai cách trên không hiệu quả.
Vì mục tiêu bán tài sản để trả nợ vay, ưu tiên hàng đầu vẫn là những bất động sản có tính thanh khoản cao nhất. Trong các loại hình, nhà hoặc đất có giá trị vừa phải, ở khu vực dân cư đông đúc hiện hữu sẽ thanh khoản ở mức khá và ít bị giảm giá quá nhiều khi thị trường khó khăn. Ưu tiên thứ hai là bất động sản phục vụ nhu cầu ở thật, vị trí thuận lợi, có pháp lý đầy đủ.
Vậy, nếu căn nhà của bạn đáp ứng được các tiêu chí như đủ điều kiện chuyển nhượng, mới bàn giao, vị trí thuận tiện thì bạn nên ưu tiên rao bán luôn. Đây có thể là bất động sản thanh khoản cao nhất, giúp bạn giảm được gần 40% khoản nợ. Từ đó số tiền trả nợ hàng tháng cũng giảm đáng kể.
Ngược lại, nếu nhà ở xã hội này không đáp ứng các tiêu chí trên, bạn buộc phải lựa chọn bán các bất động sản khác. Cách để tiết kiệm thời gian là rao bán cùng lúc. Loại hình nào phù hợp với thị trường sẽ thanh khoản nhanh nhất, lúc đó bạn sẽ ngừng bán các bất động sản còn lại. Lưu ý là bạn đang trong trạng thái bán tài sản để trả nợ ngân hàng nên việc có thể phải bán dưới mức giá kỳ vọng để sớm chốt giao dịch là điều dễ hiểu. Bởi lẽ việc rao bán bất động sản thời điểm này không thuận lợi như lúc thị trường sôi động, trong khi áp lực tài chính với bạn sẽ càng lớn nếu khoản nợ kéo dài.","Với mục tiêu bán tài sản để trả nợ vay, bất động sản có giá trị vừa phải, ở khu vực dân cư đông đúc là ưu tiên hàng đầu vì thanh khoản tốt, chuyên gia nói. - VnExpress","https://vnexpress.net/co-7-bat-dong-san-nen-ban-bot-loai-nao-de-tra-no-4678736.html","Chủ nhật, 26/11/2023, 07:54 (GMT+7)","https://i2-vnexpress.vnecdn.net/2023/11/25/cg2a61671657953602169289148926-7896-9969-1700930637.jpg?w=1200&h=0&q=100&dpr=1&fit=crop&s=M3gSYvNdqLsy4t6HAZu0Ig","Pham Nam","Tư vấn","https://vnexpress.net/tin-tuc-24h"
"4681371","Ông Zelensky tuyên bố Ukraine sắp nhận tàu vũ trang","""Chúng tôi đã đạt được thỏa thuận với các đối tác và sẽ tổ chức những chuyến hộ tống trên biển để đảm bảo an toàn cho tàu thuyền"", Tổng thống Ukraine Volodymyr Zelensky nói tại hội nghị an ninh lương thực ở thủ đô Kiev ngày 25/11.
Ông nhấn mạnh thiết lập và duy trì hành lang ngũ cốc trên Biển Đen là một trong những bước tiến quan trọng đối với Ukraine trong năm nay. Tổng thống Zelensky nói một số đối tác đã cam kết gửi tàu vũ trang cho Ukraine, kỳ vọng số phương tiện này sẽ sớm được chuyển giao.
Chủ tịch Ủy ban châu Âu Ursula von der Leyen ngày 25/11 cũng thông báo Liên minh châu Âu (EU) sẽ dành ngân sách 50 triệu euro cho chương trình sửa chữa nhanh và nâng cấp hạ tầng cảng tại Ukraine.
Tổng thống Zelensky công bố ý định triển khai thêm hệ thống phòng không đến tỉnh Odessa ở miền nam nhờ thỏa thuận mới giữa Kiev và đồng minh. ""Khu vực này sẽ sớm được bảo vệ bằng lưới phòng không rất mạnh. Tàu thuyền và tính mạng người dân tại Odessa đều quan trọng với Ukraine"", ông nói.
Tùy nhiên, ông Zelensky thừa nhận Ukraine vẫn thiếu năng lực phòng không, cần các đối tác hỗ trợ thêm và kêu gọi tăng sản lượng công nghiệp quốc phòng.
Nga hồi tháng 7 thông báo rút khỏi Sáng kiến Ngũ cốc Biển Đen. Thỏa thuận được Liên Hợp Quốc, Thổ Nhĩ Kỳ làm trung gian đàm phán và ký tại Istanbul năm ngoái, cho phép Ukraine xuất khẩu hàng triệu tấn ngô, lúa mì và các loại nông sản bằng đường biển ra thị trường thế giới.
Moskva chỉ trích phương Tây không tuân thủ thỏa thuận nới lỏng các biện pháp trừng phạt với nông sản và phân bón Nga.
Liên Hợp Quốc cảnh báo quyết định của Nga có nguy cơ gây ra cuộc khủng hoảng lương thực toàn cầu, gây tổn hại nặng nề cho những nước nghèo. Tuy nhiên, Điện Kremlin nhấn mạnh họ sẵn sàng cung cấp ngũ cốc miễn phí cho các nước nghèo ở châu Phi sau khi chấm dứt thỏa thuận.
Quân đội Ukraine đã tự tổ chức hành lang vận tải trên Biển Đen. Những tổ chức, công ty muốn Ukraine hỗ trợ trên tuyến đường này đều phải chấp nhận rủi ro.","Tổng thống Zelensky cho biết các nước đối tác cam kết gửi tàu vũ trang cho Ukraine để bảo vệ hành lang ngũ cốc trên Biển Đen. - VnExpress","https://vnexpress.net/ong-zelensky-tuyen-bo-ukraine-sap-nhan-tau-vu-trang-4681371.html","Chủ nhật, 26/11/2023, 07:37 (GMT+7)","https://i2-vnexpress.vnecdn.net/2023/11/26/zelensky-1700958513-6021-1700958583.png?w=1200&h=0&q=100&dpr=1&fit=crop&s=vHELi5rzGrrDqPuM9bPKRg","Thanh Danh","Quân sự","https://vnexpress.net/tin-tuc-24h"
