"""ID"", ""Title"", ""Content"", ""Description"", ""URL"", ""Publication Date"", ""Image URL"", ""Author"", ""Category"", ""Source"""
"4686305","10 điểm đến khách Việt thích ghé thăm nhất năm mới 2024","Ứng dụng đặt phòng có đối tác tại hơn 220 quốc gia, vùng lãnh thổ Booking.com sáng 8/12 công bố danh sách 10 điểm đến trong nước được khách Việt ghé thăm nhiều nhất dịp Tết dương 2024.
Đứng đầu là Hội An với khu Phố cổ nổi tiếng thuộc tỉnh Quảng Nam. Thành phố này cũng là điểm đến tăng hạng nhiều nhất (6 bậc) trong top 10 so với cùng kỳ năm ngoái. Đà Nẵng là thành phố tụt bậc nhiều nhất, đứng vị trí thứ 5. Năm 2022, Đà Nẵng được khách Việt lựa chọn là điểm đến ghé thăm nhiều nhất dịp năm mới 2023. Thủ đô Hà Nội giảm hai bậc khi từ vị trí thứ 2 của năm ngoái xuống vị trí thứ 4 trong năm nay.
Các điểm đến còn lại nằm trong top 10 là Đà Lạt, TP HCM, Đà Nẵng, Vũng Tàu, Phú Quốc, Nha Trang, Sa Pa, Mũi Né.
5 trong số 10 điểm đến được tìm kiếm nhiều nhất là những thành phố biển, cho thấy du khách Việt vẫn đặc biệt yêu thích loại hình nghỉ dưỡng gần biển vào mùa đông. Ngoài yếu tố tìm kiếm điểm đến ấm áp, khách Việt ưu tiên lựa chọn kỳ nghỉ gần biển cũng phù hợp với Dự đoán Xu hướng Du lịch 2024 của Booking. 82% khách Việt khi tham gia khảo sát cho biết cảm giác thư thái khi ở cạnh môi trường nước (biển, sông, hồ) quyết định điểm đến để đi du lịch.
TP HCM và Hà Nội nằm ở top 3 và 4 điểm đến được du khách tìm kiếm nhiều nhất cho thấy mức độ quan tâm nhất định của người Việt đối với kỳ nghỉ trong thành phố.
Khảo sát của Booking dựa trên số liệu khách Việt tìm kiếm nhiều nhất trong tháng 11 với ngày nhận phòng từ 1/12 đến đầu năm 2024.
Khách sạn vẫn là loại hình lưu trú phổ biến nhất với người Việt, tuy nhiên dựa vào xu hướng đặt phòng, Booking nhận thấy du khách cũng đang tìm kiếm, khám phá các loại hình lưu trú khác thay thế. Khu nghỉ dưỡng, căn hộ, nhà trọ và biệt thự là 4 loại hình lưu trú được tìm kiếm nhiều nhất sau khách sạn.
Trả lời VnExpress, Varun Grover, Giám đốc Quốc gia Booking Việt Nam cho biết ""rất vui khi thấy nhu cầu du lịch nội địa của người Việt đang ở mức cao"". Du lịch biển và du lịch đô thị được quan tâm nhiều nhất trong xu hướng chọn kỳ nghỉ của người Việt dịp cuối năm và năm mới.","Hội An được khách Việt thích ghé thăm nhất vào năm mới 2024, Đà Nẵng là thành phố tụt nhiều bậc nhất trong top các điểm đến yêu thích. - VnExpress","https://vnexpress.net/10-diem-den-khach-viet-thich-ghe-tham-nhat-nam-moi-2024-4686305.html","Thứ sáu, 8/12/2023, 11:08 (GMT+7)","https://i1-dulich.vnecdn.net/2023/12/08/anh-1-1658647624-1702004679-4908-1702005169.jpg?w=1200&h=0&q=100&dpr=1&fit=crop&s=djZNsLblJZQhG9vSBDGPJQ","","Tin tức","https://vnexpress.net/tin-tuc-24h"
"4686363","Khoảnh khắc Israel hạ tổ săn tăng Hamas","""Các tổ tác chiến của tiểu đoàn biên phòng số 636 xác định nhóm chiến binh mang súng chống tăng kiểu RPG tiếp cận và khai hỏa nhằm vào đơn vị thuộc lữ đoàn bộ binh số 1 Golani"", Lực lượng Phòng vệ Israe (IDF) ngày 7/12 thông báo.
Lực lượng trinh sát Israel vận hành máy bay không người lái (UAV) quay lại cảnh các thành viên Hamas mang theo súng chống tăng rời khỏi khu nhà cao tầng, khai hỏa về phía đối phương rồi rút vào nơi ẩn náu. Đây dường như là một ""tổ săn tăng"" chuyên thực hiện nhiệm vụ hạ xe tăng, thiết giáp Israel.
UAV Israel xác định vị trí của nhóm tay súng Hamas và chỉ thị mục tiêu cho không quân. ""Toàn bộ tay súng đều bị hạ bởi hỏa lực yểm trợ tầm gần"", IDF cho biết.
Video được IDF công bố cho thấy nhiều vệt đạn bắn về phía một tòa nhà đang cháy, cũng như ít nhất hai tay súng bị hạ trong trận không kích.
Trước đó, IDF thông báo thu giữ hàng trăm rocket tầm xa, bệ phóng, tên lửa, súng chống tăng kiểu RPG, máy bay không người lái (UAV) và thiết bị nổ tại ""kho vũ khí lớn nhất của Hamas"" ở Dải Gaza. IDF cho biết kho vũ khí này ""nằm gần một trường học và phòng khám"".
Chiến dịch quân sự nhằm vào Dải Gaza của Israel nhằm trả đũa vụ tấn công của Hamas đã bước sang tháng thứ ba. IDF đang bao vây Khan Yonis và mở các mũi tấn công vào trung tâm thành phố được mệnh danh là thành trì của Hamas ở miền nam Dải Gaza.
Quân đội Israel ngày 6/12 tuyên bố hạ ít nhất 10 chỉ huy tiểu đoàn Hamas, làm suy giảm đáng kể năng lực tác chiến của lực lượng này.
Các quan chức Mỹ dự đoán IDF trong vài tuần tới có thể chuyển sang chiến lược tấn công mang tính cục bộ hóa cao và cường độ thấp hơn, nhằm vào các thành viên và lãnh đạo của Hamas tại miền nam Dải Gaza. Họ cũng nhận định giai đoạn hiện tại trong chiến dịch của Israel nhằm vào Dải Gaza có thể kết thúc vào tháng 1/2024.","Quân đội Israel công bố video ghi lại cảnh lực lượng nước này không kích hạ một tổ săn tăng của Hamas tại miền bắc Dải Gaza. - VnExpress","https://vnexpress.net/khoanh-khac-israel-ha-to-san-tang-hamas-4686363.html","Thứ sáu, 8/12/2023, 11:07 (GMT+7)","https://i2-vnexpress.vnecdn.net/2023/12/08/5563187178137267862a-hamas-170-5685-5329-1702005942.jpg?w=1200&h=0&q=100&dpr=1&fit=crop&s=YuYd6ouXJUG5Q6Bgxq3p1g","","Quân sự","https://vnexpress.net/tin-tuc-24h"
"4685539","Hà Lê hát về tình thân","Màu sắc chủ đạo của ca khúc là ballad pha trộn phong cách âm nhạc điện tử synth-pop. Hà Lê cho biết tác giả trẻ Thanh Tùng gửi cho anh bài I Will Call It Love cách đây bảy năm. Anh thấy thích câu chuyện về tình thân gia đình trong nhạc phẩm. Khi đó, anh mới bắt đầu làm ca sĩ, chất giọng chưa hay để truyền đạt được hết tâm tư của nhạc sĩ. Hiện anh đã kết hôn, đủ trải nghiệm để thể hiện ca khúc trọn vẹn.
""Tôi từng thu âm bài hát nhưng không thành công. Sau này, trong một lần gặp lại tác giả, tôi quyết định phát hành sáng tác mang đầy sự yêu thương này"", ca sĩ nói.
Nội dung MV là hành trình lớn lên của một cậu bé ở thôn quê miền Bắc với mối tình đầu trong sáng, con đường làng, vòng tay yêu thương của gia đình. Hà Lê là người dẫn dắt câu chuyện.
Nghệ sĩ cho biết I Will Call It Love nằm trong album Đơn sơ dự kiến phát hành năm 2024. Anh cũng lên kế hoạch tổ chức tour diễn quảng bá CD, thực hiện liveshow đầu tiên trong sự nghiệp.
Hà Lê tên thật là Lê Vĩnh Hà, từng là thành viên nhóm PB Nation cùng Phúc Bồ. Anh tốt nghiệp khoa Toán kinh tế của Đại học Nottingham Trent (Anh) nhưng đam mê âm nhạc, có khả năng đọc rap và nhảy hip hop. Thời gian du học, Hà Lê tiếp xúc nhiều với văn hóa hip hop. Trước khi trở thành ca sĩ, anh thành công với vai trò vũ công, tổ chức nhiều cuộc thi nhảy, là giám khảo chương trình So You Think You Can Dance.
Năm 2018, anh ra mắt dự án Trịnh Contemporary, gây chú ý khi làm mới loạt tình khúc kinh điển như Ở trọ, Biển nhớ, Diễm xưa, Nhớ mùa thu Hà Nội. Hồi tháng 2, anh làm đám cưới với biên đạo Gia Linh.","Hà Lê thể hiện ca khúc &quot;I Will Call It Love&quot; với thông điệp gắn kết con người trước cuộc sống nhiều lo toan bộn bề. - VnExpress","https://vnexpress.net/ha-le-hat-ve-tinh-than-4685539.html","Thứ sáu, 8/12/2023, 11:07 (GMT+7)","https://i1-giaitri.vnecdn.net/2023/12/06/ha-le-1-1701848539-3118-1701849179.jpg?w=1200&h=0&q=100&dpr=1&fit=crop&s=wRBwOea3Y51EZ7KZBSJKrg","","Làng nhạc","https://vnexpress.net/tin-tuc-24h"
"4686369","Trường từng đề nghị điều chuyển cô giáo bị nhốt","Trong công văn gửi Văn phòng Chính phủ, Bộ Giáo dục và Đào tạo ngày 7/12, UBND tỉnh Tuyên Quang cho biết đã nhận được báo cáo nhanh của trường THCS Văn Phú, các ngành chức năng và UBND huyện Sơn Dương về vụ học sinh lớp 7C của trường nhốt, ném đồ vào cô giáo.
Theo đó, báo cáo của trường nêu thời gian gần đây, cô Hằng, 38 tuổi, có nhiều hành vi, phát ngôn không đúng chuẩn mực, xúc phạm danh dự, nhân phẩm, uy tín của người khác, gây bức xúc trong học sinh và phụ huynh.
""Trường THCS Văn Phú từng đề nghị luân chuyển cô giáo này đến cơ sở khác, do cô không được học sinh, nhân dân tin tưởng, không quản lý được học sinh"", báo cáo trích ý kiến của trường.
Ngày 21/11, cô bị trường kỷ luật vì ""có những vi phạm về đạo đức nhà giáo, xúc phạm danh dự, nhân phẩm học sinh, hành vi, ngôn ngữ ứng xử của giáo viên chưa đảm bảo tính sư phạm, đúng mực"".
UBND tỉnh Tuyên Quang đề nghị các ngành chức năng kiểm tra, xác minh làm rõ nguyên nhân của sự việc, xử lý đúng quy định với cả cô Hằng và học sinh.
Ba ngày qua, sự việc cô giáo tại Tuyên Quang bị học sinh nhốt trong lớp, chửi bới, nhét rác và ném đồ vào người thu hút sự quan tâm lớn của dư luận.
Diễn biến vụ việc qua lời kể của cô Hằng, phụ huynh
Theo UBND huyện Sơn Dương, sự việc diễn ra lúc 10h30 sáng 29/11. Khi bắt đầu tiết Âm nhạc ở lớp 7C, một số học sinh xin ra ngoài nhưng cô Hằng không cho. Sau đó, giữa giáo viên và học sinh ""xảy ra khúc mắc"". Hết tiết học, cô giáo chuyển sang dạy lớp 6A thì một số học sinh lớp 7C đi sang, nói tục, xúc phạm, quay video đăng lên Facebook.
UBND tỉnh Tuyên Quang đánh giá hành vi của một số học sinh trong sự việc là ""không đúng mực, vô lễ với giáo viên"", đồng thời chỉ đạo xem xét trách nhiệm của hiệu trưởng khi để xảy ra sự việc.
Tỉnh cũng yêu cầu Sở tăng cường quản lý, đánh giá giáo viên, thực hiện quy định về đạo đức nhà giáo, xây dựng văn hóa học đường, giáo dục tư tưởng, đạo đức cho học sinh.
Bộ Giáo dục và Đào tạo đánh giá việc học sinh nhốt cô giáo trong lớp, chửi bới và ném đồ vào người cô là vi phạm đạo đức nghiêm trọng, gây bức xúc trong dư luận. Thứ trưởng Hoàng Minh Sơn hôm 6/12 nhìn nhận sự việc ""rất nghiêm trọng, không thể chấp nhận được"", nhưng nhấn mạnh cần đánh giá khách quan, thấu đáo để tìm giải pháp phù hợp.
Bộ này đề nghị tỉnh Tuyên Quang thông báo kết quả xử lý vụ việc trước 29/12.","Tuyên Quang- Trước khi bị học sinh nhốt, cô Hằng từng bị trường THCS Văn Phú kỷ luật và đề nghị chuyển trường vì &quot;vi phạm đạo đức nhà giáo&quot;, theo báo cáo của trường gửi UBND tỉnh. - VnExpress","https://vnexpress.net/truong-tung-de-nghi-dieu-chuyen-co-giao-bi-nhot-4686369.html","Thứ sáu, 8/12/2023, 11:04 (GMT+7)","https://i2-vnexpress.vnecdn.net/2023/12/08/3af20dcb3843911dc852-jpeg-1702-2811-5997-1702007699.jpg?w=1200&h=0&q=100&dpr=1&fit=crop&s=UvyCs1UNJzZtbIarFBHILg","","Tin tức","https://vnexpress.net/tin-tuc-24h"
"4686341","Siu Black 'phiêu' với nhạc Phú Quang","Ca sĩ là khách mời bất ngờ trong liveshow tối 7/12, không được ban tổ chức thông báo trước. Cô cho biết hồi hộp khi trở lại hát nhạc tình của Phú Quang sau hơn 10 năm. Biểu diễn bài Đâu phải bởi mùa thu, ca sĩ khoe giọng hát khỏe với nhiều quãng ngân nga, bỏ nhỏ tinh tế. Cuối ca khúc và trong phần giao lưu, Siu Black mời khán giả tại Nhà hát Lớn hát cùng câu ""Lá trút rơi nhiều đâu phải bởi mùa thu"".
Trong đêm nhạc với không khí nhẹ nhàng, tiết mục của Siu Black là điểm nhấn. Cô được người nghe vỗ tay hưởng ứng mỗi lần lên nốt cao.
Siu Black kể kỷ niệm một lần đi biểu diễn ở Đà Nẵng, gặp nhạc sĩ Phú Quang. Khi ấy, cô không có ca khúc nào phù hợp để hát trong chương trình, dự định diễn lại các bài của Nguyễn Cường. Nhạc sĩ Phú Quang nói: ""Anh nghĩ có bài này khá hợp, nếu em muốn có thể thử"". Siu Black nói rất thích ca khúc, nhưng không tự tin hát nhạc lãng mạn. Nhạc sĩ Phú Quang sau đó đã nhờ ca sĩ Mỹ Linh hướng dẫn Siu Black một buổi. Sau lần biểu diễn, Siu Black mới tự tin hát thêm các dòng nhạc khác ngoài những ca khúc về Tây Nguyên.
Sau đó, Siu Black khiến sân khấu bùng nổ với Rock buồn. Bài hát là một trong số ít tác phẩm nhạc sĩ viết theo phong cách rock, từng được Siu Black đưa vào album Ly cà phê Buôn mê.
Ngoài Siu Black, các giọng ca Hà Trần, Tấn Minh, Tùng Dương, Đào Mác, góp mặt trong liveshow, tái hiện sự nghiệp đồ sộ của nhạc sĩ Phú Quang. Hà Trần hát một số ca khúc chưa phổ biến như Những ngày ta yêu nhau, Mùa thu và em, Chuyện bình thường cuối cùng. Còn Tùng Dương biểu diễn các nhạc phẩm quen thuộc Mẹ, Em ơi Hà Nội phố, Khúc mùa thu. Con gái nghệ sĩ - pianist Trinh Hương và con rể - violist Bùi Công Duy - song tấu bài Tình yêu của biển, bản nhạc ông viết tặng vợ cũ.
Chương trình do gia đình nhạc sĩ Phú Quang thực hiện theo tâm nguyện của ông. Trước khi qua đời, ông giao con gái cả Trinh Hương kế thừa di sản âm nhạc, tổ chức các đêm nhạc hàng năm, như ông vẫn làm khi còn sống. Lợi nhuận thu được dùng để bảo tồn, lưu trữ gia tài tác phẩm của nhạc sĩ, xây dựng thư viện âm nhạc, kỷ vật của ông trong tương lai.
Tùng Dương rưng rưng nhớ nhạc sĩ Phú Quang khi lần đầu tiên hát ""Khúc mùa thu"". Video: Cao Thiên Sinh","Hà Nội- Siu Black được khán giả cổ vũ khi hát &quot;Đâu phải bởi mùa thu&quot; trong đêm nhạc Phú Quang. - VnExpress","https://vnexpress.net/siu-black-phieu-voi-nhac-phu-quang-4686341.html","Thứ sáu, 8/12/2023, 11:01 (GMT+7)","https://i1-giaitri.vnecdn.net/2023/12/08/siu-black-1702006387-170200643-6484-6387-1702006563.jpg?w=1200&h=0&q=100&dpr=1&fit=crop&s=R8ZBHk0RendB2ky_BSjlqQ","","Làng nhạc","https://vnexpress.net/tin-tuc-24h"
"4686293","Thị trấn Nhật tặng tiền cho người họ Suzuki tới định cư","Thị trấn Kainan, tỉnh Wakayama, được coi là ""cái nôi"" của dòng họ Suzuki, họ phổ biến thứ hai ở Nhật Bản. Họ quyết định khai thác mối liên kết này bằng cách phát động chiến dịch từ năm 2021, tặng tiền cho người dân họ Suzuki tới định cư. Chính quyền thị trấn nhắm đến 750.000 người họ Suzuki sống ở Tokyo và các tỉnh lân cận như Chiba, Saitama và Kanagawa.
Mỗi hộ gia đình mang họ Suzuki sinh sống ở Kainan trong 5 năm sẽ được nhận một triệu yen (gần 7.000 USD), cùng số tiền tương tự cho mỗi trẻ em dưới 18 tuổi; nghĩa là một hộ gia đình 4 người gồm bố mẹ và hai con nhỏ sẽ được nhận ba triệu yen. Người độc thân sẽ được nhận 600.000 yen (gần 4.200 USD).
Tuy nhiên, sau hai năm thực thi chính sách thúc đẩy dân số, thị trấn không thu hút được người nào mang họ Suzuki. Thực tế này phản ánh khó khăn mà giới chức địa phương đối mặt, đồng thời làm nổi bật tình trạng suy giảm và già hóa dân số khắp Nhật Bản.
""Tôi có thể xác nhận rằng tới nay, chưa có người nào mang họ Suzuki chuyển tới Kainan"", Tomonari Fujita, người đứng đầu phòng phát triển đô thị của thị trấn, nói. ""Có một người từng hỏi nhưng cuối cùng không chuyển đến"".
Bỏ qua yếu tố tiền bạc, giới chức cho rằng khi chuyển tới Kainan, những người họ Suzuki sẽ được tìm về gốc rễ. Họ Suzuki bắt nguồn từ các thầy tu ở một ngôi đền tại thị trấn Kumano lân cận. Gia tộc Suzuki chuyển tới Kainan ngày nay trong thời kỳ Heian (794-1185) và tiếp tục truyền bá tư tưởng Thần đạo, tôn giáo bản địa của Nhật Bản.
Dinh thự của gia đình xây từ thời Edo (1603-1868) gần đây được tu bổ nhờ nguồn đóng góp 70 triệu yen từ những người họ Suzuki trên khắp đất nước và cả nhà sản xuất xe máy và ôtô Suzuki. Thị trấn cũng thường xuyên tổ chức gặp gỡ giữa những người mang họ Suzuki muốn tìm hiểu về tổ tiên.
Sato là họ phổ biến nhất Nhật Bản với 18,6 triệu người theo khảo sát hồi tháng 3; còn Suzuki đứng thứ hai với 1,77 triệu người. Kainan không phải nơi duy nhất dân số liên tục suy giảm. Dân số Nhật Bản đã giảm 800.000 người xuống 125,4 triệu năm 2022, dù lượng người nước ngoài ở mức kỷ lục gần ba triệu. Viện Nghiên cứu An sinh Xã hội và Dân số Quốc gia Nhật Bản dự báo dân số Nhật xuống mức 87 triệu vào năm 2070.
Fujita cho biết trong số 47.000 cư dân Kainan, hơn 36% trong độ tuổi từ 65 trở lên. ""Suy giảm dân số ở đây rất nghiêm trọng"", ông nói. ""Chúng tôi tưởng chiến dịch của mình có thể trở thành điểm sáng nhờ thu hút những người mang họ Suzuki nhưng trở ngại rất lớn"".
Giới chức của thị trấn nổi tiếng với đồ sơn mài, quýt, cảnh hoàng hôn ven biển tuyệt đẹp, hy vọng sẽ hoàn thành một khách sạn vào năm tới để thu hút nhiều người họ Suzuki tới thăm và cảm nhận về tinh thần quê hương.
""Không thể yêu cầu mọi người bỏ lại mọi thứ và chuyển tới nơi khác sinh sống"", Fujita nói. ""Có quá nhiều thứ cần cân nhắc. Nhưng nếu chúng tôi có thể thu hút mọi người đến trong thời gian ngắn và cảm nhận bầu không khí ở đây, tôi nghĩ sẽ có người sớm yêu nơi này"".","Thị trấn Kainan tặng hàng triệu yen cho người mới đến định cư nhằm gia tăng dân số với điều kiện người đó phải mang họ Suzuki và ở lại nơi này ít nhất 5 năm. - VnExpress","https://vnexpress.net/thi-tran-nhat-tang-tien-cho-nguoi-ho-suzuki-toi-dinh-cu-4686293.html","Thứ sáu, 8/12/2023, 11:00 (GMT+7)","https://i2-vnexpress.vnecdn.net/2023/12/08/6296-9441-1702001631.jpg?w=1200&h=0&q=100&dpr=1&fit=crop&s=GmL9BCCz5fjTLW8xbYOd0g","","Cuộc sống đó đây","https://vnexpress.net/tin-tuc-24h"
"4686198","Vợ tâm sự với người đàn ông khác rằng có chồng cũng như không","Tôi làm công việc toàn thời gian, còn vợ làm tự do ở ngoài. Gần đây, tôi thấy vợ có nhưng biểu hiện bất thường, đi làm về thì để mấy bố con trông nhau, lúc nào cũng ôm khư khư cái điện thoại để nhắn tin, đôi khi còn cười một mình nên tôi sinh nghi.
Cho đến gần đây, có cơ hội đọc được tin nhắn trên điện thoại của vợ, tôi khá sốc và bất ngờ vì vợ đang nhắn tin qua lại với một người đàn ông khác đã có gia đình. Có mấy tin nhắn như sau: ""Em có chồng cũng như không, nhà em cơm ai người nấy ăn, áo ai người nấy mặc, việc ai người lấy làm"", ""Chồng em là người nhu nhược nên hai vợ chồng làm gì có tình cảm gì đâu"", rồi hẹn hò nhau gặp gỡ và đi chơi.
Tôi nói chuyện với vợ, cô ấy trả lời rằng đó không phải sự thật sao và đòi ly dị dù đã có với nhau hai người con, hơn nữa lần nào hai vợ chồng có chuyện lại đòi ly hôn. Tôi thực sự không biết nên làm gì trong trường hợp lần này, hai con còn quá nhỏ.
Tiến Anh","Phát hiện vợ nhắn tin với người đàn ông khác đã có gia đình, hẹn hò gặp gỡ và đi chơi, tôi nói chuyện thì vợ đòi ly dị. - VnExpress","https://vnexpress.net/vo-tam-su-voi-nguoi-dan-ong-khac-rang-co-chong-cung-nhu-khong-4686198.html","Thứ sáu, 8/12/2023, 11:00 (GMT+7)","https://i2-vnexpress.vnecdn.net/2023/12/08/divorceconceptwithsadpeople232-8324-1230-1701996306.jpg?w=1200&h=0&q=100&dpr=1&fit=crop&s=78Tjgb7yEHG2Yujd_TRzdA","","Tâm sự","https://vnexpress.net/tin-tuc-24h"
