"""ID"",""Title"",""Content"",""Description"",""URL"",""Publication Date"" ,""Image URL"",""Author"",""Category"",""Source"""
"4684196","Mỹ nhân 'Bản năng gốc' mặc phá cách ở tuổi 65","Hôm 1/12, tới dự sự kiện Women In Cinema thuộc Red Sea International Festival 2023, Sharon Stone ghi điểm với đầm đuôi cá nhấn bằng hai chiếc trâm cài mạ vàng. Vogue khen bộ cánh tôn dáng, ăn ý cách trang điểm tông nude cùng mái tóc vuốt ngược, giúp bà toát lên vẻ sang trọng. Ảnh: AFP
Hôm 1/12, tới dự sự kiện Women In Cinema thuộc Red Sea International Festival 2023, Sharon Stone ghi điểm với đầm đuôi cá nhấn bằng hai chiếc trâm cài mạ vàng. Vogue khen bộ cánh tôn dáng, ăn ý cách trang điểm tông nude cùng mái tóc vuốt ngược, giúp bà toát lên vẻ sang trọng. Ảnh: AFP
Trước đó một ngày, tại buổi khai mạc sự kiện này, bà gây chú ý với mốt khoe nội y theo kiểu peekaboo, kết hợp bộ đầm hồng xẻ vai dáng freesize. Ảnh: AFP
Trước đó một ngày, tại buổi khai mạc sự kiện này, bà gây chú ý với mốt khoe nội y theo kiểu peekaboo, kết hợp bộ đầm hồng xẻ vai dáng freesize. Ảnh: AFP
Sharon Stone sinh năm 1958, là diễn viên, người mẫu, nhà sản xuất phim Mỹ. Bà được mệnh danh là một trong những biểu tượng nóng bỏng của Hollywood suốt hai thập niên qua. Người đẹp nổi tiếng khi đóng Bản năng gốc và được đề cử giải Oscar. Với phim Casino, bà giành giải Quả Cầu Vàng Nữ diễn viên chính xuất sắc. Stone trải qua ba đời chồng, hiện sống với ba con trai ở California, Mỹ.
Sharon Stone sinh năm 1958, là diễn viên, người mẫu, nhà sản xuất phim Mỹ. Bà được mệnh danh là một trong những biểu tượng nóng bỏng của Hollywood suốt hai thập niên qua. Người đẹp nổi tiếng khi đóng Bản năng gốc và được đề cử giải Oscar. Với phim Casino, bà giành giải Quả Cầu Vàng Nữ diễn viên chính xuất sắc. Stone trải qua ba đời chồng, hiện sống với ba con trai ở California, Mỹ.
Ở tuổi 65, diễn viên xây dựng phong cách sang trọng, hợp mốt khi đi sự kiện. Bà mặc đa dạng, không gò mình theo phong cách nào. Hồi tháng 9, bà được Vogue Italy xếp vào nhóm sao mặc đẹp tại Tuần thời trang Milan khi diện bộ quần áo da nâu. Ảnh: Instagram Sharon Stone
Ở tuổi 65, diễn viên xây dựng phong cách sang trọng, hợp mốt khi đi sự kiện. Bà mặc đa dạng, không gò mình theo phong cách nào. Hồi tháng 9, bà được Vogue Italy xếp vào nhóm sao mặc đẹp tại Tuần thời trang Milan khi diện bộ quần áo da nâu. Ảnh: Instagram Sharon Stone
Trong một sự kiện hồi tháng 8, Stone khoe đường cong trong bộ đầm sequin dáng đuôi cá. Tạp chí Elle khen bà quyến rũ, đầy sức sống không thua kém những cô gái trẻ. Ảnh: Instagram Sharon Stone
Trong một sự kiện hồi tháng 8, Stone khoe đường cong trong bộ đầm sequin dáng đuôi cá. Tạp chí Elle khen bà quyến rũ, đầy sức sống không thua kém những cô gái trẻ. Ảnh: Instagram Sharon Stone
Sharon Stone tham dự sự kiện do tờ Hollywood Reporter tổ chức cuối tháng 5 tại Los Angeles. Bà chọn bộ suit đỏ, cài hoa khổng lồ trên vai. Ảnh: AFP
Sharon Stone tham dự sự kiện do tờ Hollywood Reporter tổ chức cuối tháng 5 tại Los Angeles. Bà chọn bộ suit đỏ, cài hoa khổng lồ trên vai. Ảnh: AFP
Stone được tôn dáng với đầm suông đa chất liệu khi dự sự kiện ở California hồi tháng 3. Bà chọn khuyên tai lớn và clutch ánh kim làm điểm nhấn cho tổng thể. Ảnh: AFP
Stone được tôn dáng với đầm suông đa chất liệu khi dự sự kiện ở California hồi tháng 3. Bà chọn khuyên tai lớn và clutch ánh kim làm điểm nhấn cho tổng thể. Ảnh: AFP
Tại tiệc hậu Oscar 2023, Sharon Stone được Vogue xếp vào nhóm sao mặc đẹp với đầm dáng cape phối túi Dolce &amp; Gabbana. Ảnh: AFP
Tại tiệc hậu Oscar 2023, Sharon Stone được Vogue xếp vào nhóm sao mặc đẹp với đầm dáng cape phối túi Dolce &amp; Gabbana. Ảnh: AFP
Vogue nhận xét Stone táo bạo và truyền cảm hứng trong bộ suit màu hồng cách điệu với blazer xếp bèo tại một sự kiện ở Beverly Hills, California hồi tháng 2. Ảnh: AFP
Vogue nhận xét Stone táo bạo và truyền cảm hứng trong bộ suit màu hồng cách điệu với blazer xếp bèo tại một sự kiện ở Beverly Hills, California hồi tháng 2. Ảnh: AFP
Ngoài đời, bà ăn vận đơn giản, chú trọng sự thoải mái để vẽ tranh cả ngày. Tủ đồ của bà thường có quần shorts, áo phông, sơ mi dáng dài, áo hoodie, quần jeans, dép bệt. Ảnh: Instagram Sharon Stone
Ngoài đời, bà ăn vận đơn giản, chú trọng sự thoải mái để vẽ tranh cả ngày. Tủ đồ của bà thường có quần shorts, áo phông, sơ mi dáng dài, áo hoodie, quần jeans, dép bệt. Ảnh: Instagram Sharon Stone
Trên CNN, bà cho biết kể từ khi Covid-19 bùng nổ, bà bắt đầu vẽ tranh nhiều hơn. Trước đó, bà từng học nghệ thuật một thời gian ngắn tại Đại học Edinboro ở quê hương - bang Pennsylvania. Ảnh: Instagram Sharon Stone
Trên CNN, bà cho biết kể từ khi Covid-19 bùng nổ, bà bắt đầu vẽ tranh nhiều hơn. Trước đó, bà từng học nghệ thuật một thời gian ngắn tại Đại học Edinboro ở quê hương - bang Pennsylvania. Ảnh: Instagram Sharon Stone
Stone mặc áo hoodie cùng quần thể thao. Trang phục thường lấm lem màu vẽ, nhưng bà cảm thấy hạnh phúc khi được thỏa đam mê. Trong hai năm, bà đã biến nhà riêng thành studio tranh. Hồi tháng 10, Stone tổ chức triển lãm Welcome to My Garden tại Phòng trưng bày C. Parker ở Greenwich, bang Connecticut. Ảnh: Instagram Sharon Stone","Minh tinh Sharon Stone thử nghiệm nhiều kiểu trang phục, hướng đến nét sang trọng, quyến rũ, phá cách ở tuổi 65. - VnExpress","https://vnexpress.net/my-nhan-ban-nang-goc-mac-pha-cach-o-tuoi-65-4684196.html","Chủ nhật, 3/12/2023, 18:22 (GMT+7)","https://i1-giaitri.vnecdn.net/2023/12/03/Sharon-Stone-phong-cach-tuoi-65.jpg?w=1200&h=0&q=100&dpr=1&fit=crop&s=RGi4r_p1PLsG8Q0QtTyrfA","","Sao đẹp - Sao xấu","https://vnexpress.net/tin-tuc-24h"
"4684214","Núi lửa Indonesia phun cột tro bụi 3.000 m","""Cột tro bụi được quan sát có màu xám, khá dày đặc và nghiêng về phía đông"", Hendra Gunawan, lãnh đạo Trung tâm Núi lửa và Giảm thiểu Nguy cơ Địa chất Indonesia, cho biết.
Núi lửa Marapi cao 2.891 m nằm trên đảo Sumatra của Indonesia phun trào vào 2h54 ngày 3/12. Đến nay, chưa có bất kỳ báo cáo thiệt hại nào về người. Cơ quan chức năng đã phát cảnh báo mức ba trên thang 4 cấp độ và thiết lập một khu vực phong tỏa quanh ngọn núi.
""Các cộng đồng xung quanh núi lửa Marapi và khách du lịch không được phép tiếp cận trong bán kính 3 km tính từ miệng núi"", Gunawan cho hay.
Theo Ahmad Rifandi, một quan chức tại trạm giám sát núi Marapi, họ cũng ghi nhận mưa tro bụi trong khu vực sau vụ phun trào.
""Mưa tro bụi đã lan đến thành phố Bukittinggi"", ông nói, đề cập đến thành phố lớn thứ ba ở Tây Sumatra với dân số hơn 100.000 người. ""Hy vọng những người ở gần núi Marapi sẽ đội mũ, đeo kính và đeo khẩu trang đầy đủ"".
Indonesia thường xuyên trải qua các trận động đất và phun trào núi lửa do nằm trên ""vành đai lửa"", vòng cung hoạt động địa chấn dữ dội, nơi các mảng kiến tạo va chạm kéo dài từ Nhật Bản qua Đông Nam Á và lưu vực Thái Bình Dương. Quốc gia Đông Nam Á này có gần 130 ngọn núi lửa đang hoạt động. Marapi là ngọn núi lửa hoạt động mạnh nhất trên đảo Sumatra.
Hồi tháng 5, Merapi, ngọn núi lửa hoạt động mạnh nhất Indonesia nằm trên đảo Java, đã phun dung nham trong bán kính hai km tính từ miệng núi.","Một ngọn núi lửa ở miền tây Indonesia phun trào, tạo ra cột tro bụi cao khoảng 3.000 m, khiến chính quyền phải phát cảnh báo. - VnExpress","https://vnexpress.net/nui-lua-indonesia-phun-cot-tro-bui-3-000-m-4684214.html","Chủ nhật, 3/12/2023, 18:06 (GMT+7)","https://i2-vnexpress.vnecdn.net/2023/12/03/FBIMG16730569873131jpgwebp-170-2767-5312-1701601389.jpg?w=1200&h=0&q=100&dpr=1&fit=crop&s=jZCrV0QH-gwg-ghFsuatJQ","","Thế giới","https://vnexpress.net/tin-tuc-24h"
"4684204","Nhà khoa học nổi tiếng Palestine thiệt mạng do đòn không kích của Israel","Ông Tayeh, sinh năm 1971 ở miền bắc Dải Gaza, là nhà nghiên cứu hàng đầu về vật lý và toán học ứng dụng. Theo mạng tin tức địa phương Quds, ông được xếp vào nhóm 2% những nhà nghiên cứu giỏi nhất thế giới năm 2021.
""Nhà nghiên cứu kiêm hiệu trưởng Đại học Hồi giáo Gaza, tiến sĩ Sufian Tayeh, và gia đình ông đã tử vì đạo do cuộc không kích của lực lượng chiếm đóng Israel ngày 2/12"", Bộ trưởng Giáo dục Đại học Palestine Mahmoud Abu Mouis thông báo.
Thị trấn Al-Faluja cách Gaza City, tâm điểm các đợt tấn công của Israel, khoảng 30 km về phía đông bắc. Kể từ tháng 10, Israel đã kêu gọi dân thường sơ tán từ bắc Gaza xuống khu vực miền nam.
Nghiên cứu của tiến sĩ Tayeh đã được công nhận trên phạm vi quốc tế, trong đó có Tổ chức Giáo dục, Khoa học và Văn hóa Liên Hợp Quốc (UNESCO).
Cơ quan y tế của Gaza cho biết 15.207 người, trong đó có hơn 6.200 trẻ em và hơn 4.000 phụ nữ, đã thiệt mạng và 40.652 người bị thương vì các đòn đáp trả của Israel, sau cuộc đột kích của Hamas khiến 1.200 người thiệt mạng ở Israel hôm 7/10. Quân đội Israel tiếp tục ném bom Dải Gaza từ 1/12 sau khi lệnh ngừng bắn tạm thời hết hiệu lực. Khoảng 300 người Palestine đã thiệt mạng kể từ khi Israel nối lại các cuộc không kích.
Bộ trưởng Quốc phòng Mỹ Lloyd Austin hôm 2/12 nhấn mạnh Israel có nguy cơ ""thất bại chiến lược"" ở Dải Gaza nếu không nỗ lực bảo vệ dân thường Palestine. Ông cho biết đã hối thúc các lãnh đạo Israel tránh thương vong cho dân thường, ngăn chặn bạo lực đối với người định cư ở Bờ Tây.
Giới chức Mỹ cũng tăng cường lên tiếng cảnh báo Israel về giai đoạn tiếp theo của chiến dịch ở Gaza. Chính quyền Tổng thống Joe Biden nhấn mạnh chiến dịch ở miền nam Dải Gaza phải được thực hiện chính xác hơn những gì Israel đã làm ở miền bắc.","Nhà khoa học nổi tiếng người Palestine Sufyan Tayeh và gia đình ông đã thiệt mạng trong cuộc không kích của Israel vào thị trấn Al-Faluja, đông bắc Gaza City. - VnExpress","https://vnexpress.net/nha-khoa-hoc-noi-tieng-palestine-thiet-mang-do-don-khong-kich-cua-israel-4684204.html","Chủ nhật, 3/12/2023, 17:42 (GMT+7)","https://i2-vnexpress.vnecdn.net/2023/12/03/nha-khoa-hoc-1701598014-5239-1701598205.png?w=1200&h=0&q=100&dpr=1&fit=crop&s=8_Qt67Q23-L5D6Xw1mAsbg","","Thế giới","https://vnexpress.net/tin-tuc-24h"
"4683947","5 sai lầm khiến thịt luộc bị khô, kém vị","Không sơ chế thịt
Không ít người có thói quen mua thịt về là cho cả tảng vào luộc luôn và bỏ qua khâu sơ chế. Việc này vô tình làm cho thịt chín không đều, bên ngoài mềm mà bên trong còn đỏ.
Để thịt luộc chín đều cần pha các khối đều, vừa phải. Trước khi luộc cần cạo sạch phần lông ở da, dùng chanh và muối hạt chà xát rồi rửa sạch. Chanh và muối khử mùi hiệu quả và chất citric, vitamin C giúp thịt thơm và tươi ngon hơn.
Tùy theo mỗi món ăn mà lựa phần thịt lợn cho phù hợp. Với món thịt luộc nên chọn phần ba chỉ dưới (nạc mỡ đan xen mềm liên khối) hoặc thịt bắp giò, thịt nạc đầu giòn có nạc mỡ đan xen món ăn sẽ ngon hơn. Nếu dùng thịt nạc (thăn) để luộc nên ngâm vào trước với nước pha muối đường loãng tỷ lệ 4-5% (500 ml nước pha thêm 20-25 gr muối, 20-25 gr đường) sau đó rửa sạch lại rồi mới luộc.
Đây là phương pháp brine liquid (nước muối pha đường) mà các đầu bếp Âu Mỹ thường sử dụng khi luộc thịt ức gà giúp miếng thịt mọng ngọt, không bị khô.
Luộc thịt bằng nước lạnh
Nhiều người nội trợ thường cho thịt luôn vào nồi cùng nước lạnh từ đầu rồi bật bếp. Lúc này khi nhiệt độ tăng dần sẽ đưa những chất ngọt dinh dưỡng bên trong thịt ra nước. Cách này chỉ nên áp dụng khi ninh nước dùng hoặc tận dụng nước luộc để nấu canh.
Để thịt luộc ngọt tự nhiên nên cho thịt vào khi nước sôi, lúc này phần da và thớ thịt bên ngoài co lại, giữ chất protein bên trong không bị thoát ra ngoài. Khi nước sôi trở lại hạ lửa nhỏ và luộc thịt chín tới, trung bình khoảng 15 phút thử xiên vào không thấy nước hồng chảy ra. Tắt bếp, đậy vung ngâm để giúp thịt ngậm nước trở nên mọng hơn. Đây là bí quyết giúp thịt ngọt mềm mà không hề bị đỏ bên trong hay da thâm đen, thớ thịt khô.
Luộc lửa to và thêm nước lạnh khi đang luộc
Muốn nhanh chín nên một số người thường bật lửa to luộc mà không biết là nhiệt lớn dẫn tới tình trạng bên ngoài thịt chín mà bên trong vẫn còn đỏ. Hơn nữa, hơi nước bốc nhanh khiến cho nồi nước luộc vơi bớt, lúc này lại thêm nước lạnh vào luộc tiếp.
Theo các chuyên gia dinh dưỡng, trong thịt và xương vốn chứa nhiều protein và chất béo; nếu đang luộc mà cho nước lạnh vào làm giảm nhiệt độ đột ngột khiến protein cùng chất béo bị kết tủa, khe hở của thịt sẽ co lại dễ nhiễm khuẩn làm giảm vị ngọt của thịt.
Luộc thịt quá lâu, quá kỹ
Vì ý nghĩ luộc kỹ chín sâu để không đỏ bên trong nên nhiều người luộc thịt cả nửa tiếng, thậm chí lâu hơn. Điều này khiến cho món ăn khô xác và nhạt vị. Hơn nữa, theo các chuyên gia sức khỏe, khi đun nấu lâu chất dinh dưỡng trong thịt thoát ra nước luộc và làm protein bị phá hủy, một số loại còn gây độc tố ảnh hưởng hương vị món ăn, không tốt cho sức khỏe.
Vớt ra, thái thịt ngay khi luộc chín
Thịt vừa luộc chín mà vớt ra ngay dễ bốc hơi nước làm phần da chuyển màu thâm xỉn, lại mất đi vị ngọt mọng.
Sau khi luộc cũng không nên thái thịt ngay bởi thịt chưa có độ kết dính khiến phần da và phần thịt bong ra thiếu tính thẩm mỹ. Nên để thịt nghỉ tầm 5 - 10 phút rồi dùng dao sắc thái miếng mỏng vừa ăn. Nếu muốn ba chỉ thái miếng dài mỏng để cuốn bánh tráng chấm mắm nêm hoặc thịt chân giò thái lát mỏng ăn bún đậu khi vớt thịt ra cho vào âu nước đá sạch cho phần bì se lại, thấm khô rồi bọc màng bọc thực phẩm để ngăn mát tủ lạnh vài tiếng dễ thái tạo phom hơn.
Yêu cầu thành phẩm: Miếng thịt đạt chuẩn là bên trong hơi hồng ngọt mềm, mọng nước, không bị khô hay bã. Thịt luộc chấm mắm tôm hay mắm tép, muối tiêu chanh đều ngon.","Thịt lợn luộc là món ăn bình dân dễ làm nhưng một số thói quen dễ làm cho món ăn bị khô, giảm giá trị dinh dưỡng. - VnExpress Cooking","https://vnexpress.net/5-sai-lam-khien-thit-luoc-bi-kho-kem-vi-4683947.html","Chủ nhật, 3/12/2023, 17:39 (GMT+7)","https://i1-giadinh.vnecdn.net/2023/12/03/anh3-1701505222-8270-1701574662.jpg?w=1200&h=0&q=100&dpr=1&fit=crop&s=jPOyR-zkVrNPov8zamCXzw","","Mẹo tư vấn","https://vnexpress.net/tin-tuc-24h"
"4683437","Có nên lát sàn gỗ ở tầng một?","Tôi đang có nhu cầu cải tạo căn nhà phố, lắp đặt sàn gỗ mới ở các tầng thay cho gạch lát cũ. Tầng một cũng có phòng ngủ nên tôi muốn làm đồng bộ, nhưng có người bảo không nên vì lo ngại lắp sàn gỗ ở khu vực này sẽ gặp tình trạng ẩm mốc, ngấm trong quá trình sử dụng.
Mong chuyên gia tư vấn giúp phương án phù hợp và gợi ý một số vật liệu thay thế.
Độc giả: Tùng
Chuyên gia trả lời:
Sàn gỗ là một loại vật liệu quen thuộc trong ngôi nhà hiện đại, được nhiều người lựa chọn vì tạo được cảm giác gần gũi, ấm áp, nhất là trong phòng ngủ. Tuy nhiên, nếu không phải vì lý do quá đặc biệt, bạn không nên làm sàn gỗ ở tầng một, dù là gỗ tự nhiên hay gỗ công nghiệp. Lý do là khu vực này thường có độ ẩm cao hơn sàn các tầng trên, dễ bị ngấm, gây ra hiện tượng phồng, cong vênh vật liệu gỗ.
Bên cạnh đó, sàn gỗ tầng một dễ bị mối mọt xâm nhập vì là nơi đi lại nhiều, mang vác những vật nặng trong quá trình sinh hoạt, dễ gây xước, hỏng bề mặt. Nếu nhà bạn ở khu vực trũng thấp, mưa to gây ngập, nước tràn vào dễ nhanh hư hỏng sàn.
Nếu bạn vẫn thích màu sắc, hoa văn của gỗ có thể cân nhắc chuyển sang vật liệu có tính chất tương đồng, điển hình như sàn nhựa và gạch vân gỗ.
Sàn nhựa
Sàn nhựa (hay còn gọi là sàn nhựa giả gỗ), có hình dáng, kích thước và cấu tạo gần giống sàn gỗ công nghiệp, nhưng cốt vật liệu chủ yếu bằng nhựa PVC.
- Cho cảm giác gần với chất liệu gỗ, bề mặt nhẵn, dễ vệ sinh.
- Mẫu mã, màu sắc phong phú.
- Chịu ẩm, chịu nước, chống nồm tốt.
- Chịu tác động cơ học tốt (khó bị nứt vỡ như gạch).
- Không bị mối mọt, thi công nhanh, dễ sửa chữa, thay thế.
- Giá cả dao động từ 100.000-300.000 đồng mỗi m2.
- Độ dày mỏng (trung bình 4 mm), nếu nền lát không phẳng sẽ bị lồi lõm, nhấp nhô.
- Vẫn có thể bị giãn nở, co ngót, cong vênh.
- Chịu nhiệt, chống cháy kém.
Gạch giả gỗ
Gạch giả gỗ là gạch lát ceramic thông thường, nhưng có bề mặt hoa văn giả vân gỗ. Gạch giả gỗ có nhiều loại kích thước: thanh dài giống thanh gỗ sàn, hoặc viên hình vuông, hình chữ nhật.
- Bề mặt nhẵn, cứng, phẳng, dễ lau chùi vệ sinh.
- Mẫu mã, màu sắc phong phú.
- Chịu ẩm, nhiệt, chống cháy tốt.
- Không bị giãn nở, co ngót, cong vênh, mối mọt.
- Giá cả tương đương sàn nhựa, khoảng 100.000-300.000 đồng một m2.
- Chỉ cho cảm giác về mặt thị giác giống gỗ, còn chất cảm bề mặt vẫn là gạch.
- Thi công lâu và phức tạp hơn (lát bằng vữa xi măng).
- Chịu tác động cơ học kém (dễ vỡ nếu bị tác động bởi các vật cứng, nặng).
- Chống nồm kém, khó sửa chữa, thay thế.
Từ những gợi ý trên, bạn có thể cân nhắc thêm để lựa chọn vật liệu phù hợp với điều kiện thực tế và sở thích của gia đình.","Tôi muốn lát sàn gỗ ở tầng một (còn gọi là trệt) nhà phố nhưng phân vân vì nhiều người bảo việc này sẽ khiến sàn bị ngấm, ẩm mốc. - VnExpress","https://vnexpress.net/co-nen-lat-san-go-o-tang-mot-4683437.html","Chủ nhật, 3/12/2023, 17:11 (GMT+7)","https://i2-vnexpress.vnecdn.net/2023/12/02/sango04-1701405709-1701405722-9983-1701521460.jpg?w=1200&h=0&q=100&dpr=1&fit=crop&s=AU3wRw4gBHnppqWnv4nDkg","","Tư vấn","https://vnexpress.net/tin-tuc-24h"
"4684054","Vợ muốn sống tách biệt với nhà chồng","Nhà chúng tôi sống được thiết kế như chung cư mini, gồm ba căn hộ cách biệt, đi chung thang máy, thuộc sở hữu của mẹ chồng. Tuy nhiên vợ muốn ở một căn chung cư cao cấp thuộc sở hữu của hai vợ chồng với lý do sức khỏe. Vợ bảo ở tầng cao của chung cư thì không còn ho và dị ứng, tốt cho việc học các con.
Tôi thấy chỗ ở hiện tại cũng có nhiều trường tốt nhưng vợ cho rằng ở chung cư kia có trường tốt hơn. Tôi vẫn muốn sống ở chỗ hiện tại, nhà mới xây rất hiện đại, tiện nghi không kém gì chung cư cao cấp, lại vừa được ở gần mẹ để chăm lo khi cần. Tôi nghi ngờ lý do vợ đưa ra chỉ là ngụy biện. Theo mọi người, tôi nên yêu cầu vợ ở lại hay đi cùng cô ấy? Nếu vợ kiên quyết muốn tôi đi cùng các con, tôi nên làm gì?
Quang Hòa","Vợ chồng tôi cưới hơn 10 năm, có hai con, kinh tế khá giả, đang sống gần mẹ chồng (bố chồng đã mất) và chị chồng đã ly thân. - VnExpress","https://vnexpress.net/vo-muon-song-tach-biet-voi-nha-chong-4684054.html","Chủ nhật, 3/12/2023, 17:00 (GMT+7)","https://i2-vnexpress.vnecdn.net/2023/12/03/stressexhaustedboredfeelingbus-7131-2982-1701587461.jpg?w=1200&h=0&q=100&dpr=1&fit=crop&s=OtifzWfMs7d9ODLE0xY3bQ","","Tâm sự","https://vnexpress.net/tin-tuc-24h"
"4684203","","","Việt Nam - UAE dự kiến ký Hiệp định Đối tác kinh tế toàn diện năm sau; Israel tuyên bố phát hiện 800 lối dẫn vào địa đạo của Hamas... - VnExpress","https://vnexpress.net/diem-tin-21h-no-tau-ba-nguoi-bi-thuong-nha-khoa-hoc-noi-tieng-palestine-thiet-mang-4684203.html","Chủ nhật, 3/12/2023, 17:00 (GMT+7)","https://i2-vnexpress.vnecdn.net/2023/12/03/401255354900234225026841707552-9026-8459-1701597210.jpg?w=1200&h=0&q=100&dpr=1&fit=crop&s=h3bhpKynSDaYB_q9hJEG0Q","","","https://vnexpress.net/tin-tuc-24h"
