"""ID"", ""Title"", ""Content"", ""Description"", ""URL"", ""Publication Date"", ""Image URL"", ""Author"", ""Category"", ""Source"""
"4681452","Doanh nghiệp có thể không bị khống chế trần chi phí lãi vay 30%","Nội dung trên được nêu tại dự thảo tờ trình báo cáo Chính phủ của Bộ Tài chính về sự cần thiết sửa đổi Nghị định 132 năm 2020 về quản lý thuế với doanh nghiệp có giao dịch liên kết.
Nghị định 132 quy định, trường hợp ngân hàng cho doanh nghiệp vay trên 25% vốn góp của chủ sở hữu và chiếm trên 50% tổng các khoản nợ trung và dài hạn của doanh nghiệp đi vay, giữa doanh nghiệp và ngân hàng được xác định là các bên có quan hệ liên kết. Khi đó, chi phí lãi vay với doanh nghiệp có giao dịch liên kết - cơ sở xác định thu nhập chịu thuế thu nhập doanh nghiệp - không được vượt quá 30% tổng lợi nhuận thuần từ hoạt động kinh doanh trong kỳ...
Theo Bộ Tài chính, doanh nghiệp vay vốn ngân hàng, tổ chức tài chính, tổ chức tín dụng nhưng các đơn vị này không điều hành, kiểm soát, góp vốn, không quyết định với doanh nghiệp đi vay nên về bản chất không phải là các bên có quan hệ liên kết.
Do đó, Bộ báo cáo Chính phủ sửa đổi Nghị định 132 để loại trừ việc xác định quan hệ liên kết với trường hợp ngân hàng bảo lãnh hoặc cho một doanh nghiệp vay vốn. Ở đây, ngân hàng được xác định không tham gia điều hành, kiểm soát, góp vốn hoặc đầu tư vào doanh nghiệp đi vay. Các khoản vay bao gồm cả khoản vay từ bên thứ ba được đảm bảo từ nguồn tài chính của bên liên kết.
Nếu đề xuất của Bộ Tài chính được thông qua, khi vay ngân hàng, doanh nghiệp sẽ không phải xác định quan hệ liên kết dù khoản vay vượt 25% vốn chủ sở hữu và chiếm trên 50% tổng giá trị các khoản nợ trung và dài hạn.
Quy định khống chế trần chi phí lãi vay này, theo phản ánh của nhiều doanh nghiệp với Bộ Tài chính, là ""không hợp lý"" và đề xuất Chính phủ sửa đổi. Theo họ, việc vay vốn ngân hàng để phục vụ sản xuất kinh doanh là hoạt động phổ biến của các doanh nghiệp tại Việt Nam. Cấp tín dụng cũng là hoạt động kinh doanh thông thường của ngân hàng.
Trong khi đó, doanh nghiệp và ngân hàng hoàn toàn độc lập với nhau, không có việc kiểm soát, điều hành, góp vốn của ngân hàng đối với hoạt động sản xuất kinh doanh của doanh nghiệp. Chi phí lãi vay của doanh nghiệp là chi phí thực tế phục vụ hoạt động sản xuất kinh doanh. Đặc biệt là các doanh nghiệp BOT thường vay ngân hàng đến 80% vốn, do đó khi bị khống chế chi phí lãi vay sẽ ảnh hưởng đến phương án tài chính thu hồi vốn mà doanh nghiệp đã được phê duyệt.
Dự kiến, Bộ Tài chính lấy ý kiến dự thảo Nghị định vào quý I/2024 để trình Chính phủ ban hành sửa đổi, bổ sung Nghị định vào quý III sau đó.
Trước đó, Hiệp hội Bất động sản TP HCM (HoREA) cũng kiến nghị Bộ Tài chính bỏ khống chế trần chi phí lãi vay này, vì cho rằng không nên và không cần thiết. Giai đoạn hiện nay, theo Hiệp Hội chỉ nên khống chế mức trần chi phí lãi vay này với doanh nghiệp nước ngoài có giao dịch liên kết và chưa áp dụng thuế tối thiểu toàn cầu.
Sau 3 năm thực hiện Nghị định 132, số doanh nghiệp kê khai quan hệ liên kết tăng dần qua các năm, từ 11.811 năm 2021 lên 12.418 năm 2022. Trong đó, doanh nghiệp đầu tư nước ngoài chiếm khoảng 68%. Các doanh nghiệp có giao dịch liên kết kê khai, nộp thuế thu nhập doanh nghiệp năm 2021, 2022 lần lượt là 103.717 tỷ đồng, 121.532 tỷ đồng. Qua thanh kiểm tra các doanh nghiệp có giao dịch liên kết từ năm 2020 đến nay, số thuế đã xử lý hơn 96.987 tỷ đồng.","Bộ Tài chính đề xuất sửa Nghị định 132 theo hướng bỏ khống chế chi phí lãi vay 30% của doanh nghiệp có giao dịch liên kết. - VnExpress","https://vnexpress.net/doanh-nghiep-co-the-khong-bi-khong-che-tran-chi-phi-lai-vay-30-4681452.html","Chủ nhật, 26/11/2023, 13:48 (GMT+7)","https://i1-kinhdoanh.vnecdn.net/2023/11/26/vpbank-thanhtung10-1700981496-9121-1700981522.jpg?w=1200&h=0&q=100&dpr=1&fit=crop&s=omLRkbCjuROwZu-mkUAkcA","Phương Dung","Doanh nghiệp","https://vnexpress.net/tin-tuc-24h"
"4681192","Xe tải điện phong cách kei-car sắp bán ở Mỹ","HW Electro vừa ra mắt mẫu concept Puzzle tại triển lãm ôtô tại quê nhà vào cuối tháng 10 và đầu tháng 11, và nhanh chóng đưa xe tới New York, Mỹ, giới thiệu với giới truyền thông hôm 17/11. Mẫu van cỡ nhỏ sẽ sản xuất trong 2025 và tới Mỹ cùng năm.
Thành lập năm 2019, trụ sở Tokyo, HW Electro có mục tiêu trở thành nhà sản xuất xe thương mại hạng nhẹ (LCV) chạy điện đầu tiên của Nhật. Puzzle là một chiếc LCV có ngoại hình ngộ nghĩnh, với chiều dài chỉ 3.395 mm, rộng 1.475 mm và cao 1.920 mm, với trục cơ sở 2.480 mm.
So với một chiếc Fiat 500, Puzzle ngắn hơn 176 mm. Nhưng kích thước này cho phép Puzzle nằm trong phân khúc kei-car ở Nhật. Ngoài ra, kiểu dáng hình hộp và các bề mặt phẳng cho phép một số tấm ốp thân xe có thể thay đổi, giảm chi phí khi cần sửa chữa thay thế.
Các tấm ốp hai bên đầu xe, sát với chắn bùn, khi mở ra cho thấy các cổng sạc, cổng USB, kết nối internet, và bộ dụng cụ y tế. Trên nóc xe là các tấm hấp thu năng lượng mặt trời. Ngoài ra, còn có một cây xà beng nằm dưới sàn khoang hành lý, có thể dùng trong những trường hợp khẩn cấp khi cần cứu hộ cho ai đó bị kẹt trong xe.
Puzzle có mục tiêu được chia sẻ giữa nhiều người sử dụng khác nhau, vì thế cabin hai ghế có bề mặt mang phong cách bảng ghim, cho phép mỗi người có thể bố trí đồ cá nhân theo nhu cầu. Màn hình cảm ứng trung tâm tích hợp công nghệ kết nối mới nhất cùng ứng dụng MyHWE sử dụng AI để tối ưu việc vận chuyển, sắp xếp hàng hóa cũng như hỗ trợ trong trường hợp khẩn cấp.
Quan trọng hơn, hình dạng gần như hình hộp của khoang hành lý giúp chiếc xe trở thành lý tưởng để xếp những chiếc hộp. Động cơ điện hạn chế tải trọng tối đa ở 350 kg.
Hãng chưa cung cấp thông số đầy đủ của Puzzle. Xe trang bị một pin LFP với hành trình 201 km mỗi lần sạc, tức tương đương các mẫu kei-car chạy điện khác từ Nhật.
Tại Mỹ, không nhiều mẫu xe có kích thước tương đương với tính năng gần giống. Nhưng ở Nhật, rất nhiều đối thủ khi phần lớn các hãng xe đều đã có các phiên bản điện của các mẫu xe tải cỡ nhỏ.","Hãng xe Nhật HW Electro sẽ đưa mẫu kei-car phân khúc xe tải tới Mỹ trong 2025 với ngoại hình thú vị cùng nhiều tính năng độc đáo. - VnExpress","https://vnexpress.net/xe-tai-dien-phong-cach-kei-car-sap-ban-o-my-4681192.html","Chủ nhật, 26/11/2023, 13:43 (GMT+7)","https://i2-vnexpress.vnecdn.net/2023/11/25/HWEPuzzle1-1700891444-5535-1700897911.jpg?w=1200&h=0&q=100&dpr=1&fit=crop&s=eOnscVVvH4i1mucseAbC6Q","Mỹ Anh","Thế giới","https://vnexpress.net/tin-tuc-24h"
"4681455","Làm gì khi iPhone gặp lỗi 'không khả dụng'","Thông báo iPhone Unavailable (iPhone không khả dụng) sẽ xuất hiện trên màn hình khóa khi máy bị nhập mật khẩu sai liên tiếp nhiều lần. Tuy là biện pháp ngăn kẻ gian truy cập trái phép, người dùng cũng có thể không chủ đích kích hoạt khi vô tình chạm vào màn hình, quên mật khẩu hoặc trẻ em nghịch máy.
Quá số lần nhập mật khẩu được phép, máy sẽ yêu cầu tạm dừng đăng nhập trong một quãng thời gian nhất định trước khi cho phép thử lại. Càng nhập sai nhiều lần thì thời gian chờ càng dài. iPhone có thể tự động xóa toàn bộ dữ liệu sau 10 lần nhập sai mật khẩu liên tiếp nếu chủ sở hữu chọn cài đặt này từ trước.
Dưới đây là một số cách để lấy lại quyền truy cập thiết bị trong trường hợp bị báo lỗi không khả dụng:
Sử dụng mật khẩu cũ để đăng nhập iPhone
Cách làm này chỉ hiệu quả với iPhone chạy iOS 17 trở về sau vì Apple mới thêm tính năng này gần đây. Tuy nhiên, biện pháp này chỉ hiệu quả tối đa 72 tiếng kể từ khi thay mật khẩu. Từ màn hình đang khóa, chọn Forgot Passcode (Quên mã số) ở góc dưới bên phải của iPhone (có thể đợi một lúc mới xuất hiện lựa chọn này), nhấn Try Passcode Reset (Thử khôi phục mã số), nhập mã số cũ (đổi trong vòng 72 tiếng trước đó), thực hiện theo các hướng dẫn trên màn hình iPhone để thay đổi mật khẩu đăng nhập mới.
Nếu không thấy phần khôi phục mã số trên màn hình, có thể do iPhone không chạy iOS 17 trở về sau hoặc mật khẩu đã đổi quá thời hạn 72 giờ cho phép. Khi đó, người dùng bắt buộc xóa và khôi phục cài đặt gốc điện thoại.
Khôi phục iPhone sử dụng Apple ID và mật khẩu
Apple cho phép chủ máy iPhone xóa và khôi phục thiết bị mà không cần dùng tới máy tính, miễn họ còn nhớ tài khoản Apple ID và mật khẩu đăng nhập. Để dùng Apple ID vượt qua màn hình iPhone Unavailable, thiết bị phải đang chạy iOS 15.2 hoặc mới hơn, có kết nối mạng Internet (Wi-Fi hoặc mạng di động).
Nhà sản xuất đưa ra lưu ý trường hợp màn hình hiện thông báo ""Khóa bảo mật"" (Security Lockout) và khởi động lại iPhone, người dùng sẽ không thể kết nối máy với mạng Wi-Fi cho đến khi mở khóa được thiết bị. Để khôi phục iPhone khi quên mật khẩu, người dùng thực hiện theo các bước sau:
Nhấn vào Forgot Passcode ở góc dưới bên phải màn hình khóa &gt; chọn Start iPhone Reset (Bắt đầu khôi phục iPhone) &gt; nhập tài khoản Apple ID để đăng xuất &gt; chọn Erase iPhone (Xóa iPhone) để xóa mọi dữ liệu trên máy.
Nếu sử dụng eSIM, đừng quên chọn Keep eSIM and Erase Data (Giữ lại eSIM và xóa dữ liệu) trong trường hợp muốn tiếp tục sử dụng thẻ SIM gắn trong máy tại (lựa chọn này chỉ có ở iOS 17 trở về sau). Ngược lại, chọn Delete eSIM and Erase Data (Xóa eSIM và xóa dữ liệu) nếu không muốn dùng tiếp.
Sau thao tác này, iPhone sẽ khởi động lại và người dùng cần thực hiện các thao tác yêu cầu trên màn hình để bắt đầu tiến trình khôi phục dữ liệu từ một bản sao lưu có sẵn trên iCloud.
Dùng máy tính để khôi phục iPhone
Máy tính luôn là công cụ hữu dụng trong trường hợp người dùng phải xóa và khôi phục iPhone để xử lý lỗi ""Không khả dụng"". Phương pháp này áp dụng cho cả máy tính Mac hoặc PC chạy Windows thông qua iTunes, yêu cầu kết nối với iPhone bằng cáp.
Đầu tiên, hãy tắt iPhone. Đối với thế hệ iPhone 8/X/SE 2 trở về sau, nhấn giữ nút nguồn và giảm âm lượng sau đó vuốt kéo nút gạt Tắt nguồn. Với các dòng cũ hơn, chỉ cần nhấn giữ nút nguồn để hiện màn hình gạt tắt. Tiếp theo, hãy thực hiện các thao tác sau để đưa máy về chế độ khôi phục (Recovery Mode):
Nhấn giữ nút nguồn iPhone (hoặc nút giảm âm lượng trên iPhone 7/7 Plus) rồi lập tức cắm cáp kết nối với máy tính mà không bỏ tay đang giữ phím. Vẫn tiếp tục giữ phím cho đến khi màn hình thông báo vào chế độ khôi phục iPhone xuất hiện (iPhone và máy tính đang kết nối qua dây cáp). Thả nút đang giữ trên iPhone. Chọn iPhone trong phần Finder (trên máy Mac) hoặc iTunes (trên máy Windows). Chọn Restore (Khôi phục).
Nếu quá trình này diễn ra quá 15 phút, hãy đợi việc tải phần mềm hoàn tất, sau đó tắt iPhone và lặp lại các bước trên. Khi việc khôi phục hoàn tất, iPhone sẽ khởi động lại. Sau đó ngắt kết nối với máy tính và tiến hành cài đặt máy. Người dùng có thể chọn cách khôi phục bản sao lưu từ iCloud hoặc tập tin sao lưu trên máy tính để đưa lại các dữ liệu cũ vào máy.","Apple tạo cơ chế bảo mật nhằm bảo vệ dữ liệu khi báo &quot;iPhone không khả dụng&quot; nhưng đôi khi người dùng có thể vô tình kích hoạt. - VnExpress","https://vnexpress.net/lam-gi-khi-iphone-gap-loi-khong-kha-dung-4681455.html","Chủ nhật, 26/11/2023, 13:26 (GMT+7)","https://i1-sohoa.vnecdn.net/2023/11/26/a1-1700979813-1850-1700979818.jpg?w=1200&h=0&q=100&dpr=1&fit=crop&s=4UDqH06ZPPKzgV68WoY5Bg","Sử dụng mật khẩu cũ để đăng nhập iPhone","Kinh nghiệm","https://vnexpress.net/tin-tuc-24h"
"4681338","Chó cưng thi trình diễn thời trang","Hoạt động này là một phần trong Ngày hội thú cưng tổ chức tại khu du lịch Suối Tiên. Ông Đoàn Minh Thuận, trưởng Ban tổ chức cho biết, cuộc thi đã nhiều lần tổ chức ở các địa điểm khác nhau, không phân biệt loài giống, mục đích là nơi giao lưu dành cho cộng đồng yêu chó.
Hoạt động này là một phần trong Ngày hội thú cưng tổ chức tại khu du lịch Suối Tiên. Ông Đoàn Minh Thuận, trưởng Ban tổ chức cho biết, cuộc thi đã nhiều lần tổ chức ở các địa điểm khác nhau, không phân biệt loài giống, mục đích là nơi giao lưu dành cho cộng đồng yêu chó.
Trong sân khấu lót thảm, rộng khoảng 80 m2, những chú chó cưng lần lượt trình diễn thời trang cùng chủ. ""Lần thứ hai đưa cún đi diễn thời trang, tôi chọn trang phục làm từ bánh mì để thể hiện chất truyền thống. Mất ba ngày để hoàn thành bộ đồ, chủ yếu là vui nên không đặt nặng thành tích"", chị Mỹ Tiên cho biết.
Trong sân khấu lót thảm, rộng khoảng 80 m2, những chú chó cưng lần lượt trình diễn thời trang cùng chủ. ""Lần thứ hai đưa cún đi diễn thời trang, tôi chọn trang phục làm từ bánh mì để thể hiện chất truyền thống. Mất ba ngày để hoàn thành bộ đồ, chủ yếu là vui nên không đặt nặng thành tích"", chị Mỹ Tiên cho biết.
Mỗi thí sinh chó phải catwalk một vòng trên sân khấu cùng chủ trong khoảng ba phút. Tiêu chí chấm giải là trang phục đẹp mắt, độc đáo, cún trình diễn tự tin có thần thái. Ngoài ra chủ cũng cần diện quần áo đẹp mắt và đồng bộ với thú cưng.
Mỗi thí sinh chó phải catwalk một vòng trên sân khấu cùng chủ trong khoảng ba phút. Tiêu chí chấm giải là trang phục đẹp mắt, độc đáo, cún trình diễn tự tin có thần thái. Ngoài ra chủ cũng cần diện quần áo đẹp mắt và đồng bộ với thú cưng.
Một chú chó hoá trang thành kỳ lân, tuy nhiên lại khá rụt rè khiến chủ phải liên tục xoa đầu động viên.
Một chú chó hoá trang thành kỳ lân, tuy nhiên lại khá rụt rè khiến chủ phải liên tục xoa đầu động viên.
Người chủ thơm động viên cún của mình trước giờ trình diễn.
Người chủ thơm động viên cún của mình trước giờ trình diễn.
Bà Tomoko đến từ Nhật Bản là người duy nhất dắt theo hai con chó cùng trình diễn thời trang. Hai con giống poodle được bà cho mặc trang phục truyền thống Yukata cách điệu.
Bà Tomoko đến từ Nhật Bản là người duy nhất dắt theo hai con chó cùng trình diễn thời trang. Hai con giống poodle được bà cho mặc trang phục truyền thống Yukata cách điệu.
Sau khi trình diễn một vòng, các thí sinh sẽ dừng khoảng một phút trước bàn ban giám khảo để tạo đáng chụp ảnh. Qua đó, người chấm giải sẽ đánh giá kỹ hơn về phong cách, biểu cảm của các cún cưng dự thi.
Sau khi trình diễn một vòng, các thí sinh sẽ dừng khoảng một phút trước bàn ban giám khảo để tạo đáng chụp ảnh. Qua đó, người chấm giải sẽ đánh giá kỹ hơn về phong cách, biểu cảm của các cún cưng dự thi.
Ở ngoài sân khấu, trong lúc chờ tới danh sách, Hồng Anh (góc trái) chỉnh sửa lại trang phục, vuốt ve tạo thêm sự tự tin cho chú cún của mình.
Ở ngoài sân khấu, trong lúc chờ tới danh sách, Hồng Anh (góc trái) chỉnh sửa lại trang phục, vuốt ve tạo thêm sự tự tin cho chú cún của mình.
Sau hơn một tiếng cuộc thi, chó của anh Trần Hải Duy, 25 tuổi giành giải nhất. Trang phục được anh Duy lấy cảm hứng từ hình tượng tứ linh (long, lân, quy, phụng) hội tụ. Anh mất ba ngày làm đồ trình diễn bằng mút, xốp rồi vẽ màu cho trang phục. ""Hôm nay em cún thể hiện rất xuất sắc, theo tôi đó yếu tố quyết định để giật giải"", Hải Duy nói.
Sau hơn một tiếng cuộc thi, chó của anh Trần Hải Duy, 25 tuổi giành giải nhất. Trang phục được anh Duy lấy cảm hứng từ hình tượng tứ linh (long, lân, quy, phụng) hội tụ. Anh mất ba ngày làm đồ trình diễn bằng mút, xốp rồi vẽ màu cho trang phục. ""Hôm nay em cún thể hiện rất xuất sắc, theo tôi đó yếu tố quyết định để giật giải"", Hải Duy nói.
Kết thúc cuộc thi, mọi ở vẫn nán lại giao lưu, chụp ảnh với nhau. Trong khuôn khổ ngày hội còn có nhiều hoạt động như mục xiếc thú, tạp kỹ, giao lưu biểu diễn huấn luyện thú cưng chuyên nghiệp, spa cho chó mèo, kiểm tra sức khỏe vật nuôi miễn phí...
Hoạt động diễn ra đến ngày 26/11, thu hút 500 thú cưng tham gia.
Kết thúc cuộc thi, mọi ở vẫn nán lại giao lưu, chụp ảnh với nhau. Trong khuôn khổ ngày hội còn có nhiều hoạt động như mục xiếc thú, tạp kỹ, giao lưu biểu diễn huấn luyện thú cưng chuyên nghiệp, spa cho chó mèo, kiểm tra sức khỏe vật nuôi miễn phí...","TP HCM- 50 con chó trong trang phục đủ sắc thái cùng trình diễn trên sân khấu trong ngày hội thú cưng tổ chức ở TP Thủ Đức, ngày 25/11. - VnExpress","https://vnexpress.net/cho-cung-thi-trinh-dien-thoi-trang-4681338.html","Chủ nhật, 26/11/2023, 13:06 (GMT+7)","https://i1-giadinh.vnecdn.net/2023/11/25/233A3524-1700924006.jpg?w=1200&h=0&q=100&dpr=1&fit=crop&s=9rTY-FP0T0s6W6WRb5XW7A","","Nhịp sống","https://vnexpress.net/tin-tuc-24h"
"4681366","Ảnh hưởng của rượu, bia đến làn da","Uống quá nhiều rượu, bia ảnh hưởng đến vẻ ngoài của làn da và các vấn đề về da khác. Dưới đây là dấu hiệu nhận biết sớm ảnh hưởng của rượu, bia đến làn da trước khi chúng gây tổn hại đến cơ thể không thể khắc phục.
Da mất nước
Rượu có tác dụng lợi tiểu. Do đó, uống nhiều rượu, bia có thể làm tăng sản xuất nước tiểu, khiến cơ thể mất nước và làm các tế bào da khô, xuất hiện nếp nhăn. Nơi dễ nhận thấy là vết chân chim ở khu vực quanh mắt.
Quầng thâm dưới mắt
Rượu làm gián đoạn nhịp sinh học và chất lượng giấc ngủ nên người uống ngủ ít hơn. Điều này ảnh hưởng đến giai đoạn phục hồi sức khỏe khi ngủ và dẫn đến quầng thâm dưới mắt, mặt sưng vào buổi sáng.
Bệnh vẩy nến
Vẩy nến là tình trạng tế bào da tích tụ và tạo thành các mảng khô, ngứa. Tiêu thụ nhiều đồ uống có cồn thường xuyên có thể làm cho bệnh bùng phát nặng hơn, nhất là ở nam giới.
Nổi mụn nhiều
Đường trong đồ uống có cồn có tác dụng kích hoạt hormone IGF-1, khiến da sản xuất nhiều dầu, làm tăng nguy cơ nổi mụn. Uống nhiều rượu trong thời gian dài có thể dẫn đến tăng tình trạng viêm và thay đổi nội tiết tố trên da, làm trầm trọng thêm mụn trứng cá và bệnh trứng cá đỏ (rosacea).
Một số nghiên cứu cho thấy rượu có thể làm tăng nguy cơ trứng cá đỏ ở người chưa mắc bệnh này.
Phát ban
Những vết sưng đỏ, ngứa trên da có thể xuất hiện khi uống rượu. Phát ban có thể kéo dài vài phút hoặc vài ngày. Đôi khi chúng là triệu chứng của chứng không dung nạp rượu hoặc là kết quả của phản ứng dị ứng với thành phần trong rượu. Chườm mát và dùng thuốc kháng histamine không kê đơn có thể giảm tình trạng này.
Viêm mô tế bào
Uống nhiều rượu có thể gây nên bệnh viêm mô tế bào, một dạng nhiễm trùng da do vi khuẩn thường ảnh hưởng đến cẳng chân. Vi khuẩn xâm nhập vào cơ thể thông qua vết cắt hoặc vết thương trên da và làm cho vùng da ở đó đỏ, sưng, đau và ấm khi chạm vào.
Tăng nguy cơ ung thư da
Rượu làm suy yếu hệ thống miễn dịch, giảm khả năng phòng vệ tự nhiên của cơ thể trước bệnh tật. Một số bằng chứng cũng cho thấy uống rượu có thể làm trầm trọng thêm tác động của tia cực tím lên da, gây ra nhiều tổn thương hơn bình thường.
Cùng với việc tăng nguy cơ ung thư gan, tuyến tụy và vú, rượu còn làm tăng nguy cơ ung thư da bao gồm ung thư biểu mô tế bào vảy, ung thư biểu mô tế bào đáy và khối u ác tính.
Mỗi người nên uống nhiều nước sau khi say để chống mất nước. Bổ sung vitamin A, C, E, B1, B6, B2, B3 và omega 3 giúp giữ cho làn da, tóc và móng khỏe mạnh, sửa chữa tổn thương trên da.
Các chuyên gia khuyến cáo nam giới nên uống tối đa hai đơn vị rượu mỗi ngày, nữ giới là một đơn vị rượu. Một đơn vị cồn theo cách tính của Tổ chức Y tế Thế giới tương đương một ly rượu vang 100 ml (nồng độ cồn 13,5%), một cốc bia hơi 330 ml hoặc một chén rượu mạnh 30 ml (nồng độ cồn 40%).","Da khô, nổi mụn, phát ban và xuất hiện quầng thâm hoặc sưng húp vào buổi sáng có thể do tiêu thụ quá nhiều đồ uống có cồn. - VnExpress","https://vnexpress.net/anh-huong-cua-ruou-bia-den-lan-da-4681366.html","Chủ nhật, 26/11/2023, 13:00 (GMT+7)","https://i1-suckhoe.vnecdn.net/2023/11/26/woman-rubs-her-eyes-close-up-1-8933-8161-1700953590.jpg?w=1200&h=0&q=100&dpr=1&fit=crop&s=WKu7pODkIxPA7-NC0BVJnQ","Da mất nước","Bệnh da liễu","https://vnexpress.net/tin-tuc-24h"
