"""ID"", ""Title"", ""Content"", ""Description"", ""URL"", ""Publication Date"", ""Image URL"", ""Author"", ""Category"", ""Source"""
"4680878","'Tấm séc nhiệm màu' đội lốt chữa lành tâm lý","Huệ là nhân viên văn phòng, thu nhập thấp trong khi cần chi nhiều khoản nên thường xuyên mất ngủ, rối loạn lo âu do bế tắc tài chính. Cuối tháng 9, cô được người quen giới thiệu một loại ""tấm séc nhiệm màu"", rằng chỉ cần để một tờ trong ví và một tờ dán ở những nơi thường xuyên nhìn để ""cảm nhận rung động và biết ơn vũ trụ"", sẽ thu hút tài lộc.
Cô gái mua 24 tấm ""séc"", giá 40.000 đồng/tấm, tại một cửa hàng ở Hà Nội. Mỗi tháng, cô đốt hai tờ cũ, thay bằng hai tờ mới, một để ví và một dán treo. Người bán mời cô mua thêm ""bút chì thanh tẩy"" sử dụng cùng với tờ séc ""giúp thu hút tài lộc nhanh hơn"", giá 20.000 đồng một chiếc.
""Dùng đầu tẩy bút chì gõ vào séc nói điều mong muốn 30 lần hoặc nhiều hơn, tâm trí hướng đến hình ảnh mình đạt được số tiền đó và dâng trào cảm xúc biết ơn số tiền đã về với mình"", Huệ cho biết đã được người bán hướng dẫn như vậy.
Làm theo cách này một tháng, Huệ không nhận được khoản tiền nào thêm từ ""vũ trụ"" như giới thiệu. Cô thắc mắc, người bán trả lời ""do chưa có đủ niềm tin, hiệu quả hay không tùy vào niềm tin của mỗi người"". Huệ nói: ""Tôi nhận ra mình đã bị lừa, còn lo lắng mất ngủ hơn trước"".
Cũng gặp khó khăn tài chính, thường xuyên lo âu, rối loạn giấc ngủ và hay có suy nghĩ tiêu cực, Phương Loan, 27 tuổi, mua ""thẻ ATM thanh tẩy tài chính"" với giá 120.000 đồng cho bộ hai tấm thẻ có in số tài khoản và tên của mình. Theo lời người bán, cách hữu hiệu nhất là in thẻ ra thành tấm card để đặt trong ví, xe hơi hoặc một số vị trí trong nhà. Dùng thẻ này vuốt qua các hóa đơn, khoản ghi nợ hoặc tài liệu dưới bất kỳ hình thức nào ""sẽ như một tác nhân thu hút sự giàu có và thịnh vượng"".
Loan tin rằng ""vũ trụ"" sẽ giúp được cô có nhiều tiền hơn, dù bạn bè, người thân can ngăn. Được một tháng, tình trạng rối loạn lo âu, mất ngủ kèm theo những suy nghĩ tiêu cực xuất hiện nhiều hơn, Loan phải gặp bác sĩ tâm lý.
Bác sĩ Trần Thị Hồng Thu, Phó giám đốc Bệnh viện Tâm thần ban ngày Mai Hương, nói rằng những loại hình như trên là dịch vụ trá hình ""sản phẩm chữa lành"" nhằm lợi dụng nỗi lo lắng căng thẳng và nhẹ dạ cả tin của mọi người để kinh doanh trục lợi. Thời đại ngày nay, con người gặp vô vàn áp lực trong cuộc sống, nhu cầu duy trì sức khỏe tâm thần trở thành ưu tiên hàng đầu. Chính vì vậy, một số người lợi dụng nhu cầu này để kiếm lợi, có thể gây nguy hiểm đối với sức khỏe tâm thần bệnh nhân.
""Không có phương pháp nào, bằng một sản phẩm hay liệu trình đơn giản, có thể chữa trị mọi vấn đề sức khỏe"", bác sĩ cho hay, thêm rằng sức khỏe tâm thần không thể được ""chữa lành"" nhanh chóng thông qua những khóa học hay sử dụng sản phẩm ""thần bí cao siêu"". Ngược lại, nếu không được đến bệnh viện điều trị kịp thời, bệnh lý ngày càng nặng, lâu dài có thể gây ra những tổn thất lớn về sức khỏe thể chất, tiền bạc. Không ít người tiền mất tật mang khi trót tin vào những loại hình chữa lành bất ổn.
Nhìn nhận nguyên nhân thực trạng này, giảng viên tâm lý Nguyễn Thị Hương Lan, Học viện Hạnh phúc Việt Nam, cho rằng chi phí điều trị tâm lý khá cao, từ vài trăm đến cả triệu đồng một lần khám. Đây là rào cản khiến những người không đến bác sĩ điều trị. Họ đang gặp áp lực tài chính lại phải chịu thêm gánh nặng và không đủ khả năng chi trả điều trị. Từ đó, họ thiên về giải pháp tâm linh, không có cơ sở khoa học.
""Gặp chuyên gia tâm lý để được điều trị đúng cách là giải pháp ngắn nhất, hiệu quả nhất chứ không phải biện pháp tâm linh"", bà Lan nói, thêm rằng khi khỏe mạnh cả về thể chất lẫn tinh thần, bạn có thể làm việc tạo ra thu nhập và những giá trị tốt hơn nữa, từ đó nâng cao tài chính và những giá trị lâu dài.","Hà Nội- Thu Huệ, 24 tuổi, mua &quot;tấm séc nhiệm màu để thu hút tài lộc&quot;, sau khi dùng một tháng không thấy tiền tài hanh thông như quảng cáo. - VnExpress","https://vnexpress.net/tam-sec-nhiem-mau-doi-lot-chua-lanh-tam-ly-4680878.html","Chủ nhật, 26/11/2023, 12:17 (GMT+7)","https://i1-suckhoe.vnecdn.net/2023/11/24/4ea37df1dbab72f52bba-170081127-4467-7043-1700811388.jpg?w=1200&h=0&q=100&dpr=1&fit=crop&s=ICPY6rUhR1ZeL_qEu7Lryw","Như Ngọc - Thúy Quỳnh","Tin tức","https://vnexpress.net/tin-tuc-24h"
"4681412","Cua lông Trung Quốc giảm giá mạnh","Từ tháng 10, cua lông Thượng Hải vào mùa và được các đầu mối nhập về Việt Nam rất nhiều. Đây là loại cua ngon nhất Trung Quốc và là món ăn thượng hạng của giới nhà giàu. Các năm trước, chúng có giá đắt đỏ, có lúc lên 2 triệu đồng một kg cho hàng loại 1, nhưng nay giảm 20-30% so với cùng kỳ năm ngoái.
Vừa nhập về hàng nghìn con cua lông từ Trung Quốc, anh Hòa - chủ cửa hàng hải sản ở Tân Bình - cho biết năm nay sản lượng cua lông dồi dào nên hàng nhập về đang có giá tốt.
""Cua lông loại 1 được chúng tôi bán giá 1,1 triệu đồng, còn hàng loại 2 là 660.000-700.000 đồng một kg. Giá tốt nhưng sức mua khá yếu"", anh Hòa nói.
Sau gần hai tháng mới bán được 5 tạ cua, giảm 40% so với cùng kỳ năm ngoái, chị Oanh ở Hà Nội cho biết năm nay chỉ nhập hàng loại 2 có giá rẻ cho dễ bán. ""Cua đợt này chắc thịt, nhiều gạch nhưng lượng khách đặt hàng chậm do kinh tế khó khăn, người dân thắt chặt chi tiêu"", chị Oanh nhìn nhận.
Là đầu mối nhập khẩu chính ngạch - ông Trần Văn Trường, CEO chuỗi hải sản Hoàng Gia - cho rằng nguyên nhân khiến giá cua lông Thượng Hải giảm mạnh là nguồn cung dồi dào, hàng nhập tận gốc, thủ tục nhập khẩu dễ dàng hơn các năm.
Ngoài ra, theo ông này, tỷ giá USD giảm, cộng thêm sức mua yếu nên các đơn vị bán hàng phải cân đối chi phí để kích cầu tiêu dùng. ""Tại chuỗi hải sản của tôi, sức mua năm nay giảm 30% so với cùng kỳ năm ngoái"", ông Trường nói.
Hiện trên thị trường, cua lông có khá nhiều loại. Đối với hàng loại 1 có trọng lượng 5 con một kg được bán giá 1,1-1,2 triệu đồng. Hàng loại 2 giá 600.000-800.000 đồng, loại 3 là 400.000-500.000 đồng một kg. Ngoài ra, cua lông năm nay ngoài hàng thiên nhiên còn có thêm loại nuôi nên sản lượng nhập về dồi dào.
Theo giới kinh doanh, tháng 10-11 là thời điểm cua ngon nhất vụ. Từ tháng 12 trở đi, chất lượng cua sẽ giảm hơn và lượng gạch trên mỗi con không nhiều như chính vụ.
Cua lông được xem là đặc sản của Trung Quốc, hàng năm mang về doanh thu hàng tỷ USD. Tại các nhà hàng nước này, cua lông đã chế biến có giá lên tới 4-8 triệu đồng một kg (loại trọng lượng 300 gram một con). Hai năm gần đây, cua lông nhập về Việt Nam càng trở nên phổ biến. Chúng được nhập về cả đường tiểu ngạch và chính ngạch.","Mỗi kg cua lông, đặc sản Trung Quốc, đang được bán ở Việt Nam với giá 990.000 đồng đến 1,1 triệu đồng, giảm mạnh so với mức 1,5-2 triệu đồng trước đây. - VnExpress","https://vnexpress.net/cua-long-trung-quoc-giam-gia-manh-4681412.html","Chủ nhật, 26/11/2023, 12:14 (GMT+7)","https://i1-kinhdoanh.vnecdn.net/2023/11/26/screen-shot-2023-11-26-at-10-0-8304-2157-1700968183.png?w=1200&h=0&q=100&dpr=1&fit=crop&s=r04ZbXwzYJQfqs_9IhnJaQ","Thi Hà","Hàng hóa","https://vnexpress.net/tin-tuc-24h"
"4681432","Chồng từ chối giúp khi tôi gặp khó khăn","Lúc tôi làm ăn được, anh đi khoe và rất vui vẻ. Lúc tôi bị đứt vốn, cần chồng xoay xở và anh có thể đứng vay ngân hàng được thì anh nói không muốn vay vì sợ áp lực trả nợ. Khoản vay chỉ tương đương nửa năm tiền lương của chồng tôi nhưng anh mặc kệ tôi tự xoay xở. Lúc này tôi mới nhận ra rốt cuộc tôi đã lấy ai vậy.
Giờ tôi mới nhận thấy chúng tôi tuy là vợ chồng nhưng như thế này có khác gì bạn chung phòng, thân ai nấy lo. Bình thường tôi cũng có thể vay mượn người nhà nhưng do nhà tôi mới dùng hết toàn bộ tiền vào việc khác nên không còn dư tiền để giúp tôi.
Nói chung thất vọng vì chồng nhưng tôi cũng trách bản thân đã nhìn nhầm người. Một năm làm bạn, ba năm yêu nhau và hơn một năm lấy nhau, tôi thấy mình sai lầm. Tôi đã viết đơn ly hôn và chờ ngày tòa gọi. Cuối cùng cũng nghĩ thông suốt vì không thể sống với người chồng lúc có tiền thì vui vẻ, hạnh phúc còn lúc khó khăn lại bỏ mặc vợ.
Thúy Hoa","Một năm làm bạn, ba năm yêu nhau và hơn một năm lấy nhau, tôi thấy mình sai lầm. - VnExpress","https://vnexpress.net/chong-tu-choi-giup-khi-toi-gap-kho-khan-4681432.html","Chủ nhật, 26/11/2023, 12:00 (GMT+7)","https://i2-vnexpress.vnecdn.net/2023/11/26/problemscouplerelationsconcept-9155-4183-1700974000.jpg?w=1200&h=0&q=100&dpr=1&fit=crop&s=7hhf3tGeztoT5tack5fDxg","Thúy Hoa","Tâm sự","https://vnexpress.net/tin-tuc-24h"
"4681374","Kỹ sư tại OpenAI nhận lương bao nhiêu?","Ngành công nghệ luôn nổi tiếng vì mức lương cao, trong đó kỹ sư tại các doanh nghiệp hàng đầu như Meta, Google và Amazon có thể kiếm hàng trăm nghìn USD mỗi năm. Trong cơn sốt AI, kỹ sư tại những công ty chuyên về trí tuệ nhân tạo có thu nhập cao hơn 8-12,5% so với đồng nghiệp ở doanh nghiệp công nghệ thông thường, theo dữ liệu từ nền tảng Levels.fyi.
Bloomberg thống kê từ các nguồn tin và thông báo tuyển dụng cho thấy phần lớn kỹ sư OpenAI có lương 200.000-370.000 USD mỗi năm, trong khi các vị trí đòi hỏi chuyên môn cao có thể đạt 450.000 USD. Cộng với các khoản thưởng, nhiều kỹ sư của công ty này đạt thu nhập tới 800.000 USD.
Trước đó, hồi tháng 7, Google cũng bị lộ bảng lương nội bộ, cho thấy hầu hết kỹ sư nhận lương từ 100.000 đến 375.000 USD mỗi năm. Trong danh sách, người được trả cao nhất là kỹ sư phần mềm cấp độ 7 với 718.000 USD. Cộng khoản thưởng 605.000 USD, vị trí này có thu nhập lên đến 1,3 triệu USD.
Còn theo Salary.com, lương trung bình của kỹ sư công nghệ tại Mỹ là 77.433 USD một năm. Các chuyên gia đánh giá mức thu nhập hậu hĩnh của Google và OpenAI đối với kỹ sư là để giữ chân nhân tài, tránh việc họ đầu quân cho đối thủ.
Sự bùng nổ của AI khiến nhiều công ty chạy đua săn tìm nhân sự chuyên về học máy. Nhu cầu lao động trong lĩnh vực này tăng cao trong khi không có nhiều người đủ am hiểu về AI, nên các doanh nghiệp phải tìm mọi cách để giữ chân những kỹ sư có năng lực. Do đó, những kỹ sư như vậy ở OpenAI đóng vai trò then chốt trong việc đưa Sam Altman trở lại vị trí CEO chỉ vài ngày sau khi ông bị sa thải. Hơn 700 nhân viên công ty đã ký vào thư ngỏ, dọa sẽ rời công ty và đầu quân cho Microsoft nếu hội đồng quản trị không nhượng bộ.
""Quá trình sa thải Sam Altman và loại Greg Brockman khỏi hội đồng quản trị đã gây nguy hiểm cho tất cả công việc đang thực hiện, làm suy yếu sứ mệnh cũng như công ty của chúng ta. Hành vi đó thể hiện rõ rằng hội đồng quản trị hiện tại không có đủ năng lực để giám sát OpenAI"", bức thư có đoạn.
Sam Altman là nhà đồng sáng lập OpenAI từ năm 2015 và giữ chức CEO trước khi bị sa thải qua Google Meet vào ngày 17/11. Vụ lật đổ được cho là vì những bất đồng trong định hướng phát triển AI, khi Altman đẩy nhanh việc thương mại hóa sản phẩm, còn nhóm các nhà khoa học, đứng đầu là Ilya Sutskever, muốn giữ sứ mệnh của một tổ chức phi lợi nhuận, xây dựng AI tổng quát (AGI) theo hướng có lợi cho nhân loại.","Nhiều trong số những kỹ sư dọa rời OpenAI sau vụ sa thải CEO có thu nhập 800.000 USD mỗi năm và có tầm ảnh hưởng với công ty. - VnExpress","https://vnexpress.net/ky-su-tai-openai-nhan-luong-bao-nhieu-4681374.html","Chủ nhật, 26/11/2023, 12:00 (GMT+7)","https://i1-sohoa.vnecdn.net/2023/11/26/openai-1-1700958333-4804-1700958371.png?w=1200&h=0&q=100&dpr=1&fit=crop&s=D76ndWyhmPMibthkzkdnNA","Điệp Anh","Công nghệ","https://vnexpress.net/tin-tuc-24h"
"4681012","Lính Ukraine kể về mưa pháo kích của Nga ven sông Dnieper","Ngồi thu mình trong chiếc xe bán tải đậu dưới tán cây, Serhiy Ostapenko cố gắng ẩn nấp trước cơn mưa đạn pháo của lực lượng Nga, dù bây giờ đang là nửa đêm.
""Đối phương pháo kích chúng tôi 24/24. Tôi không thể nhớ nổi lần cuối khu vực này yên tĩnh được hơn một giờ là khi nào"", Ostapenko nói với phóng viên CNN trong cuộc phỏng vấn trực tuyến. Nơi mà binh sĩ Ukraine 32 tuổi này đang hiện diện là bờ tây sông Dnieper, chiến tuyến mới trong cuộc xung đột Nga - Ukraine.
Ostapenko là thành viên của đơn vị vận hành máy bay không người lái (UAV) ""Những đứa con của Sấm"", một trong các lực lượng được Ukraine huy động cho chiến dịch vượt sông Dnieper.
Quân đội Ukraine ngày 17/11 thông báo giành được một ngôi làng bên bờ đông sông Dnieper, đánh dấu bước tiến lớn hiếm hoi trong chiến dịch phản công vốn đang rơi vào bế tắc.
Ostapenko cho biết đơn vị anh đang thực hiện nhiệm vụ thì bị đối phương phát hiện và pháo kích vào vị trí, buộc mọi người phải tìm chỗ ẩn nấp.
""Một quả đạn nữa đang bay đến, tôi nghĩ đó là rocket"", binh sĩ Ukraine nói, ngay sau đó là một tiếng nổ lớn.
""Lần nào đến đây, tôi cũng chuẩn bị sẵn tinh thần để nói lời vĩnh biệt. Tôi biết rằng mình có thể chết bất cứ lúc nào, không trúng tên lửa thì cũng là đạn pháo"", anh nói tiếp.
Có chiều dài 2.200 km, Dnieper là con sông dài thứ tư ở châu Âu, bắt nguồn từ Nga, đi qua Belarus, Ukraine và đổ ra biển Đen. Con sông chảy qua tỉnh Kherson, khu vực mà Nga từng kiểm soát gần như toàn bộ sau khi xung đột bùng phát.
Tháng 11 năm ngoái, quân đội Ukraine tiến hành phản công chớp nhoáng và giành lại các khu vực bên bờ tây sông Dnieper, trong đó có thủ phủ Kherson, đẩy lực lượng Nga sang bờ đông. Nga hiện kiểm soát khoảng 75% diện tích tỉnh Kherson.
Một năm sau sự kiện này, thành phố Kherson và các khu vực lân cận vẫn thường xuyên hứng chịu đạn pháo từ bên kia sông Dnieper. Có chiều rộng lên tới 1,5 km ở một số đoạn, con sông này được coi là thành lũy tự nhiên cho binh sĩ Nga, giúp họ có thể thoải mái pháo kích mục tiêu đối phương ở bờ tây mà ít bị phản kích.
Đó là lý do Ukraine nhiều tháng qua liên tục tìm cách vượt sông Dnieper. Việc thiết lập được đầu cầu ở bờ đông con sông và đẩy lùi lực lượng Nga tại đây sẽ giúp thành phố Kherson ở xa tầm bắn của pháo binh hơn, qua đó giảm nguy cơ bị pháo kích.
Điều này cũng giúp lực lượng Ukraine có bàn đạp để tiến xa hơn về phía nam và áp sát bán đảo Crimea, vùng lãnh thổ Nga sáp nhập năm 2014.
Quân đội Ukraine hôm 19/11 thông báo tiến được thêm 3-8 km trên bờ đông sông Dnieper, hai ngày sau khi thiết lập được đầu cầu ở đây. Ostapenko cho biết lực lượng Ukraine đang tiếp tục tiến sâu vào bên trong.
""Nỗ lực tiến quân gặp rất nhiều khó khăn. Chúng tôi đang cố gắng để tích lũy lực lượng ở bờ đông con sông"", binh sĩ Ukraine nói.
Theo Ostapenko, Ukraine đã thiết lập được ""một số kết nối nhất định"" qua sông Dnieper, cho phép binh sĩ ở bờ tây có thể vận chuyển vũ khí, đạn dược, thực phẩm và nhiên liệu cho lực lượng ở bờ đông.
Ostapenko cho biết đơn vị trinh sát trên không của anh có nhiệm vụ yểm trợ đồng đội khi họ vượt sông, giám sát hoạt động của lực lượng Nga, cũng như hỗ trợ che giấu vị trí của binh sĩ và khí tài Ukraine.
""Đây là một nhiệm vụ nguy hiểm"", Ostapenko nói. ""Chúng tôi hàng ngày phải đối mặt với rất nhiều UAV tự sát của đối phương, cũng như bị tấn công bằng rocket, súng cối và đạn pháo xe tăng"".
Tuy nhiên, binh sĩ Ukraine cho rằng việc Nga tăng cường tập kích lại là dấu hiệu tốt, vì điều đó cho thấy quân đội Ukraine ""đang đi đúng hướng"". ""Chúng tôi đang gây ra nhiều vấn đề cho đối phương và họ đang cố gắng chống trả"", anh nói.
Nhiều người dân tại thành phố Kherson không lạc quan như Ostapenko, trong bối cảnh cuộc sống của họ bị ảnh hưởng rất nhiều bởi các trận pháo kích từ Nga.
""Lúc mọi thứ yên tĩnh còn đáng sợ hơn nhiều những lúc bị pháo kích"", Inna Balyoha, 54 tuổi, cư dân thành phố Kherson, chia sẻ. ""Chúng tôi không dám bật tiếng radio to, phải luôn căng tai nghe ngóng âm thanh ngoài cửa sổ để có thể phản ứng kịp khi đạn pháo bắt đầu trút xuống"".
Hiện còn khoảng 73.000 cư dân ở thành phố Kherson, chưa bằng 1/4 dân số trước chiến sự. Balyoha cho biết bà không thể rời đi vì còn phải chăm sóc cho đứa cháu 4 tuổi và mẹ già 87 tuổi.
""Một trong những từ đầu tiên mà cháu tôi học nói là 'báo động'"", Balyoha cho biết. ""Cháu nó biết cách phản ứng khi có tiếng còi báo động không kích. Nếu nghe được tiếng nổ ở bên ngoài cửa sổ, cháu sẽ trốn vào một góc nhỏ ở hành lang"".
Theo Oleksandr Prokudin, tỉnh trưởng do Ukraine bổ nhiệm ở Kherson, số lượng các cuộc tấn công vào thủ phủ của tỉnh gia tăng mạnh trong tháng qua, có thời điểm lên tới 700 lượt một ngày.
Balyoha cho biết gia đình bà không còn dám ra ngoài đi bộ, hầu như chỉ ở trong nhà để tránh bị trúng đạn pháo. ""Nhiệm vụ chính của chúng tôi là sống sót"", bà nói.","Ukraine đã thiết lập được chỗ đứng chân bên bờ đông sông Dnieper, song lực lượng của họ phòng thủ ở bờ tây vẫn bị Nga pháo kích không ngừng. - VnExpress","https://vnexpress.net/linh-ukraine-ke-ve-mua-phao-kich-cua-nga-ven-song-dnieper-4681012.html","Chủ nhật, 26/11/2023, 12:00 (GMT+7)","https://i2-vnexpress.vnecdn.net/2023/11/24/nh1-1700820099-9511-1700820177.png?w=1200&h=0&q=100&dpr=1&fit=crop&s=sp4229_Soz6yw27a43aJYQ","Phạm Giang","Quân sự","https://vnexpress.net/tin-tuc-24h"
"4680992","Đóng góp của Trung Quốc trong sản xuất 'Mặt Trời nhân tạo'","","Trung Quốc phụ trách chế tạo hệ thống nam châm nặng hơn 1.600 tấn cho lò phản ứng nhiệt hạch ITER, Mặt Trời nhân tạo lớn nhất thế giới. ","https://vnexpress.net/dong-gop-cua-trung-quoc-trong-san-xuat-mat-troi-nhan-tao-4680992.html","Chủ nhật, 26/11/2023, 12:00 (GMT+7)","https://i2-vnexpress.vnecdn.net/2023/11/25/MTnhantaosetchina-1700882011-9842-1700882025.jpg?w=1200&h=0&q=100&dpr=1&fit=crop&s=TmPxbx5NhDBRF40hsJq94A","","Khoa học","https://vnexpress.net/tin-tuc-24h"
"4681335","Khớp gối nhân tạo có thời hạn sử dụng bao lâu?","Khớp nhân tạo có dùng được suốt đời không hay sau bao lâu phải thay lại? (Nguyễn Tài, 58 tuổi, Tiền Giang)
Trả lời:
Phẫu thuật thay khớp gối thường được chỉ định cho các trường hợp tổn thương, hư hỏng nặng ở khớp gối do thoái hóa khớp, di chứng biến dạng vùng khớp gối sau chấn thương hoặc các nguyên nhân khác. Với phẫu thuật này, bác sĩ cắt bỏ phần đầu xương đã hư và tái tạo bằng vật liệu nhân tạo để bảo vệ, tránh các đầu xương ma sát trực tiếp với nhau khi di chuyển, hạn chế tối đa đau đớn cho người bệnh, sửa chữa các biến dạng của khớp, trục chi.
Khớp gối nhân tạo không thể sử dụng suốt đời, thường có tuổi thọ trung bình 15-20 năm. Tuy nhiên, thời hạn sử dụng có thể thay đổi tùy vào mức độ vận động của người bệnh. Với người có nhu cầu vận động thấp như người cao tuổi, nếu sinh hoạt đúng tư thế, khám sức khỏe định kỳ... thì tuổi thọ khớp gối có thể dài hơn. Ngược lại, người trẻ tuổi có nhu cầu đi lại, chơi thể thao nhiều, khớp gối nhân tạo nhanh hao mòn, giảm tuổi thọ của khớp. Do đó, những người mắc bệnh này có thể phải thay khớp gối lần hai khi sử dụng chưa đến 15 năm.
Để bảo vệ khớp gối nhân tạo, sau phẫu thuật, người bệnh cần tuân thủ chỉ định của bác sĩ trong tập vật lý trị liệu, bổ sung đầy đủ chất dinh dưỡng. Trong sinh hoạt hàng ngày, tránh các tư thế ngồi xổm, gập gối quá 120 độ... Dù không gây đau nhưng các tư thế này làm cho lớp đệm nhựa mau hỏng hơn, giảm tuổi thọ của khớp. Người bệnh cần đến bác sĩ khám định kỳ hoặc ngay khi phát hiện bất thường ở khớp gối.","Tôi bị thoái hóa khớp gối nhiều năm, gần đây trở nặng, bác sĩ chỉ định thay khớp gối. - VnExpress","https://vnexpress.net/khop-goi-nhan-tao-co-thoi-han-su-dung-bao-lau-4681335.html","Chủ nhật, 26/11/2023, 12:00 (GMT+7)","https://i1-suckhoe.vnecdn.net/2023/11/25/screen-shot-2023-11-25-at-21-4-1539-6561-1700923585.png?w=1200&h=0&q=100&dpr=1&fit=crop&s=DidlrqvcLC-ibw8YzKvnjA","Trả lời:","Chấn thương - Chỉnh hình","https://vnexpress.net/tin-tuc-24h"
