"""ID"",""Title"",""Content"",""Description"",""URL"",""Publication Date"" ,""Image URL"",""Author"",""Category"",""Source"""
"4683985","Triệu phú tìm thấy con trai sau 25 năm mất tích","Trong khoảnh khắc đoàn tụ, người cha là doanh nhân có tiếng của thành phố Hình Đài thông báo đã mua tặng biệt thự cùng xe hơi cao cấp cho con trai, bù đắp những thiệt thòi khi cậu không được sống chung với bố mẹ thời gian dài.
Ông Khắc Phong kể, 25 năm trước khi đang làm ăn xa nhận được điện thoại của vợ thông báo con trai thứ hai mất tích. Theo người vợ kể lại, bà đã để cậu bé ba tháng tuổi ngủ trong phòng, chạy ra cửa hàng cách nhà 100 m mua chút đồ ăn. Khi trở lại, người mẹ không thấy con trai đâu.
Người cha nghi ngờ cậu bé bị bắt cóc nhưng ông không có bất kỳ manh mối nào. Họ đã gọi điện cho cảnh sát, huy động người thân bạn bè tìm kiếm nhưng vô ích. Không có camera cũng như nhân chứng, cuộc điều tra của cảnh sát địa phương đi vào ngõ cụt.
""Tôi rất tuyệt vọng vào thời điểm đó, thậm chí còn không muốn sống"", Khắc Phong hồi tưởng. Nhưng rồi ông tự nhủ, nếu bản thân không đứng vững, sẽ không có cơ hội gặp lại con trai. Người chồng khuyên vợ ở nhà chăm con gái nhỏ ba tuổi, một mình ra ngoài tìm con.
Thời điểm Thanh Soái mấy tích, người cha đã đi khắp các tỉnh thành đăng thông báo tìm con. Ở những nơi có nhiều người qua lại như nhà ga, bến xe... ông đều ở lại đó vài tiếng, hỏi hết người này đến người khác.
Khắc Phong đã chi rất nhiều tiền để đăng thông báo từ truyền hình cho tới báo giấy, trên các ngã tư đường phố. Từng có thời điểm người đàn ông này treo thưởng một triệu tệ (3,4 tỷ đồng) cho người tìm thấy con mình. Mỗi lần có tin báo ở đâu đó nghi ngờ về thông tin con trai, ông lại lập tức lên đường.
Trong 25 năm tìm kiếm không ngừng nghỉ, người đàn ông này vẫn phải làm việc để duy trì cuộc sống gia đình. Hoạt động mạnh trong ngành xây dựng, Khắc Phong đã trở thành một triệu phú, với tài sản lên tới vài trăm triệu tệ.
Những năm 2000, với sự phát triển của công nghệ ADN áp dụng trong chiến dịch tìm người thân mất tích tại Trung Quốc, Khắc Phong trở thành người đầu tiên của tỉnh Hà Bắc được thu thập mẫu máu để đưa vào cơ sở dữ liệu. Ông cũng tham gia nhiệt tình vào nhóm phụ huynh có con mất tích. Gia đình nào gặp khó khăn, ông sẽ cho mượn tiền, xe cùng các mối quan hệ để giúp đỡ hết mức có thể.
Trong 25 năm tìm con trai, Khắc Phong đã giúp hơn 20 gia đình tìm được người thân thành công.
Cuối tháng 11/2023, tin vui đã đến với gia đình khi Khắc Phong nhận được cuộc gọi của cảnh sát, thông báo đã tìm được Thanh Soái. Chàng thanh niên này bị bắt cóc đến thành phố Hàm Đan, cách Hình Đài 50 km. Vì cha nuôi mất sớm, mẹ tái hôn nên từ nhỏ Thanh Soái lớn lên cùng ông bà nội. Sau khi tốt nghiệp đại học, chàng trai đến Thành Đô làm việc, gửi tiền về nuôi ông bà. ""Bao nhiêu năm nay, tôi chưa bao giờ cảm nhận được tình yêu thương của cha mẹ, dù vậy ông bà nội đối xử với tôi rất tốt"", Thanh Soái nói.
Nhận được thông tin, Khắc Phong nói rằng, con trai ông đã phải chịu khổ sở quá nhiều, giờ là lúc gia đình phải bù đắp.
Chiều 1/12, người cha chuẩn bị sẵn một tấm băng rôn chào mừng con trai trở về. Cả gia đình bốn người ôm chặt nhau và không ngừng khóc.
Sau khi tìm được con, Khắc Phong đã tổ chức một bữa tiệc lớn cảm ơn những người đã luôn đồng hành, giúp đỡ ông trong 25 năm qua. Vị triệu phú cũng khẳng định sẽ dành thêm nhiều thời gian và sức lực hơn nữa để giúp những gia đình khác tìm kiếm người thân.
""Cuộc đời đã không quá bất công với tôi, và tôi muốn truyền những may mắn đó cho những bố mẹ có con mất tích khác"", ông nói.","Trung Quốc- Chiều 1/12, tại thành phố Hình Đài, tỉnh Hà Bắc, Giả Khắc Phong ôm chặt lấy con trai Giả Thanh Soái, cậu con trai mất tích 25 năm. - VnExpress","https://vnexpress.net/trieu-phu-tim-thay-con-trai-sau-25-nam-mat-tich-4683985.html","Chủ nhật, 3/12/2023, 13:33 (GMT+7)","https://i1-giadinh.vnecdn.net/2023/12/03/typhu11-1701577868-4938-1701579812.jpg?w=1200&h=0&q=100&dpr=1&fit=crop&s=2HSMnyiQDsJsSo-9Hh4PiQ","","Tổ ấm","https://vnexpress.net/tin-tuc-24h"
"4684022","Hai cách diễn đạt với 'ear'","Cô Moon Nguyễn và thầy Quang Nguyễn, chuyên gia đào tạo phát âm tiếng Anh, hướng dẫn cách đọc và sử dụng hai cụm từ này:","&quot;Ear&quot; nghĩa là &quot;tai&quot; trong tiếng Anh. Vậy &quot;I&#039;m all ears&quot; hay &quot;play it by ear&quot; có nghĩa là gì? - VnExpress","https://vnexpress.net/hai-cach-dien-dat-voi-ear-4684022.html","Chủ nhật, 3/12/2023, 13:30 (GMT+7)","https://i2-vnexpress.vnecdn.net/2023/12/02/m6-1701526702-1701526725-6138-1701527774.jpg?w=1200&h=0&q=100&dpr=1&fit=crop&s=7NKNtC_29aKFMOmZoHvraw","","Học tiếng Anh","https://vnexpress.net/tin-tuc-24h"
"4684036","Giải MMA châu Á tiếp tục tổ chức ở Việt Nam","Sự kiện lần này gồm bảy trận, trong đó có bốn trận tranh đai. Đáng chú ý là cuộc so tài ở hạng Light Weight (70,4kg) giữa Park Jae Hyun (Hàn Quốc) và Addalla Biayda (Australia). Park là đại diện của lò MMA danh tiếng Hàn Quốc Korean Zombie, trong khi Biayda có chiều cao lên đến 1,91 m cùng thành tích ấn tượng tám thắng sau chín lần thượng đài.
Một võ sĩ Hàn Quốc khác Kim Sang Wook (9 thắng, 3 thua) sẽ tranh đai Welter Weight (77,2 kg) với Arvin Chan (Philippines, 8 thắng 10 thua). Ngoài ra, còn có hai trận tranh đai vô địch tạm thời hạng Feather Weight (65,9kg) giữa Song Young-jae - tay đấm Hàn Quốc đã toàn thắng năm trận thượng đài với bốn lần thắng knock-out - và Shimizu Shunichi, võ sĩ Nhật Bản 38 tuổi từng 74 lần thượng đài và thắng 35 trận.
Trận tranh đai cuối cùng ở hạng Light Weight (70,4kg) sẽ là màn đối đầu giữa Hong Jun-young (Hàn Quốc, 12 thắng 7 thua 1 hòa), một đại diện khác của lò Korean Zombie, và Alfiandi Galih (Indonesia, 7 thắng 3 thua).
Những cặp đấu còn lại hứa hẹn mang tính giải trí cao. Hai võ sĩ ""khổng lồ"" Jang Sung-hyo (Hàn Quốc, 2 trận toàn thắng) và Abdulaziz (Uzbekistan, 5 trận toàn thắng) sẽ so tài ở hạng Heavy Weight (120kg). Ở hạng Middle Weight (84kg), Cha In-ho (Hàn Quốc, 3 thắng 6 thua) so tài Ali Akbarpour (Iran, 2 trận toàn thắng). Trận đấu cuối cùng sẽ diễn ra giữa Ko Seok-hyeon (Hàn Quốc, 9 thắng 2 thua) và Alwin Kincai (Indonesia, 7 thắng 7 thua) ở hạng Welter Weight (77,2kg)
AFC (Angel's Fighting Championship) là chuỗi sự kiện MMA chuyên nghiệp tại châu Á. Giải từng tổ chức ở Việt Nam các sự kiện thứ 21, 23, 25, 28 với nhiều trận đấu đỉnh cao và quy tụ những võ sĩ nổi tiếng, chất lượng. Lần tổ chức thứ 29 vào tháng 12 tới sẽ tiếp tục diễn ra ở khu nghỉ dưỡng The Grand Ho Tram Strip, Bà Rịa - Vũng Tàu.
AFC 29 một lần nữa được tổ chức bởi Cocky Buffalo, công ty đào tạo võ sĩ hàng đầu Việt Nam. Sự kiện sẽ được phát sóng độc quyền trên VTVcab. AFC 29 là cơ hội để khán giả trải nghiệm không khí MMA chuyên nghiệp đẳng cấp quốc tế.","Tiếp nối thành công của sự kiện thứ 28, giải MMA AFC 29 sẽ tiếp tục được tổ chức ở Bà Rịa - Vũng Tàu vào ngày 9/12. - VnExpress","https://vnexpress.net/giai-mma-chau-a-tiep-tuc-to-chuc-o-viet-nam-4684036.html","Chủ nhật, 3/12/2023, 13:26 (GMT+7)","https://i1-thethao.vnecdn.net/2023/12/02/poster-gia-i-1701535853-9785-1701536152.png?w=1200&h=0&q=100&dpr=1&fit=crop&s=BsmPe1vyUNKGOWivvXTTJQ","","Võ thuật","https://vnexpress.net/tin-tuc-24h"
"4684117","HLV tuyển Tây Ban Nha: 'Không ai muốn chung bảng với Italy'","""Không ai muốn chung bảng với Italy"", HLV De La Fuente nói sau lễ bốc thăm vòng bảng Euro 2024 tối 2/12. ""Họ là một đội bóng tuyệt vời có khả năng cạnh tranh thực sự. Những năm qua, với những cầu thủ xuất sắc, Croatia đã đạt kết quả tốt. Còn Albania, họ đã đứng đầu bảng vòng loại"".
De La Fuente cũng cho rằng bảng B của Tây Ban Nha, Italy, Croatia và Albania là ""bảng tử thần"" tại Euro 2024. Tuy nhiên, ông khẳng định các đối thủ cũng sẽ không vui khi chung bảng với Tây Ban Nha.
Để vượt qua vòng bảng, De La Fuente nhấn mạnh Tây Ban Nha cần khởi đầu tốt. Ông chú trọng vào hai trận đầu gặp Croatia và Italy. Tuy nhiên, ông cũng không xem nhẹ Albania. ""Kinh nghiệm của tôi mách bảo rằng những đội đã chơi tốt ở vòng loại sẽ tham dự vòng chung kết với sự tập trung cao nhất"", De La Fuente nói thêm.
HLV tuyển Tây Ban Nha cũng hy vọng không mất thêm cầu thủ nào như Gavi. Tiền vệ của Barca đã sớm phải nói lời chia tay với vòng chung kết Euro 2024, do chấn thương dây chằng đầu gối.
Tây Ban Nha dự vòng chung kết với tư cách đội đứng đầu bảng A vòng loại. Albania đứng đầu bảng E, trong khi Italy xếp thứ hai bảng C và Croatia xếp thứ hai bảng D. Do UEFA coi trọng kết quả vòng loại hơn thành tích lịch sử, Tây Ban Nha và Albania nằm ở nhóm hạt giống số một và số hai. Trong khi đó, Croatia và đương kim vô địch Italy nằm ở nhóm số ba và số bốn.
Italy từng hai lần giành Euro vào các năm 1968 và 2021. Trong khi đó, Tây Ban Nha giành ba lần vào các năm 1964, 2008, 2012, cùng Đức là một trong hai đội vô địch nhiều nhất.
Bốn vòng chung kết Euro gần nhất, Tây Ban Nha đều gặp Italy. Năm 2008, Tây Ban Nha thắng 4-2 trong loạt luân lưu, sau khi hòa 0-0 trong 120 phút trận tứ kết. Bốn năm sau đó, hai đội hòa 1-1 ở vòng bảng và Tây Ban Nha thắng 4-0 trong trận chung kết. Nhưng sau đó, Italy bắt đầu chiếm ưu thế. Năm 2016, Italy thắng 2-0 ở vòng 1/8. Đến năm 2021, đội bóng của cựu HLV Roberto Mancini thắng 4-2 trong loạt luân lưu, sau khi hòa 1-1 trong 120 phút trận bán kết.","Đức- HLV Luis De La Fuente thừa nhận khó khăn khi chung bảng B với Italy, Croatia và Albania tại Euro 2024. - VnExpress","https://vnexpress.net/hlv-tuyen-tay-ban-nha-khong-ai-muon-chung-bang-voi-italy-4684117.html","Chủ nhật, 3/12/2023, 13:25 (GMT+7)","https://i1-thethao.vnecdn.net/2023/12/03/euro-1701578297-1701578309-4487-1701578502.jpg?w=1200&h=0&q=100&dpr=1&fit=crop&s=LHn9IaLLFhWdDXfcrzLxmA","","Các giải khác","https://vnexpress.net/tin-tuc-24h"
"4684134","Italy tự tin dù rơi vào bảng tử thần Euro 2024","Italy đang là ĐKVĐ, nhưng khả năng lọt vào vòng knock-out của họ năm 2024 bị nghi ngờ khi rơi vào bảng B cùng Tây Ban Nha, Croatia và Albania. Tây Ban Nha đứng thứ ba Euro 2020 còn Croatia đứng thứ ba World Cup 2022.
Tuy nhiên, Spalletti khẳng định đừng bao giờ đánh giá thấp Italy. Ông nói với RAI Sport: ""Kết quả bốc thăm đã có thể tốt hơn. Nhưng đừng bao giờ quên chúng tôi là Italy"".
Italy sẽ mở màn Euro 2024 bằng trận gặp Albania vào ngày 15/6 tại Dortmund. Họ sẽ gặp Tây Ban Nha ngày 20/6 tại Gelsenkirchen, trước khi đối đầu Croatia ở Leipzig ngày 24/6.
""Rất khó đưa ra dự đoán lúc này bởi còn nhiều tháng giải mới diễn ra"", Spalletti nói tiếp. ""Albania đã chứng tỏ họ được tổ chức tốt. Chúng tôi biết kết quả phụ thuộc phong độ của đội lúc đó hoặc quá trình chuẩn bị và sự đoàn kết trong tập thể. Croatia mạnh và giàu kinh nghiệm. Một vài cầu thủ của họ đã luống tuổi nhưng tôi biết họ có những tài năng mới"".
Trên lý thuyết, đối thủ đáng ngại nhất với Italy là Tây Ban Nha, đội từng hai lần đánh bại họ ở bán kết Nations League. Tuy nhiên, Italy cũng có lý do để tự tin bởi từng thắng Tây Ban Nha ở bán kết Euro 2020 sau loạt luân lưu.
Buffon cho rằng kết quả bốc thăm vòng bảng Euro 2024 khiến ông nhớ lại Euro 2012, khi Italy lọt vào chung kết và chỉ thua Tây Ban Nha. Sau khi giải nghệ, Buffon đang làm trưởng đoàn ở Liên đoàn bóng đá Italy (FIGC). Ông góp mặt ở lễ bốc thăm tối 2/12.
""Italy nằm ở nhóm bốn, nên rơi vào bảng khó là điều dễ hiểu. Bảng này tương tự Euro 2012 với Tây Ban Nha, Croatia và Ireland. Lần đó, chúng tôi vượt qua rồi vào đến chung kết. Ở lần tổ chức này, bốn đội thứ ba có thành tích tốt cũng được đi tiếp. Điều này làm tăng cơ hội cho chúng tôi. Chúng tôi lo lắng, nhưng các đội khác cũng không vui vẻ gì khi phải gặp Italy"", Buffon nhận định.
Chủ tịch FIGC Gabriele Gravina thì nói ông hài lòng với kết quả bốc thăm. ""Như mọi lần bốc thăm khác, chúng tôi mong vào bảng dễ hơn. Nhưng mọi chuyện cũng có thể tệ hơn. Chúng tôi tin rằng Italy sẽ thi đấu tốt và Luciano Spalletti cho rằng đội sẽ tận dụng được sự ủng hộ từ CĐV nhà. Chúng tôi cần tinh thần như khi Italy vô địch Euro 2020, với nỗ lực, sự cuồng nhiệt và trực giác nhạy bén của Spalletti"", ông nói.
Khi được hỏi về mục tiêu đặt ra cho Spalletti tại Euro 2024, Gravina khẳng định Italy sẽ đến Đức với tham vọng lớn. ""Chúng tôi phải cố bảo vệ chức vô địch. Bảng đấu khó nhưng không phải không thể vượt qua. Trận đầu tiên bao giờ cũng khó khăn nhất. Italy cần quyết tâm ngay từ đó"", ông nói.
Kết quả bốc thăm vòng bảng Euro 2024","HLV Luciano Spalletti và thủ thành Gianluigi Buffon tin Italy đi tiếp dù cùng bảng các đội mạnh ở Euro 2024. - VnExpress","https://vnexpress.net/italy-tu-tin-du-roi-vao-bang-tu-than-euro-2024-4684134.html","Chủ nhật, 3/12/2023, 13:23 (GMT+7)","https://i1-thethao.vnecdn.net/2023/12/03/screenshot-2023-12-03-at-11-21-4419-5454-1701577373.png?w=1200&h=0&q=100&dpr=1&fit=crop&s=SoR1zufysT-55Wx459AhaA","","Các giải khác","https://vnexpress.net/tin-tuc-24h"
"4683781","Bóng đá Đức chứng kiến 'bàn phản lưới tệ nhất mọi thời đại'","Phút 27 trận đấu ở vòng 15 giải hạng hai Đức tối 1/12, Hamburg được hưởng quả phạt phát bóng lên trong vòng cấm. Ban đầu, thủ môn Fernandes chuyền nhẹ cho Stephan Ambrosius, người sau đó đẩy bóng đến Guilherme Ramos.
Sau khi nhận lại bóng từ Ramos, Fernandes quyết định phát mạnh lên. Tuy nhiên, thay vì bay ra ngoài vòng cấm, bóng chạm má ngoài chân phải của thủ môn người Đức rồi đi thẳng vào khung thành. Bàn thua bất ngờ khiến Hamburg bị dẫn 0-2. Trước đó, phút 15, Jackson Irvine đã mở tỷ số cho St Pauli.
Nhiều CĐV không tin vào mắt mình khi chứng kiến pha phản lưới. ""Hamburg vừa ghi bàn phản lưới tệ nhất từ trước đến nay"", một CĐV viết trên mạng xã hội X. ""Thật sự không hiểu nổi"".
Người khác thì cho rằng lẽ ra trận đấu giữa hai đội đang dẫn đầu giải hạng hai Đức không nên xuất hiện những sai sót như vậy. Nó khiến trận đấu trở nên lố bịch và ảnh hưởng xấu đến chất lượng giải đấu.
Một số ý kiến khác thì quả quyết cú sút của Fernandes sẽ vĩnh viễn đi vào lịch sử với tư cách pha phản lưới tệ nhất mọi thời đại. ""Rõ ràng chúng ta còn cách xa cái chết không thể tránh khỏi của vũ trụ, nhưng tôi sẽ rất ngạc nhiên nếu có pha phản lưới nào tệ hơn"", một người viết.
Sau pha phản lưới, Fernandes vẫn chơi đến hết trận. Đầu hiệp hai, Robert Glatzel và Immanuel Pherai lần lượt ghi bàn gỡ hòa 2-2 cho Hamburg. Sau trận này, St Pauli tiếp tục dẫn đầu với 31 điểm, hơn Hamburg ba điểm.
Fernandes từng bắt một mùa Bundesliga và bảy mùa giải hạng hai cho các CLB Darmstadt, Paderborn và Hamburg. Thủ môn 31 tuổi có cha là người Bồ Đào Nha. Fernandes từng chơi sáu trận cho tuyển U21 Bồ Đào Nha, nhưng không được lên tuyển Bồ Đào Nha.","Đức- Truyền thông và CĐV Đức tỏ ra thống nhất khi cho rằng pha phản lưới của thủ môn Heuer Fernandes trong trận St Pauli - Hamburg ở Bundesliga 2 là tệ nhất lịch sử. - VnExpress","https://vnexpress.net/bong-da-duc-chung-kien-ban-phan-luoi-te-nhat-moi-thoi-dai-4683781.html","Chủ nhật, 3/12/2023, 13:20 (GMT+7)","https://i1-thethao.vnecdn.net/2023/12/02/fernandes-1701482133-170148214-7586-3735-1701482240.jpg?w=1200&h=0&q=100&dpr=1&fit=crop&s=HksYvhGYeE6O4oyT7AdXRA","","Tin tức","https://vnexpress.net/tin-tuc-24h"
