"""ID"", ""Title"", ""Content"", ""Description"", ""URL"", ""Publication Date"", ""Image URL"", ""Author"", ""Category"", ""Source"""
"4686008","Long bào được cho là của vua Bảo Đại bán giá 450.000 Euro","Trong phiên đấu giá tối 7/12 (giờ Hà Nội), cổ vật được gõ búa mức giá 450.000 Euro (khoảng 11,7 tỷ đồng). Sau khi thêm thuế, phí, tổng số tiền người mua phải trả khoảng 590.000 Euro (khoảng 15,4 tỷ đồng).
Mức giá này thấp hơn kỳ vọng của hãng Delon - Hoebanx (Pháp). Ban đầu, họ để giá khởi điểm là 500.000 Euro nhưng không ai trả cao hơn. Nhà đấu sau đó hạ xuống 450.000 Euro, có người đã mua. Trong thông tin gửi riêng cho những người đăng ký đấu giá, hãng ước tính áo dao động khoảng 500.000 Euro đến 600.000 Euro.
Trước đó, long bào được rao trên trang web của Delon - Hoebanx. Trong khi nhiều món cùng lô được niêm yết giá khoảng 2.000-4.000 Euro, hãng không công khai giá của long bào, ghi chú ""liên hệ để biết thêm chi tiết"". Trong catalogue giới thiệu, chỉ riêng long bào được dịch thông tin ra tiếng Việt.
Hãng chú thích áo có nguồn gốc từ một bộ sưu tập cá nhân, là lễ phục Bảo Đại mặc trong lễ đăng quang năm 1926. Áo có tay rộng bằng lụa màu vàng, lót lụa màu cam, được thêu bằng chỉ vàng và chỉ nhiều màu. Hai bên áo thắt đai, ở giữa thêu hình rồng nằm giữa những đám mây và chữ ""Thọ"". Nhà đấu giá giới thiệu hình ảnh rồng gắn với văn hóa Việt, tượng trưng cho mưa thuận gió hòa, đồng thời đại diện cho vua - người được coi là ""thiên tử"" (con của trời). Các chi tiết còn lại trên áo cũng ngụ ý về sự trường thọ, may mắn, quyền lực.
Tuy vậy, nhiều chuyên gia trong nước cho rằng chưa thể khẳng định nguồn gốc, xuất xứ của long bào. Một số người nhận định áo có thể không phải của vua Bảo Đại. Chuyên sưu tập và nghiên cứu mỹ thuật triều Nguyễn, nhà sưu tập La Quốc Bảo, 26 tuổi, cho biết nếu xét theo quy chế lễ phục cung đình được nêu trong Khâm định Đại Nam hội điển sự lệ, áo giao lãnh (cổ chéo) màu vàng chánh sắc (chánh hoàng sắc) được dành cho vua khi dự thường triều. Còn lễ đăng quang của hoàng đế triều Nguyễn phải dùng đại triều bào cổ viên lãnh (cổ tròn).
Những hình ảnh nhà đấu giá đính kèm trong catalogue cũng cho thấy vua Bảo Đại mặc áo cổ tròn. Thậm chí, các hình này là chân dung ông sau khi đi học ở Pháp về Việt Nam, chứ không phải hình vua trong lễ đăng quang năm 1926. ""Vì vậy, thông tin đây là áo vua Bảo Đại mặc trong lễ đăng quang như nhà đấu giá cung cấp chưa thuyết phục"", La Quốc Bảo nói. 
La Quốc Bảo và đối tác của anh là Đức Nicolas, một chuyên gia mỹ thuật Việt Nam sống ở Paris (Pháp) còn phát hiện một chiếc áo giống hệt từng được lưu trữ tại Bảo tàng Khải Định (tên cũ của Bảo tàng Cổ vật Cung đình Huế), và chủ nhân chính là vua Đồng Khánh. Tạp chí Extreme-Asie ngày 1/5/1929 đã đính kèm bài viết từ giám tuyển của bảo tàng, lúc bấy giờ là ông Jean Henri Peyssonnaux (1888-1937), cùng hình chiếc áo làm minh họa.
Nhà nghiên cứu Trịnh Bách, người từng phục dựng nhiều trang phục, cổ vật triều Nguyễn, cho rằng cổ vật thuộc về vua Khải Định.
Ông cho biết khoảng năm 1997, chiếc áo từng được một người Việt sống ở Mỹ mua, nay lại xuất hiện trên sàn đấu giá Pháp. Lúc đó, ông thấy áo thêu lối mây lam tròn của các lò thêu ở Nam Ninh (Trung Quốc) chứ không phải mây ngũ sắc của triều Nguyễn, và trên áo có đến 13 con rồng thay vì chín con như thông lệ. Ngoài ra, cổ áo màu vàng chứ không phải màu bạch tuyết (trắng tinh), nên tưởng đó là áo có nguồn gốc Trung Quốc.
Tuy nhiên, sau khi so sánh áo đấu giá ở Pháp với long bào trong ảnh vua Khải Định mặc, ông thấy hai chiếc giống nhau nhiều tiểu tiết, trong đó có vị trí thêu các chữ ""thọ"". Điểm khác biệt là áo trong ảnh cổ tròn (áo bản lĩnh) còn áo đấu giá cổ chéo (áo giao lĩnh). Áo giao lĩnh thường được mặc trong lễ Nam Giao (tế trời đất).
""Nếu đúng thì áo đấu giá này rất quý, bởi đó là áo vua mặc trong lễ Nam Giao. Loại áo này ít được thấy vì thường mặc bên trong. Bên ngoài, vua thường khoác áo ô sa. Hiện một chiếc ô sa được lưu giữ ở Bảo tàng Cổ vật Cung đình Huế"", ông Bách cho biết.
Ngoài ra, Bảo tàng Cổ vật Cung đình Huế còn lưu giữ mãng bào của Hoàng tử Chánh Mông (sau này là vua Đồng Khánh), có lối thêu tương tự chiếc áo được đấu giá. Mãng bào này từng được Giáo sư Trần Đức Anh Sơn phục chế.
La Quốc Bảo cũng nhận định áo có thể từ thời vua Khải Định hoặc Đồng Khánh. Nhà sưu tập cho rằng chiếc áo trên sàn đấu Pháp và áo long trấn đang ở Bảo tàng Nghệ An là cảm tác từ mãng bào giữa thế kỷ 19 của nhà Thanh. La Quốc Bảo sở hữu một chiếc mãng bào của Cáo mệnh phu nhân (dành cho vợ quan lại), với phong cách tương tự.
""Giả thuyết của tôi là triều đình Huế khoảng thời Đồng Khánh đã mua được một cuộn vải xưa chưa cắt may từ Trung Quốc, cho thợ thêu học theo rồi thêm thắt, phủ đầy các vị trí còn thiếu, ra được phom dáng chuẩn của triều Nguyễn nhưng cách thêu khá giống của triều Thanh, với phong cách sử dụng tơ se với tông vàng, xanh lam, xanh lục, có sắc lá mạ, cam sữa, thêu lối satin và sa hạt, hạn chế các hình viền kim tuyến, đối ngược phong cách thường thấy ở triều Nguyễn"", La Quốc Bảo nói.
Một số nhà nghiên cứu lại nghiêng về giả thuyết áo là đồ giả. Ông Vũ Kim Lộc, người từng phục chế nhiều mũ quan triều Nguyễn, tư vấn cho phim cổ trang Phượng khấu, cho rằng nhiều món đồ giả cao cấp hiện được làm tinh vi, giống y như thật. ""Nếu không sờ tận tay, nhìn tận mắt mà chỉ nhìn qua ảnh, không ai có thể đưa ra nhận định chính xác về món cổ vật này"", ông Lộc nói. Tiến sĩ Phạm Quốc Quân, Ủy viên Hội đồng di sản quốc gia, người từng xác minh ấn Hoàng đế chi bảo - có chung nhận định với ông Lộc.
Vua Bảo Đại (1913-1997) là hoàng đế cuối cùng của triều Nguyễn. Ông thoái vị năm 1945, dành thời gian cuối đời ở Pháp. Trước khi qua đời vào tháng 8/1997, ông để lại di chúc, trao quyền thừa kế tài sản của ông ở Pháp, bao gồm nhiều cổ vật cho vợ là bà Monique Baudot. Bà Monique Baudot qua đời năm 2021, năm ngoái những người thừa kế tài sản của bà mang nhiều món đồ đi đấu giá.","Pháp- Long bào được cho của vua Bảo Đại được gõ búa với mức 450.000 Euro, dù vậy, gây tranh cãi về nguồn gốc. - VnExpress","https://vnexpress.net/long-bao-duoc-cho-la-cua-vua-bao-dai-ban-gia-450-000-euro-4686008.html","Thứ sáu, 8/12/2023, 14:19 (GMT+7)","https://i1-giaitri.vnecdn.net/2023/12/07/long-ba-o-1-1701941976-6282-1701942025.png?w=1200&h=0&q=100&dpr=1&fit=crop&s=J7fu_P2pZ-uyLkDUXZeaOA","","Mỹ thuật","https://vnexpress.net/tin-tuc-24h"
"4686239","Bể nước ngầm nguyên vẹn 6 triệu năm dưới dãy núi Italy","Một lượng nước ngọt lớn thấm qua vỏ Trái Đất cách đây 6 triệu năm vẫn bị chôn vùi ở sâu bên dưới dãy núi tại Italy, theo nghiên cứu công bố trên tạp chí Communications Earth &amp; Environment. Lượng nước ngọt này nhiều khả năng mắc kẹt dưới lòng đất trong suốt cuộc khủng hoảng mặn Messinian, khi biển Địa Trung Hải khô cạn sau sự kiện mát dần toàn cầu tích tụ nước biển bên dưới các thềm băng và sông băng. Sự kiện đó có thể khiến đáy biển tiếp xúc với nước mưa thấm qua vỏ Trái Đất.
Nước mưa tích tụ và hình thành một tầng ngậm nước trải dài giữa độ sâu 700 - 2.500 m bên dưới dãy núi Hyblea ở phía nam Sicily, Italy, và giữ nguyên vẹn kể từ sau đó. Trong nghiên cứu mới, các chuyên gia tìm hiểu nguồn nước ngầm sâu ở bên trong và xung quanh thành hệ Gela. Họ xây dựng mô hình 3D của tầng ngậm nước và ước tính nó chứa 17,5 km3 nước, nhiều gấp hơn hai lần hồ Loch Ness ở Scotland.
Nhóm nghiên cứu sau đó sử dụng mô hình 3D để quay ngược thời gian và dựng lại quá khứ đại chất của khu vực trải rộng ngang qua cao nguyên Hyblaea và Malta ở trung tâm Địa Trung Hải. Trong suốt kỳ Messina (từ 5,3 đến 7,2 triệu năm trước), nước ngọt thấm qua vỏ Trái Đất xuống độ sâu vài nghìn mét bên dưới mực nước biển ngày nay do khủng hoảng mặn. Cuộc khủng hoảng kéo theo mực nước biển hạ xuống 2.400 m dưới mực nước hiện nay ở phía Địa Trung Hải.
Bể nước ngầm ""hóa thạch"" sau đó tích tụ ở tầng đá carbonate, đóng vai trò như một loại xốp mà chất lỏng tồn tại bên trong những lỗ rỗng giữa các hạt đá, theo trưởng nhóm nghiên cứu Lorenzo Lipparini, nhà khoa học địa chất ở Đại học Malta, Đại học Roma Tre, Viện địa vật lý và núi lửa học quốc gia Italy. Để cách lý giải này có tính thuyết phục, Lipparini và cộng sự cần tìm ra một đường dẫn nước mưa và nước tuyết từ đáy biển Địa Trung Hải tới thành hệ Gela. Vách Malta, vách đá dưới biển vươn dài 300 km theo hướng nam từ rìa phía đông Sicily có thể là đường kết nối trực tiếp, theo nhóm nghiên cứu. Nói cách khác, đường dẫn thất lạc có khả năng nằm bên trong vách đá.
Cuộc khủng hoảng mặn Messinian kéo dài khoảng 700.000 năm kết thúc đột ngột với mực nước biển tăng cực nhanh, làm thay đổi điều kiện áp suất và ngừng toàn bộ cơ chế. Một khả năng khác là trầm tích và quặng khoáng chất chặn mất đường dẫn dọc theo vách Malta trong cuộc khủng hoảng mặn, ngăn nước biển trộn lẫn với nước ngọt ở thành hệ Gela trong hàng triệu năm sau. Nhóm nghiên cứu hy vọng có thể bơm hút nguồn nước ngọt mới để giảm bớt tình trạng khan hiếm nước ở Sicily.","Nước ngọt chảy qua vỏ Trái Đất 6 triệu năm trước mắc kẹt tại độ sâu hàng nghìn mét bên dưới dãy Hyblaea ở Sicily, hình thành tầng ngậm nước không thay đổi từ sau đó.","https://vnexpress.net/be-nuoc-ngam-nguyen-ven-6-trieu-nam-duoi-day-nui-italy-4686239.html","Thứ sáu, 8/12/2023, 14:07 (GMT+7)","https://i2-vnexpress.vnecdn.net/2023/12/08/VNEWater-1702008108-8875-1702008234.jpg?w=1200&h=0&q=100&dpr=1&fit=crop&s=LU-dkIqoGjYWt-r7Eghe5Q","","Tin tức","https://vnexpress.net/tin-tuc-24h"
"4686382","Nguy cơ gây nghiện từ sản phẩm đội lốt 'thanh năng lượng'","Giống một chiếc bật lửa, thanh năng lượng hít mũi có cấu tạo gồm hai ống nhựa hình que, bán sẵn trên các sàn thương mại điện tử với giá từ 10 đến 30 nhân dân tệ (1,4 đến 3,2 USD). Người bán mô tả chúng giúp ""bổ sung năng lượng mạnh mẽ"", có mùi hương bạc hà, borneol, long não và tinh dầu thực vật.
Nguồn gốc của thanh hít mũi chưa rõ ràng, song những món đồ có chức năng tương tự (làm sạch mũi và sảng khoái tinh thần) đã có mặt từ lâu. Gần đây, chúng mới trở nên phổ biến trong cộng đồng học sinh, sinh viên.
Hôm 3/12, Hiệp hội Người tiêu dùng Trung Quốc đưa ra cảnh báo, kêu gọi học sinh thận trọng khi sử dụng thanh hít năng lượng. Thông báo nêu rõ việc nhét các thanh này vào mũi tạo điều kiện cho vi khuẩn xâm nhập, gây hại niêm mạc. Nó cũng dẫn đến tình trạng như viêm loét, chảy máu mũi.
Theo Yin Kai, Bệnh viện Liên kết Số 5, phía nam tỉnh Quảng Đông, việc sử dụng thanh hít thường xuyên có thể dẫn đến các tác dụng phụ.
""Chúng chỉ tạo cảm giác sảng khoái trong thời gian ngắn, phù hợp với người bị nghẹt mũi và chóng mặt, ít để lại tác dụng phụ. Tuy nhiên, sử dụng thường xuyên để thấy tỉnh táo lâu dài sẽ gây nhiều hệ lụy"", ông nói.
Yin giải thích thành phần bạc hà, borneol và long não trong sản phẩm dễ dẫn đến phát ban, dị ứng da, gây căng thẳng cho hệ hô hấp và thần kinh. Những chất này cũng có nguy cơ gây nghiện, là mối đe dọa tiềm ẩn đối với trẻ em.
Hiệp hội Người tiêu dùng Trung Quốc lưu ý sản phẩm được ưa chuộng bởi dễ tìm thấy trên các nền tảng trực tuyến, có nhiều mùi vị như dưa hấu, chanh và Coca-Cola. Sau thời gian được cảnh báo, một số nhà bán hàng đã thêm thông tin nhằm giải quyết nỗi lo lắng của người tiêu dùng, số khác bổ sung khuyến cáo trẻ em chỉ nên sử dụng dưới sự giám sát của người lớn.
Theo một nhà cung cấp trên nền tảng mua hàng Taobao, sản phẩm của họ không có hại và cũng không gây nghiện. Người này đã bán được hơn 10.000 thanh hít năng lượng, chủ động thêm hướng dẫn không đưa thanh hít vào mũi. ""Hãy đặt nó dưới lỗ mũi và ngửi"", hướng dẫn nêu rõ.
Tuy nhiên, tại cửa hàng khác, người bán khuyên học sinh nên nhét cả thanh hít vào lỗ mũi, khẳng định sản phẩm an toàn cả với người chưa đủ tuổi.
Ngoài những nguy cơ tiềm ẩn về sức khỏe, thanh năng lượng còn gây lo ngại về tác động tiêu cực đối với tâm lý trẻ nhỏ. Hành động hít hơi giống với việc tiêu thụ ma túy bất hợp pháp, khiến nhiều cơ quan đưa ra cảnh báo.
""Thật khó để tưởng tượng tác hại của chứng nghiện này. Nó có thể khiến giới trẻ bớt thận trọng hơn trong việc sử dụng ma túy"", đại diện Trung tâm Cai nghiện tỉnh Cát Lâm cho biết.
Trong bối cảnh lo ngại của phụ huynh ngày càng tăng, các cơ quan giáo dục trên khắp Trung Quốc đã vào cuộc. Tháng 11, Cục Quản lý Thị trường quận Hải Đến, Bắc Kinh phát động chiến dịch kiểm định các cơ sở kinh doanh gần trường học, cấm bán thanh hít năng lượng cho học sinh.","Trung Quốc- Cơn sốt hít &quot;thanh năng lượng&quot; đang lan rộng trong các trường học, các chuyên gia khuyến cáo tác động tiêu cực lên sức khỏe của trào lưu. - VnExpress","https://vnexpress.net/nguy-co-gay-nghien-tu-san-pham-doi-lot-thanh-nang-luong-4686382.html","Thứ sáu, 8/12/2023, 14:03 (GMT+7)","https://i1-suckhoe.vnecdn.net/2023/12/08/973-jpeg-1702007913-7596-1702007986.jpg?w=1200&h=0&q=100&dpr=1&fit=crop&s=PRhVtZYy_k9XA4cUB6mLsQ","","Tin tức","https://vnexpress.net/tin-tuc-24h"
"4686453","Tưởng đau cột sống cổ hóa u não","Ông Trần Văn Lên thường xuyên đau đầu, chóng mặt, ói, ho, mất thăng bằng, khó nghe, mỗi lần ho mạnh là đau nhói, thốn cột sống cổ. Bác sĩ tại bệnh viện địa phương chẩn đoán thoái hóa đốt sống cổ, thoát vị đĩa đệm, rối loạn tiền đình, tư vấn phẫu thuật thoái hóa đốt sống cổ. Ông quyết định đến TP HCM khám cho chính xác.
Ngày 8/11, ThS.BSCKII Chu Tấn Sĩ, Trưởng Khoa Phẫu thuật Thần kinh, Trung tâm Khoa học Thần kinh, Bệnh viện Đa khoa Tâm Anh TP HCM, cho biết kết quả chụp MRI não của ông Lên cho thấy một khối u màng não bên phải, kích thước khoảng 7-8 cm, to như quả cam.
Theo bác sĩ Tấn Sĩ, khối u chèn ép tiểu não bên phải, gây hẹp cống não và đẩy lệch não thất 4 dẫn đến ứ đọng dịch não tủy. Não thất 3 và não thất bên ở phía trên giãn rộng. Khối u nằm sâu ở tiểu não, bám chặt vào lều tiểu não và mặt bên của xoang ngang. Do đó, khi mổ, bác sĩ phải đặt bệnh nhân ở tư thế nằm sấp hơi cúi đầu.
Nhờ hướng dẫn của hệ thống định vị thần kinh neuro-navigation ứng dụng trí tuệ nhân tạo (AI) và kính vi phẫu có chức năng chụp huỳnh quang 3D mới nhất, ê kíp chọn đường mổ phù hợp, tiến vào vị trí khối u sâu khoảng 8 cm từ xương sọ.
Sau ba giờ phẫu thuật, các bác sĩ dùng máy siêu âm cusa đánh nhỏ, hút từng phần và lấy hết khối u. Hình ảnh từ kính vi phẫu cho thấy vị trí khối u giống như cái hố sâu. Sau mổ, tiểu não bên phải bệnh nhân được giải phóng, đường lưu thông dịch não tủy hoạt động bình thường trở lại, áp lực trong sọ giảm.
Sau một ngày phẫu thuật, ông Lên hồi phục tốt, có thể xuống giường đi lại, ăn uống được, không còn triệu chứng chóng mặt, loạng choạng, hết ói.
""Khi nghe bác sĩ thông báo khối u não lớn, cả nhà tôi đều lo, không nghĩ mổ não nhanh khỏe như vậy"", ông Lên nói. Sau mổ vài giờ, ông đã tỉnh táo, nhận biết được người thân, khỏe hẳn và xuất viện sau một tuần.","TP HCM- Ông Lên, 57 tuổi, ở Đồng Tháp, đau cột sống cổ khi ho, tưởng thoái hóa đốt sống cổ, đến TP HCM khám bác sĩ phát hiện khối u não. - VnExpress","https://vnexpress.net/tuong-dau-cot-song-co-hoa-u-nao-4686453.html","Thứ sáu, 8/12/2023, 14:00 (GMT+7)","https://i1-suckhoe.vnecdn.net/2023/12/08/u-nao-1702014468-6074-1702014473.png?w=1200&h=0&q=100&dpr=1&fit=crop&s=LY4HZBjxEsQKevm6RmORtA","","Ngoại thần kinh","https://vnexpress.net/tin-tuc-24h"
"4686306","Make in Viet Nam 2023 vinh danh 50 giải pháp số","Giải thưởng thuộc khuôn khổ Diễn đàn Quốc gia Phát triển doanh nghiệp công nghệ số Việt Nam - VFTE. Sự kiện diễn ra tại Cung Quy hoạch, hội chợ và triển lãm, thành phố Hạ Long, tỉnh Quảng Ninh. Chương trình có chủ đề ""Sáng tạo ứng dụng số để phát triển kinh tế số - Động lực cho tăng trưởng kinh tế và năng suất lao động"", do Bộ trưởng Bộ Thông tin và Truyền thông chỉ đạo, Báo VnExpress phối hợp tổ chức.
Đăng ký tham gia tại đây
Lễ công bố và trao Giải thưởng Sản phẩm công nghệ số Make in Viet Nam 2023 diễn ra vào sáng ngày 11/12, sau phiên thảo luận chính. Năm nay chương trình có năm hạng mục: Sản phẩm số xuất sắc cho Chính phủ số, Sản phẩm số xuất sắc cho kinh tế số, Sản phẩm số xuất sắc cho xã hội số, Sản phẩm số xuất sắc cho thị trường nước ngoài, Sản phẩm số tiềm năng.
Trong đó, Sản phẩm số xuất sắc cho thị trường nước ngoài là hạng mục lần đầu xuất hiện. Mỗi hạng mục sẽ vinh danh top 10, trong đó chọn ra ba đơn vị để trao giải Vàng, Bạc, Đồng.
Các sản phẩm được đánh giá dựa trên hai tiêu chí: thiết kế sáng tạo và tính tác động. Ở tiêu chí đầu tiên, hội đồng chuyên môn chấm điểm dựa trên: sự độc đáo, công nghệ - chất lượng, công đoạn cốt lõi do người Việt Nam thực hiện, tính năng như dễ sử dụng, tương thích, mở rộng... Yếu tố thứ hai xem xét về kết quả sản xuất, kinh doanh, thị phần, số lượng người sử dụng; ảnh hưởng, giá trị thiết thực, mức độ lan tỏa... Các tiêu chí đánh giá có thay đổi theo từng hạng mục.
Trước đó, chương trình nhận 277 hồ sơ đăng ký từ ngày 12/7 đến hết ngày 12/10 theo hình thức trực tuyến. Số đăng ký tăng cao hơn so với năm 2022 (218 hồ sơ).
Các hồ sơ trải qua giai đoạn sơ khảo để chọn ra top 12 điểm cao nhất. Top 12 sau đó tham gia thuyết trình trước hội đồng giám khảo để chọn ra top 10 cùng các giải thưởng.
Tại VFTE 2022, giải Vàng trao cho Rynan Technologies Vietnam (Sản phẩm số tiềm năng), Viettel (Sản phẩm số xuất sắc cho xã hội số), FPT Smart Cloud (Sản phẩm số xuất sắc cho kinh tế số), MISA (Sản phẩm số xuất sắc cho Chính phủ số). Ban tổ chức đánh giá chương trình có nhiều sản phẩm chất lượng. Một số sản phẩm đạt giải có tính cạnh tranh so với các giải pháp của doanh nghiệp nước ngoài đang phục vụ tại Việt Nam.
VFTE 2023 gồm ba hoạt động: hội thảo (năm phiên), Giải thưởng Sản phẩm công nghệ số Make in Viet Nam 2023, triển lãm công nghệ make in Viet Nam. Sự kiện kéo dài xuyên suốt ngày 11/12, dự kiến thu hút 1.000 người tham dự.","Giải thưởng Sản phẩm Công nghệ số Make in Viet Nam gồm năm hạng mục, đánh giá dựa trên các tiêu chí sáng tạo - tác động, công bố ngày 11/12. - VnExpress","https://vnexpress.net/make-in-viet-nam-2023-vinh-danh-50-giai-phap-so-4686306.html","Thứ sáu, 8/12/2023, 14:00 (GMT+7)","https://i1-sohoa.vnecdn.net/2023/12/08/c2c8ec5ab2a86bf632b9-1143-1670-5484-9708-1702016906.jpg?w=1200&h=0&q=100&dpr=1&fit=crop&s=czOpSFX9XtE5m9qIFSYElg","","Tin tức","https://vnexpress.net/tin-tuc-24h"
