"""ID"", ""Title"", ""Content"", ""Description"", ""URL"", ""Publication Date"", ""Image URL"", ""Author"", ""Category"", ""Source"""
"4675273","","","Mẫu crossover hoàn toàn mới mang đến hình ảnh trẻ trung, tiện nghi và nhiều công nghệ, giúp Toyota hoàn thiện dải sản phẩm xe gầm cao tại Việt Nam. - VnExpress","https://vnexpress.net/yaris-cross-xe-gam-cao-co-b-nhieu-cong-nghe-an-toan-4675273.html","Thứ năm, 30/11/2023, 10:00 (GMT+7)","https://i2-vnexpress.vnecdn.net/2023/11/30/settop-1701311653-2692-1701311-9879-7218-1701312389.jpg?w=1200&h=0&q=100&dpr=1&fit=crop&s=mNtm4pKhh098K4QM4AC2Wg","","Thị trường","https://vnexpress.net/tin-tuc-24h"
"4683007","Mẹ cựu giám đốc Bệnh viện TP Thủ Đức xin được gặp con tại tòa","Ngày 30/11, phiên xử ông Nguyễn Minh Quân; Nguyễn Văn Lợi, Giám đốc Công ty Nguyễn Tâm, và đồng phạm về tội Tham ô tài sản; Rửa tiền; Vi phạm quy định về đấu thầu gây hậu quả nghiêm trọng, tiếp tục với phần thẩm vấn.
Trước khi bắt đầu phiên tòa, HĐXX nhận được đơn của bà Sa cùng người thân, bày tỏ mong muốn được gặp bị cáo Quân trong giờ giải lao để động viên, thăm hỏi con trai.
Sau khi xem xét, HĐXX đồng ý cho họ gặp bị cáo với điều kiện có đại diện VKS, công an cùng thư ký sẽ giám sát cuộc gặp gỡ. Nội dung cuộc gặp gỡ sẽ được lập thành văn bản gửi cho HĐXX.
Sáng hôm qua, trong phần thủ tục phiên tòa, ông Quân cho biết bố đã mất sau khi bị cáo bị bắt. Chủ tọa chia sẻ với ông và đình, đồng thời động viên ông giữ gìn sức khỏe
Theo quy định tại khoản 4 Điều 256 Bộ luật Tố tụng Hình sự về nội quy phiên tòa, tại tòa, bị cáo đang bị tạm giam chỉ được tiếp xúc với người bào chữa cho mình. Việc tiếp xúc với những người khác phải được chủ tọa phiên tòa cho phép.
* Tiếp tục cập nhật.
Trước đó, trả lời HĐXX trong phiên làm việc chiều 29/11, ông Quân cho rằng nội dung cáo trạng không đúng với sự thật khách quan hành vi của mình. Ông phủ nhận việc thành lập các công ty sân sau để tham gia đấu thầu bán thiết bị y tế cho bệnh viện để tham ô tài sản.
Ông Quân khai, trước khi xảy ra vụ án, bệnh viện bị thanh tra về các gói thầu. Nhưng khi đoàn thanh tra tới thì hồ sơ mất hết không rõ lý do, nên ông đã chỉ đạo cấp dưới làm hồ sơ 28 gói thầu, ký lùi ngày để đối phó. Sau khi đoàn thanh tra làm việc xong bị cáo mới biết xảy ra nhiều sai phạm trong đấu thầu nên đã thuê hai công ty tư vấn rà soát lại các hồ sơ.
Trước lời khai của cựu giám đốc Bệnh viện TP Thủ Đức, thẩm phán lưu ý bị cáo được xác định là bị hại trong vụ án cựu cán bộ C03 Bộ Công an Bùi Trung Kiên và đồng phạm nhận tiền hối lộ. Ông đã bỏ ra hàng triệu USD để chạy án sau khi bị điều tra về các sai phạm trong quá trình đấu thầu thiết bị y tế.
Còn trong buổi làm việc sáng nay, khi trả lời luật sư, ông Quân cho biết mục đích để vợ đứng tên Công ty Ngọc Đạo là nhằm chứng minh tài chính, làm hồ sơ cho con đi du học. Việc mua bán các tài sản gồm hai biệt thự tại Nha Trang, Sài Gòn và thửa đất ở phường Linh Xuân, TP Thủ Đức đều do ông quyết định, không bàn bạc gì với vợ. Sau khi quyết định mua, ông nhờ Nguyễn Văn Lợi làm thủ tục. ""Trong gia đình người quyết định thu chi, mua bán tài sản là tôi, vợ tôi thường không quan tâm đến tiền bạc"", ông Quân trình bày.
Theo cáo buộc, từ năm 2016 đến năm 2020, khi làm Giám đốc Bệnh viện TP Thủ Đức, ông Quân đã chỉ đạo Lợi thành lập 4 công ty sân sau, thuê và nhờ người thân đứng tên để tham gia thâu tóm các gói thầu. Lợi giao cho nhân viên lập các hợp đồng mua bán khống, lòng vòng giữa các công ty để nâng giá thiết bị máy móc cao hơn 30%-50% giá thị trường.
Tại bệnh viện, ông Quân hàng năm đều ký các quyết định thành lập các tổ để thực hiện việc mua sắm, dự toán, đấu thầu, ký hợp đồng... rồi giao cho cấp dưới làm thủ tục theo quy định. Tuy nhiên, thực tế các tổ đấu thầu không hoạt động theo quyết định được phân công, chỉ ký hoàn thiện, hợp thức hồ sơ. Các nhân viên bệnh viện biết rõ nhóm công ty dự thầu đều là ""sân sau"" của ông Quân nhưng vẫn làm theo chỉ đạo.
Cơ quan công tố xác định, 4 công ty do Lợi quản lý đã trúng thầu 27/28 gói với tổng giá trị hơn 345 tỷ đồng. Lợi đã chỉ đạo nhân viên chuyển cho vợ chồng ông Quân hơn 103 tỷ đồng là số tiền nâng khống giá thiết bị y tế từ 27 gói thầu. Số tiền này ông Quân và vợ Nguyễn Trần Ngọc Diễm dùng để mua nhiều bất động sản, xe sang.","TP HCM- Bà Nguyễn Thị Sa, 76 tuổi có đơn xin tòa được tiếp xúc con là bị cáo Nguyễn Minh Quân, cựu giám đốc Bệnh viện Thủ Đức, trong quá trình diễn ra phiên xử. - VnExpress","https://vnexpress.net/me-cuu-giam-doc-benh-vien-tp-thu-duc-xin-duoc-gap-con-tai-toa-4683007.html","Thứ năm, 30/11/2023, 10:44 (GMT+7)","https://i2-vnexpress.vnecdn.net/2023/11/30/nguyen-minh-quan-1-1701313464-8520-1701313629.png?w=1200&h=0&q=100&dpr=1&fit=crop&s=i0Nb9dtjLM8gyZ8ws36gFQ","","Pháp luật","https://vnexpress.net/tin-tuc-24h"
"4683060","Ngân hàng Nhà nước 'chia' lại room tín dụng","Thông báo này đã được Ngân hàng Nhà nước gửi tới các tổ chức tín dụng ngày hôm qua (29/11).
Đến tháng 7, cơ quan quản lý đã phân bổ hạn mức tín dụng với tổng tăng trưởng 14,5%. Tuy nhiên, 11 tháng qua, tăng trưởng kinh tế gặp khó khăn, hấp thụ vốn và cầu tín dụng còn yếu nên đến ngày 22/11, tăng trưởng tín dụng toàn hệ thống mới đạt 8,21%. ""Mức tăng trưởng tín dụng không đồng đều, một số tổ chức tín dụng tăng trưởng khá cao, một số thấp, thậm chí tăng trưởng âm"", báo cáo Ngân hàng Nhà nước cho biết.
Theo đó, để đáp ứng yêu cầu đẩy mạnh tăng trưởng tín dụng, Ngân hàng Nhà nước đã điều chỉnh chỉ tiêu này từ ngân hàng không sử dụng hết sang các nhà băng cần được tiếp tục mở rộng. Tăng trưởng tín dụng chung trong năm 2023 vẫn giữ nguyên chỉ tiêu đã xác định từ đầu năm (14,5%).
Việc phân bổ lại tính theo mức tăng trưởng tín dụng từ đầu năm và xếp loại. Trong đó, các ngân hàng có tăng trưởng đạt đến 80% sẽ được bổ sung hạn mức tín dụng trên cơ sở xếp hạng năm 2022, ưu tiên thêm cho những tổ chức tập trung tín dụng các lĩnh vực ưu tiên và hạ lãi suất cho vay xuống mức thấp.
""Việc bổ sung hạn mức này là sự chủ động của Ngân hàng Nhà nước mà các tổ chức tín dụng không cần thiết phải đề nghị hoặc xin bổ sung"", Ngân hàng Nhà nước cho biết.
Tính tới cuối quý III, bức tranh tín dụng chung của hệ thống ngân hàng cũng cho thấy sự phân hóa. Ở nhóm ngân hàng quốc doanh, theo báo cáo tài chính riêng lẻ, các nhà băng tăng trưởng tín dụng đều ở mức một con số. Vietcombank trong 9 tháng đầu năm tăng trưởng tín dụng khoảng 4%, BIDV và VietinBank ở mức 9%.
Trong khi đó, các nhà băng tư nhân có mức tăng cao hơn đáng kể. Ngân hàng mẹ VPBank có dư nợ cho vay đến cuối quý III là hơn 454.000 tỷ đồng, tăng 26% so với đầu năm. Cho vay khách hàng của MB đạt hơn 500.000 tỷ đồng, tăng 16%. Một số nhà băng khác như Techcombank, LPB, HDBank hay SHB cũng tăng tín dụng trên 10%.
Theo Ngân hàng Nhà nước, các ngân hàng tiếp tục được yêu cầu cấp tín dụng an toàn, lành mạnh, hỗ trợ doanh nghiệp, đảm bảo tăng trưởng tín dụng phù hợp với năng lực quản lý rủi ro. Cơ quan quản lý cũng cho biết sẽ ""tiếp tục theo dõi sát diễn biến thị trường để có các giải pháp điều hành kịp thời, phù hợp, chủ động bổ sung hạn mức, sẵn sàng hỗ trợ thanh khoản"".","Tăng trưởng tín dụng hệ thống không đều, Ngân hàng Nhà nước quyết định phân bổ lại chỉ tiêu tăng trưởng từ ngân hàng thừa sang nhà băng thiếu. - VnExpress","https://vnexpress.net/ngan-hang-nha-nuoc-chia-lai-room-tin-dung-4683060.html","Thứ năm, 30/11/2023, 10:36 (GMT+7)","https://i1-kinhdoanh.vnecdn.net/2023/11/30/VPBankThanhTung10-1701314929-3427-1701315056.jpg?w=1200&h=0&q=100&dpr=1&fit=crop&s=fU9Bpm_XdpmX2hAUXJ-PzA","","Ngân hàng","https://vnexpress.net/tin-tuc-24h"
"4682738","Quốc Trường: 'Tôi dư dả vật chất'","Quốc Trường lần đầu làm host trong show Chị đẹp đạp gió rẽ sóng (hay còn gọi là Đạp gió). Dịp này, diễn viên nói về công việc, cuộc sống hiện tại.
- Anh nói gì trước việc bị khán giả chê nên phải rút khỏi chương trình, vắng mặt ở tập 5?
- Trong vòng công diễn đầu, tôi không góp mặt vì vướng lịch ra mắt phim có từ trước khi nhận lời làm host. Êkíp quyết định để anh Lâm Bảo Châu dẫn cùng MC Anh Tuấn và tôi sẽ xuất hiện ở những tập sau. Vì vậy, không có chuyện vì bị chê dẫn nhạt mà tôi rút khỏi vai trò host.
Tôi thừa nhận bị khớp, run khi dẫn một chương trình lớn và đứng trước 30 ""chị đẹp"". Trước giờ tôi không thân với ai trong showbiz ngoài Bảo Anh nên gặp khó khi tương tác với các sao nữ. Ngoài ra, lần đầu tôi làm host nên chưa có kinh nghiệm xử lý cảm xúc hay lời nói. Khán giả đánh giá tôi dẫn bị nhạt, cứng nhắc là đúng và tôi cần phải cố gắng hơn nữa. Công việc dẫn chương trình là trải nghiệm mới nên tôi chuẩn bị tâm lý trước, đón nhận ý kiến trái chiều.
- Ai là người động viên khi anh nhận bình luận không tốt ở chương trình?
- Tôi muốn cảm ơn ca sĩ Lệ Quyên, Hồng Nhung, Thu Phương. Trong lúc trò chuyện ở hậu trường, các chị liên tục cổ vũ tinh thần, nói giọng tôi ấm, êm tai. Tôi không biết họ khen thật hay chỉ nói vậy để an ủi nhưng vẫn vui. Bố mẹ cũng theo dõi các tập phát sóng và nói tôi dẫn chương trình ổn, chỉ là chưa thực sự tốt dưới con mắt của những người khó tính.
Qua vai trò mới này, tôi hiểu thêm công việc host vất vả như thế nào và đồng nghiệp giỏi ra sao. Tôi cũng thêm chất liệu cuộc sống để sau này nhìn lại có thể mỉm cười vì không ngại thử thách. Tôi không mất điều gì cả bởi làm host không phải là chuyên môn chính. Khán giả thấy không hay thì góp ý và vẫn yêu mến tôi.
- Anh thu xếp thế nào khi vừa đóng phim, kinh doanh và tham gia show thực tế?
- Lịch quay show không nhiều như đóng phim nên dễ cho tôi thu xếp mọi việc. Tôi luôn chủ động thời gian trong việc kinh doanh cũng như hoạt động nghệ thuật. Sau bộ phim Kẻ ẩn danh ra mắt hồi tháng 8, tôi cũng chưa nhận phim mới mà tập trung cho kế hoạch mở thêm hàng chục chi nhánh nhà hàng.
Tôi may mắn có được những đối tác, nhân viên giỏi, hỗ trợ tôi trong chiến lược quảng bá, tiếp cận khách hàng, tìm mặt bằng trong kinh doanh.
- Anh nói gì khi thường được gọi là đại gia trong showbiz Việt? 
- Tôi không phủ định những gì mọi người nghĩ khi thấy công việc kinh doanh của tôi phát triển rầm rộ. Mỗi tháng, tôi mở hai chi nhánh nhà hàng mới dù tình hình kinh tế sau đại dịch gặp nhiều khó khăn, nhiều doanh nghiệp đóng cửa, công nhân thất nghiệp. Ngoài ra, tôi còn mới ra mắt một thương hiệu mỹ phẩm riêng.
Tôi dư dả về vật chất. Nhưng quan trọng hơn, tôi luôn hướng đến lối sống tự tại, an nhiên. Tôi thấy nội tâm hạnh phúc, yêu từng con kiến, ngọn cỏ. Tôi không bị vướng mắc vào chuyện tình cảm hay quá mong cầu điều gì trong cuộc đời. Mỗi sáng thức dậy tôi pha một bình trà, ngồi uống lắng nghe chim hót, chơi với chó cưng, sau đó điều hành công việc từ xa. Buổi chiều tôi tập thể dục, về nhà vào bếp nấu nướng, rồi cập nhật thông tin và đi ngủ lúc 22h.
- Với anh, đồng tiền có ý nghĩa như thế nào?
- Tài sản lớn nhất mà con người có được là trí tuệ. Hiện tôi tranh thủ kiếm nhiều tiền không phải để trở nên giàu hơn mà tích lũy, lập quỹ về giáo dục trong tương lai. Tôi chỉ giữ lại một căn nhà, những tài sản còn lại đều bán hết đưa vào quỹ này với mong muốn giúp được nhiều người hơn.
Tôi nghĩ mình có được thành công là hưởng phúc đức từ gia đình. Tôi học và hiểu sâu về Phật pháp nên ứng dụng vào lối sống thường ngày. Tôi không đề cao sự giàu có, nổi tiếng mà sống bình dị. Tôi chưa bao giờ đánh giá bất cứ ai về địa vị, tiền tài. Tôi có thể ngồi nói chuyện hàng giờ với ông xe ôm ngoài đường hoặc những người lang thang đầu đường xó chợ. Tôi sống không tính toán với ai và biết cách cho đi. Tôi luôn chánh niệm nên bên trong dồi dào năng lượng. Tôi có thể làm việc gấp bốn, năm lần người khác vì trong đầu không chứa ""rác"" như muộn phiền, sân si, tham lam.
- Anh từng nói muốn lập gia đình, hiện tại chuyện tình cảm của anh ra sao?
- Tôi vẫn chưa đủ duyên tìm được một người đồng hành, gắn kết để xây dựng mái ấm. Quan điểm hạnh phúc của tôi thay đổi vào từng thời điểm. Vài năm trước có thể tôi thèm được như mọi người, có gia đình riêng để mỗi cuối tuần chở vợ con đi chơi, ăn uống. Hiện tôi lại thấy điều đó không còn quan trọng nữa. Nếu cưới được vợ, tôi sẽ vui còn không vẫn ung dung mà sống. Tôi không còn thấy cô đơn bởi thích được một mình tận hưởng không gian riêng.
Trải qua nhiều mối tình, tôi bớt tính gia trưởng. Mỗi khi nhìn thấy khuyết điểm của bản thân, tôi mừng vì còn có thể thay đổi được, tốt hơn từng ngày.","Diễn viên Quốc Trường nói có cuộc sống dư dả ở tuổi 35 khi làm chủ hàng chục nhà hàng, thương hiệu mỹ phẩm riêng. - VnExpress","https://vnexpress.net/quoc-truong-toi-du-da-vat-chat-4682738.html","Thứ năm, 30/11/2023, 10:33 (GMT+7)","https://i1-giaitri.vnecdn.net/2023/11/29/quoc-truong-1701245886-4669-1701249383.jpg?w=1200&h=0&q=100&dpr=1&fit=crop&s=ES5AlU7oqmdRbTIBb9Skfw","","Trong nước","https://vnexpress.net/tin-tuc-24h"
"4681964","'Thăng chức', 'bỏ việc' trong tiếng Anh nói thế nào?","Để nói về việc tuyển dụng, tiếng Anh có từ ""hire"": After a test and two interviews, the fresh graduate was finally hired by his dream company (Sau bài kiểm tra và hai cuộc phỏng vấn, chàng sinh viên mới tốt nghiệp cuối cùng đã được tuyển vào công ty mơ ước).
Từ ""employ"" cũng có nghĩa tương tự. Hai từ quen thuộc cùng họ của từ này là ""employer"", tức nhà tuyển dụng, và ""employee"", nghĩa là nhân viên.
Ngoài các từ trên, cụm từ ""take somebody on"" cũng là tuyển ai đó về làm việc: Mai was taken on as a salesperson (Mai được nhận vào làm nhân viên bán hàng).
Nếu làm việc tốt, một nhân viên có thể thăng chức, tức ""promote"": I'm so happy to announce that I've been promoted to Head of the Sales Department (Tôi rất vui mừng được thông báo rằng tôi đã được thăng chức lên Trưởng phòng Kinh doanh). Ngược lại, giáng chức là ""demote"".
Khi một người bị sa thải, người Anh hay dùng từ ""sack"": He’s been feeling down. He got sacked last week (Anh ấy đang cảm thấy chán nản. Anh ấy đã bị sa thải vào tuần trước).
Ngoài nghĩa là đốt cháy, ""fire"" cũng hay được người Mỹ dùng với nghĩa đuổi việc: The old manager got fired from his job due to poor performance (Người quản lý cũ bị sa thải vì làm việc kém hiệu quả).
""Lay off"" là từ thông dụng sau làn sóng sa thải trong ngành công nghệ: More than 240.000 workers in the tech industry have been laid off this year (Hơn 240.000 nhân sự trong ngành công nghệ đã bị sa thải trong năm nay).
Còn nếu một người bỏ việc, chúng ta dùng từ ""quit"": I would quit my job if I won a million dollars (Tôi sẽ nghỉ việc nếu trúng được một triệu đô la).
Còn khi từ chức, tiếng Anh có hai cách nói là ""resign"" và ""step down"": She resigned as director due to too much pressure (Cô từ chức giám đốc vì quá nhiều áp lực), People were annoyed that he refused to step down, despite last year’s scandal (Người ta bức xúc vì anh không chịu từ chức, bất chấp scandal năm ngoái).
Cuối cùng, nghỉ hưu là ""retire"": Since my grandfather retired, he has worked in a charity for needy children (Kể từ khi ông tôi nghỉ hưu, ông đã làm việc từ thiện cho trẻ em nghèo).
Hoàn thành các câu sau:","Demote, promote, sack hay lay off là những từ vựng tiếng Anh phổ biến khi nói về chủ đề việc làm (employment). - VnExpress","https://vnexpress.net/thang-chuc-bo-viec-trong-tieng-anh-noi-the-nao-4681964.html","Thứ năm, 30/11/2023, 10:30 (GMT+7)","https://i2-vnexpress.vnecdn.net/2023/11/27/demotedatwork1-1701097753-1701-5655-9948-1701097886.jpg?w=1200&h=0&q=100&dpr=1&fit=crop&s=zS1C6R-a3RupDA-GFNXCag","","Học tiếng Anh","https://vnexpress.net/tin-tuc-24h"
"4683055","Ten Hag nhận lỗi khi Man Utd nguy cơ bị loại khỏi Champions League","""Luôn là tôi phải chịu trách nhiệm, khi Man Utd đạt kết quả không tốt"", Ten Hag nói sau trận. ""Tôi chịu trách nhiệm về việc này, nhưng cũng biết rằng chúng tôi đang ở trong một dự án. Đội đang tiến về phía trước, tiến bộ và điều đó rất đáng hy vọng. Tôi biết chúng tôi phải đi đâu và phải thực hiện những bước nào, và tôi chắc chắn rằng Man Utd sẽ thành công về lâu dài"".
Trên sân Ali Sami Yen tối 29/11, Man Utd dẫn 2-0 chỉ sau 18 phút lần lượt nhờ công Alejandro Garnacho rồi Bruno Fernandes. Sau khi để Hakim Ziyech gỡ một bàn cuối hiệp một, Scott McTominay giúp đội khách tái lập khoảng cách hai bàn đầu hiệp hai.
Nhưng Man Utd không thể bảo toàn lợi thế trong phần còn lại của trận đấu bởi những sai lầm ở hàng thủ. Phút 62, Andre Onana bắt bóng không tốt từ tình huống đá phạt của Ziyech và lần thứ hai vào lưới nhặt bóng. Chưa đầy 10 phút sau, hàng thủ Man Utd để Kerem Akturkoglu thoải mái xâm nhập vòng cấm rồi sút trái phá vào góc gần để ấn định tỷ số 3-3.
Ten Hag nhấn mạnh Man Utd đá tốt, lẽ ra phải thắng thay vì trải qua tình cảnh tương tự trận thua chính Galatasaray trên sân nhà hay trận làm khách trước Copenhagen. Ông cũng thừa nhận Man Utd phòng ngự không đủ tốt và việc mắc những sai lầm rồi đánh mất lợi thế dẫn 3-1 là điều không thể chấp nhận.
HLV Hà Lan cũng phân tích Man Utd để thủng lưới ba bàn theo ba cách khác nhau. Bàn thua đầu tiên xuất phát từ việc Man Utd không phòng ngự trung lộ tốt khi Galatasaray lên bóng nhanh. Ở bàn thua thứ hai, ""Quỷ Đỏ"" phạm lỗi không đáng có và cũng đứng hàng rào không tốt. Bàn thua thứ ba thì các cầu thủ Man Utd không theo kèm và để Akturkoglu thoải mái xâm nhập vòng cấm. ""Điều đó không thể xảy ra, những sai lầm này không thể xảy ra. Bạn sẽ bị trừng phạt vì điều đó. Vì vậy, chúng tôi phải học hỏi"", Ten Hag nhấn mạnh.
HLV 53 cũng bảo vệ Andre Onana - thủ thành mắc lỗi và nhận hai bàn thua đầu từ những cú đá phạt đưa bóng không mạnh và không hiểm của Ziyech. ""Onana làm tốt. Kết quả này không do sai lầm cá nhân"", Ten Hag nói. ""Những lỗi cá nhân trong bóng đá có thể tạo ra sự khác biệt và bạn phải chịu trách nhiệm về điều đó, nhưng quan trọng là vấn đề của toàn đội. Chúng tôi hài lòng với Onana. Toàn đội làm tốt và có màn trình diễn tốt. Các cầu thủ phải thúc đẩy lẫn nhau"".
Kết quả hòa khiến Man Utd giậm chân ở vị trí bét bảng A và không còn quyền tự quyết vé vào vòng 1/8. Để đi tiếp, thầy trò Ten Hag phải thắng Bayern và trận còn lại giữa Copenhagen và Galatasaray có kết quả hòa ở lượt cuối ngày 12/12.","Thổ Nhĩ Kỳ- HLV Erik ten Hag nhận trách nhiệm và bảo vệ thủ môn Andre Onana sau khi Man Utd hòa 3-3 Galatasaray, chôn chân cuối bảng A Champions League. - VnExpress","https://vnexpress.net/ten-hag-nhan-loi-khi-man-utd-nguy-co-bi-loai-khoi-champions-league-4683055.html","Thứ năm, 30/11/2023, 10:29 (GMT+7)","https://i1-thethao.vnecdn.net/2023/11/30/74de34d7-a755-4d7c-bff2-a2b0fc-4568-1673-1701314869.jpg?w=1200&h=0&q=100&dpr=1&fit=crop&s=PYvY_CUE4bZvnkJ96usiWg","","Champions League","https://vnexpress.net/tin-tuc-24h"
