"""ID"", ""Title"", ""Content"", ""Description"", ""URL"", ""Publication Date"", ""Image URL"", ""Author"", ""Category"", ""Source"""
"4682869","Môtô điện Kawasaki e-1 ra mắt Đông Nam Á","Thương hiệu môtô Nhật Bản Kawasaki chọn triển lãm xe quốc tế Thái Lan (Thailand International Motor Expo 2023) để giới thiệu e-1. Mẫu chạy điện cỡ nhỏ có sẵn hai biến thể, gồm Ninja (sportbike) và Z (nakedbike).
Cả hai mẫu Ninja e-1 và Z e-1 phát triển dựa trên khung gầm của Ninja 400 và Z400. Mẫu môtô chạy điện giữ lại khung thép và gắp sau như nguyên mẫu. Thiết kế tổng thể giữ nguyên, hãng môtô Nhật Bản chỉ thay động cơ đốt bằng hệ truyền động điện.
e-1 trang bị môtơ công suất 6,7 mã lực và có thể tăng lên tối đa 12,1 mã lực, mô-men xoắn ở mức 40,5 Nm. Xe dẫn động bằng xích tải. Công suất này của e-1 tương đương một chiếc xe 150 phân khối và mô-men xoắn tương đương một chiếc xe 400 phân khối.
Nuôi môtơ điện là hai bộ pin lithium-ion dung tích 3 kWh đặt dưới bình xăng nguyên bản. Pin có thể tháo rời để sạc hoặc sạc trực tiếp ở cổng sạc phía sau xe. Mỗi bộ pin nặng 12 kg, thời gian sạc đầy khoảng 3,7 giờ. Phạm vi hoạt động của cả hai xe là 72 km. Xe còn trang bị hệ thống phanh tái tạo để cung cấp lại năng lượng cho pin.
Độ cao yên ở mức 785 mm, tương đương những mẫu 250-400 phân khối. Cả hai cùng trang bị đèn LED, đồng hồ TFT, kết nối điện thoại thông minh. Hệ thống treo giữ nguyên bản. Trang bị an toàn với phanh đĩa đơn cả hai bánh. Phanh ABS hai kênh. Cặp vành đúc 17 inch. Cả hai đều có 3 chế độ chạy, gồm Eco, Road, E-boost. Cả hai đều có tính năng đặc biệt Walk Mode giúp người điều khiển dắt xe một cách dễ dàng khi đỗ xe.
Kawasaki chưa công bố giá cũng như thời điểm bán ra của Ninja e-1 và Z e-1 ở thị trường Thái Lan.
Triển lãm xe Thailand International Motor Expo 2023 diễn ra tại Thái Lan từ ngày 30/11-11/12.","Thái Lan- Mẫu xe chạy điện cỡ nhỏ trình làng có hai biến thể sportbike và nakedbike, công suất ngang xe 150 phân khối, mô-men tương đương mẫu 400 phân khối. - VnExpress","https://vnexpress.net/moto-dien-kawasaki-e-1-ra-mat-dong-nam-a-4682869.html","Thứ năm, 30/11/2023, 09:58 (GMT+7)","https://i2-vnexpress.vnecdn.net/2023/11/30/Kawasakie1TIMS2023100-17013075-7158-6309-1701307564.jpg?w=1200&h=0&q=100&dpr=1&fit=crop&s=ae9C437hoDvStP5NQaO0Ag","","Thế giới","https://vnexpress.net/tin-tuc-24h"
"4682820","Đồng nghiệp chê tôi hèn nhát vì không dám nhảy việc","Tôi năm nay 24 tuổi, đã ra trường được hơn hai năm, đang là một nhân viên văn phòng. Buổi tối, tôi có đi làm thêm ở một chỗ khác. Lúc bắt đầu công việc làm thêm đó, tôi không hề có bất kỳ chuyên môn nào, cũng chưa từng có ý định sẽ xin vào đó. Nhưng tình cờ, tôi quen với cô chủ, nên dù biết rõ tôi không có chuyên môn về công việc này, nhưng vào lúc thiếu người, cô chủ vẫn gọi tôi đi làm.
Ban đầu tôi cũng từ chối, vì biết là mình làm dở tệ, nhưng được sự dộng viên của cô chủ, hứa giao cho vị trí chuyên môn thấp, đơn giản hơn, nên tôi quyết định đi đại, coi như bản thân sẽ có cơ hội tiếp xúc, học được cái mới và có thêm một ít thu nhập.
Lúc mới vào làm, tôi vô tư kể chuyện mình vào đây làm như thế nào, chuyên môn kém ra sao với chị đồng nghiệp. Chị cũng không học ngành này, nhưng năng lực chuyên môn lại tốt hơn tôi. Chị động viên tôi: ""Người ta đâu có để cho một người không có năng lực đi làm cho công ty của mình. Cô chủ phải thấy em có cái gì hữu dụng nên mới gọi đi làm. Đừng nghĩ mình dở, cứ cố gắng học thêm là được"". Những câu nói rất đẹp đẽ đó làm tôi cảm thấy đỡ tự ti hơn về bản thân.
Dần dần, chúng tôi cũng chơi thân. Tôi coi chị là người bạn, người chị tốt, sẵn sàng giúp đỡ nếu có thể. Chúng tôi còn chơi chung với một người em nhỏ hơn tôi một tuổi. Mới đây, chị nghỉ việc và chuyển tới một nơi khác, công việc tương tự nhưng có mức lương cao hơn. Chị có giới thiệu cho người em kia vào đó làm cùng.
&gt;&gt; 'Rất vô lý khi nhân viên ở lại phải gánh việc cho người bị sa thải'
Một buổi tối, ba chúng tôi hẹn đi ăn với nhau. Trong buổi trò chuyện, chị ngỏ ý với tôi: ""Em mà qua đây (chỗ làm mới của chị) chắc lương cũng được 180.000 đồng mỗi giờ (mặt bằng lương ở đó là 200.000 đồng). Tôi chỉ im lặng không nói gì, ngầm từ chối lời đề nghị. Thấy vậy, chị nói tiếp: ""Hay em thấy làm ở đây lương 130.000 đồng/giờ là đủ rồi?"", kèm theo một nụ cười khẩy mỉa mai. Sau đó, người em có kể vu vơ về một người giống tôi. Chị lập tức tiếp lời chê bai người đó kém cỏi, kèm theo cái liếc mắt ""ném"" về phía tôi: ""Giống em đó"".
Từ hôm đó về, tôi cứ suy nghĩ mãi. Tôi cảm thấy buồn, không phải là vì bản thân mình kém cỏi, hèn nhát, mà là do người chị mà tôi rất tin tưởng lại nói với mình kiểu khinh thường như thế chỉ vì không qua chỗ chị làm. Từ sau bữa đó, thỉnh thoảng chúng tôi cũng có nhắn tin, gặp mặt qua lại, nhưng thú thật tôi không còn có thể chia sẻ mọi điều với chị như trước nữa. Trong đầu tôi luôn suy nghĩ về những câu nói của chị hôm đó, và cảm thấy buồn.
Vừa rồi, tôi quyết định tự nộp CV và đi phỏng vấn ở một công ty khác. Thực ra, tôi cũng chưa hẳn là muốn đổi chỗ làm mới, nhưng vì câu nói của chị cứ lởn vởn trong suy nghĩ, nên tôi muốn đi để nghe xem người ta đánh giá và phản hồi như thế nào về kỹ năng của mình? May mắn, kết quả là tôi được nhận vào làm việc.
Tôi mang câu chuyển trúng tuyển đi kể cho chị nghe, một phần cũng muốn cho chị biết rằng tôi cũng có thể làm được như chị, tự đứng trên đôi chân của mình. Nhưng sau khi nghe chuyện, chị chỉ lên tiếng chê bai về chỗ làm mới của tôi. Phải chăng tôi đã sai khi chia sẻ quá nhiều cho một người đồng nghiệp? Có lẽ tôi không nên nói cho ai biết về những điểm yếu, sự tự ti của mình mà nên âm thầm tìm cách giải quyết nó, để không bị người khác coi thường?
Nguyen Trang","Từ chối đề nghị công việc từ người chị đồng nghiệp cũ do tự ti với chuyên môn của mình, tôi bị xem thường, cho rằng hèn nhát, kém cỏi.","https://vnexpress.net/dong-nghiep-che-toi-hen-nhat-vi-khong-dam-nhay-viec-4682820.html","Thứ năm, 30/11/2023, 09:52 (GMT+7)","https://i2-vnexpress.vnecdn.net/2023/11/30/stresscongty168257966540121682-4172-9895-1701311178.jpg?w=1200&h=0&q=100&dpr=1&fit=crop&s=kkeYywxW-atJBtp_mur72A","","Đời sống","https://vnexpress.net/tin-tuc-24h"
"4682246","Giáo viên thể dục đạt sub2:45 ngay lần đầu chạy marathon","Trương Văn Quân (bib 91059) bước đến vạch xuất phát VnExpress Marathon Hanoi Midnight Ioniq 5 Cup lúc 0h30, ngày 26/11. Runner vô danh đứng lọt thỏm sau những elite (top runner) nổi tiếng hàng đầu tiên. Sự náo nhiệt ở Hồ Gươm lúc nửa đêm cũng báo hiệu trước một cuộc đua khốc liệt của nhóm cự ly 42km.
Ngoại trừ Nguyễn Văn Lai có màn độc diễn đến ngôi vô địch, phía sau, cuộc cạnh tranh thứ hạng top 5 diễn ra rất căng thẳng. Bởi đây cũng là nhóm có cơ hội nhận giải thưởng chung cuộc hấp dẫn. Sau 10km đầu tiên, top các VĐV bám đuổi có đầy những gương mặt sừng sỏ như Quốc Anh, Trương Văn Tâm, Lê Tấn Hi, Đức Thọ, Hữu Hanh, Đình An. Trong số này, sự xuất hiện của cái tên lạ là Trương Văn Quân gây tò mò.
Trương Văn Quân gia nhập đường đua tốc độ ngay từ những km đầu tiên. Anh không e dè hay thăm dò mà chủ động đẩy tốc độ lên cao theo bản năng. Anh lần lượt chạm mốc 3km trong 10 phút 11 giây; 11km trong 40 phút 20 giây; 30km trong 1 tiếng 49 phút 1 giây. Kể từ khi lên cầu Vĩnh Tuy cho đến km số 35, Trương Văn Quân giữ nguyên tốc độ và duy trì vị trí thứ hai chỉ sau nhà vô địch Nguyễn Văn Lai.
Trên sóng trực tiếp đường đua ngày 26/11, chứng kiến gương mặt mới dẫn đầu đoàn đông bám đuổi Nguyễn Văn Lai, bình luận viên liên tục nói ""Nếu có ai biết về VĐV này, hãy bình luận phía dưới"".
Nếu cứ giữ nguyên tốc độ, Văn Quân đã có thể trở thành á quân VM Hanoi Midnight 2023. Tuy nhiên do thiếu kinh nghiệm, khi còn cách đích 7km, anh mất sức, giảm tốc độ và để loạt elite phía sau vượt qua. Kết quả, Văn Quân về đích thứ 5 sau Nguyễn Văn Lai, Quốc Anh, Trương Văn Tâm và Phạm Đức Thọ. Kết quả của anh là 2 tiếng 41 phút 25 giây.
Trương Văn Quân đang là giáo viên thể dục tại một trường tiểu học ở Thái Nguyên. Nói về lần đầu tiên chạy full marathon, anh cho biết rất hồi hộp. Tuy nhiên, khi nhập cuộc, anh nhanh chóng cuốn theo nhóm thành tích cao. Càng chạy càng hăng, khi lên cầu Vĩnh Tuy, thấy hưng phấn khi được so kè cùng những cái tên nổi tiếng nên anh quyết định đẩy thêm tốc độ.
Cũng chính vì cuốn theo đà hưng phấn, anh bị chuột rút ở những km cuối. Đau nên runner này phải giảm tốc độ, tuột mất ngôi á quân. ""Khi đó tôi nghĩ các runner lớn tuổi có thể chạy được 42km thì tôi cũng chạy được. Tôi động viên bản thân nhất định không đi bộ hay dừng lại. Dẫu sao đây là bài học lớn cho tôi"", chân chạy Thái Nguyên chia sẻ.
Thành tích này đủ biến Trương Văn Quân thành tân binh ấn tượng nhất năm 2023, đưa anh vào nhóm 50 người chạy full marathon nhanh nhất Việt Nam. Nhiều chân chạy lâu năm, nổi tiếng và cộng đồng marathon trong nước dành lời khen cho màn ra mắt này. Chính Văn Quân cũng không tin vào con số hiển thị trên bảng kết quả. ""Tôi chưa từng nghĩ sẽ cạnh tranh thứ hạng vì khá hồi hộp. Tôi thật sự quá hạnh phúc dù về đích không còn tí sức nào"", nam runner nói.
Việc anh đạt thông số ấn tượng không chỉ đến từ may mắn mà còn là kết quả của quá trình tích lũy kéo dài. Anh bắt đầu chạy từ năm 2009 khi còn là sinh viên sư phạm thể chất. Runner 35 tuổi chạy bộ hằng ngày và xem đó như niềm vui, đồng thời rèn luyện sức khỏe, duy trì thể lực. Hai năm sau, chấn thương dây chằng khiến anh không tiếp tục chạy. Mãi đến năm 2015 sau khi đã phẫu thuật, Văn Quân mới tiếp tục duy trì thói quen này.
Runner Thái Nguyên cho biết thời gian đầu chạy theo bản năng, không có giáo án, đều đặn 5km mỗi ngày. Anh gần như không biết đến khái niệm giải marathon mà chỉ dự một số giải việt dã nhỏ, 5 hoặc 10km ở địa phương. Năm 2018, một người bạn rủ tham gia Long Biên Marathon, cự ly 21km. Đó là lần đầu Văn Quân biết đến sự kiện có quy mô hàng nghìn người, được đeo chiptime và chạy trong không khí cuồng nhiệt. Năm đó, runner Thái Nguyên cho thấy tố chất đặc biệt khi hoàn thành đường đua trong 1 tiếng 37 phút, xếp hạng 11 chung cuộc.
Lẽ ra, Trương Văn Quân đã có thể bứt phá hơn từ 5 năm trước. Tuy nhiên, anh cho biết điều kiện khi đó không cho phép theo đuổi marathon. Nhiều năm sau đó, cái tên Trương Văn Quân không xuất hiện ở bất cứ giải marathon nào. Giáo viên thể dục chọn gắn bó với công việc sư phạm và xem chạy là người bạn đồng hành để duy trì năng lượng, sức khỏe.
Năm 2020, khi phong trào marathon phát triển hơn, Thái Nguyên Runners ra đời. Chân chạy sinh năm 1988 gia nhập CLB để tìm đồng đội cùng tập luyện. Khi này, các bài tập của anh mới bắt đầu vào khuôn khổ, có giáo án chỉn chu hơn. Mỗi ngày, anh tập từ 4h30 đến 6h30. Cuối tuần là các buổi long run. Trung bình, anh tích lũy 70 - 100km mỗi tuần. Nhưng anh tự nhận không đủ tự tin và điều kiện để tham gia giải lớn. Mãi đến năm 2022, anh mới tham gia thêm một giải half marathon và một vài giải cự ly 5 - 10km.
Hai năm qua, khi phong trào marathon bùng nổ, Trương Văn Quân được truyền cảm hứng nhiều hơn từ những tấm gương chạy bộ và con số VĐV kỷ lục ở các giải marathon. Anh quyết định thử sức ở cự ly khó nhất tại VM Hanoi Midnight 2023 sau khi được các thành viên trong CLB gợi ý và động viên. ""Tôi muốn giao lưu nhiều hơn và gặp gỡ những người yêu thể thao trong cả nước nên chốt tham gia chứ không hề nghĩ sẽ có giải"", anh nói.
Trước giải, CLB tổ chức hai buổi tập với giờ tương tự ngày thi đấu. Ngoài ra, Văn Quân tự tập thêm để tích lũy, hỏi thêm kinh nghiệm những người đã tham gia.
Giành hạng 5 trong giải đấu có hàng loại chân chạy nổi tiếng là điều nằm ngoài dự tính của chính Văn Quân nhưng đây là động lực để runner này tự tin hơn ở những giải đấu trong tương lai. Anh tập trung phục hồi, tiếp tục tích lũy với mong muốn cải thiện thành tích tại VnExpress Marathon Hải Phòng diễn ra sau đây 3 tuần.
""Tôi nhận nhiều lời nhận xét và khen sau thành tích vừa qua nhưng thấy bản thân còn nhỏ bé. Tôi chưa dám nghĩ đến vô địch giải nào, chỉ muốn cố gắng tốt hơn từng ngày"", Trương Văn Quân chia sẻ.","Trương Văn Quân (35 tuổi) là bất ngờ thú vị tại Hanoi Midnight 2023 khi cán đích ở vị trí thứ 5 trong lần đầu chạy marathon, đạt thông số 2 tiếng 41 phút 25 giây. - VnExpress","https://vnexpress.net/giao-vien-the-duc-dat-sub2-45-ngay-lan-dau-chay-marathon-4682246.html","Thứ năm, 30/11/2023, 09:42 (GMT+7)","https://i1-thethao.vnecdn.net/2023/11/30/x02-0260-jpg-3711-1701163237-1-7425-8864-1701312275.jpg?w=1200&h=0&q=100&dpr=1&fit=crop&s=fskyiQBLRB9ziv7LPtGdIQ","","Marathon","https://vnexpress.net/tin-tuc-24h"
"4682948","12 đội vào vòng 1/8 Champions League sớm một lượt","12 đội đã đi tiếp là Bayern Munich, Arsenal, PSV, Real Madrid, Real Sociedad, Inter, Atletico Madrid, Lazio, Borussia Dortmund, Man City, RB Leipzig và Barca. Bốn suất chưa được xác định nằm ở bảng A, C, F và H.
Các đội chắc suất đầu bảng và được xếp hạt giống tại vòng knock-out là Bayern, Arsenal, Real và Man City. Hai đội chắc suất nhì bảng là PSV và RB Leipzig. Man Utd, PSG và Milan là những đội giàu truyền thống có nguy cơ bị loại.
Tình thế của Man Utd ở bảng A đang khó khăn, khi họ đang đứng chót bảng với bốn điểm, còn Copenhagen và Galatasaray xếp trên với năm điểm. Có hai điều kiện bắt buộc để thầy trò Ten Hag đi tiếp, đó là thắng Bayern ở lượt cuối, còn Galatasaray và Copenhagen hòa nhau. Man Utd sẽ chắc chắn bị loại nếu không thắng Bayern trên sân Old Trafford, và đại diện Đan Mạch khi đó sẽ chỉ cần hòa CLB Thổ Nhĩ Kì để đi tiếp. ""Quỷ Đỏ"" vẫn còn cửa xuống Europa League, nếu thắng Bayern còn trận đấu giữa Copenhagen và Galatasaray phân thắng bại.
Bảng C vẫn chưa xác định được đội thứ hai theo chân Real đi tiếp, nhưng nhiều khả năng là Napoli. Đương kim vô địch Serie A được chơi trên sân nhà ở lượt cuối, chỉ cần không thua đối thủ trực tiếp Braga cách biệt quá một bàn là đủ để vào vòng 1/8.
Tình thế tương tự cũng diễn ra ở bảng H, khi Porto và Shakhtar Donetsk gặp nhau ở lượt cuối để tranh suất vào vòng 1/8. Porto được chơi trên sân nhà, chỉ cần hòa, còn đại diện Ukraine buộc phải thắng. Còn Barca sẽ đứng đầu bảng nếu không thua đội chưa có điểm nào là Antwerp.
Cục diện bảng F phức tạp hơn cả, dù đã có Dortmund chắc suất đi tiếp nhưng cũng chưa đảm bảo đỉnh bảng. PSG sẽ đi tiếp và thậm chí chiếm đỉnh bảng, nếu thắng trên sân Dortmund ở lượt cuối. Newcastle muốn đi tiếp cần thắng Milan ở St James Park, và mong PSG không thắng Dortmund. Còn cửa đi tiếp của Milan nhỏ nhất, khi họ cần thắng Newcastle và mong PSG thua Dortmund.
Lượt cuối vòng bảng diễn ra tối 12 và 13/12. Còn lễ chia cặp đấu vòng 1/8 tổ chức tối 18/12.","Vòng bảng Champions League 2023-2024 vẫn còn một lượt đấu, nhưng chỉ còn bốn suất vào vòng 1/8 chưa có chủ. - VnExpress","https://vnexpress.net/12-doi-vao-vong-1-8-champions-league-som-mot-luot-4682948.html","Thứ năm, 30/11/2023, 09:38 (GMT+7)","https://i1-thethao.vnecdn.net/2023/11/30/fernandes-jpeg-1701310542-1453-1701310657.jpg?w=1200&h=0&q=100&dpr=1&fit=crop&s=v9jqiK933PVg-wfWnRthAw","","Champions League","https://vnexpress.net/tin-tuc-24h"
"4682968","Chiều nay, công chiếu tọa đàm 'Ôtô điện thay đổi thói quen lái xe thế nào'","Ôtô điện không còn là khái niệm quá xa lạ với người Việt, bởi sự phát triển mạnh mẽ, nhiều hãng liên tiếp ra mắt các dòng xe mới, trải dài từ phân khúc phổ thông, cao cấp đến hạng sang. Sự xuất hiện của dòng xe này cũng mang đến những thay đổi trong thói quen lái và sử dụng ôtô, khi người dùng đã quen thuộc với xe động cơ đốt trong tồn tại hàng trăm năm qua.
Đến thời điểm hiện tại, những thay đổi đó diễn ra như thế nào. Người Việt đã thích ứng với thói quen lái và sử dụng xe điện ra sao. Xe điện cần những yếu tố gì để trở nên phổ biến hơn trên thị trường.
Những nội dung trên sẽ được người dùng và chuyên gia tìm hiểu, phân tích trong Tọa đàm Car Talks với chủ đề ""Ôtô điện thay đổi thói quen lái xe của người Việt như thế nào"".
Tọa đàm công chiếu lúc 14h hôm nay, 30/11, sẽ đưa ra quan điểm và góc nhìn của chuyên gia và các khách mời:
- Ông Đàm Hoàng Phúc, Giám đốc Chương trình Đào tạo Kỹ thuật ôtô, trường Đại học Bách Khoa Hà Nội.
- Ông Phạm Hoàng Việt, người dùng tiên phong sử dụng VinFast VF8, công tác tại Bộ Tài nguyên và Môi trường.
- Ông Nguyễn Phú An, Hội người dùng ôtô điện Tập đoàn FPT, phụ trách Quản trị chiến lược FPT Telecom.
Tại Car Talks, chuyên gia Đàm Hoàng Phúc sẽ cập nhật những thông tin mới nhất về xu hướng ôtô điện diễn ra trên thế giới, cũng như cách mà người dùng toàn cầu thay đổi thói quen khi sử dụng dòng xe này. Vị chuyên gia cũng đưa ra bối cảnh mà các nước tiên tiến đang triển khai, nhằm thúc đẩy và phổ biến dòng xe xanh, thân thiện môi trường, hướng đến cam kết đưa mức phát thải ròng về 0 trong những năm tới.
Từ kinh nghiệm gần 2 năm sử dụng ôtô điện, ông Phạm Hoàng Việt sẽ đưa ra những trải nghiệm của bản thân và gia đình, khi chuyển đổi từ xe xăng sang dòng SUV thuần điện do VinFast sản xuất.
Ông Nguyễn Phú An cũng đưa ra góc nhìn của bản thân, là một chuyên gia trong lĩnh vực công nghệ, có nhiều năm tìm hiểu, nghiên cứu xe điện trên thế giới và đang sử dụng ôtô điện tại Việt Nam. Ông An có nhiều năm giữ vị trí Giám đốc Trải nghiệm khách hàng của FPT Telecom, hiện phụ trách Quản trị chiến lược của công ty có doanh thu hơn 12.000 tỷ đồng (2022).
Cuối tọa đàm, chuyên gia và các người dùng sẽ đưa ra những dự đoán về tiềm năng, xu hướng cũng như những giải pháp mà Việt Nam cần có để phổ biến các dòng xe xanh, thân thiện môi trường.
Tọa đàm Car Talks với chủ đề ""Ôtô điện thay đổi thói quen lái xe của người Việt như thế nào"" công chiếu 14h chiều nay, 30/11 trên Báo điện tử và Fanpage VnExpress.
Quang Anh
Car Talks là chuỗi Tọa đàm trực tuyến nằm trong hệ thống Giải thưởng Car Awards do Báo điện tử VnExpress tổ chức thường niên.","Hai người dùng và chuyên gia Đàm Hoàng Phúc sẽ đưa ra những quan điểm, xung quanh việc lái và sử dụng ôtô điện, tại tọa đàm Car Talks, công chiếu 14h, 30/11. - VnExpress","https://vnexpress.net/chieu-nay-cong-chieu-toa-dam-oto-dien-thay-doi-thoi-quen-lai-xe-the-nao-4682968.html","Thứ năm, 30/11/2023, 09:30 (GMT+7)","https://i1-vnexpress.vnecdn.net/2023/11/30/thumbvinfast202301-1701310722-5451-4625-1701311007.jpg?w=1200&h=0&q=100&dpr=1&fit=crop&s=ihsUT4U7dLEENnBH3j79Iw","","Thị trường","https://vnexpress.net/tin-tuc-24h"
"4682933","Sao 'Sex and the City' qua đời","Theo People hôm 30/11, diễn viên mất vì tuổi già ở New Rochelle, New York ba ngày trước. Gia đình cho biết sẽ tổ chức một buổi kỷ niệm sự nghiệp và cuộc đời của Frances vào giữa tháng 1 năm sau - gần dịp sinh nhật lần thứ 94.
Trên Instagram, John Carlin - con trai Frances - đăng loạt hình của mẹ và tưởng nhớ bà: ""Vào tối thứ hai, mẹ đã qua đời yên bình tại nhà. Tôi muốn thể hiện lòng biết ơn đối với nghệ sĩ và con người tuyệt vời như Frances Sternhagen. Mẹ được nhiều người yêu mến, tôi rất may mắn khi được là con trai, bạn bè, đối tác hát và nhảy cùng bà. Hãy bay đi, Frannie, cuộc sống mẹ kết thúc bằng sự đủ đầy, đam mê, khiêm tốn và rộng lượng"".
Anh nói thêm dự định biểu diễn ở London vào cuối tuần để tri ân mẹ, hát một ca khúc được Frances truyền cảm hứng. Sinh thời, bà luôn ủng hộ và khuyến khích con ca hát cũng như viết lách. Cả hai có mối quan hệ khăng khít, thường xuyên gặp và nói lời yêu thương với nhau.
Frances nổi tiếng với những nhân vật người mẹ, đóng mẹ của Cliff Clavin trong series Cheers và Bunny Macdougal - mẹ của Trey - trong Sex and the City. Hai vai diễn có điểm chung là tính cách mạnh mẽ và nghiêm khắc, giúp bà nhận ba đề cử Emmy. ""Phải nói rằng việc đóng những phụ nữ già kiêu ngạo rất vui, họ luôn luôn thú vị khi làm phiền toái mọi người xung quanh. Tôi biết những phụ nữ như vậy và tôi chắn chắn có thể bắt chước họ"", Frances nói trên Los Angeles Times năm 2002.
Frances Sternhagen là diễn viên Mỹ, tham gia sân khấu kịch Broadway và màn ảnh rộng. Bà từng nhận hai giải Tony cho vai diễn trong The Good Doctor (1974) và The Heiress (1995), năm lần được đề cử giải này. Bà còn xuất hiện trong nhiều bộ phim như Outland (1981), Misery (1990), Starting Over (1979), And So It Goes (2014). Bà kết hôn diễn viên Thomas A. Carlin năm 1956, có sáu con cùng các cháu.","Mỹ- Frances Sternhagen - nổi tiếng trong &quot;Sex and the City&quot; và &quot;Cheers&quot; - qua đời ở tuổi 93. - VnExpress","https://vnexpress.net/sao-sex-and-the-city-qua-doi-4682933.html","Thứ năm, 30/11/2023, 09:21 (GMT+7)","https://i1-giaitri.vnecdn.net/2023/11/30/FrancesSternhagen-1701307643-6484-1701310357.jpg?w=1200&h=0&q=100&dpr=1&fit=crop&s=1a4mGqe7o0NE6nM2S75AxQ","","Quốc tế","https://vnexpress.net/tin-tuc-24h"
