"""ID"", ""Title"", ""Content"", ""Description"", ""URL"", ""Publication Date"", ""Image URL"", ""Author"", ""Category"", ""Source"""
"4681786","Lính Ấn Độ đào 'hang chuột' để cứu 41 công nhân kẹt trong hầm","Abhishek Ruhela, quan chức bang Uttarakhand, hôm nay cho biết công binh Ấn Độ sẽ dùng máy khoan tay để đào một đường hầm nhỏ qua 9 mét đất đá còn lại nhằm đưa 41 công nhân ra ngoài.
Đây được gọi là kỹ thuật ""đào hang chuột"" vốn được áp dụng trong lĩnh vực khai mỏ, trong đó các binh sĩ sẽ khoan cẩn thận qua lớp đất đá để tạo một lối đi hẹp, chỉ đủ một người qua.
Kỹ thuật này được áp dụng do máy khoan hạng nặng đã bị hỏng và mắc kẹt sau khi xuyên qua 60 mét đất đá trong hầm. Ông Ruhela cho hay các bộ phận máy khoan kẹt trong hầm đã được loại bỏ nhờ máy cắt plasma.
Trong một nỗ lực riêng biệt, các đội khoan từ đỉnh hầm đã khoan được hơn 1/4 quãng đường sâu 89 mét thẳng xuống nơi các công nhân mắc kẹt. Các đội khác cũng bắt đầu cho nổ mìn, khoan từ hướng xa hơn, ước tính có độ dài 480 mét. Nhiệt độ tại khu vực thuộc dãy Himalaya hẻo lánh này giảm mạnh trong những ngày qua, gây nhiều khó khăn cho công tác cứu nạn.
41 công nhân mắc kẹt từ khi hầm đường bộ đang thi công ở khu vực dãy Himalaya, bang Uttarakhand, đổ sập ngày 12/11.
Lực lượng cứu hộ đã triển khai 5 phương án giải cứu, thực hiện từ ba hướng khác nhau, song liên tục gặp trở ngại. Lực lượng cứu hộ trước đó luồn được một đường ống nhỏ vào trong hầm, giúp cung cấp oxy, nước và đồ ăn nhẹ cho các công nhân.
Hơn 10 bác sĩ, trong đó có chuyên gia tâm lý, đang có mặt tại hiện trường để giám sát tình hình sức khỏe của 41 công nhân trong hầm. Những người mắc kẹt được khuyến cáo tập yoga, đi bộ trong đoạn hầm dài 2 km và liên tục nói chuyện với nhau, trong khi thân nhân lo lắng cắm trại chờ đợi bên ngoài.
Đường hầm dài 4,5 km, được xây dựng giữa thành phố Silkyara và Dandalgaon nhằm kết nối hai ngôi đền Hindu linh thiêng nhất Ấn Độ là Uttarkashi và Yamnotri. Giới chức Ấn Độ chưa nêu nguyên nhân khiến đường hầm sập, nhưng khu vực này thường xuyên chịu ảnh hưởng bởi sạt lở, động đất và lũ lụt.","Công binh Ấn độ chuẩn bị khoan thủ công theo phương pháp &quot;đào hang chuột&quot; để tiếp cận 41 công nhân kẹt 16 ngày trong hầm tại bang Uttarakhand. - VnExpress","https://vnexpress.net/linh-an-do-dao-hang-chuot-de-cuu-41-cong-nhan-ket-trong-ham-4681786.html","Thứ hai, 27/11/2023, 15:51 (GMT+7)","https://i2-vnexpress.vnecdn.net/2023/11/27/344z3yw-highres-1701071197-170-7106-1593-1701071560.jpg?w=1200&h=0&q=100&dpr=1&fit=crop&s=uRXVcLuYlBTx8IUyVgWUIw","","Cuộc sống đó đây","https://vnexpress.net/tin-tuc-24h"
"4681823","Chủ tịch nước mong kiều bào trẻ tạo dựng được niềm tin yêu của người Nhật","Chủ tịch nước Võ Văn Thưởng sáng 27/11 tới thăm cán bộ, nhân viên đại sứ quán Việt Nam và gặp gỡ các trí thức đại diện các thế hệ người Việt tại Nhật Bản, theo TTXVN. Đây là một hoạt động của Chủ tịch nước trong khuôn khổ chuyến thăm chính thức Nhật Bản ngày 27-30/11.
Đại sứ Việt Nam tại Nhật Bản Phạm Quang Hiệu cho biết lực lượng trí thức trẻ Việt Nam tại Nhật Bản ngày càng tăng, tích cực đóng góp cho sở tại và đều mong muốn cống hiến cho quê hương, đất nước, là cầu nối thúc đẩy quan hệ hai nước.
Cho rằng người Việt Nam luôn yêu mến và dành tình cảm tốt đẹp với người dân Nhật Bản và ngược lại, Chủ tịch nước đề nghị đại sứ quán thúc đẩy các hoạt động giao lưu văn hóa, giao lưu nhân dân, nhất là phát huy vai trò của gần 100 cặp địa phương thiết lập quan hệ hợp tác giữa hai nước.
Chủ tịch nước bày tỏ vui mừng và tự hào về những thành tựu mà các tri thức, đại diện các giới tiêu biểu người Việt tại Nhật Bản đã đóng góp cho nước sở tại, cũng như vun đắp cho quan hệ hai nước. Ông cho rằng những thành công đó của kiều bào có được nhờ tinh thần, ý chí và nghị lực bền bỉ trong quá trình sinh sống, học tập xa quê hương, đất nước và gặp không ít khó khăn.
Giáo sư Trần Văn Thọ, Giáo sư Danh dự Đại học Waseda, cho biết người Nhật Bản rất yêu mến, tin tưởng tiềm năng con người, hợp tác với Việt Nam và mong muốn quan hệ Việt Nam - Nhật Bản sẽ phát triển mạnh mẽ hơn sau chuyến thăm của Chủ tịch nước.
Giáo sư cho rằng thúc đẩy hợp tác với Nhật Bản trong các lĩnh vực khoa học công nghệ, giáo dục đào tạo, nâng cao chất lượng quản trị nhà nước và năng lực của doanh nghiệp cũng sẽ góp phần thực hiện mục tiêu đưa Việt Nam trở thành nước thu nhập cao đến năm 2045.
Phó Giáo sư Hồ Anh Văn, Viện Khoa học công nghệ tiên tiến Nhật Bản, mong muốn có nhiều thêm sinh viên Việt Nam sang Nhật học tập và các chuyên gia người Việt tại Nhật sẽ nỗ lực để tham gia đào tạo nhân lực chất lượng cao cho Việt Nam.
Chủ tịch nước hoan nghênh các nhà khoa học đầu ngành người Việt tại các đại học Nhật Bản đã đào tạo nghiên cứu sinh, kết nối học bổng cho sinh viên Việt Nam. Chủ tịch nước tán thành quan điểm rằng người Việt Nam tại Nhật coi Nhật Bản là nhà, Việt Nam là quê hương, tiếp tục nỗ lực, cố gắng cống hiến cho cộng đồng sở tại, đồng thời đóng góp cho quan hệ hai nước.
Chủ tịch nước Võ Văn Thưởng mong muốn các bạn trẻ người Việt tại Nhật tiếp nối thành công của các thế hệ đi trước, tiếp tục gặt hái nhiều thành tựu to lớn trong lĩnh vực công tác, đóng góp cho nước sở tại và quan hệ hai nước.
Chủ tịch nước đặc biệt hy vọng thế hệ này tạo dựng được niềm tin yêu của người Nhật, khẳng định được năng lực, trình độ, phẩm chất của người Việt Nam tại Nhật. Đó là nền tảng chắc chắn nhất để duy trì và thúc đẩy mối quan hệ song phương.
Nhật Bản hiện có nhu cầu lớn về lao động và hợp tác tích cực với Việt Nam trong lĩnh vực này. Cộng đồng người Việt Nam tại Nhật Bản tăng nhanh thời gian qua, hiện có khoảng 520.000 người.
Việt Nam - Nhật Bản thiết lập quan hệ ngoại giao vào ngày 21/9/1973 và xác lập quan hệ Đối tác chiến lược năm 2009. Năm 2014, hai nước xác lập quan hệ Đối tác chiến lược sâu rộng vì hòa bình và thịnh vượng ở châu Á.
Nhật Bản là nước G7 đầu tiên công nhận quy chế kinh tế thị trường của Việt Nam và đã hai lần mời Việt Nam dự Hội nghị thượng đỉnh G7 mở rộng. Quan hệ Việt Nam - Nhật Bản có sự tin cậy chính trị cao, liên kết khu vực ngày càng chặt chẽ, chia sẻ quan điểm chung trong nhiều vấn đề hợp tác khu vực, quốc tế.
Nhật Bản là đối tác kinh tế quan trọng hàng đầu của Việt Nam, đứng thứ nhất về cung cấp viện trợ ODA, thứ hai về hợp tác lao động, thứ ba về đầu tư và du lịch, thứ 4 về thương mại. Kim ngạch thương mại song phương năm 2022 đạt gần 50 tỷ USD, trong đó Việt Nam xuất khẩu sang Nhật Bản 24,2 tỷ USD và nhập khẩu 23,4 tỷ USD.","Chủ tịch nước Võ Văn Thưởng gặp kiều bào tại Nhật, mong các bạn trẻ tạo dựng được niềm tin yêu của cộng đồng sở tại, góp phần xây dựng nền tảng vững chắc cho quan hệ song phương. - VnExpress","https://vnexpress.net/chu-tich-nuoc-mong-kieu-bao-tre-tao-dung-duoc-niem-tin-yeu-cua-nguoi-nhat-4681823.html","Thứ hai, 27/11/2023, 15:49 (GMT+7)","https://i2-vnexpress.vnecdn.net/2023/11/27/cats-1701073379-8118-1701073588.jpg?w=1200&h=0&q=100&dpr=1&fit=crop&s=ap7SnHFop_5CTnYl5_ZXXw","","Thế giới","https://vnexpress.net/tin-tuc-24h"
"4681684","Hỏng mặt sau dùng thuốc tẩy nám cấp tốc","Trước đó, người bệnh mua một loại kem được quảng cáo trị nám cấp tốc trên mạng. Thời gian đầu, chị thấy da sáng, bóng và đẹp hơn. Sau vài tuần sử dụng, da bắt đầu ngứa, đỏ, tổn thương ở cả mặt và tay nên chị đi khám.
Ngày 27/11, bác sĩ Lê Vi Anh, Khoa Da liễu - Thẩm mỹ da, Bệnh viện Đại học Y dược TP HCM, cho biết bệnh nhân bị nám do sử dụng sản phẩm không rõ nguồn gốc, chỉ định dùng thuốc uống và bôi để xử lý vết nám ngoài da. Hiện, tình trạng da cải thiện 50%.
Nguyên nhân gây nám da, đồi mồi thường là nắng, thay đổi về nội tiết tố sau sinh hoặc có bệnh lý tuyến giáp, rối loạn nội tiết, dùng thuốc tránh thai, bệnh nhân sử dụng loại thuốc tăng nhạy cảm với ánh sáng, stress, mất ngủ...
Trường hợp sử dụng mỹ phẩm không đúng cách, tăng nhạy cảm ánh sáng nhưng không dùng kem chống nắng, mỹ phẩm có chứa corticoid sẽ làm da mỏng, giãn mạch, bắt nắng. Da sau sử dụng kem có chứa corticoid tăng sắc tố, teo mỏng, hàng rào da không được bảo vệ tốt thường gây nổi mụn, tăng nám, tăng nguy cơ nhiễm trùng da.
Tùy từng bệnh nhân, bác sĩ sẽ có cách điều trị riêng. Bác sĩ khuyến cáo người bị nám, đồi mồi không nên nghe tin về những sản phẩm được quảng cáo trị cấp tốc. Thời gian điều trị nám và đồi mồi mất ít nhất 3-6 tháng và cũng chỉ giảm nám được từ từ.
Ngoài ra, bệnh dễ tái phát nên cần điều trị theo chỉ định của bác sĩ kể cả khi xong liệu trình.","TP HCM- Sau vài tuần bôi kem trị nám cấp tốc mua trên mạng, da mặt người phụ nữ viêm đỏ, lan xuống cả tay, nguyên nhân do dùng thuốc không nguồn gốc. - VnExpress","https://vnexpress.net/hong-mat-sau-dung-thuoc-tay-nam-cap-toc-4681684.html","Thứ hai, 27/11/2023, 15:48 (GMT+7)","https://i1-suckhoe.vnecdn.net/2023/11/27/Anhmanhinh20231127luc135249-17-9183-5588-1701068071.png?w=1200&h=0&q=100&dpr=1&fit=crop&s=OwICknyO2Mg_147rYoDfhg","","Tin tức","https://vnexpress.net/tin-tuc-24h"
"4681751","Ngân sách an ninh Olympic 2024 thấp nhất trong 20 năm","Tiền cho an ninh dự tính chiếm 4,7% tổng ngân sách ban đầu 7,4 tỷ USD. Con số này chỉ cao hơn Olympic Sydney 2000 (khoảng 179,6 triệu USD). Thực tế qua các kỳ Olympic, các khoản chi phí thường tăng cao hơn kế hoạch bao gồm an ninh. Đến cuối năm 2022, chính phủ Pháp công bố chi phí đã tăng lên khoảng 8,5 tỷ USD.
Tại Olympic Athens 2004, chi phí an ninh thực tế là 1,3 tỷ USD (14% tổng ngân sách). Bắc Kinh 2008 là 6,5 tỷ USD (15,5%), London 2012 là 870 triệu USD (6%), Rio 2016 là 895 triệu USD (6,8%) và Tokyo 2020 phải tăng chi phí vì phòng dịch Covid-19 với 1,5 tỷ USD (11,5%).
Theo Reuters, khủng bố và tấn công mạng là hai rủi ro an ninh chính mà Olympic 2024 phải đối mặt. Giám đốc điều hành an ninh Thomas Collomb cho biết rủi ro về khủng bố đã được lên kế hoạch, nhưng rủi ro chính là nguy cơ bị tấn công mạng và máy bay không người lái (UAV).
Thế vận hội tại Pháp đang phát động đợt thứ ba trong bốn lần đấu thầu an ninh tư nhân, dự kiến có 17.000 đến 22.000 nhân viên an ninh mỗi ngày. Quân đội Pháp có kế hoạch huy động 15.000 binh sĩ, chủ yếu được triển khai tại địa điểm tổ chức chính là thủ đô Paris. Quân đội lên kế hoạch triển khai các loại UAV giám sát không phận, máy bay chiến đấu, trực thăng trang bị hoả lực và thiết bị vô hiệu hoá UAV.
Tờ Le Monde cho biết Pháp thông qua dự luật mới cho phép sử dụng tạm thời camera kết hợp phần mềm trí tuệ nhân tạo ở Olympic để nhận dạng gương mặt. Các nhà phê bình lo ngại điều này sẽ làm xói mòn vĩnh viễn quyền riêng tư và quyền tự do dân sự.
Sự kiện được bảo vệ nghiêm ngặt nhất là lễ khai mạc vào ngày 26/7, với một cuộc diễu hành dài trên sông Seine có khoảng 600.000 người tham dự. 30.000 cảnh sát và binh sĩ được huy động đảm bảo an ninh xung quanh. Bà Brittany Jacobs - Trưởng khoa Quản lý thể thao thuộc Hệ thống Đại học công lập Mỹ - cho biết đây là sự kiện lớn chưa từng thấy ở châu Âu xét về góc độ an ninh. ""Rủi ro tiềm ẩn rất cao"", bà nói với Reuters. ""Nếu thành công, chúng ta sẽ nói về nó suốt nhiều thập kỷ"".
Lần gần nhất một kỳ Olympic xảy ra vấn đề an ninh lớn là tại Mỹ năm 1996. Vụ đánh bom tại công viên Olympic Atalanta khiến một người thiệt mạng và 111 người bị thương. Trong khi đó, Pháp từng xảy ra vụ khủng bố vào tháng 11/2015 ở nhiều địa điểm giải trí và quán cà phê tại Paris, cùng lúc ấy, trận giao hữu giữa Pháp và Đức đang diễn ra tại sân Stade de France.
Olympic Paris khai mạc ngày 26/7 và bế mạc ngày 11/8. Sự kiện gồm 10.500 VĐV tranh tài ở 329 nội dung thuộc 32 môn. Paris là thành phố đăng cai chính, bên cạnh 16 thành phố và đảo Tahiti - thuộc Pháp nằm ở Thái Bình Dương.
Việt Nam đã có ba suất chính thức đến Paris năm sau gồm xạ thủ Trịnh Thu Vinh – 10 m súng ngắn cá nhân nữ, Nguyễn Thị Thật – đua xe đạp đường trường nữ và Nguyễn Huy Hoàng – bơi 800 m tự do nam.","Ban tổ chức Olympic Paris 2024 cho rằng ngân sách 350 triệu USD là đủ để đối mặt với các thách thức an ninh. - VnExpress","https://vnexpress.net/ngan-sach-an-ninh-olympic-2024-thap-nhat-trong-20-nam-4681751.html","Thứ hai, 27/11/2023, 15:44 (GMT+7)","https://i1-thethao.vnecdn.net/2023/11/27/olympic-paris-2024-1-170106069-8141-6181-1701061444.png?w=1200&h=0&q=100&dpr=1&fit=crop&s=bMSwpz6IR0GJEgmMtOtryg","","Các môn khác","https://vnexpress.net/tin-tuc-24h"
"4681798","Ramsdale cảm kích trước hành động của CĐV Arsenal","""Một cảm xúc mà tôi không bao giờ xem đó là điều tất nhiên. Tôi yêu việc trở thành một phần của CLB này. Người hâm mộ thể hiện sự cuồng nhiệt vượt bậc khi ủng hộ tôi. Cảm ơn"", Ramsdale viết trên Instagram.
Ramsdale được Arsenal tuyển mộ với giá 33 triệu USD từ Sheffield United hè 2021, và lập tức lấy suất bắt chính của thủ thành số một lúc đó Bernd Leno. Tại Ngoại hạng Anh mùa trước, anh chơi cả 38 trận, giữ sạch lưới 14 trận, góp công lớn giúp Arsenal giành vị trí á quân. Nhưng mùa này, tuyển thủ Anh mất vị trí vào David Raya - người được mượn về từ Brentford kèm tùy chọn mua đứt với mức phí 35 triệu USD vào hè 2024. HLV Mikel Arteta ưu tiên thủ môn đồng hương vì khả năng chơi chân tốt.
Ramsdale không thi đấu tại Ngoại hạng Anh từ sau trận thắng Man Utd 3-1 hôm 3/9. Từ đó, anh chỉ ra sân thêm hai lần ở Cup Liên đoàn - trận thắng Brentford 1-0 ở vòng ba và thua West Ham 1-3 ở vòng 1/8, trước khi anh trở lại Ngoại hạng Anh cuối tuần qua vì Raya không được phép ra sân chống lại đội chủ quản hiện tại.
Đồng cảm với Ramsdale, nhiều CĐV Arsenal ủng hộ bằng việc mặc áo đấu, giương cao băng-rôn và liên tục hát vang tên anh. Các đồng đội cũng tìm cách vỗ về. Sau trận, hầu hết đều chạy đến ăn mừng cùng Ramsdale.
Tuy nhiên, việc ít được ra sân ảnh hưởng nhiều đến màn trình diễn của Ramsdale. Điển hình là phút 13, anh chần chừ trong việc đưa bóng lên rồi chuyền lỗi khi đối thủ áp sát trong cấm địa. May mắn cho thủ thành 25 tuổi khi tiền vệ Declan Rice kịp lùi về, cản ngay trên vạch vôi cú dứt điểm của Bryan Mbeumo. Ramsdale còn một một lần ném bóng lên hỏng, buộc các đồng đội phải giải vây.
Sang hiệp hai, Ramsdale chơi ổn định hơn, góp phần giúp Arsenal giữ sạch lưới và thắng 1-0. Trong họp báo sau trân, Arteta khen ngợi Ramsdale và không chỉ trích học trò về các sai lầm. ""Đó là bóng đá. Tôi rất vui với những gì đội thể hiện. Chúng tôi giữ sạch lưới và đang tiến bộ. Ramsdale rất dũng cảm, có cá tính. Đó là lý do khiến tôi yêu mến cậu ấy. Tôi thích cách các cầu thủ động viên lẫn nhau"", HLV người Tây Ban Nha nói.
Arteta từng nói sẽ xoay tua giữa Raya và Ramsdale. Nhưng có vẻ như Raya đã thắng thế trong cuộc cạnh tranh và gần đây, truyền thông Anh đưa tin Arsenal quyết định mua đứt Raya. Điều này làm dấy lên tin đồn Ramsdale sẽ rời sân Emirates vào kỳ chuyển nhượng tháng 1.","Anh- Thủ thành Aaron Ramsdale cho biết anh yêu việc trở thành một phần của Arsenal, sau khi liên tục nhận được sự động viên trong trận thắng Brentford ở Ngoại hạng Anh. - VnExpress","https://vnexpress.net/ramsdale-cam-kich-truoc-hanh-dong-cua-cdv-arsenal-4681798.html","Thứ hai, 27/11/2023, 15:40 (GMT+7)","https://i1-thethao.vnecdn.net/2023/11/27/screenshot-2023-11-27-at-14-26-7859-1670-1701070268.png?w=1200&h=0&q=100&dpr=1&fit=crop&s=NdE9FJiO_1SKpRlaO1a7zQ","","Tin tức","https://vnexpress.net/tin-tuc-24h"
"4681648","Honda CR-V 2021 giá 850 triệu nên mua?","","Tôi muốn đổi từ sedan sang xe gầm cao nên tham khảo chiếc CR-V bản L, chạy gần 50.000 km. (Phương Hằng) - VnExpress","https://vnexpress.net/honda-cr-v-2021-gia-850-trieu-nen-mua-4681648.html","Thứ hai, 27/11/2023, 15:37 (GMT+7)","https://i2-vnexpress.vnecdn.net/2023/11/27/HondaCRVjpg1631980227-17010529-3542-5408-1701052968.jpg?w=1200&h=0&q=100&dpr=1&fit=crop&s=QM6eYXnXfUlD5rXWQG0Sfw","","Hỏi đáp","https://vnexpress.net/tin-tuc-24h"
