"""ID"", ""Title"", ""Content"", ""Description"", ""URL"", ""Publication Date"", ""Image URL"", ""Author"", ""Category"", ""Source"""
"4681644","Fernandes nhường Rashford đá phạt đền trước Everton","Mùa trước, Rashford ghi 30 bàn trong 56 trận cho Man Utd. Tuy nhiên, sau 16 trận mùa này tính đến trước trận làm khách của Everton, tiền đạo 26 tuổi mới ghi bàn, ở trận thua Arsenal 1-3 ngày 3/9. Vì thế, hôm qua, khi Man Utd được hưởng phạt đền ở phút 56, Fernandes đã nhường Rashford quyền đá quả phạt này, để giúp đồng đội lấy lại tự tin và phong độ.
""Tôi cảm thấy Marcus cần một chút tự tin và cần bàn thắng"", Fernandes nói với Sky Sports sau khi được hỏi về việc nhường quyền đá quả 11m. ""Marcus đá phạt đền xuất sắc, và tôi chắc 100% rằng cậu ấy có thể ghi bàn"".
Cũng theo Fernandes, vấn đề không phải là ai thực hiện quả phạt đền, mà là việc ghi bàn. Đội trưởng Man Utd cũng cho rằng ngoài Rashford, các tiền đạo và tiền vệ cánh khác cũng cần ghi bàn. Anh coi đó là một phần trong lối chơi và giúp các cầu thủ có thêm động lực.
""Sau quả phạt đền thành bàn này, tôi nghĩ Marcus là không thể ngăn cản"", Fernandes nói thêm. ""Mùa trước, cậu ấy đã chơi rất tuyệt, nên mọi người kỳ vọng cao hơn. Vấn đề chỉ là việc lấy lại cảm giác ghi bàn và chứng tỏ lại đẳng cấp thế giới"".
Tối 26/11, Man Utd có trận đầu tiên thắng nhiều hơn một bàn cách biệt từ đầu mùa. Ngay phút thứ ba, sau quả tạt của Diogo Dalot, Alejandro Garnacho vô lê cắt kéo mở tỷ số. Sau khởi đầu thuận lợi, Man Utd gặp không ít khó khăn trước Everton. Tuy nhiên, thủ môn Andre Onana và hàng thủ vẫn đứng vững.
Phút 52, sau tình huống Ashley Young phạm lỗi với Anthony Martial, trọng tài cho Man Utd hưởng phạt đền. Fernandes nhường cho Rashford thực hiện, nâng tỷ số lên 2-0. Đến phút 75, sau đường chuyền của Fernandes, Martial lốp bóng qua thủ môn ấn định chiến thắng 3-0.
Sau trận thắng Everton, Man Utd trở lại vị trí thứ sáu Ngoại hạng Anh. ""Quỷ Đỏ"" đang có 24 điểm sau 13 vòng, chỉ kém đội xếp thứ tư Aston Villa bốn điểm. Trong khi đó, Everton vẫn xếp cuối bảng với bốn điểm. Đội này vừa bị trừ 10 điểm do vi phạm luật công bằng tài chính.","Anh- Được chỉ định đá phạt đền, nhưng tiền vệ Bruno Fernandes nhường đồng đội Marcus Rashford quyền đá quả phạt này trong trận Man Utd thắng Everton 3-0. - VnExpress","https://vnexpress.net/fernandes-nhuong-rashford-da-phat-den-truoc-everton-4681644.html","Thứ hai, 27/11/2023, 14:27 (GMT+7)","https://i1-thethao.vnecdn.net/2023/11/27/newproject20231127t095900791-1-5955-9382-1701054092.jpg?w=1200&h=0&q=100&dpr=1&fit=crop&s=W-tfLQM-5n95LrGOBRhyew","","Tin tức","https://vnexpress.net/tin-tuc-24h"
"4681548","Tác giả 67 tuổi đoạt giải nhất viết tiểu thuyết về cuộc mưu sinh","Hội Nhà văn Việt Nam cùng Tổng liên đoàn Lao động, báo Lao động tổng kết, trao giải cuộc thi Sáng tác văn học về đề tài công nhân, công đoàn tại Nhà hát Lớn tối 26/11.
Hoa xương rồng của tác giả Nguyễn Trí giành giải nhất thể loại tiểu thuyết. Tác phẩm viết về một gia đình lao động với những va đập vì mưu sinh của các thành viên.
Nguyễn Trí cho biết ông viết tác phẩm trong 35 ngày, lấy chất liệu từ chính biến cố gia đình, nguyên mẫu đều là vợ chồng, con cái ông. Năm Thao, ông già trong tác phẩm làm đủ nghề mưu sinh, bị tai nạn nằm viện. Bà Năm Thao phải đi vay tiền xã hội đen để lo cho chồng. Hương, con gái phải bỏ học sớm để phụ kinh tế cho cha mẹ.
""Vốn sống có sẵn, tôi chỉ cần sắp xếp lại và viết ra. Mỗi chi tiết, con chữ đều đánh đổi bằng máu, nước mắt cả cuộc đời"", ông cho biết, nói thêm rằng nhìn lại đời mình thấy cần phải viết ""để được an ủi mà bước tiếp"".
Tác giả Nguyễn Trí quê Bình Định, từng xuất hiện trong phiên tòa đẫm nước mắt chốn pháp đình 13 năm trước, khi con gái ông là nạn nhân, qua đời sau một vụ đánh ghen ở khu công nghiệp Nhơn Trạch (Đồng Nai). Nữ bị cáo năm đó 18 tuổi, đứng trước vành móng ngựa khi mới sinh con. Suốt buổi hầu tòa, người ẵm bồng em bé ở phía dưới chính là vợ ông Nguyễn Trí.
Ông già mất con, trong bộ quần áo bạc phếch màu, cùng vợ vượt 80 km đến pháp đình xin giảm án cho kẻ đã gây ra cái chết cho con mình. ""Tôi nghĩ đó là điều mình nên làm như cách để xoa dịu nỗi đau mất con. Tôi biết rất rõ gia đình nó, phải vào đời khi nhân cách chưa kịp hình thành, giống như một bông hoa dại lạc lõng giữa đường"", ông nói khi ấy.
Nhận thưởng 300 triệu đồng, tác giả cho biết số tiền sẽ giúp ích rất nhiều trong lúc túng quẫn, con cái khó khăn vì công việc. Giải thưởng đồng thời giúp ông có thêm động lực sáng tác cũng như tin tưởng vào con đường mình đi.
Ông có nhiều năm cầm bút, từng thắng Giải thưởng Hội Nhà văn Việt Nam về văn xuôi cho tác phẩm Bãi vàng, đá quý, trầm hương năm 2013. Ông cũng xuất bản các tập sách như Ăn bay, Ảo và sợ, Trí Khùng tự truyện, Tuổi thơ không có cánh diều.
Tiểu thuyết Phía sau tiếng sóng của Trương Anh Quốc và Nhân quả của Đoàn Hữu Nam cùng giành giải nhì.
Giải nhất hạng mục truyện ngắn trao cho Con đường của Hạ của tác giả Trịnh Thị Phương Trà, nhận thưởng 150 triệu đồng. Tác phẩm tái hiện cuộc sống khu trọ nghèo, nơi những phụ nữ gặp nhiều thăng trầm tìm về nương tựa nhau. Hạ - nhân vật chính - vật lộn với gian khó để giữ trái tim ấm áp, tìm được hạnh phúc.
Giải nhì dành cho Hệ sinh thái và cánh diều của cha của tác giả Nguyễn Thị Oanh, Nước mắt Mặc Nưa của Tống Phước Bảo.
Sau hai năm phát động và nhận bài dự thi, ban tổ chức trao giải cho 24 tác phẩm, gồm 11 tiểu thuyết và 13 truyện ngắn. Bối cảnh trong các tác phẩm trải dài khắp đất nước, từ công nhân nông trường chè Tây Bắc, trong hầm mỏ ở Quảng Ninh đến lao động ở xí nghiệp Đồng Nai, Bình Dương. Nhân vật đa dạng, từ công nhân xưởng dệt đến khai thác than, lọc hóa dầu, trồng thuốc lá trên núi hay công nhân trong các nhà máy trước cách mạng 4.0.
Ông Ngọ Duy Hiểu, Phó chủ tịch Tổng liên đoàn Lao động Việt Nam, đánh giá cuộc thi khơi lại mạch ngầm văn học về công nhân lao động, công đoàn, góp vào dòng chảy chung của văn học nghệ thuật nước nhà. Đời sống, việc làm, tâm tư lao động là nguồn chất liệu, đề tài vô tận cho các tác giả. Các tác phẩm cũng giúp xã hội nhìn nhận, thấu hiểu đời sống công nhân trong tình hình mới.
""Dù còn khó khăn, công nhân luôn giữ niềm tin về tương lai. Họ sống tử tế, chân thành, biết chia sẻ và có khát vọng cống hiến"", ông nói.
Diễn ra từ tháng 11/2021 đến tháng 8 năm nay, cuộc thi nhận gần 500 tác phẩm của gần 300 tác giả là các nhà văn chuyên nghiệp, không chuyên, công nhân, viên chức, học sinh, người cao tuổi và Việt kiều. Cuộc thi là hoạt động cụ thể hóa Nghị quyết Đại hội XIII của Đảng: Phát triển con người toàn diện và xây dựng nền văn hóa Việt Nam tiên tiến, đậm đà bản sắc dân tộc để văn hóa thực sự trở thành sức mạnh nội sinh, động lực phát triển đất nước và bảo vệ Tổ quốc.","Tác giả Nguyễn Trí lấy chất liệu từ cuộc đời nhiều nước mắt của ông để viết &quot;Hoa xương rồng&quot;, đoạt giải nhất cuộc thi sáng tác về công nhân. - VnExpress","https://vnexpress.net/tac-gia-67-tuoi-doat-giai-nhat-viet-tieu-thuyet-ve-cuoc-muu-sinh-4681548.html","Thứ hai, 27/11/2023, 14:22 (GMT+7)","https://i1-giaitri.vnecdn.net/2023/11/27/nt-9022-1701055756-1701057028-2218-1701060334.jpg?w=1200&h=0&q=100&dpr=1&fit=crop&s=r76sliR3r1xKIiheQb7c9w","","Làng văn","https://vnexpress.net/tin-tuc-24h"
"4681245","Ukraine ngụy trang UAV như đại bàng","Vệ binh Quốc gia Nga cuối tuần trước thông báo lực lượng đặc nhiệm của họ với sự hỗ trợ của lực lượng phản gián đã phát hiện một máy bay không người lái (UAV) được ngụy trang thành một con đại bàng hoạt động tại khu vực Donetsk.
Lực lượng Nga sử dụng thiết bị tác chiến điện tử để gây nhiễu và khiến chiếc UAV rơi xuống đất. Trong quá trình kiểm tra, lính Nga phát hiện camera trinh sát giấu bên trong chiếc UAV được sơn vẽ như lông đại bàng, song chưa rõ đây cụ thể là dòng nào.
Hình ảnh do lực lượng Vệ binh Quốc gia Nga chia sẻ trên Telegram cho thấy chiếc UAV được gắn mỏ, cánh và và phần thân được vẽ lông vũ giống như chim đại bàng. Ngụy trang kiểu này khiến chiếc UAV khó bị phát hiện hơn, song không thể qua mặt được thiết bị tác chiến điện tử.
""Quân đội Ukraine hy vọng phòng không Nga sẽ không phát hiện ra chiếc UAV nếu như nó được ngụy trang như một vật thể thường thấy trên bầu trời. Tuy nhiên, phòng không Nga đã không bị đánh lừa"", chuyên trang quân sự Topwar nhận xét.
Việc ngụy trang UAV giống loài chim là một chiến thuật không mới, từng được tình báo Somalia sử dụng hồi năm 2016, nhưng đây là lần đầu tiên xuất hiện thông tin về chiến thuật này ở Ukraine.
Nga năm 2019 cũng công bố dự án phát triển mẫu UAV có hình dạng giống con cú, có thể chỉ thị mục tiêu cho pháo binh, chiến đấu cơ bằng tia laser. Truyền thông Nga khi đó cũng cho biết nước này đang phát triển một mẫu UAV khác có hình dạng giống chim cắt, song hiện chưa rõ tiến độ của các dự án.
UAV, đặc biệt là dòng góc nhìn người thứ nhất (FPV), là một trong các vũ khí chủ đạo tại chiến trường Ukraine. Theo Samuel Bendett, chuyên gia tại Trung tâm Phân tích Hải quân (CNA) có trụ sở tại Mỹ, UAV FPV có giá khoảng vài trăm USD, song có thể đảm nhiệm một phần vai trò của lính bắn tỉa, pháo binh và tên lửa, đặc biệt hiệu quả trong việc tiêu diệt xe tăng, thiết giáp có giá đắt gấp hàng nghìn lần.
Hình ảnh trên mạng xã hội cho thấy lực lượng Nga ở Ukraine gần đây đẩy mạnh trang bị thiết bị tác chiến điện tử cầm tay cho xe tăng, thiết giáp, nhằm đối phó với UAV của đối phương.
Trong khi đó, Ukraine cũng không ngừng phát triển các dòng UAV có khả năng chống thiết bị tác chiến điện tử, bằng cách chuyển sang chế độ tự động lái khi kết nối với tổ vận hành bị gián đoạn hoặc liên tục chuyển tần số hoạt động để tránh bị gây nhiễu sóng.","Lực lượng Ukraine ngụy trang UAV trinh sát thành đại bàng để tránh bị Nga phát hiện, song vẫn bị thiết bị tác chiến điện tử đối phương đánh chặn. - VnExpress","https://vnexpress.net/ukraine-nguy-trang-uav-nhu-dai-bang-4681245.html","Thứ hai, 27/11/2023, 14:19 (GMT+7)","https://i2-vnexpress.vnecdn.net/2023/11/25/nh-1700894972-2894-1700895051.png?w=1200&h=0&q=100&dpr=1&fit=crop&s=F1YJImbRwBLUUdr2i7MIJw","","Quân sự","https://vnexpress.net/tin-tuc-24h"
"4681652","Triều Tiên tuyên bố sẽ phóng thêm nhiều vệ tinh","Hãng thông tấn trung ương Triều Tiên KCNA hôm nay dẫn tuyên bố của một quan chức Bộ Ngoại giao nói rằng ""Tuyên bố chung 10 quốc gia"" của Mỹ và đồng minh đã cho thấy nguyên nhân khiến Hội đồng Bảo an Liên Hợp Quốc ""không thể làm tròn trách nhiệm đảm bảo hòa bình và an ninh quốc tế"".
Mỹ và 9 quốc gia tuần trước ra tuyên bố chung chỉ trích Triều Tiên phóng tên lửa đẩy mang vệ tinh trinh sát vào không gian. Tuyên bố chung nói rằng Bình Nhưỡng đã sử dụng công nghệ tên lửa đạn đạo trong vụ phóng, vi phạm nhiều nghị quyết của Hội đồng Bảo an.
Quan chức Bộ Ngoại giao Triều Tiên cho hay phóng vệ tinh trinh sát là ""quyền phòng vệ hợp pháp, chính đáng"" của Bình Nhưỡng nhằm đối phó với ""các hành động quân sự nghiêm trọng của Mỹ và đồng minh"".
Người này cáo buộc các nước ký vào tuyên bố chung là ""tiêu chuẩn kép"" và đây là ""văn kiện vô nghĩa"" không có hiệu lực pháp lý quốc tế hay ảnh hưởng chính trị.
""Triều Tiên hoàn toàn khẳng định các quyền chủ quyền, trong đó có phóng vệ tinh, để cho thấy Mỹ và phương Tây can thiệp bất hợp pháp, liều lĩnh vào công việc nội bộ của các quốc gia có chủ quyền. Tiêu chuẩn kép của họ sẽ không bao giờ có tác dụng. Chúng tôi sẽ tiếp tục tiến hành các vụ phóng vệ tinh, đóng góp vào việc thiết lập trật tự quốc tế công bằng và bình đẳng"", quan chức này nêu thêm.
Quan chức Triều Tiên cũng cảnh báo rằng nếu Mỹ và đồng minh sẽ phải ""hoàn toàn chịu trách nhiệm"" về những hậu quả phát sinh từ hành động ""vi phạm chủ quyền Triều Tiên"", nhưng không nêu cụ thể.
Triều Tiên thông báo phóng thành công vệ tinh trinh sát quân sự Malligyong-1 vào đêm 21/11. Mỹ, Nhật Bản và Hàn Quốc ""lên án mạnh mẽ vụ phóng vệ tinh của Triều Tiên gây bất ổn cho khu vực"".
Trong khi đó, KCNA đăng bài bình luận chỉ trích Mỹ vì cung cấp vũ khí hiện đại cho ""các con rối"" của mình, khiến căng thẳng gia tăng, cảnh báo dù chỉ một tia lửa nhỏ trên bán đảo Triều Tiên cũng có thể dẫn đến chiến tranh hạt nhân.","Triều Tiên chỉ trích tuyên bố chung của Mỹ và đồng minh về vụ phóng vệ tinh trinh sát đầu tiên của nước này, tuyên bố sẽ tiếp tục đưa vệ tinh vào vũ trụ. - VnExpress","https://vnexpress.net/trieu-tien-tuyen-bo-se-phong-them-nhieu-ve-tinh-4681652.html","Thứ hai, 27/11/2023, 14:11 (GMT+7)","https://i2-vnexpress.vnecdn.net/2023/11/27/34498tp-preview-1701060425-8975-1701060796.jpg?w=1200&h=0&q=100&dpr=1&fit=crop&s=65HisNd2HACth_hfIxofHQ","","Thế giới","https://vnexpress.net/tin-tuc-24h"
"4681747","Bị bỏng lạnh bởi khí oxy lỏng","Minh (quê Tiền Giang) tự sơ cứu bằng cách dội nước mát, đắp nha đam để giảm nóng rát, sau đó tới phòng khám được bác sĩ kê thuốc uống giảm đau và kháng viêm. Ba ngày sau chỗ bỏng phồng rộp, đau nhiều hơn kèm sốt, Minh đến Bệnh viện Đa khoa Tâm Anh TP HCM khám.
Ngày 27/11, tiến sĩ, bác sĩ Đặng Thị Ngọc Bích, chuyên khoa Da liễu - Thẩm mỹ da, Bệnh viện Tâm Anh, cho biết bệnh nhân bị bỏng lạnh độ 2, tổn thương da và mô bàn tay trái, diện tích khoảng 5 cm. Bỏng lạnh là tình trạng mô sống ở người bị đông cứng và tổn thương do tiếp xúc với nhiệt độ quá thấp (dưới 0 độ C).
Bác sĩ đánh giá bệnh nhân may mắn vì các mạch máu, gân cơ và dây thần kinh ở bàn tay chưa ảnh hưởng. Người bệnh được chọc hút bóng nước, vệ sinh vết thương, bôi thuốc chứa kháng viêm, kháng sinh. Sau 5 ngày, vết bỏng ổn định, hết đau rát. Dự kiến khoảng một tuần nữa vết thương lành, mọc da non.
Theo bác sĩ Bích, bỏng lạnh ít gặp hơn so với các loại bỏng khác như bỏng nhiệt, bỏng lửa, bỏng điện, bỏng hóa chất. Các nguyên nhân phổ biến là tiếp xúc trực tiếp với các loại khí, vòi xịt khí hóa lỏng như nitơ lỏng, oxy lỏng, CO2 lỏng mà không dùng bảo hộ. Các loại khí này được đưa về dạng nước với nhiệt độ dưới âm 70 độ C.
Ngoài ra, bỏng lạnh có thể gặp khi tiếp xúc với thời tiết lạnh, làm việc trong kho đông lạnh thời gian dài nhưng không mặc đồ bảo hộ; tiếp xúc trực tiếp với nước đá, kim loại lạnh, khói giả bằng khí nitơ lạnh trên các sân khấu... Việt Nam là vùng khí hậu nhiệt đới nên ít xảy ra bỏng lạnh do thời tiết, phần lớn nguyên nhân từ tai nạn trong sinh hoạt, làm việc như Minh.
Bác sĩ Bích cho biết dấu hiệu bỏng lạnh dễ nhận thấy nhất là cảm giác lạnh buốt, tê tái, bỏng rát, nhói đau như kim châm. Sau đó bề mặt da bắt đầu tái đi và chuyển sang màu trắng, đỏ. Vùng da bỏng được làm ấm lại có thể xuất hiện các bóng nước phồng rộp, sưng phù, da chuyển màu đen, tím, mất cảm giác ở chỗ vết thương.
Thời gian cơ thể tiếp xúc với khí lỏng càng gần và càng lâu, diện tích và mức độ bỏng càng nghiêm trọng. Một số trường hợp bỏng nặng, người bệnh bị tổn thương sâu vào mô, cơ, mạch máu bên trong gây hoại tử, phải cắt bỏ phần hoại tử, hạ thân nhiệt, tử vong. Sau khi bỏng lạnh, một số người bệnh có các vấn đề vĩnh viễn như nhạy cảm với lạnh, tê, cứng và đau ở vùng da bị ảnh hưởng.
Để sơ cứu bỏng lạnh đúng cách, bác sĩ Bích khuyến cáo người bệnh cần tránh xa nguồn gây bỏng. Sau đó lập tức ngâm hoặc chườm vùng bị bỏng vào nước sạch, nhiệt độ nước tốt nhất từ 37 đến 40 độ C (bằng nhiệt độ cơ thể) để tái lập nhiệt độ bình thường ở vết thương. Dù ban đầu vùng bị bỏng cho cảm giác nóng rát, nhưng đây là ""cảm giác ảo"", thực tế vùng da đang bị lạnh.
Không nên dùng nước quá nóng hoặc đèn sưởi, lửa với nhiệt độ cao để sưởi ấm cho người bị nạn vì có thể gây phản tác dụng, phồng rộp da. Khi da xuất hiện bóng nước, tuyệt đối không được tự bóp, nặn khiến bóng nước vỡ ra. Không được tự điều trị bằng cách bôi kem đánh răng, nha đam, lòng trắng trứng hoặc các loại lá cây vì có thể gây nhiễm trùng, nhiễm khuẩn, khiến vết thương nặng thêm.
Sau khi sơ cứu, người bệnh nên tới bệnh viện sớm để bác sĩ kiểm tra mức độ vết thương, điều trị phù hợp. Mỗi mức độ bỏng lạnh có phác đồ điều trị khác nhau.
Để đề phòng bỏng lạnh, bác sĩ khuyến cáo người dân cần mang bảo hộ lao động khi tiếp xúc với các nguồn có thể gây bỏng. Cần đeo găng tay bảo hộ, kiểm tra van và dây dẫn kỹ lưỡng trước khi sử dụng các bình oxy lỏng, nitơ lỏng để tránh rò khí. Tuyệt đối không nắm vào vòi xịt trong và sau khi sử dụng bình.
Với bình chữa cháy CO2, cần học sử dụng bình đúng cách và an toàn khi có cháy, không dùng bình đã bị hở hoặc hư, tránh xa tầm tay trẻ em.
Anh Thư","TP HCM- Minh, 20 tuổi, làm ở tiệm hàn xì, khi mở van bình nén oxy lỏng bị luồng khí xịt vào tay trái gây bỏng lạnh, tê cứng, phồng rộp. - VnExpress","https://vnexpress.net/bi-bong-lanh-boi-khi-oxy-long-4681747.html","Thứ hai, 27/11/2023, 14:00 (GMT+7)","https://i1-suckhoe.vnecdn.net/2023/11/27/screen-shot-2023-11-27-at-12-0-8578-8724-1701061540.png?w=1200&h=0&q=100&dpr=1&fit=crop&s=z7hoId92gTOhBM5McWhkUw","","Bệnh da liễu","https://vnexpress.net/tin-tuc-24h"
