"""ID"", ""Title"", ""Content"", ""Description"", ""URL"", ""Publication Date"", ""Image URL"", ""Author"", ""Category"", ""Source"""
"4682830","Trung Quốc dẫn đầu về đăng ký bằng sáng chế pin mặt trời kiểu mới","Theo Nikkei, kể từ 2020, thống kê mỗi năm cho thấy lượng bằng sáng chế về pin mặt trời hiệu suất cao, có thể uốn cong perovskite của Trung Quốc luôn nhiều nhất thế giới.
Ví dụ năm 2021, Trung Quốc có 70 bằng sáng chế, cao hơn nhiều con số 39 của nước xếp thứ hai là Hàn Quốc. Trong khi đó, Nhật Bản, quốc gia đứng đầu về tổng số sáng chế ở mảng này trong 20 năm, chỉ có thêm 19 bằng đăng ký mới cùng năm.
Ngoài ra, Trung Quốc cũng thống trị về số lượng báo cáo khoa học liên quan đến perovskite. Nikkei đánh giá nếu giữ tốc độ phát triển như hiện tại, quốc gia tỷ dẫn sẽ sớm chiếm ưu thế trong lĩnh vực pin ứng dụng công nghệ mới.
Những năm qua, perovskite được kỳ vọng là nguyên liệu mở ra cuộc cách mạng trong ngành năng lượng mặt trời. Các tế bào quang năng perovskite chỉ nặng bằng 1/10 so với tế bào silicon kiểu cũ, đồng thời chi phí sản xuất bằng một nửa. Với cấu trúc tinh thể, nguyên liệu này giúp tăng hiệu suất chuyển đổi ánh sáng thành điện lên nhiều lần.
Về tổng thể, các tấm pin sử dụng perovskite có ưu điểm mỏng, nhẹ, có thể uốn cong và cố định vào hầu hết bề mặt, từ đó tối ưu diện tích lắp đặt hệ thống năng lượng mặt trời.
Cũng theo Nikkei, Trung Quốc có những bước tiến lớn trong nghiên cứu nhưng chưa vượt trội so với Nhật Bản về khả năng sản xuất. Hiện Nhật Bản sở hữu ba trong số 10 công ty hàng đầu về pin mặt trời perovskite. Trong đó, sản phẩm của Panasonic được đánh giá là một trong những loại có tỷ lệ chuyển đổi quang điện tốt nhất, đồng thời vẫn cho ánh sáng đi qua nên có thể tích hợp ngay trên cửa sổ ngôi nhà.
Sekisui Chemical, công ty Nhật Bản xếp thứ sáu trong danh sách, lại có chuyên môn về tăng cường độ bền. Họ đang phát triển chất liệu giúp bảo vệ pin không bị hư hại do tác nhân không khí và độ ẩm. Sản phẩm đã được thử nghiệm lâu dài trong môi trường thực tế và dự kiến chuyển sang thương mại hóa vào năm sau.
Trong năm 2025, Toshiba muốn trở thành nhà phân phối các tấm pin perovskite cỡ lớn. Trong khi các nhà sản xuất Trung Quốc chủ yếu sử dụng tấm nền thủy tinh, công ty Nhật Bản đã ứng dụng tấm nền dạng màng để tối ưu hóa tính linh hoạt và độ bền.
Theo thống kê năm 2023 của Cơ quan Năng lượng Quốc tế (IEA), số tiền chi cho sản xuất năng lượng mặt trời đạt 380 tỷ USD năm nay. Đây cũng là lần đầu trong lịch sử, lĩnh vực này vượt qua việc chi tiêu cho khai thác dầu mỏ (370 tỷ USD).
Các chuyên gia đánh giá, thế giới đang dịch chuyển từ năng lượng hóa thạch sang năng lượng tái tạo, nhiều nhất là năng lượng mặt trời. Với quy mô sản xuất của mình, Trung Quốc đang chiếm phần lớn thị trường pin quang điện, với 80% sản lượng tấm pin toàn cầu. Nếu xét trên chuỗi cung ứng, sức ảnh hưởng của quốc gia tỷ dân còn lớn hơn khi sản xuất 85% thành phần pin quang điện, 88% polysilicon - tấm chuyên quang năng thành điện năng và 97% tấm mỏng bảo vệ lõi pin.","Với hàng loạt bằng sáng chế đăng ký mới, Trung Quốc đang cạnh tranh vị trí dẫn đầu cuộc đua nghiên cứu pin mặt trời thế hệ mới perovskite. - VnExpress","https://vnexpress.net/trung-quoc-dan-dau-ve-dang-ky-bang-sang-che-pin-mat-troi-kieu-moi-4682830.html","Thứ năm, 30/11/2023, 08:00 (GMT+7)","https://i1-sohoa.vnecdn.net/2023/11/29/httpscmsimagebucketproductiona-5313-3847-1701256716.jpg?w=1200&h=0&q=100&dpr=1&fit=crop&s=yAthbn2p3VtkG1djhTuzzA","","Công nghệ","https://vnexpress.net/tin-tuc-24h"
"4682905","Cầu thủ tuổi teen giúp Real thắng đậm Napoli","Nico Paz vào thay Brahim Diaz ở phút 65 khi tỷ số đang là 2-2, và cần thêm gần 20 phút để tạo bước ngoặt cho Real. Phút 84, nhận bóng từ Antonio Rudiger, tiền vệ Argentina 19 tuổi xoay người loại cầu thủ Napoli theo kèm rồi dứt điểm chân trái từ khoảng 25 mét đưa bóng đi đập đất. Thủ thành Alex Meret chạm tay vào bóng nhưng không thể cứu thua.
Với 19 tuổi 82 ngày, Nico Paz là cầu thủ Argentina trẻ thứ hai nổ súng trong lịch sử Champions League. Người dẫn đầu thông số này là huyền thoại Lionel Messi khi lập công trong trận Barca thắng Panathinaikos 5-0 tại Camp Nou ngày 2/11/2005 lúc 18 tuổi 131 ngày.
Đứng thứ ba là Alejandro Garnacho - người cũng nổ súng ở lượt trận vòng bảng Champions League hôm qua. Anh mở tỷ số trong trận hòa 3-3 trên sân Galatasaray khi 19 tuổi 4 tháng 29 ngày.
Nico Paz sinh năm 2004 tại Santa Cruz, Tây Ban Nha. Anh lần lượt thi đấu cho CD San Juan, Tenerife rồi gia nhập đội trẻ Real năm 2016. Bắt đầu sự nghiệp từ vị trí trung vệ, cầu thủ Argentina dần được xếp lên đá cao hơn. Sau khi chơi ở trung phong, anh chuyển sang chạy cánh ở đội U19 Real. Paz cũng có thể đá tốt ở vị trí tiền vệ trung tâm hoặc tiền vệ kiến thiết lối chơi.
Mùa 2023-2024 ghi nhận sự tiến bộ vượt bậc của Paz. Anh ra sân lần đầu tại Champions League khi vào thay Federico Valverde trong trận thắng Braga ngày 8/11 trên sân Bernabeu. Ba ngày sau, sao trẻ Argentina trình làng ở La Liga khi vào thay Dani Carvajal trong trận thắng 5-1 trước Valencia.
Tại Bernabeu hôm qua, Paz tiếp tục để lại dấu ấn với bàn thắng đầu tiên cho đội một Real. ""Giấc mơ đã trở thành hiện thực. Toàn bộ thành viên CLB đã chúc mừng tôi. Chúng tôi là một tập thể đáng kinh ngạc"", cầu thủ 19 tuổi nói sau trận.
Trước khi Paz lập công, hai đội giằng co. Napoli vượt lên ngay phút 9 nhờ công Giovanni Simeone, nhưng Real dẫn ngược nhờ các bàn của Rodrygo và Jude Bellingham. Đầu hiệp hai, tiền vệ Andre Zambo Anguissa đưa trận đấu về vạch xuất phát. Sau đó, Paz tạo sự khác biệt khi đưa Real vượt lên ở phút 84, rồi Joselu - cầu thủ vào sân thay người khác - đệm cận thành ấn định chiến thắng 4-2 ở phút bù thứ tư.
Với kết quả này, Real giành 15 điểm tuyệt đối và chắc vị trí đỉnh bảng khi vào vòng 1/8 sớm một lượt. Trong khi đó, Napoli có bảy điểm và cần ít nhất trận hòa khi tiếp Braga ở lượt cuối ngày 12/12 để đi tiếp.
Đội hình thi đấu
Real Madrid: Lunin; Carvajal, Rudiger, Alaba, Mendy (Nacho 87); Ceballos (Joselu 57), Kroos, Valverde; Bellingham; Rodrygo (Vazquez 87), Diaz (Paz 65).
Napoli: Meret; Di Lorenzo, Rrahmani, Natan, Jesus (Zanoli 59); Zielinski (Elmas 65), Lobotka (Raspadori 87), Anguissa; Politano (Cajuste 78), Simeone (Osimhen 46), Kvaratskhelia.","Tây Ban Nha- Tiền vệ 19 tuổi vào thay người Nico Paz nâng tỷ số lên 3-2, góp công giúp Real thắng ngược Napoli 4-2 ở lượt năm bảng C Champions League. - VnExpress","https://vnexpress.net/cau-thu-tuoi-teen-giup-real-thang-dam-napoli-4682905.html","Thứ năm, 30/11/2023, 07:55 (GMT+7)","https://i1-thethao.vnecdn.net/2023/11/30/gaihcoiwwaaz2sf-1701305586-6392-1701305635.jpg?w=1200&h=0&q=100&dpr=1&fit=crop&s=KzhWQQnif6wXqkDoup2zqg","","Champions League","https://vnexpress.net/tin-tuc-24h"
"4682670","Thâu tóm dự án bất động sản nhộn nhịp trở lại","""M&amp;A là con đường chúng tôi rất quan tâm"", ông Đặng Văn Thành, Chủ tịch Tập đoàn TTC nói tại một diễn đàn về mua bán - sáp nhập mới đây. Cách đây khoảng 3 tháng, TTC khánh thành một resort đầu tư tại bãi biển Dốc Lết (Khánh Hòa). Nhưng ông Thành nói đó là trường hợp cá biệt. ""Còn lại chúng tôi M&amp;A hết"", ông cho biết.
Vài năm qua, TTC Hospitality của tập đoàn này liên tục thâu tóm khách sạn 3-5 sao tại nhiều địa phương. Dự án gần đây nhất về tay họ là Imperial Hotel Huế. Đến nay, hệ thống khách sạn, khu nghỉ dưỡng của TTC phủ gần 20 điểm đến.
Không chỉ có TTC ""đi săn"", ở phân khúc dự án nhà ở, Gamuda Land hai năm qua liên tục kiên trì chiến lược thâu tóm. Sau 2 thương vụ tại Thủ Đức (TP HCM) và Bình Dương năm ngoái, ông lớn bất động sản Malaysia năm nay chi 316 triệu USD mua lại công ty Tâm Lực để sở hữu dự án rộng 3,77 ha, được quy hoạch 6 tòa tháp cao 40 tầng ngay mặt tiền đường Mai Chí Thọ.
Ông Angus Liew, Chủ tịch Hội đồng thành viên Gamuda Land Việt Nam nói chiến lược M&amp;A triển khai ở Việt Nam từ 2020 và hai năm nay diễn ra thuận lợi. ""Chúng tôi sẽ tìm kiếm những cơ hội tiếp theo. Thị trường này rất hấp dẫn với các nhà đầu tư bất động sản"", ông nói.
Theo báo cáo của KPMG, trong 10 tháng đầu năm, bất động sản là lĩnh vực đứng nhì về quy mô M&amp;A, chiếm 23% trong 4,4 tỷ USD giao dịch toàn thị trường Việt Nam. Vào 2021 và 2022, bất động sản giữ tỷ trọng 17% và 16%.
Trong 5 thương vụ lớn nhất, bất động sản có 2. Ngoài Gamuda Land mua Tâm Lực, thương vụ lớn hơn là ESR chi 450 triệu USD mua cổ phần chiến lược nhà quản lý bất động sản công nghiệp BW Industrial. Trung bình, quy mô một thương vụ trong 10 tháng đầu năm đã đạt kỷ lục 166 triệu USD, so với mức 56 triệu USD năm 2019 và 51,8 triệu USD năm 2022.
Chủ tịch &amp; CEO KPMG Việt Nam và Campuchia Warrick Cleine cho biết bất động sản từng thu hút nhiều hoạt động M&amp;A nhiều năm trước. Đến nay, thị trường này sôi động trở lại, nhờ một số lý do.
Đầu tiên, bất động sản công nghiệp trở thành tài sản hấp dẫn khi các nhà đầu tư nhận thấy xu hướng chuyển dịch sản xuất đến Việt Nam, theo ông Trương An Dương, Giám đốc điều hành khu vực phía Bắc công ty Frasers Property Vietnam. ""Thời gian tới, bất động sản khu công nghiệp sẽ phát triển tốt và có nhiều thương vụ M&amp;A hơn"", ông dự báo.
Thực tế, trong 25,76 tỷ USD vốn FDI rót vào Việt Nam 10 tháng qua, có đến 18,84 tỷ USD là vào công nghiệp chế biến, chế tạo. Theo JJL, giá cho thuê nhà kho xây sẵn ở vẫn tiếp tục tăng trong quý III, với mức 3,5% ở phía Nam và 5,7% ở phía Bắc so với cùng kỳ 2022.
Thứ hai, sau đợt khủng hoảng thanh khoản vào năm ngoái, mặt bằng lãi suất liên tục giảm giúp thị trường bất động sản có cơ hội hồi phục, đặc biệt là kích thích hơn nhu cầu nhà ở. Ông Khanh Vũ, Phó Tổng giám đốc quỹ VinaCapital Vietnam Opportunity, cho rằng với lãi suất thấp hiện tại thì mọi người đã sẵn sàng nhìn vào bất động sản. ""Không ngạc nhiên khi các nhà đầu tư bắt đầu quay lại"", ông nói.
Các chuyên gia dự báo M&amp;A bất động sản sẽ tiếp tục sôi động. Đầu tư ở nhiều nơi nhưng ông Angus Liew nói sau khi đi một vòng thì vẫn nhận ra Việt Nam là điểm đến hấp dẫn. Theo ông, thị trường này có nhiều nhu cầu nhưng cung hạn chế, dân số không chỉ lớn mà còn trẻ và 50% sẽ chuyển dịch lên trung lưu.
""Khung pháp lý cũng thuận lợi và hấp dẫn. Chúng tôi có thể bán các dự án còn chưa xây dựng xong trong khi ở một số nước khác thì không được"", ông đánh giá. Trong đó, chọn cách M&amp;A sẽ giúp mang lại kết quả nhanh, chỉ tầm 7 năm theo tính toán của ông Angus Liew.
Ông Trương An Dương của Frasers Property cho rằng không chỉ bất động sản công nghiệp và dân cư, các tòa nhà văn phòng cũng sẽ chứng kiến M&amp;A phát triển khi lượng tòa nhà hạng sang, tiêu chuẩn xanh còn khan hiếm. ""Nhu cầu M&amp;A trong những năm tới rất nhiều tiềm năng ở tất cả phân khúc"", ông nói.
Dù vậy, thị trường cũng có những điểm cần cải thiện. Một số thách thức chung của ngành M&amp;A Việt Nam như quy trình pháp lý để tiến hành các thương vụ kéo dài, kỳ vọng định giá quá cao và hệ thống kế toán yếu của bên bán. Cùng với đó, lĩnh vực nhà đất cũng có đặc thù riêng. ""Quy trình nếu minh bạch hơn, đặc biệt là đấu giá đất, sẽ càng thu hút nhiều nhà đầu tư"", ông Angus Liew nói.
Bà Lưu Thị Thanh Mẫu, Tổng giám đốc Công ty cổ phần Đầu tư và Xây dựng Phúc Khang, đánh giá các thương vụ M&amp;A tăng nhanh về số lượng cũng như quy mô các thỏa thuận, vì thế đã đến giai đoạn cần chất hơn là số lượng. Bên mua và bán cần nâng cao chất lượng để cộng hưởng nguồn vốn, quản trị, chất lượng sản phẩm sau giao dịch, thông qua việc tuân thủ các tiêu chuẩn của ngành hàng từ góc độ M&amp;A.
Ông Warrick Cleine cho rằng ngành bất động sản có môi trường pháp lý còn nhiều thách thức nhưng các nhà đầu tư chiến lược vẫn tích cực theo đuổi nhiều tài sản chất lượng cao. ""Những nhà đầu tư có quỹ đất sạch, chất lượng pháp lý tốt sẽ có sức hấp dẫn. Đây là lĩnh vực thú vị và còn nhiều hoạt động trong 2024"", ông nói.","Mua bán - sáp nhập bất động sản sôi động trở lại khi chứng kiến các thương vụ &quot;khủng&quot;, giá trị giao dịch trung bình năm nay lên kỷ lục. - VnExpress","https://vnexpress.net/thau-tom-du-an-bat-dong-san-nhon-nhip-tro-lai-4682670.html","Thứ năm, 30/11/2023, 07:54 (GMT+7)","https://i2-vnexpress.vnecdn.net/2023/11/29/dji-0427-1701254330-1701254376-4679-1701254721.jpg?w=1200&h=0&q=100&dpr=1&fit=crop&s=SlRD9T5XogBmnhaBZiLk4A","","Thị trường","https://vnexpress.net/tin-tuc-24h"
"4678955","Với 1,5 tỷ đồng nên xây nhà 2 tầng mái Thái quy mô ra sao?","Tôi có thửa đất kích thước 10x20 m, dự tính xây dựng nhà kiểu biệt thự hình chữ L, 2 tầng, mái Thái. Ngân sách dự kiến khoảng 1,5 tỷ đồng.
Nhờ chuyên gia tư vấn giúp, với số tiền đó tôi có thể xây và hoàn thiện quy mô nhà ra sao? Ngoài ra, cần lưu ý những gì khi phân chia ngân sách để hạn chế tối đa khoản phát sinh. Tôi xin cảm ơn!","Tôi muốn tìm phương án xây nhà 2 tầng mái Thái trên thửa đất rộng 200 m2, gói gọn trong ngân sách 1,5 tỷ đồng. - VnExpress","https://vnexpress.net/voi-1-5-ty-dong-nen-xay-nha-2-tang-mai-thai-quy-mo-ra-sao-4678955.html","Thứ năm, 30/11/2023, 07:47 (GMT+7)","https://i2-vnexpress.vnecdn.net/2023/11/29/nha2tang933-1701248162-1701248-1769-3743-1701248471.jpg?w=1200&h=0&q=100&dpr=1&fit=crop&s=sVjkEv7IzGVb--oqgpmG-w","","Tư vấn","https://vnexpress.net/tin-tuc-24h"
"4682833","Giới ôtô 'tầm sư học đạo' ngành xe điện Trung Quốc","Từng thống trị vững chắc thị trường ôtô chạy bằng xăng, nhưng Volkswagen đang mất thị phần ở Trung Quốc khi khách hàng chuyển sang dùng xe điện. Giờ đây, để cạnh tranh với các nhà sản xuất địa phương, các kỹ sư của nhà sản xuất xe hơi Đức đang tìm kiếm các bí quyết của Trung Quốc để tăng tốc quá trình sản xuất xe điện.
Tương tự, Nissan Motor cũng cố gắng sản xuất ôtô nhanh hơn bằng cách áp dụng các mẹo học được từ một liên doanh Trung Quốc. Hay Toyota Motor đang tuyển dụng kỹ sư từ đối tác Trung Quốc để việc phát triển ôtô điện và ôtô thông minh.
Tại Trung Quốc, doanh nghiệp nội địa chiếm khoảng ba phần tư doanh số bán xe điện và xe lai xăng - điện (hybrid). Theo WSJ, việc các nhà sản xuất ôtô toàn cầu đến đây học tập cách làm xe điện không chỉ quan trọng với tương lai của họ tại chính thị trường này mà còn hữu ích với thị trường quê nhà. Ngược lại, hướng này cũng giúp phương pháp sản xuất, chuỗi cung ứng và công nghệ kỹ thuật số của Trung Quốc có thể thâm nhập vào các nhà sản xuất ôtô toàn cầu.
Ralf Brandstätter, Giám đốc kinh doanh Volkswagen Trung Quốc, cho biết trước đây công ty sản xuất ôtô ở châu Âu và xuất sang Trung Quốc với một số điều chỉnh. Tuy nhiên, cách tiếp cận này không còn hiệu quả vì yêu cầu của khách hàng nơi đây về điện khí hóa và kỹ thuật số ngày càng quá khác biệt.
""Chúng ta cần phải linh hoạt và tập trung hơn"" ông ta nói vào tuần trước tại Trung tâm sản xuất, phát triển và mua sắm xe điện của Volkswagen tại Hợp Phì, phía tây Thượng Hải. Ông cho biết công ty sẽ phát triển tại chỗ các mẫu ôtô cho thị trường Trung Quốc, đồng thời hợp tác với đối tác địa phương nhiều hơn.
Theo Brandstätter, những thay đổi này sẽ giúp Volkswagen đạt được mục tiêu trở thành một trong ba nhà sản xuất ôtô hàng đầu tại Trung Quốc vào 2030. Dẫn đầu doanh số tại thị trường này nhiều thập kỷ, Volkswagen đang bị ông trùm xe điện và xe hydrid BYD bám sát.
Vị thế dẫn đầu của nhà sản xuất ôtô Đức bắt đầu lung lay từ vài năm trước khi họ gặp khó trong việc phát triển xe điện. Brandstätter nói Volkswagen mất gần 4 năm để tạo ra sản phẩm mới, trong khi các công ty Trung Quốc chỉ cần hơn 2 năm rưỡi.
Vì vậy, họ đặt mục tiêu cắt giảm quá trình phát triển phương tiện xuống còn khoảng 2 năm rưỡi. Điều đó sẽ đạt được thông qua một loạt hành động, với một số lấy cảm hứng từ cách làm của Trung Quốc.
Một là sử dụng nhiều linh kiện Trung Quốc tại chỗ, vốn nhanh hơn việc dựa vào linh kiện của Đức. Từ hệ thống màn hình hiển thị, thông tin đến pin và đèn pha, việc mua các mặt hàng này từ nhà cung cấp Trung Quốc sẽ cắt giảm khoảng 30% thời gian phát triển sản phẩm và giảm từ 20% đến 40% chi phí.
Ban lãnh đạo Volkswagen đánh giá các nhà cung cấp Trung Quốc đã cải thiện đáng kể về chất lượng, độ bền và công nghệ trong khoảng 4 năm qua. Họ đã hợp tác với các nhà sản xuất ôtô nội địa hàng đầu và là một phần quan trọng trong hệ sinh thái xe điện và xe thông minh của Trung Quốc. Theo các giám đốc và chuyên gia trong ngành, các nhà cung cấp Trung Quốc vượt trội so với phần còn lại thế giới.
Volkswagen cũng đang đầu tư hàng tỷ USD vào các công ty địa phương để có được công nghệ tiên tiến của Trung Quốc. Danh mục bao gồm startup xe điện XPeng, nhà sản xuất pin Gotion High-Tech, công ty phần mềm và chip xe tự lái Horizon Robotics, nhà sản xuất hệ điều hành buồng lái thông minh ThunderSoft.
Tại Hợp Phì, đội ngũ của Volkswagen đã thay đổi về cơ cấu quản lý, có thẩm quyền phê duyệt các linh kiện địa phương để tiết kiệm thời gian. Họ đang phát triển dòng xe điện cấp thấp mới cho Trung Quốc, dự kiến ra mắt vào 2026. Đến 2030, nhà sản xuất này có kế hoạch cung cấp 30 mẫu xe điện tại đây.
Nissan cũng cố gắng đẩy nhanh tiến độ phát triển xe điện để cứu doanh số đang trượt dốc. Hãng đã học được vài kinh nghiệm từ Venucia, một thương hiệu địa phương do Nissan liên doanh với Dongfeng Motor. Một trong số đó là cách rút ngắn thời gian thử nghiệm phương tiện.
Theo truyền thống, Nissan phải đợi nhiều tháng để hoàn thiện một số khuôn trước khi sử dụng chúng chế tạo xe thử nghiệm. Còn hiện tại ở Trung Quốc, hãng xe Nhật Bản đang trong quá trình sử dụng khuôn nguyên mẫu để thay thế.
Để đảm bảo chất lượng, Nissan đồng thời có kế hoạch sử dụng nhiều công nghệ kỹ thuật số hơn, chẳng hạn máy in 3D hoặc thử nghiệm ảo để bổ sung. Đến năm 2026, Nissan có kế hoạch phát hành 4 mẫu xe thuần điện và hybrid được phát triển từ trung tâm R&amp;D Trung Quốc và 6 mẫu xe mang nhãn hiệu của liên doanh.
Người phát ngôn của Nissan cho biết công ty thừa nhận liên doanh của họ tại Trung Quốc đã xây dựng được năng lực mạnh mẽ và mọi cuộc thử nghiệm đều đáp ứng các tiêu chuẩn toàn cầu của Nissan.
Trong khi đó, Toyota đã chuyển trọng tâm của trung tâm R&amp;D Trung Quốc sang ôtô điện và thông minh, đồng thời tuyển thêm nhiều kỹ sư từ các liên doanh sở tại cho các dự án. Giống như Volkswagen, Toyota sẽ tìm kiếm các nhà cung cấp địa phương, đồng thời sửa đổi thiết kế linh kiện và nâng cấp công nghệ sản xuất để cắt giảm chi phí cho xe điện thông minh.
Bill Russo, Giám đốc điều hành công ty tư vấn chiến lược Automobilety trụ sở tại Thượng Hải, cho biết nhiều thương hiệu nước ngoài đã tụt lại phía sau trong chu kỳ sản phẩm ở Trung Quốc vì không chuẩn bị đủ sớm cho xu hướng xe điện đã bắt đầu từ năm 2020.
WSJ cũng ghi nhận một số hãng ôtô toàn cầu đã bắt đầu rút lui hoặc điều chỉnh hướng đi. Mitsubishi Motors và Stellantis - nhà sản xuất xe Jeep, đã ngừng sản xuất tại Trung Quốc. Ford thì chấm dứt hoạt động bán trực tiếp xe điện. Bill Russo cho rằng, để bắt kịp các đối thủ địa phương, các nhà sản xuất xe hơi toàn cầu sẽ cần tốn nhiều năm nữa. Còn hiện tại, nhiều công ty có thể phải dựa vào việc cắt giảm chi phí và giảm giá để tăng doanh số.","Để cải thiện năng lực cạnh tranh, Volkswagen, Nissan và Toyota đang tìm cách học hỏi kinh nghiệm phát triển xe điện của các công ty Trung Quốc. - VnExpress","https://vnexpress.net/gioi-oto-tam-su-hoc-dao-nganh-xe-dien-trung-quoc-4682833.html","Thứ năm, 30/11/2023, 07:44 (GMT+7)","https://i1-kinhdoanh.vnecdn.net/2023/11/29/fed1-2023-11-29t192859-548-170-3713-7892-1701262069.jpg?w=1200&h=0&q=100&dpr=1&fit=crop&s=nm2lYTKU1rzQgJogQtaa5g","","Phân tích","https://vnexpress.net/tin-tuc-24h"
"4682746","Nên mua Mazda CX-5 hay Ford Territory?","","Mua xe chủ yếu đi lại trong phố, hai vợ chồng đi chung một xe, vợ thích CX-5 còn tôi lại thích Territory. (Nguyễn Hà)","https://vnexpress.net/nen-mua-mazda-cx-5-hay-ford-territory-4682746.html","Thứ năm, 30/11/2023, 07:33 (GMT+7)","https://i2-vnexpress.vnecdn.net/2023/11/29/TopCX53jpg1631963523-170124566-5738-7499-1701245672.jpg?w=1280&h=0&q=100&dpr=1&fit=crop&s=BmAhtvP_2b52Yt_Pz1Rswg","","","https://vnexpress.net/tin-tuc-24h"
