"""ID"", ""Title"", ""Content"", ""Description"", ""URL"", ""Publication Date"", ""Image URL"", ""Author"", ""Category"", ""Source"""
"4686450","Đại tá Nga nói Moskva đủ sức hạ F-16 Ukraine 'vừa rời đường băng'","""Tên lửa 40N6 đã chứng tỏ được hiệu quả trên chiến trường Ukraine. Lực lượng Nga từng phá hủy hơn 20 chiến đấu cơ đối phương chỉ trong một tuần nhờ sử dụng kết hợp hệ thống phòng không S-400 và máy bay cảnh báo sớm A-50U. Điều này đã khiến người Mỹ bị sốc"", đại tá về hưu Viktor Baranets, hiện là nhà phân tích quân sự Nga, ngày 7/12 nói với Sputnik Radio.
Bộ trưởng Quốc phòng Sergei Shoigu trước đó cho biết lực lượng Nga hồi tháng 10 tiếp nhận một hệ thống phòng không mới và tổ hợp này đã bắn hạ 24 máy bay Ukraine trong 5 ngày. Ông Shoigu không tiết lộ tên của hệ thống phòng không, song giới phân tích nhận định tổ hợp Bộ trưởng Quốc phòng Nga nhắc đến là máy bay A-50 kết hợp với tên lửa S-400.
Theo ông Baranets, tên lửa 40N6 trang bị cho hệ thống S-400 là loại ""tầm siêu xa"", có thể bắn hạ mục tiêu ở khoảng cách lớn hơn hầu hết các tên lửa khác trên thế giới, bao gồm cả các mục tiêu nằm ngoài tầm nhìn thẳng.
Đại tá này cho rằng tên lửa 40N6 có thể tiêu diệt máy bay đối phương ""gần như ngay khi nó vừa cất cánh rời đường băng"", trong đó có tiêm kích F-16 mà phương Tây sắp chuyển giao cho Ukraine.
""Quân đội Nga đã chuẩn bị đầy đủ để đối phó với chiến đấu cơ F-16 Ukraine sắp tiếp nhận"", chuyên gia này nhấn mạnh.
40N6 là tên lửa phòng không hai tầng đẩy sử dụng nhiên liệu rắn, đạt tốc độ tối đa 4.300 km/h, có khả năng đánh trúng mục tiêu ở khoảng cách gần 400 km. Đây là loại đạn có tầm bắn xa nhất trong số các tên lửa trang bị cho hệ thống phòng không S-400.
Một số chuyên gia nhận định tên lửa 40N6 sử dụng kết hợp hệ thống dẫn đường chủ động và bán chủ động. Chế độ bán chủ động vận hành ở pha giữa để tiếp nhận tín hiệu phản xạ, còn đầu dò radar chủ động được kích hoạt ở pha cuối để lao vào mục tiêu một cách chính xác.
Theo nhà phân tích quân sự Nga Dmitry Kornev, hệ thống dẫn đường trên tên lửa 40N6 cho phép nó tiêu diệt vật thể ở ngoài tầm giám sát của radar S-400, đặc biệt là khi sử dụng kết hợp với máy bay cảnh báo sớm A-50U, vốn được mệnh danh là ""mắt thần trên không"" có khả năng phát hiện vật thể bay ở khoảng cách 800 km.
""Máy bay A-50U phát hiện mối đe dọa và chuyển tọa độ mục tiêu cho tổ vận hành S-400. Tên lửa được phóng đi dựa vào thông tin này, ngay cả khi nó chưa nhìn thấy mục tiêu. Đầu dò chủ động ở pha cuối sẽ giúp tên lửa khóa mục tiêu và lao về phía đối phương"", Kornev nói.
Theo truyền thông phương Tây, phi công Ukraine ""đang chạy đua với thời gian"" để hoàn thành khóa huấn luyện tiêm kích F-16, trong bối cảnh một số nước chuẩn bị chuyển giao cho Kiev chiến đấu cơ này.
Đan Mạch đã cam kết cung cấp tiêm kích F-16 cho Ukraine, lô đầu gồm 6 chiếc được bàn giao trong năm nay, 8 chiếc tiếp theo vào năm 2024 và 5 chiếc vào năm 2025. Giới chức Bỉ hồi tháng 10 cho biết nước này sẽ chuyển F-16 cho Ukraine, song không nêu số lượng cụ thể và nhận định tốc độ sẽ phụ thuộc vào quá trình Brussels thay thế mẫu máy bay này bằng tiêm kích tàng hình F-35.
Tổng thống Ukraine Volodymyr Zelensky cho rằng tiêm kích F-16 ""sẽ tăng cường năng lực phòng không cho Ukraine"", hỗ trợ họ trong chiến dịch phản công đang diễn ra. Trong khi đó, Bộ trưởng Shoigu tuyên bố quân đội Nga chỉ cần 20 ngày để hạ toàn bộ tiêm kích F-16 mà phương Tây cam kết chuyển giao cho Kiev.
Một số quan chức Mỹ cũng nhận định tiêm kích F-16 sẽ ""ít hữu ích"" cho Ukraine trong chiến dịch phản công hiện tại, do thách thức từ các tổ hợp phòng không mà Nga đã triển khai.
Tổng thư ký NATO Jens Stoltenberg ngày 29/11 cho rằng máy bay F-16 không phải ""viên đạn bạc"" và sẽ không giúp Ukraine thay đổi cục diện chiến sự.","Đại tá về hưu Nga cho rằng tên lửa S-400 khi kết hợp với &quot;mắt thần&quot; A-50U có thể đánh chặn tiêm kích F-16 Ukraine ngay khi rời đường băng. - VnExpress","https://vnexpress.net/dai-ta-nga-noi-moskva-du-suc-ha-f-16-ukraine-vua-roi-duong-bang-4686450.html","Thứ sáu, 8/12/2023, 15:07 (GMT+7)","https://i2-vnexpress.vnecdn.net/2023/12/08/nh-1702013790-7024-1702013819.png?w=1200&h=0&q=100&dpr=1&fit=crop&s=9rD80dl4c8_KLZekxAqM1w","","Quân sự","https://vnexpress.net/tin-tuc-24h"
"4686359","Ten Hag từ chối cho cầu thủ Man Utd thêm ngày nghỉ","Theo thông tin độc quyền từ báo Anh Sportmail, nhóm trụ cột của Man Utd đã phàn nàn với Ten Hag về khối lượng tập luyện và thi đấu trong những tuần qua. Họ cho rằng đội có quá ít ngày nghỉ, không thể dành thời gian cho những việc khác.
Ten Hag thông báo lịch tập luyện hàng tuần, nhưng có thể thay đổi tùy thuộc vào kết quả, trong khi một số cầu thủ Man Utd muốn có thể lên kế hoạch xa hơn để có thể nghỉ phép nếu cần.
Nhóm thủ lĩnh của Man Utd gồm các trụ cột như Luke Shaw, Marcus Rashford, Raphael Varane, Casemiro, Lisandro Martinez, Scott McTominay và thủ môn dự bị Tom Heaton. Tuy nhiên, không phải tất cả họ đều phàn nàn, và đa số trong đội đều ủng hộ phong cách làm việc của Ten Hag.
Ten Hag ""không khoan nhượng"" và từ chối đáp ứng yêu cầu có thêm ngày nghỉ từ nhóm trụ cột. HLV Hà Lan nhấn mạnh cần phải có những tiêu chuẩn cao nhất về sự cống hiến và hy sinh để thi đấu cho CLB hàng đầu như Man Utd, đồng thời nhắn nhủ các cầu thủ nên chuẩn bị tinh thần sẵn sàng cống hiến hết mình.
Dù thỉnh thoảng vẫn cho các học trò được nghỉ thêm mùa này, Ten Hag tin rằng Ngoại hạng Anh đang ngày càng đòi hỏi thể chất nhiều hơn và CLB phải có chế độ tập luyện nghiêm ngặt. HLV Hà Lan cũng không hề nói lời xin lỗi nào cho những yêu cầu ông đặt ra với các cầu thủ.
Sportmail đã liên hệ Man Utd về câu chuyện trên, nhưng đội bóng từ chối bình luận.
Hồi đầu tuần, truyền thông Anh đưa tin Man Utd bất ổn nội bộ, với phân nửa cầu thủ đội một không còn tin tưởng ở Ten Hag, không bằng lòng với chế độ tập luyện cũng như cách ông cô lập Jadon Sancho khỏi đội một. Vì thế, chủ sân Old Trafford đã có biện pháp cứng rắn khi cấm cấm cửa bốn tờ báo, gồm Manchester Evening News, Sky Sports, ESPN và The Mirror, dự buổi họp báo dự buổi họp báo trước trận gặp Chelsea ở vòng 15 Ngoại hạng Anh. Lý do là những tờ báo này viết bài tiêu cực về Man Utd mà không xin ý kiến của đội để đảm bảo tính khách quan.
Bên cạnh việc lên tiếng phủ nhận tin đồn, trận thắng Chelsea 2-1 cũng giúp Ten Hag giảm tải áp lực. ""Khủng hoảng ư? Không phải là vấn đề của chúng tôi"", HLV 53 tuổi nói sau trận khi được hỏi về nội tình đội bóng. ""Chúng tôi đang trên một cuộc hành trình, phải giữ bình tĩnh và tin tưởng vào quá trình này. Chúng tôi biết mình phải xây dựng những gì và không bị phân tâm bởi những lời chỉ trích xung quanh. Khi đoàn kết, có thái độ đúng đắn, chúng tôi có màn trình diễn tốt để giành điểm"".
Trong khi đó, các cầu thủ Man Utd cũng thể hiện sự ủng hộ với ông thầy và tiết lộ về những điều chỉnh nhất định của Ten Hag trong chế độ tập luyện. Sau trận thắng Chelsea 2-1 ngày 6/12, tiền vệ McTominay nói rằng bí quyết nằm ở Ten Hag, bởi ông giảm khối lượng tập luyện cho các cầu thủ trước trận. ""Các bài tập nhẹ giúp chúng tôi sung sức hơn"", tiền vệ lập cú đúp trận đó nói thêm.
Man Utd hiện đứng thứ sáu Ngoại hạng Anh với 27 điểm, bằng Tottenham và kém Man City ba điểm sau 15 vòng. Ở vòng 16, thầy trò Ten Hag tiếp tục đá trên sân nhà Old Trafford gặp Bournemouth ngày 9/12.","Anh- Theo báo Anh Daily Mail, HLV Erik ten Hag từ chối mong muốn của các cầu thủ Man Utd về việc có thêm ngày nghỉ tập giữa các trận đấu. - VnExpress","https://vnexpress.net/ten-hag-tu-choi-cho-cau-thu-man-utd-them-ngay-nghi-4686359.html","Thứ sáu, 8/12/2023, 15:00 (GMT+7)","https://i1-thethao.vnecdn.net/2023/12/08/2023-11-28t102124z-1799257849-3611-6013-1702009348.jpg?w=1200&h=0&q=100&dpr=1&fit=crop&s=w6sYkZu9aA78RDPAPSdUnQ","","Tin tức","https://vnexpress.net/tin-tuc-24h"
"4686548","Aston Villa hóa giải sức mạnh của Man City thế nào","Chưa CLB nào từng áp đảo Man City của Pep Guardiola như cách Aston Villa làm tại sân Villa Park ngày 6/12. Suốt 90 phút, Man City dứt điểm hai cú - thông số tệ nhất trong một trận của CLB được dẫn dắt bởi Guardiola. Ngược lại, nhà đương kim vô địch phải chịu 22 cú dứt điểm - thông số cao nhất của một CLB dưới trướng Guardiola. Những thông số này được tính toán trong cả thảy 535 trận trong toàn bộ sự nghiệp cầm quân của HLV Tây Ban Nha.
""Đây không chỉ là chiến thắng giúp Aston Villa thăng tiến trong cuộc đua top 4. Đây không chỉ là trận thứ tư liên tiếp mà Man City không thắng. Mà đây là một trong những màn trình diễn tuyệt vời nhất mọi thời đại ở Ngoại hạng Anh"", trang chủ Ngoại hạng Anh bình luận trong bài phân tích về những dấu ấn chiến thuật Aston Villa sử dụng để đánh bại nhà ĐKVĐ.
McGinn và Bailey khai thác khoảng trống của Rodri 
Cuối tuần qua, hệ thống 4-4-2 với bộ đôi tiền đạo Nicolo Zaniolo và Ollie Watkins của Aston Villa thi đấu thiếu gắn kết trong trận hòa 2-2 trên sân Bournemouth. Vì thế, đến màn tiếp đón Man City, Emery chuyển sang sơ đồ 4-2-3-1 với Youri Tielemans đá hộ công ngay sau lưng trung phong Watkins nhằm áp đảo tuyến giữa của đội khách.
Guardiola nổi tiếng với lối chơi kiểm soát. Nhưng bất chấp sự vắng mặt của Rodri vì án treo giò, HLV Tây Ban Nha vẫn quyết định không sử dụng tiền vệ trung tâm đúng nghĩa nào khi để cả Kalvin Phillips, Matheus Nunes và Mateo Kovacic trên băng ghế dự bị.
Manuel Akanji được giao nhiệm vụ thay Rodri, một mình bao quát khu vực tiền vệ phòng ngự, còn John Stones vẫn được sử dụng theo vai trò kép - dâng cao khi Man City kiểm soát bóng - như thường lệ. Man City ra sân với sơ đồ 4-1-4-1, với Phil Foden, Rico Lewis, Julian Alvarez và Bernardo Silva là các vệ tinh phía sau Haaland.
Điều đó có nghĩa là ngay khi có được động lực và gây sức ép liên tục, Aston Villa có thể áp đảo khu vực quanh Akanji. Đoàn quân dưới trướng Emery có 13 lần giành bóng thành công trên một phần ba sân cuối, trở thành CLB đầu tiên làm được điều này trước Man City của Guardiola ở Ngoại hạng Anh.
Việc bố trí Tielemans đá hộ công mang lại hiệu quả, nhưng điều quan trọng hơn là cách hai tiền vệ cánh John McGinn và Leon Bailey thường xuyên di chuyển vào khu trung tuyến để nhận bóng phía sau hàng tiền vệ công bốn người của Man City và khai thác khoảng trống quanh Akanji.
Một trong số vô số ví dụ là tình huống Pau Torres chuyền dài vượt qua hàng công của Man City và đến vị trí của McGinn - người đứng trong thế không người kèm, buộc John Stones phải băng lên và rời khỏi vị trí. Vài giây sau, McGinn chuyền bổng để Bailey đối mặt với Ederson.
Bailey cũng có ngày thi đấu thăng hoa khi được hưởng lợi từ khoảng trống bên cạnh vị trí hậu vệ trái Josko Gvardiol, nơi Rodri chắc chắn sẽ băng ra để bọc lót nếu có mặt trên sân.
Cỗ máy gặt đập liên hợp ở giữa sân của Aston Villa
Guardiola thử nhiều ý tưởng khác nhau ở Villa Park, nhưng đều không hiệu quả. ""Aston Villa chơi tốt hơn chúng tôi"", là câu trả lời ngắn gọn của Guardiola ở buổi họp báo sau trận về diễn biến suốt 90 phút.
Bên cạnh sơ đồ 4-1-4-1 và việc để Akanji một mình ở khu trung tuyến, Man City đã không tận dụng được khoảng thời gian đầu Aston Villa thi đấu chệch choạc bằng những đường chuyền dài hướng về Haaland.
Lối chơi này tương đối hiệu quả trong 15 phút đầu, dẫn đầu hai pha dứt điểm cận thành liên tiếp của Haaland nhưng bị thủ thành Emiliano Martinez cản phá ở phút 11. Đây cũng là những cú sút trúng đích duy nhất và cơ hội ngon ăn nhất của đội khách. Tuy nhiên, khi Aston Villa vào guồng, pressing tốt hơn nhờ màn trình diễn xuất sắc của bộ đôi tiền vệ con thoi Douglas Luiz và tiền vệ phòng ngự Boubacar Kamara, nhà ĐKVĐ không còn có thể tạo ra cơ hội.
Để xoay chuyển tình thế, đầu tiên, Guardiola hoán đổi vị trí của Silva với Lewis ngay khi vào hiệp hai. Tiền vệ Bồ Đào Nha di chuyển vào giữa sân và cùng Alvarez lùi sâu hơn mỗi khi các trung vệ của Man City kiểm soát bóng.
Sau đó, Guardiola lần lượt tung Matheus Nunes, Mateo Kovacic và Oscar Bobb vào sân trong 20 phút cuối. Nhưng Man City vẫn không thể tạo đột biến cho khu vực giữa sân, nơi ""cỗ máy gặt đập liên hợp"" Luiz - Kamara của phía chủ nhà hoạt động quá hiệu quả. Nhà ĐKVĐ chẳng những không thể cải thiện thế trận, mà thậm chí còn thủng lưới bàn duy nhất trong thời gian này.
Chiến thắng trước Man City giúp Aston Villa lập kỷ lục thắng 14 trận trên sân nhà liên tiếp ở Ngoại hạng Anh. Lần gần nhất họ làm được điều tương tự đã xảy ra từ năm 1931.
Aston Villa cũng chiếm vị trí thứ ba của chính Man City khi hiện có 32 điểm qua 15 vòng, kém Liverpool và Arsenal lần lượt hai và bốn điểm. Đây là khởi đầu mùa giải tốt nhất của Aston Villa kể mùa 1980-1981, mùa họ đăng quang giải VĐQG Anh với 60 điểm. Mùa kế tiếp, họ tiếp tục thăng hoa khi vô địch Cup C1 châu Âu, với chiến thắng 1-0 trước Bayern Munich ở chung kết tại De Kuip, Rotterdam.","Anh- Nhờ sử dụng sơ đồ năm tiền vệ với hai cầu thủ chạy cánh bó vào trung lộ khai thác khoảng trống của Rodri, Aston Villa áp đảo và thắng Man City 1-0 tại vòng 15 Ngoại hạng Anh. - VnExpress","https://vnexpress.net/aston-villa-hoa-giai-suc-manh-cua-man-city-the-nao-4686548.html","Thứ sáu, 8/12/2023, 15:00 (GMT+7)","https://i1-thethao.vnecdn.net/2023/12/08/34793x4-highres-1702020758-5406-1702022120.jpg?w=1200&h=0&q=100&dpr=1&fit=crop&s=IIHY2t3HjgpbxCoBKjatWA","","Phân tích","https://vnexpress.net/tin-tuc-24h"
"4685599","InterContinental Phu Quoc giới thiệu trải nghiệm Giáng sinh 2023","Du khách đến resort trong dịp Giáng sinh sẽ được chào đón bằng nghi thức ""Thắp sáng Đại dương"". Tại đây, các em nhỏ đến từ nhà thờ địa phương thực hiện bản đồng ca và nhân viên sẽ mang thức uống chào mừng đặc biệt tới du khách.
Thực đơn tại các nhà hàng của IntrerContinental Phu Quoc Long Beach dịp này cũng đa dạng hơn. Cụ thể, Sora &amp; Umi nâng cấp tiệc buffet với các hương vị Việt Nam truyền thống hòa quyện phong vị quốc tế phá cách. Trong khi đó, Sea Shack lại mang đến các lựa chọn BBQ kết hợp nhạc sống tươi vui; Lava với thực đơn kết hợp hài hoà giữa nguyên liệu đất liền và đại dương...
Chủ đề xuyên suốt của các thực đơn Giáng sinh năm nay là sự hòa quyện giữa món ngon truyền thống và hương vị tươi mới của hải sản. Ngoại trừ set menu tại Lava, các trải nghiệm tại Sora &amp; Umi và Sea Shack sẽ theo định huớng buffet. IntrerContinental Phu Quoc Long Beach còn tổ chức tiệc đếm ngược năm mới bên bãi biển, sự kiện đón năm mới Cheers to the new year...
Để phục vụ nhu cầu giải trí, khu nghỉ dưỡng tạo một sân chơi nhiệt đới với các hoạt động: biểu diễn múa lửa nghệ thuật bên bờ biển, thể thao dưới nước, Ông già Noel ghé thăm, săn tìm báu vật Giáng sinh...
Kết thúc chuyến trải nghiệm Giáng sinh tại IntrerContinental Phu Quoc Long Beach, du khách có thể ghé HARNN Heritage Spa để tái tạo năng lượng và cân bằng nội tại. Các liệu trình chăm sóc tại đây được thiết kế riêng cho mỗi khách lưu trú, dựa trên sự thấu hiểu về nguyên lý ngũ hành phương Đông. Tất cả nhằm tạo nên trải nghiệm chăm sóc và nuôi dưỡng thân - tâm - trí trọn vẹn, sẵn sàng chào đón năm mới.
Mới đây, IntrerContinental Phu Quoc Long Beach đạt giải Khu nghỉ dưỡng sang trọng dành cho gia đình tốt nhất châu Á 2023 tại World Travel Awards. InterContinental Phu Quoc Long Beach Resort tọa lạc tại bãi Trường, do tập đoàn IHG Hotels and Resorts Group vận hành. Khu nghỉ dưỡng được đánh giá cao bởi mang đến các trải nghiệm du lịch cao cấp cùng phong cách thiết kế ấn tượng.
Thiết kế của InterContinental Phu Quoc Long Beach Resort lấy cảm hứng từ những hình ảnh đặc trưng của đảo ngọc như tường cát vàng, đường cong sóng biển, bạch tuộc... Điều này giúp dự án tạo dấu ấn tốt với du khách. Toàn khu có 459 phòng nghỉ và villa phong cách hiện đại, thanh lịch, đáp ứng nhu cầu đa dạng khách du lịch.
Tìm hiểu thêm tại đây, hoặc liên hệ hotline (084) 297 397 8888, email: guestservicecenter.icpq@ihg.com","Khu nghỉ dưỡng IntrerContinental Phu Quoc Long Beach vừa ra mắt thực đơn Giáng sinh, nhiều hoạt động giải trí và các liệu trình chăm sóc sức khỏe mùa lễ hội. - VnExpress","https://vnexpress.net/intercontinental-phu-quoc-gioi-thieu-trai-nghiem-giang-sinh-2023-4685599.html","Thứ sáu, 8/12/2023, 15:00 (GMT+7)","https://i1-dulich.vnecdn.net/2023/12/06/inter-1701849411-7023-1701849487.png?w=1200&h=0&q=100&dpr=1&fit=crop&s=feWuEAgmUXfzwMHDML1SeQ","","Điểm đến","https://vnexpress.net/tin-tuc-24h"
"4686195","Vợ bỏ đi khi biết tôi nợ nần do đầu tư thua lỗ","Vào các năm 2022 và 2023, tôi đầu tư chứng khoán, bất động sản, forex và BTC nhưng thua lỗ rất nhiều tiền. Nếu bán tất cả tài sản đang có để trả nợ, tôi vẫn còn thiếu khoảng hơn hai tỷ đồng nữa. Tôi làm việc cho tập đoàn đa quốc gia, mức thu nhập khoảng một tỷ đồng mỗi năm nên khoản nợ này tôi tự tin có thể trả được.
Tuy nhiên có một vấn đề thế này. Khi tôi báo nợ, vợ đã dẫn con ra khỏi nhà và về nhà ngoại được gần sáu tháng rồi. Lỗi của tôi ở chỗ, khi đầu tư, có những khoản lỗ và nợ nhỏ, không đủ can đảm nói thật với vợ để dẫn đến cơ sự ngày hôm nay. Có những khoản đầu tư, tôi không nói với vợ nên vợ không biết tôi lỗ nhiều vậy. Xin nhắc lại một điều chắc chắn rằng vợ chồng tôi không có các mối quan hệ ngoài luồng, điện thoại luôn để chế độ mở và thoải mái đọc tin nhắn của nhau. Thực tình mà nói lỗi là do tôi, nhưng đôi lúc cũng buồn vì muốn tìm một người đồng hành qua những lúc thế này sao khó quá.
Tháng 5/2023, tôi nợ 200 triệu đồng, về nói với vợ để giải quyết cho khỏi ảnh hưởng đến công việc thì vợ không hỗ trợ dù tôi biết lúc đó vợ có tiền trong tài khoản. Xin nói thêm, thu nhập trong gia đình tôi là đóng góp chính, vợ hơi chi li với gia đình chồng về vấn đề tiền bạc. Ví dụ, Tết lì xì cho các cháu nhà tôi mỗi cháu 50 nghìn đồng, còn bên vợ là 500 nghìn đồng. Tôi biết và không nói gì. Một năm về nhà nội hai lần dù cách có 60 km, còn về nhà ngoại cách đó 30 km thì hơn 30 lần. Một vấn đề nữa là hai vợ chồng rất ít chia sẻ, cũng ít gần gũi, tháng khoảng một hai lần, đa số vợ không có nhu cầu. Mong nhận được lời khuyên từ các bạn.
Bùi Thành","Tôi 38 tuổi, cưới vợ được chín năm, có một con, chúng tôi có một ngôi nhà xinh và công việc ổn định, tuần sau ra tòa ly hôn. - VnExpress","https://vnexpress.net/vo-bo-di-khi-biet-toi-no-nan-do-dau-tu-thua-lo-4686195.html","Thứ sáu, 8/12/2023, 15:00 (GMT+7)","https://i2-vnexpress.vnecdn.net/2023/12/08/divorceconceptwithsadpeople232-7232-8955-1702001104.jpg?w=1200&h=0&q=100&dpr=1&fit=crop&s=Kwm06n7ZtmN-e7c4_v-Pcg","","Tâm sự","https://vnexpress.net/tin-tuc-24h"
