"""ID"", ""Title"", ""Content"", ""Description"", ""URL"", ""Publication Date"", ""Image URL"", ""Author"", ""Category"", ""Source"""
"4681625","Nhà văn Ireland thắng giải Booker 2023","Theo Guardian, hội đồng giám khảo công bố Paul Lynch nhận giải thưởng trị giá 50.000 bảng (hơn 1,5 tỷ đồng), cho cuốn tiểu thuyết thứ năm trong sự nghiệp. Shehan Karunatilaka, người giành giải Booker năm 2022, trao thưởng cho Lynch.
Trong bài phát biểu, Lynch nói: ""Tôi vô cùng vui mừng được mang giải Booker về nhà. Nhiều năm trước, khi đang nghỉ mát tại Sicily (Italy), tôi chợt nhận ra rằng mình cần phải viết, là phương hướng của cuộc đời tôi phải đi. Ngày hôm đó tôi quyết định chuyển hướng sang viết văn, và tôi rất vui vì đã làm được điều đó"".
Chủ tịch ban giám khảo - tiểu thuyết gia người Canada Esi Edugyan - mô tả tác phẩm ""chân thực và đau lòng"", ""lồng ghép sự bất an về xã hội và chính trị trong thời điểm hiện tại"". Edugyan cho biết quyết định trao giải thưởng cho Paul Lynch không nhận được sự đồng thuận cao từ ban giám khảo, vì vậy các thành viên trải qua nhiều vòng thảo luận và bỏ phiếu kéo dài khoảng sáu giờ, hôm 25/11.
Năm nay là lần thứ hai liên tiếp khi tiểu thuyết về xung đột chính trị đoạt giải Booker. Năm ngoái, nhà văn Shehan Karunatilaka giành chiến thắng với The Seven Moons of Maali Almeida, về cuộc nội chiến ở Sri Lanka.
Nội dung Prophet Song lấy bối cảnh Ireland đang chuyển sang chế độ chuyên chế. Vào một buổi tối ở Dublin, hai cảnh sát chìm đến căn hộ của nhà vi sinh vật học Eilish Stack để hỏi về chồng cô, một quan chức cấp cao của Liên đoàn Giáo viên Ireland. Trước đó, chồng của Eilish mất tích cùng hàng trăm người. Eilish bị bỏ lại với bốn người con và người cha già của cô. Nhân vật chính buộc phải làm mọi thứ để bảo vệ gia đình trước một xã hội đang sụp đổ.
Lynch cho biết không viết tác phẩm để nói ""đây là một lời cảnh báo"", mà nhấn mạnh: Nững điều đang xảy ra trong sách vượt qua mọi thời đại, và con người cần đào sâu hơn về cảm xúc của mình khi tiếp xúc với ý tưởng của tác phẩm. ""Tôi muốn độc giả có thêm sự hiểu biết sâu sắc, đến mức họ không chỉ biết mà còn tự cảm nhận vấn đề đến trang cuối"", Lynch nói.
Tác phẩm của Paul Lynch nhận được nhiều lời khen sau khi xuất bản lần đầu vào tháng 8 năm nay. Cây bút Aimée Walsh của Observer viết: ""Tác giả phản ánh thực tế các quốc gia bị chiến tranh tàn phá, nơi những người tị nạn vượt biển để thoát khỏi sự đàn áp trên đất liền"". Guardian gọi tiểu thuyết là ""câu chuyện ác mộng mà bất kỳ độc giả nào cũng có thể bắt gặp"".
Paul Lynch, 46 tuổi, sinh tại Limerick, hiện sống ở Dublin (Ireland). Các tiểu thuyết nổi bật khác của tác giả gồm The Black Snow (2013), Red Sky in Morning (2013), Beyond the Sea (2019) và Grace (2019). Ông là tác giả Ireland thứ năm giành giải Booker, sau Iris Murdoch, John Banville, Roddy Doyle và Anne Enright.
Giải Booker, từng được biết đến với tên Booker - McConnell hoặc The Man Booker, là giải thưởng văn chương danh giá nhất trong cộng đồng các nước nói tiếng Anh, thành lập năm 1968. Từ năm 2014, ban tổ chức cho phép các tiểu thuyết viết bằng tiếng Anh và được xuất bản ở Anh của các nhà văn nước ngoài tranh giải. Trước đó, chỉ nhà văn ở khối Thịnh vượng chung Anh và Cộng hòa Ireland được tham gia. Bên cạnh đó, ban tổ chức cũng thành lập giải International Booker vinh danh các tác phẩm quốc tế được dịch sang tiếng Anh và phát hành tại Mỹ, Anh hoặc Ireland.
Sự kiện năm nay do nhà báo Samira Ahmed chủ trì. Ngoài trao giải thưởng chính, chương trình có các cuộc phỏng vấn với khách mời. Trong đó có bài phát biểu của tác giả Nazanin Zaghari-Ratcliffe, mô tả cách những cuốn sách cho cô động lực sống lúc bị biệt giam. Tháng 3/2022, Zaghari-Ratcliffe được trả tự do sau khi nhận án tù 5 năm, do bị kết tội âm mưu lật đổ chính phủ Iran.","London- Tác giả người Ireland Paul Lynch thắng giải Booker năm nay với tiểu thuyết &quot;Prophet Song&quot;, sáng 27/11 (giờ Hà Nội). - VnExpress","https://vnexpress.net/nha-van-ireland-thang-giai-booker-2023-4681625.html","Thứ hai, 27/11/2023, 11:24 (GMT+7)","https://i1-giaitri.vnecdn.net/2023/11/27/bookerpaullynch051rbslice-1701-6008-6092-1701055382.jpg?w=1200&h=0&q=100&dpr=1&fit=crop&s=IRbTgSWPEc-IJEvpMOa27A","","Làng văn","https://vnexpress.net/tin-tuc-24h"
"4681672","Verstappen thắng 19 trong 22 chặng F1 mùa 2023","Verstappen hoàn thành 58 vòng đua tại Yas Marina sau 1 giờ 27 phút 2,624 giây, nhanh hơn tay đua Ferrari về nhì Charles Leclerc tới 17,993 giây. Chiến thắng áp đảo này giúp nhà ĐKVĐ kết thúc năm 2023 một cách mỹ mãn với cả cá nhân anh lẫn đội đua Red Bull.
Với 19 lần về nhất sau 22 chặng, Verstappen lập kỷ lục mới về tỷ lệ chiến thắng trong lịch sử F1 - 86,4%. Cách đây 2 chặng, khi kết thúc Grand Prix Brazil, Verstappen đã phá kỷ lục tỷ lệ chiến thắng trong một mùa giải 75% do Alberto Ascari thiết lập vào năm 1952. Nhưng việc giành chiến thắng ở hai chặng đua cuối và lập được kỷ lục mới hơn kỷ lục cũ tới 11% cho thấy sự vượt trội của Verstappen và Red Bull.
Kết thúc cuộc đua, Verstappen rất xúc động lúc đưa xe về khu vực trao thưởng. ""Đó là những khoảnh khắc cuối tôi ngồi trên chiếc xe đã giúp tôi rất nhiều mùa này. Đây là một mùa giải đáng kinh ngạc. Sẽ rất khó để làm được điều tương tự một lần nữa. Red Bull đang làm việc chăm chỉ để có một chiếc xe có tính cạnh tranh cao hơn cho mùa tiếp theo. Các đội khác sẽ cố gắng đánh bại, nhưng chúng tôi đã sẵn sàng cho mọi thử thách sắp tới"", nhà vô địch nói sau lễ trao giải.
Ngôi nhất tại Abu Dhabi đến với tay đua người Hà Lan một cách dễ dàng khi anh nắm lợi thế xuất phát đầu. Sức ép đáng kể nhất lên chiếc RB19 của Verstappen chỉ có ở vòng đầu, nơi chiếc SF23 của Leclerc ba lần ngoi lên tấn công ở cuối các đoạn đường thẳng nhưng đều bị Verstappen nhanh chóng đánh bại tại các góc cua Turn 1, 6 và 7.
Chặng đua khép lại mùa giải đại thành công của Red Bull đáng lẽ còn hoàn hảo hơn nếu tay đua còn lại của họ là Sergio Perez về nhì. Tuy nhiên, tay đua người Mexico bị phạt năm giây do va chạm với chiếc MCL60 của Lando Norris (McLaren) tại Turn 6 ở vòng 60. Với án phạt này, dù về nhì sau khi bất ngờ vượt qua Leclerc ở vòng áp chót, Perez bị đánh tụt xuống thứ tư. Ferrari chỉ đạo Leclerc chủ động giảm tốc để Perez vượt qua nhằm có được lợi thế điểm số trước Mercedes trong cuộc chiến giành vị trí thứ hai trên bảng xếp hạng đội đua.
Tính toán của Ferrari là để Perez vượt qua với hy vọng tay đua Mexico, với bộ lốp mới hơn, có thể tạo khoảng cách hơn năm giây với Russell - người đang chạy thứ 4 và vượt qua mức án phạt năm giây để cán đích thứ ba. Nhưng cuối cùng, Perez chỉ tạo được khoảng cách chưa đầy 4 giây, và tay đua của Red Bull bị tụt từ thứ hai xuống vị trí thứ tư, với 1,1 giây chậm hơn Russell.
Leclerc có thể giảm tốc ở các vòng đua cuối để kìm chân Russell hòng giúp Perez tạo cách biệt lớn hơn 5 giây, nhưng tay đua người Monaco vẫn giữ nguyên tốc độ. Nhờ đó, kết thúc mùa giải, Mercedes cán đích thứ hai trên bảng tổng sắp các đội đua. Trước chặng cuối, đội đua nước Đức nhiều hơn đối thủ Ferrari bốn điểm. Tại Abu Dhabi, Leclerc về nhì, kiếm được 18 điểm, Russell về ba với 15 điểm, Hamilton về thứ chín và có hai điểm. Trong khi đó, do Carlos Sainz không có điểm, nên dù có nhiều hơn đối thủ 3 điểm tại chặng cuối, tính cả mùa giải, Ferrari vẫn kém đối thủ một điểm.
""Kết quả này có ý nghĩa rất lớn đối với toàn thể đội đua sau một mùa giải khó khăn. Tôi thực sự hạnh phúc khi biết Mercedes giữ được vị trí thứ hai"", Russel nói sau chặng đua tại Abu Dhabi.
Leclerc thì tiếc nuối: ""Perez bị phạt 5 giây, nên chúng tôi cố gắng đưa anh ta đủ nhanh hơn trước Russell. Tôi đã cố gắng hỗ trợ, nhưng tiếc là không đủ. Thực sự thất vọng khi để mất vị trí thứ hai trên bảng xếp hạng đội đua, nhưng tôi tự hào khi Ferrari đã phục hồi mạnh mẽ sau thời gian vất vả hồi đầu mùa"".
Kết quả Grand Prix Abu Dhabi
+) Fastest-lap: 1 phút 26,993 giây do Max Verstappen (Red Bull) lập tại vòng 45.
Bảng xếp hạng cá nhân chung cuộc mùa giải 2023
Bảng xếp hạng đội đua chung cuộc mùa giải 2023","UAE- Về nhất tại Grand Prix Abu Dhabi, tay đua Hà Lan của Red Bull Max Verstappen khép lại mùa giải 2023 với 19 chiến thắng qua 22 chặng đua. - VnExpress","https://vnexpress.net/verstappen-thang-19-trong-22-chang-f1-mua-2023-4681672.html","Thứ hai, 27/11/2023, 11:24 (GMT+7)","https://i1-thethao.vnecdn.net/2023/11/27/f-4jl-pwcaa5g0t-1701058396-2104-1701058950.jpg?w=1200&h=0&q=100&dpr=1&fit=crop&s=BrKabbceJ04JfR6yifFJ4g","","Đua xe","https://vnexpress.net/tin-tuc-24h"
"4681703","Nga lập kỷ lục về cấp khí đốt cho Trung Quốc","""Hôm 23/11, lượng khí đốt Nga cung cấp qua đường ống Power of Siberia một lần nữa vượt hạn mức hàng ngày theo hợp đồng. Gazprom đã giao toàn bộ lượng hàng theo yêu cầu và lập kỷ lục mới về số khí đốt cung cấp cho Trung Quốc theo ngày"", thông báo hôm 25/11 của Gazprom cho biết.
Trung Quốc hiện là khách mua chính khí đốt tự nhiên của Nga. Nga cung cấp sản phẩm này theo hợp đồng dài hạn giữa Gazprom và công ty CNPC (Trung Quốc). Từ năm 2014, hai công ty đã ký thỏa thuận mua bán kéo dài 30 năm, trị giá 400 tỷ USD.
Trung Quốc hiện nhận phần lớn khí đốt Nga qua đường ống Power of Siberia. Đường ống này hoạt động một phần từ tháng 12/2019 và là đường ống đầu tiên cung cấp khí đốt Nga cho Trung Quốc. Power of Siberia dài khoảng 3.000 km, chạy qua vùng Siberia của Nga đến tỉnh Hắc Long Giang, đông bắc Trung Quốc.
Năm ngoái, Nga cung cấp 15,5 tỷ m3 khí đốt cho Trung Quốc qua đường ống này. Công suất tối đa hàng năm của Power of Siberia là 38 tỷ m3.
Phó thủ tướng Nga Alexander Novak cho biết khí đốt họ cung cấp cho Trung Quốc qua đường ống này sẽ đạt 22 tỷ m3 năm nay, khi Moskva tăng cường hợp tác năng lượng với Bắc Kinh. Đầu tháng này, Gazprom, hãng dầu quốc doanh Trung Quốc CNPC và PipeChina đã ký thỏa thuận thiết kế, xây dựng một đường ống ở vùng Viễn Đông, nhằm cấp thêm khí đốt từ Nga sang Trung Quốc.
Ngoài khí đốt tự nhiên, Trung Quốc cũng đang gom mua khí hóa lỏng (LNG) toàn cầu. Mục đích là đảm bảo nguồn cung trong nước hoặc bán cho nước khác khi nhu cầu nội địa yếu.","Đại gia khí đốt Nga Gazprom cho biết vừa lập kỷ lục mới về số khí đốt giao cho Trung Quốc trong ngày, qua đường ống Power of Siberia. - VnExpress","https://vnexpress.net/nga-lap-ky-luc-ve-cap-khi-dot-cho-trung-quoc-4681703.html","Thứ hai, 27/11/2023, 11:24 (GMT+7)","https://i1-kinhdoanh.vnecdn.net/2023/11/27/power-of-siberia-1701056976-4989-1701057055.jpg?w=1200&h=0&q=100&dpr=1&fit=crop&s=xNT-22zkf_sbv70wIb45UA","","Quốc tế","https://vnexpress.net/tin-tuc-24h"
"4681552","Đài phun nước bị chê 'xấu nhất thế giới'","Nhân dịp kỷ niệm 150 năm hệ thống cấp nước hiện đại, mang đến cho Vienna nước ngọt từ những dòng suối từ dãy Alps, chính quyền thủ đô Áo đã mở cuộc thi thiết kế xây dựng đài phun nước. Thiết kế của một nhóm nghệ sĩ trong thành phố đã được chính quyền lựa chọn và cho xây dựng theo nguyên tác.
Khánh thành vào ngày 24/10 trước sự chứng kiến của Tổng thống Áo Alexander Van der Bellen, đài phun nước mới nhất của Vienna, WirWasser, nhanh chóng thu hút sự chú ý của dư luận. Nhiều người gọi đây là ""đài phun nước xấu nhất châu Âu"", ""xấu nhất thế giới"" hoặc ""xấu nhất từng thấy"", đặc biệt khi kinh phí xây dựng lên đến 2 triệu USD. ""Đài phun làm tổn hại đến hình ảnh xinh đẹp của Vienna trong mắt du khách"", một người bình luận.
""Công trình giống như được tạo bởi một đứa trẻ 5 tuổi vậy"", ""Nhiều người khác có thể tạo ra một thứ đẹp hơn với giá rẻ hơn"", ""Còn đâu là Vienna với những di sản đẹp đẽ"" là những bình luận chỉ trích khác.
Bất chấp những lời chỉ trích, Thị trưởng Michael Ludwig khẳng định đài phun có thiết kế phi thường, lấy cảm hứng từ thực tế và tạo cảm giác gắn kết. Đối mặt với chỉ trích lãng phí 2 triệu USD để xây ""một đài phun xấu nhất thế giới"", thành phố cho biết họ đã cố gắng tiết kiệm 300.000 USD.
Ngoài đài phun nước mới, du khách ghé thăm thủ đô Áo có thể tham gia các trải nghiệm khác theo gợi ý từ Tripadvisor như nghe hòa nhạc cổ điển tại Nhà thờ Thánh Peter, tham gia tour đi trong ngày đến làng Hallstatt nổi tiếng, tour đi tham quan Vienna, ghé thăm lâu đài Schönbrunn (Dòng suối đẹp) có 1.441 phòng.","Áo- Đài phun nước mới được xây dựng trị giá 2 triệu USD tại Vienna bị nhiều người đánh giá &quot;xấu nhất thế giới&quot; vì hình dáng không đẹp như kỳ vọng. - VnExpress","https://vnexpress.net/dai-phun-nuoc-bi-che-xau-nhat-the-gioi-4681552.html","Thứ hai, 27/11/2023, 11:24 (GMT+7)","https://i1-dulich.vnecdn.net/2023/11/27/1-1701020014-6800-1701020781.jpg?w=1200&h=0&q=100&dpr=1&fit=crop&s=ECinj2815MA-XnXIkvXy5w","","Quốc tế","https://vnexpress.net/tin-tuc-24h"
"4681615","Binh sĩ nổi loạn, đảo chính hụt ở Sierra Leone","""Sáng sớm 26/11, một nhóm chưa rõ danh tính tìm cách xông vào kho vũ khí quân đội tại doanh trại ở Wilberforce. Họ đã bị đẩy lùi"", Chernor Bah, Bộ trưởng Thông tin và Giáo dục Dân sự Sierra Leone, cho biết trong thông báo cùng ngày, nhắc đến quận ở thủ đô Freetown.
Bộ trưởng Bah nói những kẻ tấn công còn nhắm vào một số nhà giam lớn ở Freetown và thả các tù nhân. Hình ảnh trên mạng xã hội cho thấy tù nhân chạy khỏi nhà tù, với tiếng súng vang lên phía sau. Theo Bah, lực lượng an ninh Sierra Leone đã kiểm soát tình hình. Để trấn áp các nghi phạm hiệu quả, giới chức Sierra Leone ban lệnh giới nghiêm trên toàn quốc.
""Chúng tôi khuyến cáo người dân ở trong nhà. Xin hãy theo dõi các kênh chính thức của Bộ Thông tin và Giáo dục Dân sự để có thông tin chính xác và cập nhật về tình hình"", Bộ trưởng Bah bổ sung.
Hiện chưa rõ danh tính cũng như động cơ của nhóm tay súng. Giới chức Sierra Leone mô tả đây là ""những binh sĩ nổi loạn"". Một số nguồn tin cho rằng đây là nỗ lực đảo chính bất thành.
Cộng đồng Kinh tế Các quốc gia Tây Phi (ECOWAS) ra tuyên bố nhấn mạnh khối ""không khoan nhượng đối với sự thay đổi chính quyền một cách vi hiến"". Khối dùng ngôn từ tương tự như khi lên án những nỗ lực đảo chính trước đó, bày tỏ ""sự ghê tởm tột độ"" khi ""một số cá nhân âm mưu cướp vũ khí, làm xáo trộn hòa bình và trật tự hiến pháp ở Sierra Leone"".
Tổng thống Sierra Leone Julius Maada Bio cho biết hầu hết những kẻ cầm đầu trong vụ tấn công doanh trại ở Freetown đã bị bắt và giới chức đang điều tra sự việc. ""Là tổng tư lệnh, tôi muốn trấn an người dân Sierra Leone rằng chúng ta đã vượt qua thách thức này"", ông Bio nói.
Video trên mạng xã hội cho thấy một số người đàn ông mặc đồng phục bị bắt và ngồi phía sau một xe bán tải quân sự.
Đại sứ quán Mỹ tại Freetown lên án vụ tấn công và sẵn sàng tiếp tục hỗ trợ cho những người ""đang vì hòa bình, dân chủ, sức khỏe và thịnh vượng của Sierra Leone"".
Động thái diễn ra trong bối cảnh khu vực Tây và Trung Phi đã ghi nhận 8 cuộc đảo chính quân sự kể từ năm 2020, tại các quốc gia Gabon, Niger, Burkina Faso (hai lần), Guinea, Chad, Mali và Sudan.
Sierra Leone đang trong cuộc khủng hoảng chính trị từ sau cuộc tổng tuyển cử tháng 6. Ông Bio, lãnh đạo Sierra Leone từ năm 2018, tái đắc cử với 56% số phiếu. Phe đối lập cáo buộc đảng của ông Bio đã liên kết với ủy ban bầu cử để gian lận kết quả. Giới quan sát cũng cho rằng cuộc bầu cử thiếu minh bạch.
Đây là cuộc bầu cử tổng thống thứ 5 của Sierra Leone kể từ khi nước này kết thúc cuộc nội chiến kéo dài 11 năm hồi năm 2002. Ông Bio đối mặt chỉ trích vì tình trạng kinh tế Sierra Leone vẫn bất ổn. Gần 60% trong tổng số hơn 7 triệu người dân đối mặt đói nghèo, tỷ lệ thanh niên thất nghiệp trong nhóm cao nhất ở Tây Phi.","Nhóm binh sĩ nổi loạn tấn công một doanh trại ở thủ đô Freetown của quốc gia Tây Phi Sierra Leone và bị ngăn chặn, trong sự việc được cho là âm mưu đảo chính. - VnExpress","https://vnexpress.net/binh-si-noi-loan-dao-chinh-hut-o-sierra-leone-4681615.html","Thứ hai, 27/11/2023, 11:23 (GMT+7)","https://i2-vnexpress.vnecdn.net/2023/11/27/2023-11-26t121927z-2112684171-2250-4407-1701056011.jpg?w=1200&h=0&q=100&dpr=1&fit=crop&s=t31C6IeMmpBHtv0xI4MqAA","","Thế giới","https://vnexpress.net/tin-tuc-24h"
"4681713","Anh xe ôm Sài Gòn: 'Con giúp bác thôi, không lấy tiền đâu'","Tôi đến TP HCM đã rất nhiều lần, từ những năm đầu giải phóng và sau này trong những chuyến đi công tác. Nhờ đó, tôi được chứng kiến sự thay đổi không ngừng của thành phố này về mọi mặt. Thành phố ngày một to đẹp hơn, kinh tế phát triển hơn, dân số đông hơn, văn hóa cũng đa dạng hơn vì có nhiều người từ các địa phương trên cả nước đến lập nghiệp tại đây.
Người thân của tôi sống tại đây và vì sự thân thiện của thành phố này nên tôi tự nhủ sẽ quay lại nhiều lần. Lần này, tôi tới TP HCM để đưa vợ đi chơi. Vợ rất tin tưởng vào sự thành thạo của tôi. Chúng tôi hiện là lớp người cao tuổi, nên rất nhiều thời gian. Chúng tôi đi thăm Bảo tàng thành phố tại quận 1. Khi về, chúng tôi quyết định trải nghiệm đi xe buýt về nhà.
Lần đầu tiên đi xe buýt tại thành phố nên vợ chồng tôi còn nhiều bỡ ngỡ. Chúng tôi tản bộ đến điểm trung chuyển xe buýt tại phố Hàm Nghi, quận 1 và bắt đầu tìm hiểu lộ trình. Vợ tôi đọc bảng hướng dẫn tại điểm chờ và tìm tuyến xe đi về phía nhà mình. Tôi muốn làm cách khác nhanh hơn, đó là hỏi những người lái xe hoặc người bán vé trên xe buýt.
Một chiếc xe buýt lao đến bến, tôi chờ mọi người trên xe xuống hết mới ngó đầu vào hỏi đường. Không thấy ai trả lời, nên tôi mạnh dạn leo lên xe để hỏi cho dễ hơn. Thế nhưng, chưa kịp hỏi, thì xe đã đóng cửa và lao đi vun vút. ""Thôi chết rồi, vợ còn đang đứng ở bến, mà mình tự nhiên mất tích thế này"", tôi nghĩ bụng và lo lắng. Sau đó, tôi vội vàng nói với tài xế: ""Xin lỗi nhưng cậu làm ơn cho tôi xuống ở đây được không?"". Nhưng người lái xe chỉ đáp lại: ""Không xuống được, đến bến tiếp theo rồi xuống"".
Lúc này, tôi rất lo cho vợ vì chẳng biết tôi đi đâu mà tìm. Tôi chỉ cầu mong cho vợ mình cứ ở đấy chờ chứ đừng đi đâu lung tung. Trên xe buýt lúc này không đông lắm, một số người biết câu chuyện của tôi nên rất thông cảm và chia sẻ, động viên. Một ông già đầu tóc bạc phơ, nói giọng Hà Nội lại lạc vợ giữa thành phố to lớn này, quả là một chuyện đáng ngại. Sau đó, tài xế chỉ dẫn cho tôi sang bên kia đường bắt xe số 56 ở bến kế tiếp để về lại bến cũ và ở đó bắt xe số 88 để đến nhà người thân.
Tới nơi, tôi cảm ơn, cúi chào bác tài và mọi người rồi xuống xe theo đúng hướng dẫn tại bến Bạch Đằng. Phải mất 10 phút tôi mới sang được phía bên kia đường vì mật độ xe cộ ở con đường này rất đông. Nhưng may mắn tôi cũng đến được bến xe buýt để chờ xe số 56 và quay lại tìm vợ. Tôi cứ chờ mãi nhưng chẳng thấy xe số 56 đến, trong lòng nóng như lửa đốt vì lo cho vợ.
Vừa hay, tôi nhìn thấy một tài xế xe ôm công nghệ đang đứng một mình, nên vội vàng vẫy lại. Anh chàng dừng lại, nghe tôi trình bày, sau đó nói tôi lên xe và đưa mũ bảo hiểm. Thấy người tài xế luồn lách giữa làn xe cộ đông đúc, tôi bắt đầu lo lắng và nghĩ linh tinh: ""Nhỡ anh ta thấy mình ngu ngơ, già cả, lại nói giọng Bắc nên đưa mình đi đâu thì sao?"".
Chỉ đến khi nhìn thấy bảng tên phố Hàm Nghi, tôi mới yên tâm, thở phào nhẹ nhõm. Lướt nhanh trên con phố, ngồi trên xe tôi nhìn sang phía đối diện để tìm vợ nhưng không thấy. Đi tiếp một đoạn nữa, từ phía xa tôi nhìn thấy vợ mình vẫn đứng đó, đang ngóng tìm tôi. ""Thật may vì vợ vẫn ở đó"", tôi mừng thầm. Tới nơi, tôi cám ơn anh tài xế công nghệ và toan lấy tiền ra trả. Nhưng chàng trai trẻ nhanh nhảu xua tay không lấy, tôi nói thế nào anh cũng chỉ cười và nói ""con giúp bác thôi, không lấy tiền đâu"" rồi đi mất.
Tôi rất đỗi ngạc nhiên, không ngờ rằng giữa một thành phố sôi động, giữa một cuộc sống mưu sinh, đầy cạnh tranh thế này mà vẫn có những tấm lòng thơm thảo đến thế. Tôi không kịp hỏi tên anh, vì khi nhìn lại đã thấy anh đã khuất trong đám đông, chỉ biết thầm cảm ơn vì một tấm lòng tốt đẹp giữa đời thường.","Tôi ngạc nhiên khi người tài xế xe ôm công nghệ trẻ tuổi vừa chờ mình đi tìm vợ bị lạc nhưng nhất quyết không lấy tiền công.","https://vnexpress.net/anh-xe-om-sai-gon-con-giup-bac-thoi-khong-lay-tien-dau-4681713.html","Thứ hai, 27/11/2023, 11:20 (GMT+7)","https://i2-vnexpress.vnecdn.net/2023/11/27/cachnhackheobantratien-1701057-7246-8363-1701057843.jpg?w=1200&h=0&q=100&dpr=1&fit=crop&s=tYDxYKFWzw8xViTaGNDibQ","","Đời sống","https://vnexpress.net/tin-tuc-24h"
